Aircraft,CabinFlown,CabinStaffService,DateFlown,FoodAndBeverages,GroundService,InflightEntertainment,Recommended,Route,SeatComfort,Textchunk,TypeOfTraveller,ValueForMoney,WifiAndConnectivitynan,Economy Class,2.0,December 2017,2.0,3.0,nan,no,Honolulu to Sydney,3.0," | My wife and I have just returned from a US holiday flying from Honolulu to Sydney. During the flight I had to go to the toilet. The toliet was occupied so I attempted to go to the other side of the plane. The male flight attendant was in the galley so rather than disturb him I waited for the toilet to vacate. He then told me rudely to stop ""mulling"" around that area, so I started to go back to my seat, but then he said the other one was vacant. After using the other toilet I had no way of getting back to the other side of plane so I attempted to go back through the galley but then he critisied me again for going through that area and spoke ""rudely"" to me (in front of other passengers). I absolutely refuse to accept this type of rude behaviour, to a paying passenger from a flight attendant. The female attendants were not rude but this male attendant needs to have a close look at himself and this behaviour towards passengers. We will never fly Hawaiian Airlines again.",Couple Leisure,1.0,1.0
nan,Economy Class,5.0,November 2017,3.0,5.0,nan,yes,Hilo to Honolulu,3.0," |  Hilo to Honolulu. Hawaiian was fantastic! We made a mistake in our booking and didn't realize that we had scheduled our return flight from the big island out of the wrong airport with united airlines. While united wanted to charge us $4000 to get us home, Hawaiian worked very hard to find a different route home for us even though we hadn't been using their airline!! They even checked our bags all the way to Toronto for free because they wanted to help! I have never had any airline treat me so well! It's just a shame that we can't fly Hawaiian for all of our flights! We are so pleased. Their ticketing agents were amazingly helpful!",Couple Leisure,5.0,nan
nan,Economy Class,1.0,October 2017,1.0,2.0,1.0,no,Kauai to Los Angeles ,2.0," |  Flew Kauai to Los Angeles. I wish I could say Hawaiian was any different from any US-based airline. Customer service is pretty mediocre, bordering on rude at times. Our flight did not include individual TV screens, only shared TV screens that showed things like a Hawaii city council meeting and public access type television programming. The food was inedible - lukewarm breakfast sandwiches with fruit that tasted old. The airline staff were very curt with us. At one point we asked about early boarding because we had a child with us, and the desk agent snapped that it wasn't our turn yet. Okay, that's why we were asking. We had to check in our stroller at the gate and when we arrived at Lihue, it took us 20 minutes to find an airline staff who could tell us where the stroller was. We were told they'd bring it to us, then it turned out to be behind the desk. We flew Hawaiian because we figured it would be better than United, but it's really the same level of bad service just disguised with a lei.",Family Leisure,2.0,nan
nan,Economy Class,2.0,September 2017,nan,1.0,nan,no,Kona to Honolulu,2.0," |  Kona to Honolulu. I was told I could not check in due to being late. I was not aware of this policy and never before when I flew with Hawaiian Airlines was I denied my ticket to fly. There is no policy about checking in on time on your itinerary so the only way you can find out about this bad news is if you get it first from the desk. I was then printed a ticket for a flight an hour after my original flight, and when everything was done, I went off to TSA line and got to my original gate in 2 mins. I arrived at the gate 20 mins before boarding even began and I was denied entry on board by the Hawaiian employees. They were not being friendly at all and wanted to just go on their ""lunch break"" at 6:28pm. Very unprofessional of these people. I was also belittled by one of them when claiming that is my plane that I should be on and they were asking me in a very condescending way if I want my ticket back as I gave it to one of the ladies for confirmation. I was and am still disgusted with Hawaiian Airlines and their customer service. I feel cheated that I had to still pay them for the pet cabin too because I had my pet in her kennel all the time waiting eagerly to get home. They email me later asking how my flight was and on the bottom it had their checking in Policy with different information then what I was told by all the employees.",Solo Leisure,1.0,nan
nan,Economy Class,2.0,September 2017,1.0,1.0,1.0,no,Maui to Honolulu,1.0," |  Flew Hawaiian Airlines from Maui to Honolulu. Old, uncomfortable and small planes. Unhelpful check in crew. The night before my flight I got an email saying that there would be a delay on my flight and I would miss my conection to LAX. After making calls and rechecking the situation, apparently the email was a mistake, there was nothing wrong with the flight. After being mistreated at check in where the attendant didn't help to arrange the seats for me and my husband to sit next to each other, the airplane, very old by the way, had a technical problem causing departure delay. Not satisfied with the service provided by this company.",Couple Leisure,1.0,1.0
A330,Economy Class,4.0,August 2017,4.0,5.0,4.0,yes,Honolulu to Sydney,5.0," |  On time flight Honolulu-Sydney with Hawaiian Airlines. Crew were friendly and efficient enough. Beverage supply was very good as were the meals albeit of the smaller size. Aircraft was in good condition and appeared to be of the newer A330 kind, however, the fact that the screen is fixed to the seat back in front makes for difficult viewing if the person in front reclines.",Solo Leisure,5.0,nan
Boeing 717,Economy Class,5.0,July 2017,4.0,5.0,3.0,yes,Hilo to Lihue via Honolulu,4.0," |  Flew Hilo to Lihue via Honolulu. This trip was two very short flights, less than an hour in the air total, but Hawaiian left me with a good impression. The seats and plane interiors are nothing special, but for flights this short it doesn't matter - I've flown long haul with them and on those flights they're great. On this trip, despite checking in all the way to Lihue, for some reason my bag was only checked to Honolulu. I wasn't told this when checking in, so I arrived at Lihue to find my bag hadn't come with me. This was annoying, but the way Hawaiian handled it couldn't have been better. I was on the last flight for the night, but when I rang at 8am the next morning, my bag had already arrived. Then, a couple of days later, I noticed the fee I had paid for checked luggage refunded to my bank account, without me even asking. Every company makes mistakes sometimes, but if they all handled them like Hawaiian did, the world would be a much nicer place.",Solo Leisure,4.0,nan
A330,Economy Class,4.0,August 2017,3.0,2.0,nan,yes,Sydney to Honolulu,2.0," |  Overall average airline experience flying from Sydney to Honolulu. Check in: automated counters weren't working, so everyone had to be manually checked in, took around 30 mins of waiting. Service staff at the counter couldn't even manage a smile. But was a smooth process despite the minor flaws. Boarding: boarded in zones, worked well, was slightly delayed due to the incoming flight being slightly delayed. Staff kept everyone well informed. Couldn't ask for more. Inflight: air crew were very casually dressed, fitted with the Hawaiian vibe. Weren't as tight and efficient as Thai airways or Etihad. Still the staff were friendly and seemed like they cared about passengers having a good experience. There was no power port on the plane, only USB charging for low power devices. The seats were uncomfortable with very thin cushions, the seats recline quite a bit but there's hardly any leg room. I'm not a tall person but my knees were mashed into the seat in front most of the flight. They provided a pillow and a blanket as well as headphones and earplugs which are necessary as this aircraft was very loud. Meals: dinner was a casserole/curry with rice and beans which was pretty good. There was some coon cheese, and a dairy milk. Staff offered a large range of beverages. Breakfast was a bit dissappointing as there was no hot meal, I got a yoghrt, a bread piece with jam and butter and a cinnamon muffin. Overall was acceptable for the price",Family Leisure,3.0,nan
Boeing 767-300,Economy Class,5.0,October 2017,3.0,5.0,3.0,yes,San Jose to Honolulu ,4.0," | Flew San Jose to Honolulu with Hawaiian Airlines. Probably the best airline I've flown to date! From the moment I boarded the plane, I was captivated. The atmosphere spelled Hawaiian hospitality, and I felt at peace. The food could have been a bit better, but hey, can't complain about complimentary meals!",Solo Leisure,5.0,nan
nan,Premium Economy,1.0,February 2018,3.0,3.0,1.0,no,Honolulu to New York City ,2.0," | Flew Honolulu to New York City. Hawaiian Airlines, please do not advertise the electrical outlet on your website for your extra comfort seats if they don't work properly. And when asked about why it doesn't work, to have a discourteous flight attendant make up an excuse and lie to me. Why am I paying extra for this sub-par service. Please train your staff properly. Readers, please spend your money on another airline.",Couple Leisure,1.0,1.0
nan,Economy Class,2.0,February 2018,1.0,1.0,nan,no,Maui to Honolulu,3.0," | Flew Maui to Honolulu. Hawaiian Airlines is the worst airline I have flown to date. The airline staff at the airport in Maui and customer service representatives lack empathy, are dismissive and downright rude. After hours of waiting for a “delayed” flight the airport representatives became irritated and rude to all of the customers in the airport. The airline customer service representatives added to the poor customer experience with their poor attitude and lack of information or knowledge to remediate my concerns.",Business,1.0,nan
Boieng 717,Economy Class,4.0,November 2017,4.0,5.0,nan,yes,Honolulu to Maui,4.0, |  I travelled on Hawaiian Airlines from Honolulu to Maui on 4th February 2018. It was the last flight of the night so it arrived in Maui around 22:40. It was a very short flight of about 35 minutes. We were given a Guava juice drink (see photo). A nice flight all around. I will fly Hawaiian again.,Solo Leisure,4.0,nan
nan,Economy Class,2.0,February 2018,nan,1.0,nan,no,San Francisco to Honolulu ,3.0," | My family of five was scheduled for Flight HA 11 from San Francisco to Honolulu with a departure time of 8.55am. At around 8.16am, there was an announcement regarding the flight being delayed for 7 hours with a new scheduled departure of 4.30pm. When we were all moved to a different gate, we stood in line for about 20-30 minutes when another announcement came on asking everyone with the delayed flight to take a seat and that accommodations would be made. We sat and waited for a while and around 9.40am, I noticed people who had been on the delayed flight were able to check into the another flight, 41. So I went to wait in line to ask if we could be accommodated. After getting to the counter, the employee who assisted us, said it was possible and stated she needed everyone up at the counter. I signaled to my family but as we were boarding, I realized my husband wasn’t there. I called him and he had gone out of the gate area thinking we would not be accommodated. My kids and I came back out of the tunnel area and I apologized and told the agent we would wait for the 4.30pm flight since my husband wasn’t there. At this, she became upset and yanked the tickets from my hand and all three of my kids’ hands angrily. I apologized again and she made a comment stating “This is why I asked if everyone in your party was here.” I responded that I thought we were. She then raised her voice stating that “you guys are the reason why this flight (41) is delayed”. As upset and frustrated as I already was about a 7 hour delay on our original flight, I had been patient but could not believe my ears when she accused me and my kids of causing a delay in the flight when 1) there were still individuals going into the tunnel at the time we stepped out and 2) after our original flight was delayed for 7.5 hrs and we were told to sit down and they would take care of accommodations. I can understand there can be flight delays but it does not justify the workers being hostile. I did respond that it (causing the delay on 41 even though that wasn’t the case because she was still checking in someone else) wouldn’t have happened if the original flight wasn’t delayed. Also, at this time, there were still other customers who were going into the tunnel area. This is my family’s first time flying with Hawaiian Airlines and it has been a complete mess with rude service. When there are flights delayed for 7.5 hours, I would think that the airline would better train their employees to understand the frustration of its customers instead of blaming them for causing another delayed flight or yanking tickets out of kids’ hands when there are additional people boarding after.",Family Leisure,3.0,nan
nan,Economy Class,1.0,January 2018,3.0,1.0,1.0,no,New York JFK to Honolulu,1.0," | Due to fly Hawaiian Airlines from New York JFK to Honolulu. The staff are not nice, we have been delayed for 2 hours and they keep anouncing that we will delayed for 15 minutes. They never update us as to what is happening and we are just standing looking stupid waiting to find out what will happen next. Cabin crew just keep running around getting their breakfast.",Solo Leisure,1.0,1.0
A330,Economy Class,3.0,December 2017,1.0,2.0,1.0,no,San Diego to Brisbane via Honolulu,1.0, |  San Diego to Brisbane via Honolulu. Was a very bad experience. Honolulu has a very old airport that cannot handle the traffic causing numerous delays and problems getting to the gate and going through security. It took 2.5 hours to check in! One of the worst airports in the US. We were stuck on the taxiway for 45 minutes after landing in HNL due to no gate available. The food was awful and they do not offer options based on dietary needs or a second choice for food. They do not give frequent flyer points or status credits if you booked a sale fare. That was an unpleasant surprise. Plus the planes are very old and cramped. Far less leg room than other airlines.,Family Leisure,2.0,1.0
Boeing 767,Economy Class,2.0,December 2017,2.0,3.0,nan,no,Honolulu to Sacramento,2.0," |  Honolulu to Sacramento. Travel with extra time on your hands. Three out of four flights coming home from HNL have had delays. Lost something to do with the motor one the first flight. This flight was from Maui to San Jose, California. We were forced us to turn around about an hour out from Hawaii and land at HNL. That caused everyone to spend several hours in a very separated airport terminal. Away from any real food. But we were given snacks and waters! Second flight went fine. Our third flight was delayed over seven hours at the airport. We arrived at 5 am when we should have arrived at 10 pm the night prior. Hawaiian never compensated us for the delay. They have continued to lose our paperwork, strange. Our last flight (fourth), was delayed two hours due to a malfunctioning piece of equipment. Which they fixed and got us underway. I learned the after the first run-in with the Hawaiian staff. You won't win at the airport. They can be rude and dishonest with the best of them. A small riot almost broke out in the airport due to all the passengers be kept in the dark over the ""status of repairs"". They had pieces of the plane that were the size of a small car laying on the ground with zero maintenance staff anywhere. They even went so far as to bring a standby pilot to sit in the cockpit and act like something was going to happen. Hours went by with no repairs and no answers. That's when it got out of hand, passengers yelling at the staff for answers. They finally were forced to put everyone in a hotel for the night. The next morning we reboarded the repaired plane and another mechanical issue forced us back to the gate. Several people just got up and left the flight. After all that, they still managed to lose our luggage. Still never received compensation for the damaged bag either. They keep losing that paperwork as well. Travel with caution.",Family Leisure,3.0,nan
nan,Economy Class,3.0,December 2017,nan,2.0,1.0,no,Portland to Honolulu,1.0," |  Portland to Honolulu. I used to love traveling back home to Oahu on Hawaiian Airlines. Key words: ""used to"". I am not sure when their decline in quality and service happened but it's a real bummer. I had my trip back home planned for over six months. My boyfriend decided to tag along and bought his ticket a month before. Not knowing Hawaiian declined, I boasted how great of an airline it is. I wanted his first trip to Hawaii to start off great and felt confident he'd have a great ride. We arrived to HNL within 15 mins of each other. This was the first time I rode home on United and it was great! I ran over to the Hawaiian terminal with a fresh lei in hand so I could give my bf a proper Hawaiian greeting as he walked out. After giving him his lei I asked how his flight was. ""terrible, this was the WORST airline I ever rode on! They had no entertainment on the flight, no complimentary meal and everyone was terribly rude!"" I didn't believe him and joked that maybe he got on the wrong plane. On the way back home after a great week on Oahu, his flight was delayed and then delayed again for another two hours after they boarded. I thought for sure his flight was a fluke with Hawaiian. Well, here I am today. Christmas Day 2017. My father called last night to let me know my grandma would be passing. Hawaiian Airlines was the only airline with a seat on the earliest flight out so I booked it knowing I'd be in comfort.  Lo and behold, the flight was a half hour delayed because their caterers had trouble getting the food on board. Then they finally board us! Nope. I am sitting here almost two hours later, as they decided to fuel up and de-ice after boarding passengers. Why would any airline make its customers wait on board in cramped chairs when we already have a long flight ahead? So, I decided to bide my time by watching some entertainment. No! I guess my bf wasn't lying all along, there is none! Bad on their part, now my only source of entertainment is to write this (what should be 0) one star review. In addition to their decline in quality, a single bag check used to be free. Now $25. Haven't had my in-flight meal yet but I'm wondering if I'll have to pay premo-prices for the food the caterers probably dropped all over the place when they had a hard time loading it up and delaying the flight.  As I'm typing this they just announced another hour delay. Here's to three hours wasted! Let's hope Hawaiian Airline's delays don't make me late from seeing my grandma one last time! Time to sign off. The lady behind me is starting to panic from feeling claustrophobic.",Family Leisure,1.0,nan
nan,Economy Class,1.0,December 2017,1.0,1.0,1.0,no,Honolulu to Las Vegas,1.0," |  Honolulu to Las Vegas. First they changed our flight to leave earlier, with a layover in Honolulu for four hours. And to make it even better they lost our luggage. And they also cannot scan the barcode for our luggage because Hawaiian airlines does not offer that. However they give you a barcode for your luggage when you check your bag, but it doesn’t work. Whatever you do don’t use this airline. The team on the flight make you feel like they don’t even want to assist you. Worst experience ever! It’s 1am in the morning and I am trying to make a claim to find my bag.",Couple Leisure,1.0,1.0
nan,Economy Class,nan,nan,nan,nan,nan,no,nan,nan,"SJC-HNL-LIH. I booked our flight 3 months in advance - only to find a month later that the company offered a Hawaiian Plus fare for $200 per ticket cheaper than the ones I had purchased. This Plus fare included 2 free checked bags as well! The Hawaiian Plus fare was not even offered at the time I made the reservation. The checked baggage for our trip will cost an additional $100! When talking to customer service and asking that our bag fee be waived I was told by the service representative and supervisor that they could not do this. It is amazing that the two service representative did not recognize how the airline ""Policy"" makes little sense. Future travel on this airline is highly doubtful. The trip was to celebrate my wife 50th birthday and all I can do cross my fingers and hope the rest of the experience with Hawaii will be positive.",nan,1.0,nan
nan,First Class,nan,nan,nan,nan,nan,yes,nan,nan,LAX-HNL-KOA return First Class. LAX Premier Club Lounge very small and basic with limited food and drink options. Transpacific flights on new A330 but old style reclining seats with a footrests a big let-down. IFE screen and choices very good. Catering quite tasty for domestic first class though quality was much higher out of LAX than HNL. Flight attendants professional and attentive. Inter-island first class is not value unless you're on a through fare. HNL airport is in serious need of a make-over - old poorly run counter-intuitive muted staff and barebones lounges. For a US carrier HA is not a bad operation but not all that special in any way either.,nan,1.0,nan
nan,First Class,nan,nan,nan,nan,nan,yes,nan,nan,LAX-HNL roundtrip First class on new A330. Good seat and legroom though expected more recline for newer plane that they plan to use for future international routes. Service was great! Meal was good (get to pick 3 of 5 choices on menu). IFE great enjoyed the selection of movies and programming. Flew coach back on new A330 and pretty impressed - more legroom and slightly better recline than older Hawaiian 767s. Have to pay for movies/videos on IFE in coach though. One of the few domestic airlines that still serve complimentary meals in coach.,nan,4.0,nan
nan,Economy Class,nan,nan,nan,nan,nan,yes,nan,nan,Las Vegas to Honolulu  good on time flight coach seating adequate best seats for legroom are 26AC or 26HJ on Boeing 767 aircraft. First Class seating looked good but not worth paying anything over $250 for upgrades on US Mainland to Hawaii flights would obviously be happy to pay more for longer distance flights. Good choice of meal you can have a free meal or choose to pay for an upgraded meal which I did and was a good move free coffees and soft drinks. Very friendly and smiling cabin crew great start to Hawaiian trip.,nan,4.0,nan
nan,Economy Class,nan,nan,nan,nan,nan,no,nan,nan,Sydney to Honolulu flight was most uncomfortable seating. Temperature in the cabin was extremely warm and unbearable. On our return flight a more comfortable trip seating wise but the cabin was extremely cold throughout the 10 hour flight. Even the thin blankets supplied did not do us any good. Everyone was dragging out extra jackets to put on. The aircraft also left from the domestic terminal and we were unable to take advantage of buying duty free there because no one told us prior that once we booked in we couldn't get to the International Terminal to purchase goods. All international flights should leave from the International Terminal.,nan,1.0,nan
nan,Economy Class,nan,nan,nan,nan,nan,yes,nan,nan,Honolulu to Las Vegas. Very helpful guy at Honolulu airport got us through the boarding process fast this seemed to set the standard on our flight everything went well. I have flown on a number of American airlines any this flight was as good as I have had to date. The food is typical USA airline style but far from the worst I have had. Only one complaint this was the coldest flight I have ever been on in over 35 years of flying it is the first time I have ever found it necessary to wrap myself in an airline blanket 90% of the passengers were similarly wrapped in blankets. My wife asked why the plane was so cold but none of the crew seemed to know.,nan,4.0,nan
nan,Economy Class,nan,nan,nan,nan,nan,no,nan,nan,"SFO-HNL-KOA and back. Hawaiian advertises their outstanding service and free meals and beverages. They kept changing our flights and departure times I had to call them and rebook us on a flight that would not arrive 8 hours later than the flight I paid for. At the airport (SFO) there was no gate information we had to ask our way through to find out which the departure gate is. When we started boarding there was still no gate information. The staff seemed to be very unmotivated they had different groups for boarding but no one actually enforced that. By the time we got to our seats almost everyone in front of us was already there and all luggage bins were full. Hidden charges: You have to pay extra for each piece of luggage you want to check in. On the way to KOA no one cared about our carry-on luggage. BUT on the way back they were inspecting every single piece of luggage checking the measurements and the weight. If it was larger or heavier than the allowed size/weight for carry-on items you had to check it in (and pay of course). The meals nothing special I probably would have been better off with home made sandwiches. It was not worth the higher price we paid. On the plane the service was okay I wouldn't call it outstanding you get the same service as on almost any other airline. On the ground the service was very bad - staff very unhelpful and unfriendly. Hawaiian's ""service"" doesn't make up for the higher air fare that you are paying. flying with United or Alaska Airlines when you fly to Hawaii. The have direct flights to certain islands this way you don't waste your time in Honolulu waiting for a connecting flight.",nan,1.0,nan
