Aircraft,CabinFlown,CabinStaffService,DateFlown,FoodAndBeverages,GroundService,InflightEntertainment,Recommended,Route,SeatComfort,Textchunk,TypeOfTraveller,ValueForMoney,WifiAndConnectivitynan,Economy Class,nan,nan,nan,nan,nan,yes,nan,nan,LHR-MRU Economy flight delayed by one hour. Seats uncomfortable but size okay. Skipped dinner. Breakfast was really basic with near frozen pastry and bread. For an economy flight it was basic service nothing to be impressed. Crew did their jobs but that was it. IFE okay for a night flight.,nan,4.0,nan
nan,Economy Class,nan,nan,nan,nan,nan,no,nan,nan,MRU-MEL on A340. Disinterested check-in clerk couldn't have cared less about my seating preferences even though what I wanted was available. Could not read as an alternative to the non-on demand video because the light switch was incorrectly wired to illuminate the seat next to mine. Flight attendants nice enough but take a water bottle on board - they make no effort to carry water or juice along the aisles when the cabin lights are down. If you aren't in an aisle seat presumably you are just expected to dehydrate unless you climb over your sleeping fellow travellers to get to the galley. Food ordinary. No reason to fly this airline unless route dictates worth rescheduling to avoid.,nan,1.0,nan
nan,Business Class,nan,nan,nan,nan,nan,yes,nan,nan,MRU-MXP return Business. Flight delayed by 6 hours then another 6 hours. Being local we went back home and returned. Skipped dinner and went to sleep as soon as we took off. Staff very helpful. Return leg was night flight good sleep crew was excellent. Only set back is the seat at an angle not the best. Milan lounge is not really a lounge.,nan,4.0,nan
nan,Economy Class,nan,nan,nan,nan,nan,no,nan,nan,Horrific flight out managed to sleep a little on the way back but only because I probably could have slept standing. The seats were horribly uncomfortable (comparable to a short haul easy jet flight possibly worse) and any room for your feet is taken-up by the inflight entertainment box. Inflight entertainment had poor screens and an even poorer selection of films. Seats badly damaged with wire from the document holder (which had somehow reversed its spring) forcing into my knees for the whole way out. Flight staff polite but seemed to be very pleased with themselves which added to the depression of the whole experience. Booked through Kuoni so expected the flight to be fine I won’t be so trusting in future. I find it hard to believe given the cost of everything on Mauritius that their airline has to be so poor.,nan,1.0,nan
nan,Economy Class,nan,nan,nan,nan,nan,yes,nan,nan,London Heathrow to Mauritius return. I'm 5'10 and average build and found I had sufficient room to recline and doze a bit for the 12 hr flight. The inflight entertainment was good with a large touchscreen offering recent movies tv documentaries and games - all on-demand. The only drawback is that the screen is sometimes too touch sensitive or not at all which can be frustrating at times. Going out mine froze all together once but the stewardess reset it within minutes. The food was tasty and service not intrusive. However there was no announcement that drinks were always available in the galley - I only knew this from previous reviews. Flight out was just 1 hr delayed due to late inbound arrival but return flight taxied dead on time and arrived 30 mins early.,nan,4.0,nan
nan,Business Class,nan,nan,nan,nan,nan,yes,nan,nan,Paris to Mauritius return on Business with a promotional fare. Warm welcome from staff served a choice of pre- flights drinks with a local tropical touch. Starters main courses and desserts tasty and again with a creole twist that was memorable. The lie-flat seat is comfortable with relax and massage options. Plenty of space for storage and water bottles provided before going to sleep. Only 2 things to improve - the IFE is not on-demand and the choice of movies is limited there are no snacks/drinks buffet on overnight flights which last about 11 hrs. Otherwise a satisfying trip where I managed to get 7 hrs sleep.,nan,4.0,nan
nan,Economy Class,nan,nan,nan,nan,nan,no,nan,nan,Mauritius to London Heathrow. The service was below average. Food was satisfactory although served chicken for every meal. The television did not work I told a cabin crew member 3 times and she simply said 'ok I'll come back to you' she didn't for 12 hours. As for the other points they were satisfactory. Not much leg space and variety of films and shows.,nan,1.0,nan
nan,Business Class,nan,nan,nan,nan,nan,no,nan,nan,"MAU to SYD. Flight was ok nice aircraft but as for cabin service - well your on your own. If you need the toilet join the line of Economy passengers for Business Class facilities. A request for water was met with ""try economy"".",nan,1.0,nan
nan,Business Class,nan,nan,nan,nan,nan,yes,nan,nan,Business Class from MUR to Paris. Usual great service. Clean A340. Crew very pleasant and smiling. Wines and food was ok. Seats aren't the most modern but plenty of space and very comfortable. Left on time and arrived 10 mins late. This is a late flight so they quickly serve dinner then close cabin down for the night.,nan,4.0,nan
nan,Economy Class,nan,nan,nan,nan,nan,no,nan,nan,Paris-Mauritius-Paris Economy on A340's. Poor service on both flights. Seats very uncomfortable they seem to tilt forward and have limited space. Food OK but drinks service appalling. 1 trolley service and 1 round of soft drinks for 11 hr flight! If you wanted more drinks you had to go to the galley at the back to help yourself where the flight attendants were sitting chatting/reading or putting on their makeup! If you are a Mauritian national though you are very well looked after personal food & drinks served and bottles of wine given to take home! Will never fly them again.,nan,1.0,nan
nan,Economy Class,nan,nan,nan,nan,nan,no,nan,nan,MRU-MEL-SYD - A340. Service on board was very good however a couple of announcements could have been made by staff prior to boarding in Mauritius warning Sydney passengers in transit that their duty free spirits purchased in Mauritius would be confiscated by security staff upon arrival at Melbourne airport. The onus is on the Airline to warn its passengers that only a limited amount of liquid would pass security requirements at the second check point. This problem occurs quite often and results in quite an unnecessary loss of revenue to passengers unaware of this legal requirement.,nan,4.0,nan
nan,Business Class,nan,nan,nan,nan,nan,yes,nan,nan,MRU-CDG. Business. One of the newest A340. Excellent service staff was very helpful and pleasant. If the seats would be at 180 that would be great. Keep on the good job.,nan,4.0,nan
nan,Business Class,nan,nan,nan,nan,nan,yes,nan,nan,Just travelled to and from Mauritius in business class. Service was excellent. Nothing too much trouble for Cabin Crew. Very good comprehensive menu. Comfortable seats. Able to sleep comfortably both outward and inward journey. In flight entertainment a little limited. Otherwise very good.,nan,4.0,nan
nan,Economy Class,3.0,nan,2.0,nan,3.0,no,nan,1.0,Travelled PER-MRU twice. Reasonably priced seats the timing of flight departure is an absolute nightmare at 2am don't understand why it has to be so late. Plane is fairly uncomfortable with hard seats and lack of leg room. A warning alarm came on 1 hour into return flight and we had to wait around in transit hall for 2 hours in early am. Only direct flight to MRU which is a pity.,nan,3.0,nan
nan,Economy Class,2.0,nan,2.0,nan,1.0,no,nan,1.0,Very disappointed with the inflight service. Flight from Mauritius to Heathrow is 12.5 hrs. Usually on long flights flight attendants on other airlines would on several occasion offer passengers a glass of water. With Air Mauritius not once did the flight attendants offer water to passengers. You have to ask for it. Once the food was served their duty was done. The quality of the food was very poor. The entertainment choice was limited and outdated.,nan,2.0,nan
nan,Economy Class,5.0,nan,4.0,nan,3.0,yes,nan,3.0,LHR to MRU. Good cabin crew although a bit slow to reset my entertainment system on time flight and baggage arrived as well. Return leg was good 2 meals breakfast lunch and a snack before landing. Seats are cramped my knees were touching the seat in front. Crew don't smile.,nan,5.0,nan
nan,Economy Class,4.0,nan,4.0,nan,3.0,yes,nan,4.0,London-Mauritius return on 23rd Jan. Plane only half full so lots of space my son had a bad tooth and was looked after very well. Food was fine quite a good flight with no complaints crew were excellent. Have flown with a lot worse airlines supposedly of better quality.,nan,4.0,nan
nan,Economy Class,5.0,nan,3.0,nan,4.0,yes,nan,nan,Hong Kong to Mauritius return - wasn't a bad trip but the seat was a bit congested and the food quantity was not good. There should be a great variety of food but there were only two which excluded the vegetarian meal both ways. Having Air-Mauritius to be the only possible direct airline to Mauritius the ticket was very pricey.,nan,2.0,nan
nan,Economy Class,4.0,nan,4.0,nan,1.0,no,nan,1.0,LHR-MRU return. Flew out December returned Jan in economy class on a A340-300 with window seats on both flights. Flight staff on the ground and cabin crew helpful. Food quality generally ok. You could have as many drinks as you required. However that's where the positives end the seating was cramped and no way is the seat pitch 33/34 inch as stated. The recline space available is also very poor so you never feel comfortable quite the opposite with no chance of any sleep. The entertainment system is also disappointing with limited choice of films and music.,nan,2.0,nan
nan,Business Class,1.0,nan,1.0,nan,1.0,no,nan,1.0,Worst airline ever. Business class ticket they lost our luggage and did nothing to find them. We spent 8 days in Mauritius with a 15 months old baby and without any luggage a nightmare. Our luggage were lost in Nairobi. It's not the first time it happens but with other airlines they usually find them and deliver them in a couple of days. Service in the flight is bad. From Nairobi to Mauritius you get a kind of breakfast when you board then after nothing not even a glass of water! And we travelled business class!,nan,1.0,nan
nan,Economy Class,1.0,nan,1.0,nan,2.0,no,nan,3.0,I was delayed more than 48 hrs in Shanghai Pudong Airport! The whole ordeal started when we boarded the plane we were told there was a technical problem and take off would be delayed. The crew had to open the middle doors for us as it was getting too hot inside. During the 4 hr wait we did not get any food or drinks! We were driven finally after 5 hours on the tarmac back to the terminal to be dumped in the airport hotel without food or information. For the next 2 days we were left without any info on the flight! We had to fight with airport staff to get our luggage back after more than 24hrs. Absolutely unprofessional management of problems lying to customers covering up a major problem and never getting back to us for any kind of compensation.,nan,1.0,nan
nan,Economy Class,nan,nan,nan,nan,nan,yes,nan,nan,My Family and I flew Singapore to Mauritius and return via KL. We were impressed with good inflight customer service including the food having travelled there new Airbus A330-200.,nan,4.0,nan
nan,Economy Class,nan,nan,nan,nan,nan,yes,nan,nan,Melbourne-Mauritius-Nairobi return pleasantly surprised by the level of service we received. For both long haul services requested and received exit rows - which can be quite difficult to do with other airlines. I found the seats comfortable food was fine and there was never any issue about heading down to the back galley to get a drink when you felt like one. The staff on the whole were very friendly. Mauritius airport itself is very small and cramped but this should not be a problem when the new terminal opens.,nan,4.0,nan
nan,Economy Class,3.0,nan,3.0,nan,3.0,yes,nan,3.0,PER-MRU-PER. We flew Air Mauritius as a codeshare with Air Austral. All-in-all a fairly reasonable flight experience for the price although we did suffer a quite long delay on the return flight due to technical issues with the aircraft that needed to be sorted out. The cabin attendants were friendly and responsive both ways however there was insufficient water provided during the return flight which in a warmer than usual cabin was disappointing. The food was only fair to be honest but the wine pretty reasonable. My main issue was the ground staff and boarding process at MRU. A lack of updates on the delay and a temporary breakdown of the boarding card readers slowed things down even further. The SSR (Plaissance) airport in Mauritius is okay but fills to bursting when you have 3 flights leaving at once which was the case on the evening we flew. Chaos!,nan,4.0,nan
nan,Economy Class,4.0,nan,4.0,nan,4.0,yes,nan,3.0,We flew from Mauritius to Anantanrivo and back recently. We were impressed by the efficiency of check in and the punctuality of the flights. Though not expecting any food on this short haul flight we were surprised to receive a quick small lunch with a complimentary drinks run which was most welcome and refreshing. The FAs were pleasant and efficient. The aircraft A340 was clean and leg room was satisfactory for short haul sector. We would recommend this airline.,nan,4.0,nan
nan,Economy Class,3.0,nan,1.0,nan,3.0,no,nan,3.0,LHR-CDG-MRU-CDG-LHR. My first flight on 25/05/2012 from LHR was delayed by one hour and I had only 20 mins left to catch my MK flight to MRU. AT CDG there were no ground staff to guide I just managed to catch my flight. Got to my seat found the fellow passenger sitting next to me was intoxicated and immediately started being a real nuisance by interfering with my entertainment system and changing his postured endlessly. I reported this fact to the chief cabin crew. I was given another seat. On arriving at MRU I found out that my baggage was left at CDG so I had to return to MRU the next day to collect it.,nan,2.0,nan
nan,Economy Class,3.0,nan,2.0,nan,1.0,no,nan,1.0,Very bad flight from MIL to Mauritius via CDG. Poor service seat pitch the smallest I have experienced on a long haul flight. Never again.,nan,3.0,nan
nan,Business Class,4.0,nan,4.0,nan,3.0,yes,nan,4.0,Flew to Mauritius from Edinburgh via CDG. My wife and I could not fault the service from the staff on board although an attempt by a flight steward to fix both our TV monitors failed on the way out. Food and wine was in plentiful supply both ways. The only drawback is that the business class seats do not recline fully flat which can make your sleeping position slightly uncomfortable.,nan,4.0,nan
nan,Economy Class,1.0,nan,1.0,nan,3.0,no,nan,2.0,LHR-MRU-LHR. Poor seating told we had bulkhead seats during check-in but found this was not the case upon boarding. On outbound and return flight we had specifically selected the vegetarian option yet no veg meal was available on the return flight. Flight attendants were arrogant as to suggest we had made a mistake in the booking although we had the confirmation to prove the contrary. All in all poor staff training poor inflight experience and poor post-flight service.,nan,2.0,nan
nan,Economy Class,1.0,nan,1.0,nan,1.0,no,nan,1.0,LHR-MRU-LHR. Very disappointed with inflight service. The quality of the food was very poor. Entertainment choice was limited and outdated. Staff service was bad. Travelled with children but unfortunately did not specifically request kids meals which meant they were served the adults over spiced food. Travelled in the middle 4 seats (2-4-2) which had the added discomfort that only 2 of the 3 arm rests lifted making it difficult to sleep on the overnight to MRU.,nan,3.0,nan
nan,Economy Class,3.0,nan,3.0,nan,3.0,yes,nan,3.0,DEL-MRU-DEL. DEL-MRU flight was to depart at 5.20am but got delayed and finally took off at 10am. Airport staff were accommodating and gave us snacks and coffee. Onboard FA's were not attentive and you had to request again and again before being served a glass of water. Food and IFE was average. Return flight on time and was better. Adequate drinks and good food made the return flight pleasant.,nan,4.0,nan
nan,Economy Class,3.0,nan,1.0,nan,2.0,no,nan,2.0,Flight from Mauritius to Hong Kong was very poor. Although some staff were professional the plane was old the seats buckled and there was not enough food. In the past Air Mauritius was a great airline now service has dropped.,nan,4.0,nan
nan,Economy Class,5.0,nan,5.0,nan,4.0,yes,nan,3.0,LHR-MRU. A very long night due to babies crying but food was nice unlimited though you have to ask for it and cabin crew very friendly. Seats a bit tight luckily had two spare seats next to me so I laid down. Quite a few blockbusters to watch if you really can't sleep. A bit late in baggage delivery. MRU-CDG. Excellent food smiling staff and superb service.,nan,4.0,nan
nan,Economy Class,3.0,nan,4.0,nan,3.0,yes,nan,3.0,PER-MRU-PER August 2012 - A330-200. Plane is fairly new on PER-MRU legs. Travelling with toddler (under 2) and 2 adults. Economy pretty standard config and seats small but relatively comfortable. Outbound at PER not allowed to use QF lounge even though I was QP. Plane quite empty. Had to wait for 1.5 hrs for Virgin arrival from Melbourne which had 40+pax on. Even with them the flight was about 70% loading. Gave us a row of 4 to us so we were able to lay the child down for a nap. Outbound was daytime flight and quite easy - IFE very basic. Food was ok (poor entree). Not a lot of drinks (hot cabin too) and service was too quick with them wanting to get everything out the way ASAP. Toddler given an infant meal (as she was on an infant ticket) and we were not allowed to get anything else as there was no other food loaded. Return - slightly more full but this time we were given a bulkhead. Pointless with a toddler but we did have a row of 4. Word of warning the bulkhead rows the arm rests do not lift up. Overnight flight but bulkhead was near toilet which was going all night - so impossible to get sleep. Also some annoying little blue light sits right above you so its not dark either. On SSR/MRU Airport second comments from Philip Loveder below. Airport cant cope with 3 x 747 and A330 leaving at the same time. Place was packed. No chairs nowhere to sit even on the floor. If you are on your own fine but with kids its hard work! Poor timing of scheduling of the flights left a bad feeling to what was an amazing holiday.,nan,3.0,nan
nan,Economy Class,1.0,nan,3.0,nan,2.0,no,nan,1.0,The customer service was non existent. We were sat at the back of the plane near the toilets so the 12 hour flight we had no peace with people going back and forward. Couldn't even draw the curtain to block out the light from the area of the toilet and where the cabin crew sat. The leg room in economy was the worst we have experienced. Bad enough for me who is 5 ft 5 awful for my husband who is 6ft 2. We didn't even realise we would travel Air Mauritius for this long flight we had booked with Air France. Awful experience.,nan,1.0,nan
nan,Business Class,1.0,nan,2.0,nan,1.0,no,nan,1.0,Flight MK 034 from MRU to CDG on 12-12-08. The most uncomfortable trip in business-class we have had. The seats are not only no lie-flat when you try to find a position to sleep it is not possible as you always slip downwards. The cabin-crew were unfriendly and unenthusiastic. The quality of the food was poor.,nan,2.0,nan
nan,Economy Class,3.0,nan,4.0,nan,4.0,yes,nan,4.0,Flew SIN-MRU-KUL-SIN. Have flown several times before and I have received the same consistent good service every time. Check in was uneventful and normal. Boarding was quic the crew were smiling and friendly. The interior of the A330-200 is fresh and new. The seat though wasn't something to smile about. It was pretty cramped and I couldn't sleep a wink throughout the night flight. IFE was good decent selection of films and games. Food was also good really enjoyed it however there was no cabin presence throughout the night flight. Overall it was quite a good flight and I would recommend Air Mauritius.,nan,4.0,nan
nan,Economy Class,1.0,nan,1.0,nan,1.0,no,nan,1.0,On 26/09/12 my family travelled to Mauritius (11 people). We embarked on our journey from Melbourne on Virgin to Perth then boarded Air Mauritius. The first thing I noticed was how old the plane was leg room was non existent and felt really boxed in. The onboard entertainment was not working - made it hard to entertain 6 teenagers on an 8 hour flight. I felt the staff were annoyed with any request made. Upon our return to Australia the experience seemed worse. The cabin temperature was really hot which made it uncomfortable. Refreshments were only served twice. The crew were unresponsive - no politeness customer interaction no smiles - almost robotic. Service is an integral part of customer satisfaction.,nan,2.0,nan
nan,Economy Class,4.0,nan,3.0,nan,3.0,yes,nan,2.0,Pleasantly surprised by the service. I found the seats were just too small and quite hard but overall you get what you pay for. Fair value for money attentive staff clean seats and a smooth flight.,nan,3.0,nan
nan,Business Class,4.0,nan,4.0,nan,2.0,yes,nan,3.0,Perth to Mauritius return. Allowed to use Qantas club lounge at Perth which was good as usual. Lounge at Mauritius less impressive and completely full due to number of departing flights. IFE terrible (about 10 films with only one option suitable for children) but otherwise reasonable. Lie flat seats were at quite an angle but reasonably comfortable for short night flight on return leg. Food was better than anticipated. In flight service was reasonable and friendly. Make sure you stick on your 'do not disturb' sticker on a night flight otherwise the staff wake you for breakfast even if you're fast asleep; if you have pre-assigned seats make sure you ensure they've given you those seats at check in; pre-load your own IFE on an ipad or laptop!,nan,4.0,nan
nan,Economy Class,2.0,nan,1.0,nan,3.0,no,nan,1.0,London and back in Oct 2012. I wish now I had read the reviews here first otherwise we would not have flow Air Mauritius. I agree with all the other reviews no leg room entertainment box in way of feet the worst food I have had on any flight. My daughter and wife did not eat any of the meals on the outward and return flight.,nan,1.0,nan
nan,Economy Class,4.0,nan,4.0,nan,1.0,yes,nan,4.0,LHR-MRU-LHR 12 -17 Oct Economy class in extra legroom seats in both directions. Cabin crew were friendly with many drink rounds and smiles all round. I have to say that without the extra legroom seats I could not sit in a normal seat due to the tight space and entertainment box's under the seats. Best thing to do would be to take a few rows out and remove the entertainment equipment as its very outdated.,nan,4.0,nan
nan,Economy Class,4.0,nan,3.0,nan,3.0,yes,nan,4.0,A340 Mauritius to Heathrow overnight flight generally good reasonable comfort and good service - but why did the aircon have to be at full cold for the whole 12 hour flight making it almost impossible sleep. My wife has walking difficulty and we cannot praise the assistance she had highly enough.,nan,3.0,nan
nan,Business Class,4.0,nan,3.0,nan,nan,no,nan,1.0,Business Class from Cape Town to Mauritius to London then back to Mauritius and on to Cape Town a week later. The short haul trips CT to Mauritius were a complete waste of money. As far as I can see there is no real benefit to paying for business class. The seats are a three-row of which they only use two so a bit of extra space but not much extra comfort and the food etc was identical (according to a friend who was in economy). The long haul was better but even then the seats are the most uncomfortable business class seats I have ever experienced. The strange pitch means you are always sliding down and there is some kind of hard ridge right in the middle. Horrible. The airport experience was good the flight attendants were nice and the food on the long haul was good but - even for the cheapest Bizclass seat out there - never again except on the short run from SA to Mauritius.,nan,2.0,nan
nan,Economy Class,1.0,nan,1.0,nan,1.0,no,nan,3.0,Where has all the friendly Mauritian welcome and smile gone? Having flown regularly on MK since 1978 I will think twice before booking another MK flight. Last year the service was on the downhill and I thought that this was a one off but to my amazement I was faced with a worse experience this year. It appeared that the crew were doing you a favour! The meal choice was chicken or lamb and the crew had no idea how they were prepared or what they were served with! We only got a drink half way through the main meal. As for the state of the aircraft a complete refurbishment will do a bit of justice to the experience compensating for the service delivery that we received. Return journey was on a code share with Air France it was like chalk and cheese.,nan,2.0,nan
nan,Economy Class,5.0,nan,3.0,nan,nan,yes,nan,4.0,Heathrow to Mauritius return. Not sure what all the negative comments are about - personally I had a lovely flight with Air Mauritius. Crew were friendly food was fine and seat was fine too. As for entertainment - I'm not too bothered but there seemed to be an ok selection of movies and music etc.! Overall if you're flying economy a plane is a plane and a seat is a seat so take AM and have a nice trip to Mauritius.,nan,4.0,nan
nan,Economy Class,1.0,nan,3.0,nan,4.0,no,nan,4.0,India to Mauritius. Frustrated when I saw the touch screen was not working properly. I pressed the call button to call an FA who came to my seat after 15 mins. Water requested was provided after half an hour. I was unable to see flight attendants as they were sitting chatting with each other. Never again.,nan,2.0,nan
