Aircraft,CabinFlown,CabinStaffService,DateFlown,FoodAndBeverages,GroundService,InflightEntertainment,Recommended,Route,SeatComfort,Textchunk,TypeOfTraveller,ValueForMoney,WifiAndConnectivity
717,Economy Class,3.0,July 2018,nan,4.0,nan,no,Honolulu to Maui,1.0," |  
Honolulu to Maui. This was the worst experience ever. I will never fly with Hawaiian Airlines again and I think no one else should either. First off the employees are very rude. I was asking one AO some questions and he told me to go ask ""questions at another gate"". I was on standby all day until the last flight out and for the most part no one said anything throughout the process besides how many other people were on standby. One employee was so loud when speaking to the customers, almost as if she hated dealing with customer's but that's her job. My husband and I are employees of another airline we paid for our tickets but was told by the male employee who previously told me to go away that we were on the bottom of the list because we are employees of another airline and booked through our flight benefits. We were later told by really nice AO's something different. In the past I flew with many airlines and overall this is the worst experience Hawaiian Airlines did not even offer food vouchers to their customers. To whom every is thinking of flying with this company I suggest you think long and hard.",Family Leisure,1.0,nan
nan,Economy Class,4.0,July 2018,nan,1.0,nan,no,Honolulu to Kahului ,4.0, |  Honolulu to Kahului . We were booked at 9:50pm and were at the gate early. We requested to take the 8:45pm flight instead and we had no checked in luggage. The 8:45pm flight wasn't full but we were denied. They said there are fees associated with the change. Really? I guess there isn't any more bending backwards for customers. No logic!,Family Leisure,2.0,nan
nan,Business Class,5.0,July 2018,5.0,4.0,3.0,yes,Las Vegas to Auckland via Honolulu,5.0," |  Flew Las Vegas to Auckland via Honolulu June 26th 2018 and returned July 19, 2018. A wonderful experience on all sectors, the cabin staff were outstanding, and the flight deck were very informative on the conditions expected throughout the flight. Hawaiian music and videos welcomed us onboard, and set the mood for a very enjoyable flight. I usually travel Air New Zealand out of Los Angeles or San Francisco but decided to try Hawaiian as they fly out of Las Vegas. I am so glad I did and would like to thank all of the crew, both cabin and flight deck for a job well done! The only complaint is with Honolulu airport. It is certainly overdue for a complete overhaul.",Solo Leisure,5.0,nan
nan,Economy Class,1.0,July 2018,1.0,1.0,1.0,no,Honolulu to Phoenix,1.0," | I was beyond disappointed with Hawaiian Airlines. From the horrible customer service, rude flight attendants, planes that are so outdated and falling apart that nothing works on them. The terrible fees they charge. I left a carry on bag and when I tried to get a flight attendant from our flight to help me out with it I was met with a rude attitude and told I would just have to call the next day because she needed to meet her friend who was picking her up. When I asked if there was someone else she said there was no managers or staff or anyone in the entire airport that could help, I find that hard to believe considering the fact that our baggage hadn't even made it to baggage claim when I notified her that I left somthing behind. She made no effort to try to help at all and was clearly bothered by me even asking. The flight attendants on the plane weren't any friendlier either. When boarding the plane I was told my carry on wouldn't fit because this was a really old plane and the bins are small and hopefully my bags would make it cause that's reassuring. For the amount of money I spent to fly 7 people I would expect a lot more. I am doubtful I will get any help tomorrow regarding my carry on left behind. I have flown with many other airlines and never had such a poor experience.",Family Leisure,1.0,1.0
nan,Economy Class,1.0,April 2018,1.0,1.0,1.0,no,Las Vegas to Kahului via Honolulu,1.0," |  Las Vegas to Kahului via Honolulu. Their customer affairs department that handles issues is only accessible via on-line submission form, and they're just going to send you the same response, no matter whether it resolves your problem or not. If you call - they will tell you there is no way to talk to consumer affairs department, and just keep sending them messages.  We boarded a plane and were sitting on the plane for 1.5 hrs with no idea of why we are not taking off. Nobody was able to give us any information on what kind of “issues” are those. We had to get off the plane and only after numerous inquiries and concerns raised one of the staff told us it was an issue with pilot’s communication system. 2 hours later from the original departure time, we boarded the plane again, and took off. The plane was freezing cold and I was told I have to purchase blankets if we’re cold, and they can’t change the temperature. Other people were freezing too, and there was nothing done about it. Additionally, there were electrical issues and our monitors weren’t working for a long time. They said we will all get unlimited entertainment package for our inconvenience, but it never happened. 20 min into the flight one of the passengers had medical issue. Within minutes this man collapsed in front of our eyes and they started performing CPR on him, alternating with oxygen mask. After the plane started flying back we got an announcement that it was turned around. Back at Honolulu we were waiting for at least another hour for all of the medical procedures, and police investigation, before we could get off the plane to switch the planes. By the gate we were told to wait in line for food vouchers and new seat assignments.  It was chaos to say the least as all of us were trying to get food at only one restaurant that was opened by the gate. There was not enough fast food left after first batch of people went through it, and ordering food was impossible as they said they won’t be able to make enough for everyone in time. It was past 9pm at this point, and we have been traveling since 10am. We boarded a new plane which was an older plane and it was freezing again! And we were sitting on a plane for an hour with no announcements or letting us know what’s going on. Later they were waiting on a second pilot. Why were we rushed to get on the plane with no time to eat, if the pilot was not even there? Entertainment systems were still locked, and we got offered no comfort, drinks or anything after everything we have been thru. Back home, their luggage process got screwed up with mixing bags from different flights, and nobody from the staff knew what's going on. After all of that, we only got offered $50 refund! Absolutely ridiculous! And there is no way to talk to someone, and all we get is that consumer affairs approved $50 and good luck with that. ",Family Leisure,1.0,nan
nan,Economy Class,3.0,May 2018,2.0,3.0,2.0,yes,Las Vegas to Honolulu,3.0," |  Las Vegas to Honolulu. Halfway through our family vacation, in Hawaii, my father passed away. When I contacted Hawaiian Airlines to change my flight they wanted $400 to do so. I was blown away by the clerks attitude we were working with, so insensitive and would not cooperate in any way. It was cheaper for me to purchase a return flight than to change my existing flight. My wife thought that she would appreciate my empty seat, she would be more comfortable on the return flight with the kids. She checked in my seat for which I could not get a refund or any consideration. A smelly beach bum tried sit in my seat. My wife told him that it was not his because we paid for it! The stewardess told my wife it was his seat because they resold my seat to him. WOW! Talk about double dipping into our pockets. I am so upset at how Hawaiian Airlines has treated my family and great lack of customer service or consideration. I can never use them again and I would not recommend them. By the way they charge for just about everything. The dinners that we had going out and coming back were horrible. A terrible value in general and poor customer service. ",Family Leisure,2.0,1.0
nan,Economy Class,1.0,June 2018,1.0,1.0,1.0,no,Honolulu to San Diego,2.0," |  Honolulu to San Diego. Very disappointing. When we arrived to airport there is no guidance from Hawaiian Airlines staff on we’re we should go or line should we go. The staff can’t control the line and throngs of customer. It doesn’t guide customer which line to go. There is also no directions on going to check point and we’re to go to gate line. Not enough staff help.  Very poor communications. If I have opportunity again to come back to Hawaii, I will avoid taking to Hawaiian Airlines.",Family Leisure,2.0,2.0
nan,Economy Class,5.0,June 2018,5.0,5.0,nan,yes,San Francisco to Kahului,5.0," | San Francisco to Kahului. I want very much to thank all staff of Hawaiian Airlines for the BEST experience on my first time flying. The courtesy, and assistance, meal, and cleanliness from check in to landing to and from. I could not express enough the joy I had and comfort. ",Solo Leisure,5.0,nan
nan,Economy Class,4.0,May 2018,nan,1.0,nan,no,Kahului to Molokai via Honolulu,1.0," |  Kahului to Molokai via Honolulu. Not at all happy with the change in our scheduled flight. Originally we had plenty of time to pick up our luggage from another and recheck-in with Hawaiian and be taken directly to Molokai. The two airlines were booked on separate itineraries. The change moved not only the time from several hours to about 1.5 hours, but also we had to stop in HNL and change planes. I called Hawaiian Airlines customer service about what to do and got 'maybe this, maybe that', in other words, no help. Arrived at the originating airport from Mainland to The Islands early, that airline was more than helpful, even though separate itineraries, that airline was able to check our bags through to final destination",Couple Leisure,1.0,nan
nan,Economy Class,1.0,May 2018,nan,4.0,1.0,no,Maui to Phoenix via Honolulu,3.0," |  Maui to Phoenix via Honolulu. When booking my families tickets I decided to pay extra to fly Hawaiian because I had heard positive reviews of the airline before but I was surprisingly disappointed. On both flights I was excited about getting a window seat but on both flights the window seat did not have a window but rather just a wall to look at. The in-flight entertainment app did not work and the flight attendants skipped past both me and my brother when handing out food. During the flight I saw that all the bathrooms near me were occupied and saw a bathroom sign that said it was unoccupied towards the front. After walking to the front bathroom a flight attendant blocked me with their arms and told me (quite rudely) that I was not allowed back there. Overall, I would not recommend Hawaiian airlines to a friend.",Family Leisure,2.0,1.0
nan,Economy Class,3.0,nan,3.0,nan,1.0,no,nan,3.0,We flew over to Honolulu on 8th January 2014 and was most uncomfortable flight I have been on. The flight entertainment was atrocious and we were told the entertainment was no longer available which I call false advertisement as they still claim the tablets are available. We are dreading the flight back to Sydney and will not be travelling with Hawaiian Airlines again. The airfares were not cheap either. Big mistake on our part.,nan,2.0,nan
nan,Economy Class,2.0,nan,3.0,nan,1.0,no,nan,3.0,Went from New Zealand to Honolulu to JFK Return. Chose Hawaiian for the price. The staff seemed to be keen to help in the first 2 hours. Then it seemed that they were sleeping as it was hard to get service. My husband is blind and this was noted when booking but the staff were not very understanding compared to other airlines we have flown. Food marginal.,nan,3.0,nan
nan,Economy Class,5.0,nan,1.0,nan,4.0,yes,nan,4.0,"I fly monthly on Hawaiian and January is always a surprising month as they change services for the new year. This time HNL-PDX I flew coach exit row. No meal upgrade available like in 2013. Instead their complementary meal was a soggy bready carbohydrate laden terrible mess. It's as if Hawaiian said: let's do this on the cheap so we can say ""we're the only airline to offer complimentary meals from mainland to Hawaii"". I get PR but what I was served was like a slap in the customers face it was so horrible. I would pay the $15 for a more appetizing meal. The crew was as always excellent.",nan,2.0,nan
nan,Economy Class,5.0,nan,3.0,nan,4.0,yes,nan,4.0,Positive experience on short return hop between Honolulu and Kona. All flights on time. Baggage was not on plane on arrival in Kona but arrived on the next flight after a short wait. Staff was friendly and professional.,nan,4.0,nan
nan,Economy Class,4.0,nan,4.0,nan,3.0,yes,nan,3.0,San Diego - HNL - Hilo. Good service very welcoming staff small portions of food but good breakfast consisted of fruit crackers and cheese and macadamia chocolate. Later we were served a cocktail and chips which was lovely. Most entertainment has to be paid for and I think so has the earphones but I had my own entertainment. My one bugbear the recline of the seats are ridiculous with the travellers in front nearly on your knee more so than on any other airline I've flown with. Luckily they were very strict at meal times for seats to be upright. All in all a pleasant experience.,nan,4.0,nan
nan,Business Class,5.0,nan,4.0,nan,4.0,yes,nan,4.0,HA451 13/12/13 business class seat 1G. On time boarding and departure and thankfully business class before children this time. As usual I was treated as a VIP due to my platinum status. Once onboard the business class cabin staff were outstanding they introduced themselves by name and learnt the customers names. The smiling faces of the 3 business class flight attendants was great - nothing was a bother for them. The food as usual on Hawaiian were great fish and veal with a very nice sweet for dessert plus dessert wines and liquors drinks flowed the whole way to Honolulu. After a sleep in the comfy armchair recliners style seats a big healthy breakfast was served about an hour out of Honolulu. One and only complaint this is an ongoing issue all of the bags marked first class priority were last off this problem always happens at Honolulu and in Sydney. Otherwise as usual great service and a highly professional team that needs acknowledged.,nan,5.0,nan
nan,Economy Class,5.0,nan,4.0,nan,3.0,yes,nan,3.0,Flew Sydney to Honolulu then Honolulu to Las Vegas and back to Honolulu on A330 overall flights were good especially the international legs but the seats on the 330 are far too hard. The flight attendants were very good we then flew Honolulu to Brisbane on old 767 but actually this aircraft was very comfortable and would be my preference over the 330 every time.,nan,3.0,nan
nan,First Class,3.0,nan,1.0,nan,1.0,no,nan,1.0,First class from JFK to Honolulu. No more room than a normal domestic first class. Seats were manual recline and barely moved. I've never seen that before. No welcome kit. Food is a joke. Two choices tofu or ribs. 11 hour flight from hell with an equally poor entertainment system.,nan,1.0,nan
nan,Business Class,5.0,nan,5.0,nan,4.0,yes,nan,4.0,I flew to Honolulu from Sydney returning to Brisbane last week and was impressed with the onboard service. I was connecting from a internal flight to a Hawaiian Air flight and had a great welcome from desk staff which continued in the Air New Zealand Lounge. Great food and drink service with great amenities. On board the A320 the unique Hawaiian welcome on board set the ambience for a great fight. Food and drinks service and care was exceptional. The great experience with Hawaiian Air resumed on my return flight on a 767 to Brisbane. The friendly welcome from Hawaiian ground staff at the curb side at the Honolulu terminal until I got on board was terrific. My only disappointment was the Hawaiian Premier Lounge need to look at their code share airlines Virgin or Air NZ for a better standard. I felt I had the privilege of spending a further 10 hrs in Hawaii surrounded by the friendliness of Hawaiian culture. Good one Hawaiian Air ... I'll be back!,nan,5.0,nan
nan,Economy Class,5.0,nan,3.0,nan,4.0,yes,nan,4.0,HNL to AKL. Very clean A330 with neat mood lighting throughout whole cabin. Nice food but no choice. Free drinks and snacks provided at the back during the flight. Crew we're very friendly. Movies not the latest but plenty to watch. Would fly again.,nan,5.0,nan
nan,First Class,5.0,nan,4.0,nan,4.0,yes,nan,5.0,Las Vegas to Honolulu round trip in first class. This was our first experience in first class and we were very pleased. Immediate friendly service before leaving Las Vegas. Very good food and plenty to drink. On the trip back the entertainment screen failed and a flight attendant dead heading back to Las Vegas helped me get it working. Again very good and friendly service from the crew. As this was our first time in first class I can't compare seats to other airlines or plane models; but our seats were very comfortable on the A 330. If we can afford it we would definitely do this again.,nan,5.0,nan
nan,Economy Class,3.0,nan,3.0,nan,2.0,no,nan,2.0,My flight from JFK to LAX was 20 min late including the time it took to retrieve my luggage at baggage claim. The flight I had just arrived on was located right next to the gate I was to leave from to catch my Hawaii flight. When I got to the Hawaiian ticket counter to check my bag in for the flight I still had 40 minutes remaining before my flight would leave for Hawaii. To my surprise no one was there at the check in counter. I explained that I had a flight to Hawaii that leaves in 40 minutes and I asked to speak with a manager or supervisor to assist me. The only response they gave me was to go to the information booth which was downstairs and turned their backs on me and said “There is nothing they could do!”I went downstairs dragging my heavy luggage to ask for help at the information desk was told to call Hawaiian Airlines. I went back upstairs and there was a representative there. I explained my situation stating there was no one to check me in. I was told: There is nothing that he could do and the next flight is tomorrow! I was stranded and had nowhere to turn to at the time. I was offered no assistance at LAX airport. I ended up paying for the ticket having to change my return ticket because of their policies. Then they informed me about a reduction fee policy after I already paid an extra $200! Hawaiian Airlines computer system appears inefficient outdated and extremely slow. I will never fly Hawaiian Airlines again!,nan,1.0,nan
nan,Economy Class,5.0,nan,2.0,nan,2.0,yes,nan,1.0,Hawaiian is usually very good at customer service once you are on the plane but the process to get a seat or an upgrade is the worst that I have experienced in the 17 years that I have traveled for business. As a Platinum member I have vouchers for a complimentary upgrade to first class on flights from the mainland to Oahu. I am now on my 3rd year of travel to Hawaii and I have not been upgraded once. The process requires that you wait until 72 hours before the flight before they will consider an upgrade but most of the time First Class is sold out by that time. Even if it isn't sold out they will not allow any upgrades until the last minute in hopes of generating more revenue. The fact that they offer First Class to their Elite customers then put processes in place that makes it impossible to use it says that they really don't have anyone with any customer elations skills working at the corporate office. I fly to Hawaii 6 or 7 times a year and I would rather they didn't send me any type of upgrade certificate as a teaser if they are never going to let me use it.,nan,3.0,nan
nan,Economy Class,5.0,nan,5.0,nan,4.0,yes,nan,5.0,Sydney to Honolulu return A330 brand new planes. Clean tidy interior with mood lighting. Lovely helpful friendly staff. Very reassuring when we hit what they said was severe turbulence on the way to Hawaii. Kept us well informed of what was happening. Food pretty good for airline food and drinks aplenty. Always smiling. Flights all on time. Would definitely be my choice of airline flying to Hawaii or Americas again.,nan,4.0,nan
nan,Economy Class,1.0,nan,1.0,nan,1.0,no,nan,1.0,In Feb we booked our seats flying from Hawaii to Las Vegas. We booked four seats together as there were personal and mental issues that necessitated careful planning. In August On the day of our flight without consultation Hawaiian Airlines changed our seats. We were separated two of us were put in row 46 and apart. These non reclining seats were a nightmare. I checked the seats we had booked the passengers sitting there were random. To add injury to insult the staff member in Hawaii at the check in counter for our return flight had the arrogance to say there are no non reclining seats on the plane. Maybe Hawaiian Airlines needs to let their staff have the experience from hell. We will never fly Hawaiian Airlines again. We are spreading the word through our large circle of travelling friends.,nan,1.0,nan
nan,Economy Class,1.0,nan,2.0,nan,1.0,no,nan,1.0,"Our first trip (OGG-SEA) on the new A330 with Hawaiian. We like the wide-body aircraft because when the two of us travel we can get a window and an aisle seat together. The seats on this plane are the most uncomfortable seats I have ever sat in! The setback ""entertainment"" system is very slow and hard to navigate because one has to push hard on the screen for inputs to be recognized. I was afraid to push hard enough because it must have been annoying to the person in front of me. We had to miss the outbound SEA-OGG segment of this flight because of a change to our plans. I knew that we would not get anything back for that flight that we did not take but when we called HA to tell them that we would miss it they tried to collect $400 from us for change fees for the segment that we intended to keep. It has been our experience that the call center at HA is terrible and this was no exception. After 3 hours and no call we just went to the OGG airport where we were told that there was no change fee applicable.",nan,2.0,nan
nan,Economy Class,3.0,nan,3.0,nan,2.0,yes,nan,4.0,Flew Brisbane to Honolulu return in last few weeks. Seats comfortable with lots of leg room. No movies shown overnight. Movies shown on way home in the day. Only big screen. Service ok. Food too spicy. Kids meals very good. On way home 2hrs out no toilets in entire plans. Some problem. They didn't announce that though. Check in at Honolulu is entirely self check in. Rather daunting. Wouldn't recommend for elderly not a lot of help around. Would fly them again for excellent luggage allowance!,nan,4.0,nan
nan,Business Class,3.0,nan,4.0,nan,2.0,no,nan,2.0,"Flew Beijing to Honolulu March 2014 in ""Business Class."" Definitely closer to economy plus. Uncomfortable barely reclining seats no electronics charging in-flight entertainment consists of iPads with a few games and movies/TV shows. Food was okay flight attendants brusque but efficient. They definitely don't seem like they enjoy their jobs. Would look hard for other options next time especially with Air China starting to fly that route.",nan,3.0,nan
nan,Business Class,5.0,nan,nan,nan,nan,no,nan,3.0,I was most disappointed with the Business class lounge in Honolulu the worst I have ever been in. I also thought that for a business class fare I would get a seat with more recline I didn't expect a flat bed. I found it to be a lot more expensive than economy which I used twelve months ago and was quite happy with but thought I would treat myself as I was travelling alone this time.,nan,1.0,nan
nan,Economy Class,3.0,nan,3.0,nan,4.0,yes,nan,2.0,Flew SYD-HNL-PDX return June/July 2014 with Hawaiian. The price was right and the A330 aircraft configuration of 2-4-2 was handy for couples and family groups alike. Seats were rather hard on the behind after a few hours and getting up to move the limbs is hard if crew are working the aisles with snacks & meals though these weren't too common. It is all pretty no frills stuff though on the international sectors all the in flight entertainment is free but premium content is paid for on domestic sectors. The meals were adequate on international but really a token effort on domestic although Hawaiian claims they are the sole US airline to feed you on domestic sectors anyway. SYD-HNL is overnight so it is best to just try to sleep or doze the night away after they feed you an hour or so out of SYD. a 3 hour layover and HNL-PDX is a daytime flight that arrives just after dark in the last bit of the trip. PDX-HNL is daytime but is a bearable 5.5 hours or so. My most negative comments are about the HNL-SYD sectors flown almost entirely in daytime again staff feed you an hour or two out and do a few rounds of drinks but then want everyone to close the blinds and basically sleep/doze/not bother them for the next 7 hours or so. Overall we got to PDX for a month at a super low fare and knew what to expect having read a number of reviews here so had reasonably low expectations for all the additional things airlines can add to make trips bearable. I'd hate to have paid full price for the trip. Having said that for the same price we'd probably do it again.,nan,5.0,nan
