Aircraft,CabinFlown,CabinStaffService,DateFlown,FoodAndBeverages,GroundService,InflightEntertainment,Recommended,Route,SeatComfort,Textchunk,TypeOfTraveller,ValueForMoney,WifiAndConnectivityBoeing 767,Economy Class,4.0,August 2016,2.0,5.0,2.0,yes,YVR to LGW,4.0,"Vancouver to London Gatwick return with WestJet. Our outbound flight was on time. Cabin crew were slow to respond when we wanted to order drinks after the cart had been through the cabin for the first time. Generally pleasant service though. Our return flight from Gatwick was delayed about an hour. This was due to heavy air traffic and not the fault of the airline. Once inflight, the service from the FA's was friendly and they were quick to respond to any requests. We had a problem with our call buttons and overhead reading lights not working but we were flying during daylight so at least I was still able to read. I disagree with other comments that WestJet is no frills and 'the Ryanair of Canada'. I admit it was disappointing to find out months after booking that they don't provide complimentary meals on a 9.5 hour flight, but it would not be a dealbreaker to use them again. I think we got very good value for our money and would fly WestJet again.",Family Leisure,5.0,4.0
Boeing 737,Economy Class,4.0,August 2016,nan,4.0,4.0,yes,LGW to YYZ via YYT,4.0," |  London Gatwick to Toronto via St Johns. The reviews we read before our flight were not very good and we were expecting long delays at the airports but our experience was a very pleasant one. Flights were on time, attendants were friendly, polite and had a great sense of humour. Seats were comfortable, and there was a lot to choose from in the in-flight entertainment. Our return flight was equally great. We would definitely fly WestJet again.",Family Leisure,5.0,4.0
nan,Economy Class,1.0,September 2016,nan,2.0,nan,no,YYZ to LGW ,1.0,"Our flight from Toronto to London Gatwick was cancelled due to maintenance issues. Now we will miss our connecting flight which happened to be through another airline, and subsequently can't be altered by WestJet. The next available flight is over 24 hours from our original departure. We got a $15 meal voucher. Totally worth wasting the other $450! There seems to be no urgency in replacing our flight as we can't even call to check our replacement flight for another 12 hours. Thanks a lot Westjet.",Family Leisure,2.0,nan
nan,Economy Class,4.0,August 2016,1.0,1.0,2.0,no,LGW to YVR,3.0," |  We took WestJet flight from Gatwick to Vancouver in August 2016. The services are horrific. Letting alone they charge everything for international flight - we paid for check-in baggage and food online. When we got to airport, the staff could not find our information of check-in luggage. I was asked to provide proof. Luckily I had the confirmation email in cell phone. During the flight, we found out that my whole family were not on their list, got no food served. Again, I was requested to show proof. The flight attendant was nice and found us some foods. And she wrote me a note, saying WestJet will refund us as an apology. Story did not end here. I didn’t hear anything from WestJet until I expressed my frustration in a survey. Finally one plus month later, a Guest Support Specialist wrote me an email, saying WestJet will give us credit for future flight and I need to create WestJet account. The funny thing is after I created a new account and passed the number to them; I am now told everyone in my family needs to create a WestJet account. What a nice job!",Family Leisure,1.0,2.0
Boeing 737-700,Economy Class,5.0,September 2016,3.0,5.0,4.0,yes,YVR to YEG via YYC,5.0," |  Recently flew Winnipeg to Vancouver return via Calgary on Westjet. All of the flights operated on schedule with no issues. All of the Ground and Flight Crew were friendly, polite and attentive. I did preorder a sandwich on one of the flights and it was okay, nothing great, but these days anything your fed in economy is good. I will continue to fly Westjet.",Solo Leisure,5.0,nan
Boeing 767-300,Economy Class,1.0,August 2016,1.0,4.0,3.0,no,LGW to YWG,3.0," |  Flew WestJet from London Gatwick to Winnipeg. Flying often with real airlines like Singapore, Korean, Qatar etc. really makes me appreciate how hard done by Canadians are for travel choices, not only is the cost unjustifiably high the ""service"" is laughable. My last trip was ok for what I paid but the whole experience was frustrating, dealing with arrogant flight attendants whose sole purpose was to make you pay for everything, endless announcements for petty issues such as a flight attendant telling us her life story during the announcements. Instead of providing service there are pathetic jokes to ease frustrated passengers annoyed with the overall experience. Every time there was a time change in the schedule as little as 15 mins I was made to call the call centre in Canada from the UK. I have never heard of this, they said they needed my confirmation, for 15 mins schedule change really? This happened 5 times. It was during one of these calls that I heard the news that I had to pay for a checked bag on an overseas flight. Good for decent legroom if you get the better seats (surprise to be paid for), bring food as the paid for one looked disgusting and small portions. Was nice to have a direct service to Winnipeg and not have to go through the whole Toronto or Montreal connection procedure. If the price was right I would do it again otherwise go with a real airline.",Solo Leisure,2.0,4.0
nan,Economy Class,4.0,September 2016,nan,5.0,nan,yes,YHM to YLW via YYC,3.0, |  Hamilton to Kelowna via Calgary. Flight delayed by 3hours but all the staff at the desk were very nice and helpful especially one staff that was going above and beyond making sure everyone knew what was happening and asking us how we were doing. One guy was giving her a hard time about the delay (which she had no control over) but she handled it graciously and didn't get visibly upset. Overall impressed with how nicely she handled all of us confused and frustrated people! Good job I wish I knew her name to write here.,Solo Leisure,4.0,nan
nan,Economy Class,1.0,September 2016,1.0,1.0,1.0,no,YYZ to YYT,1.0,"Flew from Toronto to St. John's. I just want to say that the entertainment system being restricted to people with special apps loaded to personal electronic devices is completely unfair to people who do not have electronic devices. I have a Blackberry and travel with my laptop but I will not rake around in my carry-on and pull these devices out to use for watching movies on Westjet's entertainment system. I find travelling awkward and uncomfortable enough. Why does Westjet think that offloading the entertainment function onto passengers wedged into cramped seats is a good idea? I like to have something to drink on a flight, there's no room on that little table for my laptop, assuming I would be foolish enough to get it out of my carry-on in the overhead storage bin (and inconvenience everyone around me while I do it). I don't want to watch a movie on a Blackberry. I want to watch a movie on a screen in the back of the seat in front of me. I protest this completely stupid 'new entertainment system' of Westjet's on behalf of everyone who does not have an electronic device, or who, like me, doesn't want to take up the slack for Westjet's cutbacks in services to passengers by being personally inconvenienced by it. I'm going to avoid Westjet whenever possible in future. I've also been surprised by Westjet's unfriendly and unhelpful staff as well. There was a flight attendant on the Ottawa to St. John's leg of my trip who was very charming and entertaining. But he was the only one.",Solo Leisure,1.0,1.0
Boeing 737,Economy Class,1.0,September 2016,nan,1.0,nan,no,YYJ to YYZ via YYC,1.0," |  Victoria to Toronto via Calgary. A horrible trip. WestJet requires passengers to provide their own tablets and devices so that they can connect to the new WestJet Inflight Connect system. However, on the Calgary to Toronto leg, a 4 hour trip, the aircraft was not fitted with the Connect system, and hence no inflight entertainment was available. Westjet tried to make this up by charging passengers $7 to each passenger to rent tablets. If WestJet is having problems with installing WestJet Connect to its passengers, these tablets should be provided for free to passengers. No complimentary meals as to be expected on WestJet flights - but there wasn't even meals available for purchase on the flights. Seats were extremely tight and uncomfortable. I would avoid Westjet if I could.",Business,1.0,nan
nan,Premium Economy,4.0,September 2016,2.0,1.0,2.0,no,LGW to YYC,3.0," |  
Very unreliable for trans-Atlantic flights. I've used Westjet for 3 out of 4 flights this trip and every single one has been delayed. The London Gatwick to Calgary leg delay (1.5hrs) caused me to miss my connection which I had to subsequently pay for a new flight. The Kelowna to Calgary leg was late boarding and when we arrived the Calgary to London Gatwick leg was delayed by a further 2hrs and they would not accommodate two seats together for my wife and I. For internal flights I've normally had a positive experience but for long haul I would never consider using them again as they are so unreliable.",Couple Leisure,2.0,2.0
nan,Premium Economy,5.0,September 2016,4.0,4.0,4.0,yes,LGW to YWG,4.0,"On a recent trip to Canada used Plus from Gatwick to Winnipeg and Toronto to Gatwick, and economy Winnipeg to Vancouver and Vancouver to Toronto. Excellent service throughout : seats fine in economy but fantastic in Plus. Food options good and no problems with using tablet to access entertainment. Slight delay on flight to Winnipeg but Toronto Gatwick flight left on time and would have arrived on time but for medical emergency requiring diversion to St Johns. The inevitable delay was handled as well as possible and passengers were kept informed of events as we waited for refuelling and plane checks. Overall good value and would definitely use again.",Couple Leisure,5.0,nan
nan,Economy Class,2.0,September 2016,nan,1.0,nan,no,YYZ to YYC,1.0,"Toronto to Calgary. I bought a plus fare seat. My flight was at 7pm. Arrived at airport early and asked to change my flight to an early flight. No problem moved me to a plus seat on a flight 3 hours earlier. Hooray, even though they charged me another fifty bucks to change my flight I was happy. Get to get gate and go to board - sorry miss you were given a seat that was already bought and paid for. You have to sit on economy and no, you don't get refunded. WestJet Airlines ate 150 dollars of my hard earned money.",Business,1.0,nan
Boeing 767,Economy Class,5.0,September 2016,2.0,4.0,2.0,yes,YYC to LGW,3.0,"The inflight entertainment which I usually enjoy seemed to be geared to the fourteen to twenty five crowed. The aircraft's were from the old Quantas fleet and are about twenty plus years old. By the time we acquired our tablets, the people in front of us had their seats folded back. Now we had to attach our USB cords which are located in a position that was almost impossible to get to. My wife was on her hands and knees on the floor trying to attach the USB cord. We left on the 7th of September and flew back on the 27th of September, it was the exact same movies both ways, it seems that the inflight entertainment is going backwards. What in blazes happened to the convenient screens in the back of the seats? On the plus side the staff went overboard to ensure our comfort and were extremely pleasant. My flight was WS001 and on the way back was WS002.",Family Leisure,4.0,1.0
nan,Economy Class,3.0,October 2016,1.0,1.0,1.0,no,YEG to YYJ,1.0,"Edmonton to Victoria with WestJet. just as bad an experience as any other time I've flown with Westjet. Every single time I've flown with them there has been a considerable on tarmac delay due to maintenance issues. To top it off we could not exit the aircraft and not get something to drink other than water, even after waiting an hour. Service is horrible. If I have any other choice in the future I will never fly with Westjet again. Save your money and spend it at a respectable airline.",Solo Leisure,1.0,1.0
nan,Economy Class,4.0,August 2016,1.0,2.0,1.0,no,YYC to LGW,2.0,"Calgary to London Gatwick with WestJet. It was a sale flight, but after previously flying in Canada with WestJet, I was prepared for a pleasant experience. It wasn't. For a 9 hour flight, the only food provided was some biscuits. There was no previous warning, but luckily I packed snacks, otherwise I would've been on the plane for two meals but gotten nothing. Further, it is my understanding that entertainment is usually provided inflight. On WestJet, I was never informed until on board (when wifi was spotty) that in order to watch anything, I was required to download the WestJet app. I was unable to do so after boarding, so my only other option was to pay to rent a screen to watch / listen to entertainment. Despite having no previous notification. I would think twice before booking with westjet.",Solo Leisure,3.0,1.0
Boeing 767,Economy Class,5.0,October 2016,nan,4.0,nan,yes,YYZ to LGW,2.0,"I'm glad to say that last week I had a fine experience with WestJet flying from Toronto to London Gatwick. They got me from Toronto to London and back again with no delays or disturbances of any kind. The personnel are very nice and well-spoken. Back in steerage/economy, there's no entertainment or meals offered. I had my laptop, a good book, and picked up a sandwich in the airport. No problem. Bear in mind that I am a person who hates to fly.",Solo Leisure,5.0,3.0
nan,Economy Class,3.0,September 2016,2.0,1.0,1.0,no,YYZ to LGW,4.0,I was due to fly back to the UK on Friday 30th September but 20 minutes before we were due to board the flight was cancelled with the reason given as a technical problem with a window. I was then told that I had to come back the next day to find out when the flight home will be. I couldn't get any help from the staff about a hotel so I walked a cross to the nearest hotel and managed to get a room for $270 for one night. After a good night's sleep I went to the airport waited in the baggage queue only to be told that the flight had been arranged for Sunday night at 8pm - 47hrs after the original but this was not acceptable to me so I asked if there was any alternatives and was told that I could fly to Winnipeg then Calgary and then to Gatwick - I decided to get a flight with another company as my trust in Westjet had gone.,Solo Leisure,2.0,nan
nan,Economy Class,2.0,October 2016,2.0,1.0,nan,no,LGW to YYZ,2.0," |  My flight from London Gatwick to Toronto was cancelled and it was not announced on the website. Queued for two hours to find out what happened and only was told the next indirect flight to Toronto was on the next day (over 24 hours). Managed to get a seat to take the flight to Edmonton on the same day and then Edmonton to Toronto. When staff offered this alternative to me, she had no idea how long each leg would take. The flight from London to Edmonton was delayed from 11am to 2.30pm, had to wait in the aircraft for 1.5 hours and was not told what was happening. Due to delay, I only had less than an hour to connect my flight to Toronto and the staff were not helpful at all. Asked for my compensation and was only given an email to contact.",Solo Leisure,1.0,nan
nan,Economy Class,2.0,October 2016,2.0,2.0,nan,no,YYZ to LGW ,1.0,A completely frustrating experience. Arrived at airport to find out flight cancelled until the next day at 9.45 am. Woke up at 5.00 am to arrive at airport at 6.00 to be told the flight was delayed until 2.45 pm. Westjet paid for hotel for the night plus provided vouchers for meals and future Westjet flight however that does not make up for extended stay when we need to be returning home for responsibilities there. Not to mention the anxiety produced by continuous reports of mechanical issues in these planes. This is apparently an ongoing issue and I can only imagine a very expensive one for Westjet. It is unfortunate as I've always held the company in high esteem but this has completely soured my opinion. Hoping our flight actually does leave today and we arrive in Toronto without any incidents.,Family Leisure,1.0,nan
Boeing 767,Premium Economy,4.0,October 2016,3.0,5.0,1.0,yes,LGW to YVR,4.0,"London to Vancouver with WestJet. Booked a plus seat, did not regret it. Totally worth the extra cost. Very comfortable seats (and by the looks of it, almost twice as big as the standard seats) and great service. Unlike most reviewers here I didn't have any delays from or to London, despite returning via Calgary. I would say the non-plus looks pretty uncomfortable for a long haul flight, and if you can't get plus consider flying with BA or Virgin. The short haul flight from Vancouver to Calgary was in non-plus, and was frankly pretty crammed in even for a short flight. In the UK you would expect rows of 2 by 2 for that type of aircraft, but somehow they fit 3 by 3 in the same space! Luckily i'm a small person. The short-haul plus seat is a joke (same seat with a cup holder), don't bother. Overall decent experience but wouldn't consider as a viable option without a plus seat unless you want an unpleasant X hour journey. Biggest downside was probably the in-flight entertainment which is a joke, they hand out tablets (extra $ for non-plus) with about 5 movies or TV shows, no games or anything else. Luckily I took my own laptop and Kindle. Pity the Canadians with such terrible airline choice, WestJet sardine class or Air Canada probably won't turn up class.",Solo Leisure,4.0,nan
nan,Economy Class,1.0,September 2016,1.0,1.0,1.0,no,YYZ to LGW,1.0,"Toronto to London Gatwick with WestJet. Another London Gatwick victim here. Booked on the promise of a low budget fare to London ($249). To my disgust, the flight was cancelled only 45 minutes before we were to board. They claimed maintenance issues, but when I called WestJet corporate, the excuse given was storms over the Atlantic (i.e. we received conflicting stories). The gate crew was unbelievably rude - would not believe me that I flew in from Atlanta and had to provide my ATL-YYZ boarding pass to get a WestJet voucher for a local roach motel that I did not even use. Also was told incorrect carousel where to retrieve checked bags - told Carousel 1, then Carousel 3, then Carousel 1, then 3, then 1. All in all, this experience was a disaster. If it's too good to be true, then it is. Currently in a YYZ terminal waiting on a $1,500 Air Canada flight I had to book for the day after the WestJet disaster. I would never use this airline again under any circumstance.",Solo Leisure,1.0,1.0
nan,Economy Class,1.0,October 2016,nan,1.0,nan,no,YYZ to LGW,1.0,"Toronto to London Gatwick. Horrific experience, sat writing this review in an airport hotel after WestJet Airlines decided to cancel our flight back home less than an hour before takeoff. Absolutely no help from ground staff to arrange anything. Had to organise a hotel ourselves and not told how to receive compensation for it. Just called the helpline and was told there was a 40 minute waiting time to talk to someone. When finally got through we were told the flight had been rescheduled for Sunday (48 hours after original departure time) which means I miss work on Monday. What the hell is going on WestJet Airlines? ",Couple Leisure,1.0,nan
Boeing 737-700,Premium Economy,5.0,November 2016,4.0,5.0,nan,yes,YVR to YYC,5.0," |  Vancouver to Calgary with WestJet onboard their semi-new Boeing 737-700. Booking the ticket last minute, my dad and I were faced with a 270$+ one-way ticket which surprised us. Later, we did find out that domestic travel in Canada is generally expensive, as the only 2 airlines operating are Air Canada and WestJet. I decided to pay for a seat upgrade to their Plus seats (WestJet's Premium Economy product) for 50 Canadian dollars each. It was pretty much worth it. Priority boarding, the extra legroom, the extra space due to the blocked middle seat, first to deboard and first bags to come up. Since it was such a short flight, no actual meal was served, rather than a pretzel/cookie and drinks. Overall, very excellent service with professional and generous cabin crew. If the upgrade fee remains constant on the Vancouver-Toronto sector, I will gladly choose WestJet over their only competitor.",Solo Leisure,3.0,nan
Boeing 737,Economy Class,3.0,November 2016,nan,1.0,nan,no,LAX to YYZ,2.0,"I flew from Los Angeles to Toronto on November 8th. When I arrived in Toronto my baggage did not arrive. I was not the only one, there were two others who also had lost baggage. 3 people with lost baggage on one flight is not good odds. The clerk at the baggage claim desk was not very helpful and did not seem very concerned that we had no baggage. She promised that they would get the baggage out as soon as possible but here it is after midnight on Wednesday night a full 24 hours later, and still no baggage. There's also nobody to talk to so I can't even check on my baggage. I was promised an email would be sent to me letting me know what was going on with my baggage of which I never received. When I filled out the claim form, 1 copy was kept by WestJet, the other copy was taken by customs. I have no documentation of any sort on my last bag. Not only that is the baggage claim clerk kept my boarding pass with my baggage claim on the back of it. I have nothing to prove.  I would not suggest flying this airline. This is my first and probably my last time I will use WestJet. ",Business,2.0,nan
nan,Economy Class,1.0,November 2016,1.0,1.0,1.0,no,LGW to YYC via YYZ,3.0," |  London Gatwick to Calgary via Toronto Pearson. Left on the tarmac for 2 hours while they fixed a broken ""indicator"" and refuelled, forcing people to miss connections. The flight attendants shows little regard for how this impacted passengers. They acted like this sort of thing happens all of the time. Took us 10 hours to get to Toronto and offered no food. I purchased the most terrible ravioli I've had. The ""westjet connect"" is a joke. It crashed constantly and the flight attendants had the nerve to blame the passengers for ""too many people using it at once"". I couldn't believe I was flying WestJet. The least they could have done was given us a free croissant sandwich so we didn't starve. We barely made the connection even though we were on the same plane, but were again delayed leaving from Toronto for 45 minutes due to a ""power surge"". Guess I don't have a choice in choosing a carrier. At least I know to avoid the WestJet credit card at all costs.",Couple Leisure,4.0,1.0
nan,Premium Economy,5.0,November 2016,3.0,5.0,nan,yes,GLA to YHZ,5.0,"Glasgow to Halifax with WestJet Airlines. I am most impressed with the service I received on my recent trip to Canada from all the staff at Westjet. The service on the ground and in the air was extremely courteous and efficient. Particularly impressive was the way the staff at Halifax handled a problem I had with my passport, friendly and thoroughly relaxed. I hope that the Glasgow route will prove worthwhile for Westjet because it is certainly a bonus for those of us who live in Scotland",Solo Leisure,5.0,nan
nan,Economy Class,5.0,October 2016,4.0,4.0,4.0,yes,YVR to YYZ,4.0,Vancouver to Toronto with WestJet Airlines. Due to a death in the family I had to change my flight home so I could attend the funeral. WestJet were so accomodating with this and acted both professionally and compassionately. They quickly got me on a new flight and offered a discount on the fare. Once I was on the plane the flight attendent made a point to come over and ask if I needed anything. She said she knew I was on the flight due to bereavement and to let her know if I needed anything at all during the flight. This small act of kindness was very much appreciated. I will happily fly WestJet again and recommend them to anyone.,Couple Leisure,4.0,4.0
nan,Economy Class,1.0,October 2016,nan,1.0,nan,no,YUL to LGW via YYZ,1.0," |  An absolutely horrendous experience. We attempted to fly from Montreal to London on 30th Sept and arrived back in Gatwick on 3rd October after a 47 hour delay in Toronto. We flew from Montreal to Toronto without any issues. Just as we were about to board the connection in Toronto we noticed from the boards that the plane had been cancelled (no announcement was made). The Westjet staff told us there would be a flight the next day, that we needed to call them at 8am the next morning to book onto it and that we'd be in a hotel overnight. We called the next morning and were told the earliest flight back was at 8pm the following day and that we could stay in the hotel for another night. Except Westjet hadn't told the hotel and we were told by the hotel to check out before magically having the stay extended after we'd packed our bags. We noticed there was as a departure leaving later in the day so asked to be booked onto it. We went to the airport, the flight was delayed for 2 hours and then it was cancelled again. We queued for 2 hours to collect our bags and get a hotel voucher and were booked onto another flight leaving the next evening. We spent another night in another airport hotel and went back to the airport the next evening. We made it to Gatwick two days late. Upon return to the UK we contacted Westjet support regarding a letter to our insurance company and were told we would have a 57 day wait for a letter. We also submitted a complaint with our meal receipts (which Westjet said they would reimburse) and were told we would definitely receive a reply within 10 days. Day 13 and still nothing. Absolutely dreadful.",Couple Leisure,1.0,nan
