Aircraft,CabinFlown,CabinStaffService,DateFlown,FoodAndBeverages,GroundService,InflightEntertainment,Recommended,Route,SeatComfort,Textchunk,TypeOfTraveller,ValueForMoney,WifiAndConnectivitynan,Economy Class,4.0,nan,4.0,nan,3.0,yes,nan,4.0,Wuhan-Chengdu in Y class. Check in was fine at Wuhan airport group check in counter staff friendly and efficient. Flight delayed 2 hours dinner was distributed at terminal which was tasty and I was impressed with the quality. Boarding was fast and staff were holding a sign to switch off the mobile phone. Smooth 2 hrs flight and no drama. Cabin crew friendly and helpful. All in all it was uneventful flight and will try this airline again in the future.,nan,3.0,nan
nan,Economy Class,nan,nan,nan,nan,nan,no,nan,nan,HKG-XMN-HKG. Both legs fairly new 737 seat room and cleanliness ok. Substantial hot meal served for a 50 minute flight. First leg on time smooth flight crew spoke only poor English but were friendly enough. Good attention to safety where mobile phones and seat belts are concerned. Return flight delayed 6 hours due to weather. Boarding 3 hours late followed by another 2 hours wait on plane (food and drinks served) then another hour almost in HKG while waiting for a gate.,nan,4.0,nan
Boeing 737-800 / 787,Economy Class,4.0,May 2016,4.0,4.0,4.0,yes,TPE to AMS via XMN,5.0," |  Amsterdam from Taipei with 11 hours layover in Xiamen. They provided a free hotel accommodation for passengers with a long layover at Xiamen. The 737-800 has a newer interior than the one I was in on my way to Taipei. The Boeing 787 the same as the one on my way to Taipei. Both flights were on time. We had a constant turbulence on the first couple hours on the second leg of my journey, so the meal service was suspended accordingly. The flight attendants acted quickly as soon as we flew in a clean air again and resumed the meal service. There were a significant number of babies/toddlers on the flight to Amsterdam and most of them were crying and screaming constantly. Airlines should limit the amount of babies/toddlers on board for long haul flights. Simply unfair for the other 200+ passengers. It must also be a torture for those kids too.",Solo Leisure,4.0,nan
Boeing 787 / 737-800,Economy Class,4.0,April 2016,4.0,4.0,4.0,yes,AMS to TPE via XMN,5.0," |  Amsterdam to Taipei via Xiamen. Flown for the first time with this airline, good seating and IFE system. The food was tasty and abundant. Fight attendants are professional and worked efficiently. Both flights were on time. My luggage couldn't be checked through all the way to Taipei, so I had to collect my luggage at Xiamen and check in again. This means twice immigration procedures and twice security checks, queueing and waiting at Xiamen. Quite unnecessary on 2016 standard. The lavatories on their 787 were very cramped. I am 5'7"" and barely could turn around without hitting anything. The lavatories were kept reasonably clean during the flight. The 737-800 had a simple and old interior but sufficient for a short last leg of my journey.",Solo Leisure,4.0,nan
nan,Economy Class,5.0,February 2016,4.0,2.0,4.0,yes,AMS to TPE via XMN,4.0,"Amsterdam to Taipei via Xiamen. This Xiamen Airlines flight wasn't fully booked so we could pick out our own seats. The seats were comfortable, inflight entertainment had a lot of movies. The cabin crew was nice. What I disliked though was that you couldn't book a seat beforehand and thus had to rely on luck to get a good seat. Also, they didn't transfer my baggage directly, so once in Xiamen, I had to get my baggage and check out, and then check my baggage in again. In Amsterdam they seemed unaware that they were unable to transfer my baggage automatically, so I had to wait for a long time to get some answers, and nearly was late for my flight.",Solo Leisure,5.0,nan
Boeing 787,Economy Class,1.0,March 2016,1.0,1.0,nan,no,XMN to AMS,2.0,"Xiamen to Amsterdam with Xiamen Airlines, and the horror of a 12 hour flight. Food was terrible, entertainment system with no function, and the toilet like a railway station and dirty. Here I would rather not go to the bathroom. The staff was completely overstressed. The only positive thing I can say, the flight was on time. Never again with this airline.",Business,4.0,nan
Boeing 787-800,Economy Class,4.0,July 2015,5.0,4.0,5.0,yes,PEK to HKG via XMN,5.0,"Flew Xiamen Airlines from Beijing to Hong Kong via Xiamen. Provided a very good service. I had the opportunity to fly in its newest aircraft, the Boeing 787 Dreamliner which had very comfortable seats, a complete entertainment system and a beautiful cabin. I was surprised that good food was served on a domestic flight (PEK-XMN). The cabin crew was very attentive and professional. My next flight from Xiamen to Hong Kong was operated by a Boeing 737-800. The flight was delayed for two hours, so that wasn't good. Anyway, the crew were very attentive and good food was also served.",Family Leisure,5.0,nan
Boeing 737-800,Economy Class,3.0,February 2016,1.0,3.0,1.0,no,FOC to TPE,1.0,"Xiamen Airlines, Fuzhou to Taipei on a B737-800. No entertainment system, leg room is the smallest of any airline I have flown. The meal was poor - no taste in a lunchbox with no tray. The drink (red bean juice) was served when the meal is done. The staff are at least polite.",Business,2.0,nan
Boeing 787,Economy Class,3.0,December 2015,4.0,4.0,3.0,yes,XMN to AMS,4.0,"Xiamen to Amsterdam. Bit of a mixed bag. The food and seat comfort were quite decent but a few other issues would make me think before travelling with Xiamen Airlines again. Cabin crew had very limited English to the point they didn't understand the ""word"" vegetarian when they came around with the meal. The cabin temperature fluctuated greatly on the flight and to make matters worse, I was sat next to overweight passenger who smelt strongly of alcohol and had no concept of personal space. After he had elbowed me for about the 10th time, I decided to look for another seat but by now everyone was sleeping and simply decided to stick it out. I could have asked one of the crew but given their level of English, I thought better of it. The economy seats have UK style power sockets so useful for laptops as the inflight entertainment is somewhat limited although the screen and entertainment system was quick with none of the usual lags I have experienced on other airlines.",Couple Leisure,4.0,nan
Boeing 737-800,Economy Class,2.0,November 2015,4.0,3.0,1.0,no,SIN to HGH,2.0,"Flew Xiamen Airlines from Singapore to Hangzhou and back. Crew were generally helpful, however there was one male flight attendant who was exceptionally rude. Note that mobile phones cannot be used throughout the flight (even in airplane mode), as this is China Aviation Authority ruling. Food is acceptable. The cabin seats are not very comfortable. Xiamen Airlines is not recommended for medium or long haul flights.",Business,2.0,1.0
Boeing 737,Economy Class,2.0,August 2015,1.0,1.0,1.0,no,Xiamen to Singapore,3.0,I have flown Xiamen Airlines over the last year 2 to 3 times per month. The last three flights have been horrible. My last from Xiamen to Singapore was 2.5hrs late taking off. The airline held the aircraft because an incoming connecting fly was late. That's just wrong. The food was horrible and no water service. The cabin crew was very unhappy and not very helpful. I will do best not to fly on Xiamen Airlines again.,Business,1.0,nan
nan,Economy Class,1.0,February 2015,1.0,1.0,1.0,no,Kuala Lumpur to Fuzhou,2.0,"Kuala Lumpur to Fuzhou with Xiamen Airlines, and paid premium price for no class airline. Delays on outward and return flight. Food was quite poor and served in paper boxes. Same menu there and back and same lack of taste! Inflight entertainment was non-existant and the cabin crew were rushed and at times sounded like giving orders. Seats were not comfortable and not much different from many low cost carriers. Departure at Fuzhou was a mess and almost every bag needed to be manually checked. You would imagine that the counter staff could speed things up by giving advice on China's special baggage rules. Note - do not pack your powerbank and certain electrical items in your luggage!",Family Leisure,1.0,nan
Boeing 787-800,Economy Class,3.0,August 2016,3.0,4.0,3.0,yes,AMS to KUL via XMN,3.0,"Amsterdam to Kuala Lumpur via Xiamen. Flew with Xiamen Air and I'm really satisfied. Kind crew, sufficient command of English, good seat pitch, up-to-date IFE and choice between Chinese or Western food. What really stands out is the free hotel when your layover is more than 6 hours, your connecting flight is outside China and both flights are operated by Xiamen Air. It was well arranged, all passengers who comply with the rules were on a list and we got a confirmation in Chinese so that the taxi driver could read it. You have to pay for the taxi ride, but that is only 40 yuan. They have several hotels under contract, our first one was a 5-star hotel and the second one a 3-star. The only thing you have to do is to proceed to counter B11 (upstairs) after clearing customs.",Couple Leisure,5.0,nan
Boeing 738 / 787 / 757,Economy Class,4.0,July 2016,4.0,4.0,3.0,yes,HKG to PEK via XMN,4.0," | Hong Kong to Beijing via Xiamen with Xiamen Air (MF). Xiamen Air has just started intercontinental routes. I took this itinerary, as I was interested to see their transfer service. Outbound flights from HKG to PEK via XMN was smooth. HKG to XMN was a new B738, they provide light meal for this 50min flight. XMN to PEK with Boeing 788, PTV with good selection of movies, songs. Seats are comfortable. Inflight service was good, FAs were attentive. Xiamen Air has hotel arrangement if your connection is overnight. However, the hotel is not around the airport, and the hotel did not meet a 4-star hotel standard (which is claimed). For First, Business class, Skyteam Elite, Elite plus member, they provide your own room. For Economy, you will have to share with others! XMN lounge at domestic sector meets an average standard providing Chinese cuisine, fruits and drinks, but choices at breakfast time are limited. Inbound flights from PEK to HKG via XMN with a 2-hour connection. Flight PEK-XMN was delayed and I was worried about missing my connection to HKG wihch was the last of the day. The customer service manager at PEK did a good job. Before he stepped in, I was not happy with the way they dealt with my concerns and the delay. He coordinated with his colleagues at XMN, and also prepared backup plan for me. The flight to XMN took off 2-hour behind schedule using a B757. Onboard services were good, but ground services at XMN for transfer was not very clear, a lack of guidance and communications. MF lounge at XMN international section has no added-value, small and crowed.  Overall impression on this journey was above my expectations, I will definitely choose Xiamen Air again. But as a new player for transfer and intercontinental market, the service at XMN, could do better comparing to its competitors.",Business,4.0,nan
Boeing 737-800,Economy Class,5.0,June 2016,4.0,5.0,3.0,yes,HGH to TSN,4.0, |  Was flying from Hangzhou to Tianjin on Xiamen Air. HGH was very foggy and the plane took off 2 hours late. During the wait in the aircraft the crew provided me with coffee as I requested and after take off to a bad weather we were experiencing turbulence 70% of the 2 hour flight. But the crew were very professional in serving and food and beverages. Xiamen Airline is a nice regional wings for Asia Pacific.,Couple Leisure,5.0,nan
nan,Economy Class,3.0,July 2016,2.0,4.0,4.0,yes,AMS to TPE via XMN,4.0," | Amsterdam to Taipei via Xiamen with Xiamen Airlines. After reading many reviews here about the transfer service in Xiamen I was a bit worried but it turned out ok. Yes, you still need to check yourself and your baggage in at Xiamen again but ground staff seem to be used to the procedure by now. In Amsterdam and in Taipei they understood they could only tag our bags to Xiamen. In Xiamen when arriving at customs it's best to have printed proof you're transferring but they have a list of transferring passengers. There's a counter for free hotel if your wait is longer than 6 hours. Don't confuse this counter with the ""transfer service"" counter that's right next to it, that's only for domestic transfers, I mistakingly waited in that line for some time. The hotel is 20 minutes by taxi but it's nice. One awkward thing is that they put 2 solo passengers into one room, luckily I didn't have any roommate. On the long flight both ways they ran out of coconut juice halfway. On Xiamen to Taipei they gave drinks only after the food, so you had to eat either thirsty or with cold food. On Taipei to Xiamen they didn't give any drinks at all but maybe that was because I had ordered a special meal when booking. China has some strict rules about mobile phones and power banks. On the site it says you can do online checkin if you fly from Amsterdam but I got an error when I tried, maybe that only works if you're not transferring. All in all, it's very cheap and the annoyances are not deal-breakers if you're prepared for them, so I recommend it for the budget-wary traveller.",Solo Leisure,5.0,nan
Boeing 787,Economy Class,2.0,June 2016,1.0,1.0,3.0,no,AMS to BKK via XMN,4.0," | Amsterdam to Bangkok via Xiamen with Xiamen Airlines. This airline is ridiculous and so are the airport procedures in Xiamen. Me and my boyfriend had booked a flight from Amsterdam to Bangkok via Xiamen for an insanely good price of €370. Xiamen does not allow online check in for international flights. At the baggage drop in AMS, we asked whether the luggage could be tagged to our final destination. No proper answer could be given. Finally, at the gate we were told to pick up our luggage in Xiamen and drop it off again there. The flight itself was pretty good, except for the food which had no taste at all. Horrible. This airline does not allow any mobile phones to be turned on. Not even when they are on airplane mode. They need to be switched off, and if they find out you secretly use your phone the crew will stand next to you until you switch it off. WiFi may be used on iPads and Notebooks only. After a few hours the crew handed out arrivals / departure cards and you will need them. The crew will tell you that you won't need them for transiting however, you do need them. You will be put back in line at immigration if you don't have them filled out. Every single person has to go through immigration, even when your next flight is in 30 minutes or so. The horror really started when arriving in Xiamen. The procedure is as follows: Get out of the airplane. Walk towards customs via declare or not declare route. Go through immigration (with arrivals / departure card, passport, eticket) and you will get a temporary entrance permission. Go to baggage belt and get your luggage. Put your luggage through x-ray. Take elevator one level up. Now it gets tricky. If you have a 6 hours or more transit. Proceed to (transfer service) counter B11 for a FREE hotel. You do need to pay for travel costs. The hotel was good, but checking in took 45-60 minutes, they are so slow and don't understand English. After that return to the airport to the departures floor. Proceed to Intl. departures. Put your luggage through x-ray. Now you will find the check in counters, check in your flights and luggage. Walk upstairs and go through immigration (hand over your departures card and passport). Go through hand luggage check (they have very strict rules for power banks). If the power bank itself doesn't show its capacity it will be thrown away. No argument possible. Now proceed to the gate to your airplane that will bring you to your next destination. Never I will fly with Xiamen Airlines again. It is cheap, but that's probably all positive about it (and the free transit hotel).",Couple Leisure,3.0,1.0
nan,Economy Class,4.0,February 2016,5.0,3.0,3.0,yes,SYS to FOC,3.0,"Flew from Sydney to Fuzhou. Food was fantastic, some meals had both Chinese and Western choices, such as fried rice or pasta. Seat can be reclined. You are free to roam after seat belt signs are off. Toilets are pretty clean but flushing was unpleasant. You are not allowed to use mobile devices, or tablet devices however laptops and computers can be used but need to turn off WIFI. Entertainment included popular movies, a kids section, brief history, games section, CCTV report on the airline, and adult sections. There were also maps provided and the shopping all on PTV. There were several drinks services of juices and soft drinks. PTV is provided in 5 languages - Chinese, English, French, Japanese and Korean. Flight attendants are pleasant but tend to be a little annoyed if you call them when they are serving another passenger.",Family Leisure,4.0,nan
nan,Economy Class,3.0,May 2016,3.0,3.0,2.0,no,HGH to SIN,3.0," |  Flew Hangzhou to Singapore with Xiamen Airlines. For a Chinese airline, I was rather pleased that the plane departed on time. Most of the crew were pleasant but one or two stewardess did not have a smile on their faces. Food was served and was pleasant enough. We were also given a packet of nuts and a bottle of water 2/3 into our flight. I wouldn't mind taking this flight again although there was one issue that perplexed me. Apparently ipads, laptops, tablets could be used during the flight, but mobile phones were not allowed. I honestly think this is rather stupid since a mobile phone works just like an ipad/tablet. The inflight entertainment is but a pathetic small TV that one can barely see what is being shown, and only Chinese movies were played. ",Solo Leisure,3.0,nan
Boeing 787-800,Economy Class,4.0,May 2016,4.0,4.0,3.0,yes,AMS to CGK via XMN,5.0," |  Booked a Xiamen Airlines roundtrip ticket from Amsterdam to Jakarta via Xiamen for only 350 Euro.  Everything was great, I loved the meal, the staff were very helpful, the seat was comfortable and I had a good sleep during the flight. The entertainment was proper but some movies have no subtittle. The flight had no Wifi connection. ",Solo Leisure,5.0,nan
Boeing 787 / Boeing 737,Economy Class,5.0,May 2016,5.0,1.0,3.0,no,PEK to TSA via XMN,3.0," | My family and I travelled from Beijing To Taipei Songshan (TSA), and Taipei TPE to Beijing, both times with Xiamen Airlines in Economy class. The Good - compared to other Chinese airlines, we found the food and drinks service to be much better. The legroom on the Boeing 787 from PEK to XMN and vice-versa was very good, and the staff were friendly. An OK selection of IFE was provided on the 787 including a range of English speaking movies and many games. On 3 of the 4 flights the kids were handed an activity pack which they enjoyed playing (for about 10 minutes). The Bad - legroom on the 737 between Xiamen and Taiwan was poor. Transferring in Xiamen in both directions was ridiculous. When we checked in at Beijing, our bags were tagged through to Taipei, however we were advised that we had to go to a separate counter at Xiamen to get our boarding passes for the flight from Xiamen to Tiapei. It was not easy to find where this was once we got to Xiamen, there were no instructions nor staff to assist. Once we found the counter we were told that it didn’t open until 2 hours before the flight (we had a 3 hour layover), and there was nowhere available to sit and wait. Taking this in our stride, it was like a “red rag to a bull” when as soon as we boarded the flight to Taipei they showed us a video promoting how good Skyteam was, with their “Seamless transfer service”. It was worse when returning from Taipei. The bags could only be tagged to Xiamen, and boarding passes could only be provided to Xiamen. There was no specific transfer facility for connecting passengers that we could use to re-check bags onwards to Beijing, and no instructions whatsoever provided to assist in the transfer. Fortunately we live in mainland China so could find our way around the system, however it would have been utterly confusing for passengers who had never been to China before, with no assistance provided. If Xiamen Airlines has aspirations of being a true regional and international player, it needs to revisit its transfer services through Xiamen and replicate those of other successful airlines in performing transfers. Its part-parent airline China Southern does a dramatically better job handling passengers through Guangzhou.",Family Leisure,2.0,nan
"Boeing 788, Boeing 738",Economy Class,2.0,May 2016,3.0,2.0,3.0,no,AMS to NRT via XMN,3.0," |  Flew from Amsterdam to Tokyo via Xiamen on Xiamen Airlines. No seat reservation or online check-in is possible with this airline. The KLM ground staff were unaware of the transit procedure in XMN. They told us to tag our bags to NRT but apparently it had to be picked up in XMN to be checked-in again. The flight on the Dreamliner to XMN was good. Loadfactor about 40% so a whole row of seats for myself. Food was served 1 hour after takeoff and 5 hours after takeoff. On both services meals were exactly the same. Didn't see the crew for the last 5 hours of the flight. Entertainment system had hiccups all the time and wifi was not available on frame B-2769. Flight was on time. Transfer procedure at XMN is troublesome. Crew on the plane told us not to fill out the immigration form since we were only transiting. At the immigration we were send back to the end of the queue to fill out the immigration form. We also had to deliver a paper version of the ticket with our names to the immigration which we did not have. They didn't thrust the itinerary in the CheckMyTrip app. After a lot of discussion they provided us the 24-hours visa for China. Don't follow the signs to the departure hall immediately if you have a long layover. The check-in desks are located in a secure area without any restaurants or shops. Check-in was opened 2 hours before departure and we couldn't get back to other parts of the airport from security. So waiting on some steel couches for a few hours without anything to do. The flight to NRT on an old and worn B738 was delayed for 90 minutes. Sitting on the tarmac without air-conditioning for 60 minutes. No reason for the delay was given. Food was good on this flight however. I had a bad experience on the flight from NRT to XMN. It was said to be a non smoking flight, but not for the crew. All of a sudden the seatbelt signs went on without any obvious reason and the smell of cigarette smoke appeared from the air-conditioning system. After 5 minutes the smell of smoke disappeared and the fast seatbelt sign was switched off again. This happened 3 times on the 4 hour flight. Having learned from my previous transfer at XMN, it went smoother this time. Altough not possible to buy food at XMN since creditcards were not accepted and the ATM's were out of order. The flight to AMS on the 787 was packed this time. Chinese people carry lots of hand luggage so overhead bins filled up quickly. I skipped the first meal because I wanted to sleep. The flight did arrive on time in Amsterdam.",Business,4.0,nan
nan,Economy Class,5.0,May 2017,5.0,5.0,4.0,yes,Amsterdam to Seoul via Xiamen,5.0," |  Amsterdam to Seoul via Xiamen. I booked a flight from Amsterdam to Incheon and had never heard of Xiamen Air before.  Great service, friendly flight attendants, tasty food (chose the Asion options), and modern, spacious aircraft. I had 1 very tight layover in Xiamen due to construction work at the airport. The ground staff at Incheon provided us with all necessary information and the staff at Xiamen helped us through all the security steps and got us in the airplane on time. The other layover was long (10 hrs), but they provided a free transfer lounge and free hotel stay. FYI: foreign credit cards don't work in Xiamen restaurants, so bring/exchange RMB.",Solo Leisure,5.0,nan
