Aircraft,CabinFlown,CabinStaffService,DateFlown,FoodAndBeverages,GroundService,InflightEntertainment,Recommended,Route,SeatComfort,Textchunk,TypeOfTraveller,ValueForMoney,WifiAndConnectivityBoeing 787,Economy Class,4.0,May 2017,2.0,3.0,2.0,yes,Seattle to Tokyo via Shenzhen & Xiamen,4.0," |  Seattle to Tokyo via Shenzhen & Xiamen. Super cheap tickets, lack of information before and during trip, some airport confusion if you're really out of it or don't speak Chinese. They provide a hotel if flying all legs of trip on Xiamen Airlines with overnight layover, entertainment and food caters to Chinese tastes. I speak Mandarin, so I rate this flight a 8/10. Screaming deal of a ticket booked in 12/2016. Super nervous after receiving email in January 2017 of seat cancellation for the first leg of my trip (Seattle-Shenzhen). Customer service doesn't speak English. Got a call back in Chinese (my Chinese is ok, but not my first language) and took about 30 minutes plus another 30 minute call back to realize that the seat No I requested was cancelled and not the seat on the flight.  Over next few months, received a few more e-mails stating that flight times had changed, even though they were the same as when we booked them. Still felt insecure about whether or not our trip would really happen.  No online check-in for foreigners. We show up at the airport and have an easy check-in. Heard that Xiamen Air provides a hotel which the airport staff confirmed.  Arrived at Shenzhen to some chaos - they separate the transfers passengers, people are confused as to where to go, but are shepherded by the Xiamen air staff. Waited about 45 minutes with several other foreigners to get my boyfriend's 24-hour transit visa which allows him to leave the airport. Disembarked at Xiamen, shepherded again by the staff to pick up our baggage. Many of the foreign passengers did not know about the hotel that Xiamen air provided us with, since we all arrived around 9pm and had connecting flights in the morning. They expected to sleep on the floor of the airport. Followed signs to the reception desk that makes lodging arrangements. Showed our passports and tickets and provided with a room at the E-Charm Hotel in Xiamen. If you are travelling alone, they will pair you with someone of the same gender. The hotel is about 10 minutes away from the airport and costs about 15 RMB one way. Although the room provided was free, we had to cover our travel expense both ways to and from the hotel. I think this is strange. If you are only going to and from the hotel, the cash machines up on level 2 allow you to take out 100 RMB. Hotel was nice for Chinese standards! Continued to Tokyo in the morning. Flights were all around ok - seats were good enough, entertainment and meals were Chinese oriented - we ordered vegetarian meals. They were stingy on the drinks and don't add ice unless you ask. Warm beers on international flights, but grab them early.",Couple Leisure,5.0,nan
Boeing 737-800,Economy Class,5.0,May 2017,5.0,5.0,nan,yes,Dalian to Hangzhou,5.0," |  Dalian to Hangzhou. The plane was estimated to take off at 9:45 am, and we boarded the plane at about 9:20, then sat for one and a half hours until it took off but didn't know the reason! Other than that, all was good. The luggage rack was lit up by the blue lights and the seats were all blue which made the flight enjoyable and pleasant. The cabin crew were friendly and attentive. And the food was delicious: pork/fish rice, bread with chili sauce, cake and yogurt. All in all, it was a satisfactory flight.",Solo Leisure,4.0,nan
nan,Economy Class,3.0,January 2017,3.0,1.0,3.0,no,Vancouver to Hong Kong via Xiamen,3.0," |  Vancouver to Hong Kong via Xiamen. I arrived early at the airport, before the check in booth opened. Waited in line for over an hour and chatted with other passengers in front of me during that time. When I arrived at the counter, the check in clerk asked me where did I come from. I assumed she meant something about which line so I said this line, the same one as the people you just checked in. She said that I was in the wrong line and that I had to go to the back of the other line (for the other check in booth). I wondered if she thought I had cut in line or something so I told her if she had this type of doubt she should ask the people (who were still standing next to me) if I had been in their line all the time. She refused and told me to go to the back of the other line again and then proceeded to check in the next person in line. I was the last one to check in after waiting an additional 30 - 40 minutes. By this time, it was so close to boarding that I had to run to security and then run to the boarding gate as the plane was already boarding. I had to skip going to duty free to pick up things for my friends in China as I had promised. Even though I had to use the washroom, there was no time for that. No time to grab a snack or drink. It was the most embarrassing, stressful situations I have experienced in a very long time. Actually I can't remember ever being treated like that before. The airlines bounced my complaint back and forth between the Vancouver and Xiamen offices and finally put the blame on me, saying that if I had told her which line I was in this wouldn't have happened. What nonsense. Of course I told her that but she just ignored me and refused to serve me. I can understand a company hiring a bad employee but to back that person up when they know she was wrong, is inexcusable.",Solo Leisure,3.0,nan
Boeing 787,Economy Class,nan,April 2017,nan,1.0,nan,no,Seattle to Shenzhen,nan," |  My wife and I booked a flight for May 2017 from Portland to Shenzhen via Seattle. After 2 months, Xiamen notified us that our flight from Seattle to Shenzhen had been cancelled. We had to re-book our flight with Delta at a higher price $686.00 per ticket on Xiamen vs. $891.00 per ticket on Delta or $205.00 more per ticket. Furthermore, our new flight only takes us to Hong Kong, which will cost us more even more money with van transfers and taxis. I would recommend that you not book a flight on this airline, as they are not reliable and will leave you stranded.",Couple Leisure,1.0,nan
Boeing 737-800,Economy Class,1.0,January 2017,1.0,1.0,1.0,no,Singapore to Xiamen,1.0," |  First time took direct flight from Singapore to Xiamen, horrible experience with the cabin crew as they treat everyone like prisoner, very bad service, small leg room and food was terrible, I thought return trip will be better as it will be served by other crews but the experience was pretty awful. Remember this is not low cost airline, but they provide very low quality of service, no individual display on each deck, phone must switch off even after seatbelt sign switch-off, no entertaintment for 5 hours on my last trip, only served drink for once, strongly not recommended to take this airline if situation is allowed.",Solo Leisure,1.0,1.0
Boeing 787,Economy Class,1.0,January 2017,1.0,1.0,3.0,no,YVR to SYD via XMN,2.0," |  Vancouver to Sydney via Xiamen. I traveled with Xiamen Airlines for the first and last time over December/January. Originally flying from Sydney to Vancouver via Xiamen in December and back to Sydney Via Xiamen in January. All flights were on new Boeing 787's. The flights were extremely full, probably due to the fact it was just under $650 one way on Christmas Eve. That was probably the only appealing thing from the trip. The aircraft inside were rather dirty, finger prints and grease all over the windows, the cabin had an aweful smell as well. The seat space was okay. The inflight entertainment was updated and had a good selection. The food was nothing to get excited about, and the crew only came twice during the whole flight which is below the amount of times they come on other services I've flown between Sydney and Vancouver. The crew overall were okay, spoke hardly any English and weren't apologetic if they hit you with the trolley. The layover in Xiamen both ways was a complete nightmare - no one at the airport speaks English, and even if you are transiting immigration seem to have no idea what the process is and take a long time to process you as you have no visa. I won't be flying Xiamen again.",Solo Leisure,5.0,nan
Boeing 737-700/800,Business Class,4.0,November 2016,3.0,5.0,1.0,yes,BKK to FOC,2.0," |  Bangkok to Fuzhou return. I had no idea what to expect on Xiamen Airlines. During check-in at Bangkok, The counter was empty. The lounge in Bangkok was Air France, and more than satisfactory. The boarding was orderly and not too chaotic. The purser at the door was smiling, but when I said hello, no response whatsoever. (ot even eye contact. Boarding drinks served promptly. You can't use mobile phones (Chinese law, which is silly). There was no in-flight entertainment, so I just played my iPad. The flight attendant was polite,  made eye contact and was smiling. Her attempts at speaking english were OK, she was just following the script. The previous reviews that mentioned ""The meals were the same both ways"" meant that both flights had the same choices. It was just a difference in entree, fish or beef. The side dishes were exactly the same. Their way of cost-cutting, I presume. After meal service, the flight attendant left a bowl of mixed nuts and my drink. The return flight was the exact opposite. Bangkok to Fuzhou sector had 30% occupancy, while the return sector had 100% occupancy. The lounge at Fuzhou airport was surprising for Chinese standards, but no alcohol! Boarding was orderly, but after take-off, a first-time flyer from the economy cabin trespassed into the business cabin and asked me  ""Is this seat available?"" and I said no.  The same unruly passenger proceeded to annoy the business class flight attendants but they dealt with him professionally. The seat was uncomfortable both ways. The Boeing 737-700 had very restrictive seating, but ample space. The Boeing 737-800 had comfortable seating, but I had to bend my head during take-off and landing since there was this bulging solid piece of rubber in the headrest. The cabin smelt of cigarettes or someone was smoking before the flight. ",Business,4.0,nan
Boeing 737-800,Economy Class,3.0,September 2016,4.0,1.0,1.0,yes,SIN to FOC,2.0,"Singapore to Fuzhou. Value for money great, as Xiamen Airlines is the only airline that serves this route.  Ground service acceptable, most of their flight attendants can speak basic English. Seat preferred it to be a little more comfortable. Cabin Service average, offered hot towels which are too hot to touch. Food & beverages better than expected. Inflight entertainment average, offered headphones for music which was acceptable. ",Family Leisure,3.0,nan
Boeing 787 / A321,Economy Class,3.0,November 2017,3.0,2.0,3.0,yes,Los Angeles to Bangkok via Xiamen,3.0," |  Los Angeles to Bangkok via Xiamen. It was not the overly-friendly skies, especially on the shorter flight, but the snacks, food and beverage were OK. Another review reminded me of the barely audible English announcements (use headphones to hear it). The seats and legroom seem average. The Boeing 787 for the LAX-XMN segment is a nice, new aircraft. The entertainment system had a small selection of music and movies, which were adequate. Emirates scores better there! The website is hard to use, and changes seemed impossible. But I successfully purchased a ticket. If I purchased again, I would be certain everything is perfect before clicking Submit. I'm hesitant to call ""customer service"" as English is not their main language, and rules over customer satisfaction seem to be the situation. The worst part of the flight was the layover in Xiamen, China. Border control entry is required, followed by departure control. This is slow and time consuming. Re-entering security is very strict. Every passenger is wanded after passing the magnetometers. My baggage scan revealed two small Bic lighters, which were confiscated. Any lithium batteries in checked bags are likely to be removed. The airport is years behind many International airports, and is hard to spend time in. However, long layovers can qualify you for a hotel room (+5 hours), a city tour, or the lounge on the lowest level - with free Wi-Fi. The lounge was quite basic and drab. Hard to call it a ""benefit"". A room in the back had cots. In the airport, I was twice offered working iPhones for cash. With a landing announcement that mentions contacting quarantine if you're ill, including headaches, nausea or diarrhea, and the scrutiny upon entry and exit, I don't advise buying black market iPhones. The ticket price was very competitive. If they improved the layover experience at their airport in Xiamen, it might be worth the savings.",Family Leisure,4.0,nan
nan,Economy Class,2.0,September 2016,3.0,1.0,nan,no,WUH to AMS via XMN ,3.0," |  Wuhan to Amsterdam via Xiamen. My flight was cancelled due to bad weather conditions. The company sent me an email in Chinese stating that I had to rebook my flight but without giving any option of possible different solution. Once at the airport they were surprised I was asking to be rebooked on another flight and/or reimbursed. I'm going to try to follow up on this and see if I can get something, but in general I didn't like the way they handle the problem, they didn't care about leaving people at the airport without any support. In addition both the airport and the cabin staff barely speak English, so it's very hard to communicate with them.",Business,2.0,nan
Boeing 737-800,Economy Class,3.0,October 2017,2.0,3.0,1.0,no,Xiamen to Hong Kong,3.0," | Flight left about 30 minutes late, which is much less of a delay than usual. Crew looked tired as this was an evening flight. Crew English announcements still not really understandable through PA. No comment from cockpit crew as is usual with international airlines. Extremely hard landing in HKG (no noticeable weather or turbulence). No comment from the cockpit crew again. They still have a long way to go in my opinion to be on par with international airlines. Sometimes hearing the crew's voice in understandable English (since this is an international sector) would help.",Business,4.0,nan
nan,Economy Class,1.0,August 2017,1.0,1.0,nan,no,Beijing to Xiamen,1.0," |  Beijing to Xiamen. Such a rubbish airline, first they cancelled my flight without offering compensation. Then I tried to reason with their agency, they said they recommend I asked for a full refund. Is that a joke? I was at the airport and they wanted me to refund. I then insisted that I change to the other flight, which was scheduled to depart at 20:05 but we waited more than 5 hours due to air traffic control. Can't really trust the airline, especially you're dealing with state-owned airlines, and they don't obey by rules set out by international standard.",Business,1.0,nan
Boeing 787-8,Economy Class,5.0,July 2017,5.0,5.0,4.0,yes,Seattle to Shenzhen,5.0," |  Seattle to Shenzhen. Check-In was quick. Boarding commenced slightly late but was controlled and orderly. The Boeing 787-8 was new and a bit squeaky. The seat had a 17 inch width and 32-33 inches of pitch. The seat had a cup holder, remote, USB and AC power ports and a fairly large personal screen. The selection of content was decent but a lack of Western movies and appealing Eastern movies could be improved. The food served was good and a decent portion was served. The crew were quite sincere and attentive to all calls, Their English was okay for interactions but not too great over the PA. ",Family Leisure,5.0,nan
nan,Economy Class,3.0,July 2017,3.0,3.0,1.0,no,Quanzhou to Beijing,2.0," | Quanzhou to Beijing. The airline lured us into boarding and held us in the cabin for more than a few hours. Initially, they announced the aircraft would push back to the tarmac in 10 minutes, which didn't happen. Then I confronted a member of cabin crew and he kept saying it was the tower controller who had said the plane would push back in 10 mins and then told us to wait. The lack of transparency, coupled with highly restricted air traffic by military has tarnished this airline's reputation. Never fly on Chinese domestic routes if you had a choice. The delay is prolonged, unpredictable and not compensated for.",Business,1.0,1.0
Boeing 787-9,Economy Class,4.0,June 2017,3.0,3.0,4.0,yes,Los Angeles to Xiamen,3.0," |  Los Angeles to Xiamen. The flight was delayed due to unknown reason.  The aircraft is relatively new, bright, clean and modern. The interior was specially decorated for this inauguration flight with LAX symbols. The crews welcomed us with big smiles and everyone gets a little gift for the inauguration flight. They personal entertainment system has a large screen, and the system worked just as I wanted without struggle. A safety card, two magazines and a menu in the pocket; a blanket and a bottle of water on the seat. But the menu missed a translation for breakfast. The food is not bad but can be improved. The crew were trying to act as friendly, but lacked some sincereness, but they did a great job. Their English skill really needs improvement.  As a Chinese airline they followed the CAAC rule, which restricted people to use their laptops and other devices only when the aircraft reached cruising attitude and didn't allow passengers to switch on their phones at all. And they locked the 787 windows to a certain brightness which make them impossible to adjust by passengers. Another problem is that I had a transfer flight at XMN, but I had to pick up my luggage and recheck it again. ",Solo Leisure,4.0,1.0
nan,Economy Class,2.0,July 2017,nan,1.0,1.0,no,Hong Kong to Xiamen,4.0," |  Hong Kong to Xiamen. Upon arriving at HKG airport, my gate was still unannounced. I spoke with the airline representative many times, as did other passengers, and nothing was posted on the departure board about our takeoff or a delay or any gate. Even after scheduled departure time there hadn't been any notifications of a delay. Finally, we were told which gate to go to. We boarded the plane two hours late and had to wait 30 minutes more as the flight attendant said it took that long to load the luggage (even though less than half of the plane was full). When my phone died, I asked an attendant if they could help me to charge it as I didn't know the Chinese name of my hotel in Xiamen. He refused several times until I was very persistent that it would not had died if I had not waited so long for the flight. Landing was smooth but on the way back the same issues existed, all the while announcements on the speaker mentioned how important guests were to Xiamen Airlines. I didn't feel that at all. The staff should be more transparent and clear with guests about delays and procedures, as delays of that magnitude require changes in planning and sometimes result in losses.",Solo Leisure,1.0,1.0
Boeing 787 / 737-800,Business Class,5.0,May 2017,5.0,4.0,3.0,yes,Amsterdam to Changsha via Xiamen,4.0," |  Amsterdam to Changsha via Xiamen.I'd never heard of this airline before this trip. I have to say that I was delighted. Very polite and helpful cabin crew. Other reviewers mentioned that their English was poor, but I didn't have any difficulty. Food and drink were very good and IFE was better than I had anticipated - not great (nothing like Emirates, for example), but good, recent international films. The seat lies flat and allowed me (6 ft / 183 cm height) to stretch out comfortably. No wifi and phones have to be switched off, as per Chinese Govt rules. But using a tablet in airline mode is OK. There is an electric socket at the seat and it was enough to power my fairly large laptop. I would fly with them again. The 2nd sector was internal from Xiamen to Changsha. Once again, excellent service and good authentic Chinese food. No IFE, of course, being a short sector, so they left the TV on instead (so bring earplugs or headphones if you don't want to be bothered by it. That was the only strange aspect of the flight.",Business,4.0,nan
nan,Economy Class,5.0,May 2017,4.0,4.0,2.0,yes,Vancouver to Ho Chi Minh via Xiamen,4.0," |  Vancouver to Ho Chi Minh via Xiamen. Sat in Business class on outbound and regular economy seats on the return. Service was great, they did not understand everything in English however they knew enough.  Food was good. Seats were fine for a overseas flight.",Solo Leisure,5.0,nan
Boeing 737-800,Economy Class,1.0,June 2017,1.0,4.0,1.0,no,Tianjin to Fuzhou,3.0," | Tianjin to Fuzhou with Xiamen Airlines. The airline lured us into boarding and we were kept on the aircraft for over an hour without any announcements, which is shameful. This airline prides itself on proving the best service in China, however this has not been the case for me, the basis communication between them and passengers is not maintained, raising many questions of how any news being delivered in a transparent way.",Business,1.0,1.0
