Aircraft,CabinFlown,CabinStaffService,DateFlown,FoodAndBeverages,GroundService,InflightEntertainment,Recommended,Route,SeatComfort,Textchunk,TypeOfTraveller,ValueForMoney,WifiAndConnectivitynan,nan,nan,nan,nan,nan,nan,no,nan,nan,Istanbul to Kathmandu and Jaipur to Istanbul I found the service provided by Air Arabia to be efficient prompt and reliable. No delays a fair service onboard (with a good selection of snacks at a reasonable price) as well as a quick transfer and 96 hour visa desk. The only problem is that in the evening (around 9-10pm the airport in Sharjah is crowded with many departures and arrivals. The immigration / security check sections are understaffed for this situation and there can be long queues. Hopefully the airport service will improve. Otherwise a fair mark for Air Arabia both for the service quality and for the good coverage of the Middle East & Central Asia.,nan,nan,nan
nan,nan,nan,nan,nan,nan,nan,no,nan,nan,It's a boon for business travellers who travel regularly within GCC. Excellent flight timings friendly staff on-time departures / arrivals and quality food on board at nominal price makes it ideal in terms of value for money. However the best feature I like of Air Arabia is the convenience of booking on-line from their fantastic web portal.,nan,nan,nan
nan,nan,nan,nan,nan,nan,nan,no,nan,nan,Recently flew from Sharjah to Aqaba to Sharjah for a family weekend in Petra Jordan. Schedule convenient flights on time clean and comfortable aircraft and very friendly cabin crew. On board food can be purchased with a good selection of quality sandwiches at very reasonable prices. Seats have a very good pitch and aircraft on both flights were very new. This airline is expanding in the middle east and I would recommend using them anytime as they are extremely good value for money. Also Sharjah airport much less congested than nearby Dubai. The whole experience resulted in a great holiday.,nan,nan,nan
nan,Economy Class,1.0,nan,1.0,nan,1.0,no,nan,2.0,Flight G9301 at 14.25 11th October 2014 from Kiev to Sharjah was delayed for 20 hours due to technical problems with aircraft. All passengers were seated at the aircraft during 5 hours without any food at all! We got beverages twice only. During that passengers had to listen to captain's promises about departure every 20 minutes each hour. Before flight cancellation captain told the passengers that the aircraft was fixed and ready to fly but the crew were out of hours. After disembarkation baggage claim procedure was unorganized and horrible. We spent a night at the hotel and departed the next morning.,nan,3.0,nan
nan,Economy Class,1.0,nan,1.0,nan,1.0,no,nan,3.0,London Gatwick to Casablanca Flight 30106 30105 11/1/2014 18/1/2014. I was very disappointed to hear from the crew that the airline did not supply them with any copies of the on board sky cafe menu or food menu. The only thing we were been offered to buy or eat was a choice of disgusting chicken or cheese sandwiches! During our return and only 20 minutes before landing that my daughter found a copy of the menu under her seat full of delicious hot and cold meals snacks pastries candies and drinks that were all available but hidden from passengers!,nan,3.0,nan
nan,Economy Class,5.0,nan,4.0,nan,3.0,yes,nan,4.0,A320 flight Sharjah-Yanbu (Saudi Arabia) on 16 Sept. Great flight. Check-in was easy and agent offered me a pass to the Biz Lounge for AED 100 with food wifi drinks. Lounge was nice but wifi didn't work - not a big deal. Flight boarded via bus so nice to walk up the plane. Flight attendants very friendly - speaking 8 languages so very diverse. Safety video is the best ever! All done with children so you really want to watch and pay attention. Ordered a turkey sandwich which was large and very tasty. Smooth flight and landed 10 min early. Really enjoyed the airline and flight.,nan,5.0,nan
nan,Economy Class,nan,nan,nan,nan,nan,yes,nan,nan,30 January to 01 February. Jeddah - Sharjah - Jeddah. Reservation completed online with no difficulty. As a LCC Air Arabia offers free carry on luggage and additional checked baggage for SR 50. Also offered confirmed seat for SR 50. I took the seat confirmation on both legs. Did not take advantage of the advance purchase meal offer nor did I purchase anything to eat on the flights. Inflight entertainment on A320 was suitable for a short haul flight. Seats were comfortable and flight attendants professional and efficient. On board sky sales were relatively affordable but I did not notice any major brand names. Interesting boarding and seating announcements were started while passengers were boarding rather than after the doors had closed. I thought this was a good use of crew time. I have flown Air Arabia Jeddah to Sharjah before and have enjoyed my flights I prefer the route rather than the Jeddah Dubai flight to avoid the hustle and bustle in Dubai airport. All in all a very enjoyable trip.,nan,nan,nan
nan,Economy Class,4.0,nan,4.0,nan,nan,yes,nan,3.0,Trivandrum to Sharjah and return. Being a frequent flyer on this route in my opinion Air Arabia is one of the best low cost carriers I have flown. Every time the flights were on time clean and tidy with not so bad seats and leg space. Food available for purchase on board was reasonable and quite good. Overall a very good value for money and a highly dependable airline for sticking on to the schedule every time.,nan,5.0,nan
nan,Economy Class,nan,nan,nan,nan,nan,no,nan,nan,After booking my flight from Casablanca to Gatwick one month in advance I discover today that my flight tomorrow has been moved forward 6 hours. Had to get alternative flight on Royal Air Maroc. No reason for alteration of flight time and no help or suggestions. First time I have booked Air Arabia and the last time.,nan,1.0,nan
nan,Economy Class,nan,nan,nan,nan,nan,no,nan,nan,Air Arabia from Stuttgart to Marsa Alam and back. Service is pretty much non existEnt and only a major case of hunger made the onboard meal edible. On the return flight takeoff was delayed about 3 hours no information as to why was given to us. As this was known well beforehand we could have remained in our hotels instead of being jammed into the airport at 1 in the morning then finally boarding the aircraft at 04:30 and sitting on the Tarmac for an hour before takeoff. During this time the crew had better things to do than hand out any water or other liquid refreshment it seems. I shall not be flying with this airline again if I can help it and shall recommend to all I know that they should avoid it.,nan,1.0,nan
nan,Economy Class,nan,nan,nan,nan,nan,yes,nan,nan,Bangalore-Sharjah. Despite leaving at ungodly hours 3.30am in my case this is probably one of my favourite low cost carriers and in my opinion better than some full service airlines that fly from the middle east to India. Plane was clean and service was excellent plane half empty so had whole row to sleep. Since leaving so early in the morning lights are switched off early overall happy with the service Air Arabia provides.,nan,4.0,nan
nan,Economy Class,nan,nan,nan,nan,nan,yes,nan,nan,CMN-BRU. For a LCC Air Arabia has been a welcome surprise. They offer you 20 kg baggage allowance new airplanes decent seats and a fresh crew. For a price/quality comparison they are better than Air Maroc. But their website is often malfunctioning certain routes are deleted without notice time tables suddenly change and they often leave at ungodly hours. I'm satisfied with this airline and will keep flying them if they keep their standards to the current level.,nan,4.0,nan
nan,Economy Class,nan,nan,nan,nan,nan,no,nan,nan,My wife my daughter (infant) and son travelled to Goa by Air Arabia - Dammam-Sharjah-Goa. Air Arabia did not provide the Bassinet for my infant even though it was mentioned in the E-ticket. My wife requested the crew to provide the Bassinet but they did not help her to provide this.,nan,1.0,nan
A320,Economy Class,1.0,December 2016,1.0,1.0,1.0,no,MUX to DXB,1.0," |  Multan to Dubai.The flight was supposed to leave at 10:40am from Multan, Pakistan but it took the whole day till 9pm in the evening waiting for our flight to arrive, without any proper information from Air Arabia as to why is the flight been delayed and what actions being taken. They never tell us if it will be canceled or just been delayed. The staff cannot even give any details from Air Arabia from Sharjah in UAE as to whether they will be sending the plane to Pakistan or not. We tried to contact the Air Arabia Sharjah landline and customer service but to no avail.The line is not being attended and only automated reply is what you get everytime you ring them. Air Arabia cannot take care of their passengers. The delays caused us a lot of trouble at work and stress to our family and friends.",Solo Leisure,1.0,1.0
nan,Economy Class,3.0,November 2016,3.0,2.0,1.0,yes,SHJ to CGP,2.0," | Sharjah to Chittagong with Air Arabia. Good value for money. Well maintained schedule. Good offers every week. Check in very slow in Sharjah. Seat not comfortable. 1 of the cabin toilets is restricted by cabin crews. As such, there is always a long queue.",Family Leisure,3.0,1.0
A320,Economy Class,5.0,October 2016,5.0,5.0,3.0,yes,SHJ to BAH,5.0," | Sharjah to Bahrain with Air Arabia. The best economy class legroom in a low cost concept I have experienced. Flight attendants very professional, friendly and smiling. Boarding smooth quick and easy. Catering on board reasonably priced. For a low cost airline everything was impeccable. I was with my family and we were very satisfied. I will consider flying again with Air Arabia.",Family Leisure,5.0,nan
A320,Economy Class,4.0,July 2016,2.0,4.0,1.0,yes,CGP to JED via SHJ,3.0, | I flew from Chittagong to Jedddah via Sharjah and return with Air Arabia. All the 4 flights were nice and comfortable. The seats offered great legroom which is 32 inches. The cabin crews were very friendly and helpful. However the food quality was average. You have to book your meal with the ticket or you have to purchase it on board. Overall I think Air Arabia offers the best value for money.,Solo Leisure,5.0,nan
A320,Economy Class,5.0,January 2016,4.0,4.0,nan,yes,TNG to AMS,5.0,"is a very decent airline. Delays with any airline in North Africa are common and therefore I have no big reason to complain. Service onboard is as good as any other and with kindness to the crew who is serving you, smiles and respect goes both ways. Had to pay for food and drinks but it is not a big deal. Prices are fair in comparison with some of the bigger low cost airlines. I hop on Air Arabia Maroc very frequent and my experiences with them have always been good.",Business,5.0,nan
A320,Economy Class,4.0,December 2015,nan,3.0,nan,no,SHJ to DOH,5.0,"I travelled Air Arabia from Delhi to Sharjah, and Sharjah to Doha, flying on an A320. It was not so nice because no food is served, and there is no personal tv. One thing that is nice on Air Arabia is that the seats offer good legroom with a 32 inch seat pitch.",Family Leisure,3.0,nan
A320,Economy Class,3.0,December 2015,1.0,1.0,1.0,no,AMM to KWI,3.0,"Amman to Kuwait. I had a very bad experience with Air Arabia. The flight was supposed to leave at 1pm and they informed us because of some technical issues the flight should be delayed until 5pm. and no from the company came back to inform the passengers about the status. On the boards we have seen its delayed to 6pm. Again no one appears we called the airport security team to bring us Air Arabia staff but no one shows up. Then they announced the flight will be delayed until 8pm for the 3rd time. Gate changed 3 or 4 times. Company was not clear and keeps ambiguity from the beginning. Although technical issues can happen any time, you have to be clear with your passengers.",Family Leisure,2.0,nan
nan,Economy Class,2.0,December 2015,nan,1.0,nan,no,Sharjah to Mumbai,2.0,"That was my first experience on Air Arabia. I booked for a return ticket from Sharjah to Mumbai. The seats weren't that comfortable but timing wise it was good no delays. NO WiFi or any other sort of entertainment on the flight, but it was one of the most economical and available tickets at this time of the year. ",Solo Leisure,2.0,nan
nan,Economy Class,3.0,September 2015,1.0,2.0,2.0,no,Multan to SHJ,1.0,"That was my first experience on Air Arabia. I booked it for AED-1865 for a return ticket from SHJ to Multan. The seats were not comfortable or clean. The most amazing thing is that you have to pay for a glass of water, which is beyond my imagination. Coming back from multan, the flight was late for 6 hours, so from my side I will give 3/10. Not a trustworthy airline.",Business,3.0,1.0
Airbus 320,Economy Class,4.0,October 2014,4.0,3.0,2.0,yes,Chennai to Sharjah,4.0,"The flight was good, the price of the ticket was low - about AED 900. For the money we paid the service was really good, there are some problems like there is no food provided so we had to buy this onboard the plane. We did not have personal TV and the inflight entertainment was poor but the cabin crew service was good. I recommend if you want a cheap ticket with good service, but no entertainment onboard.",Family Leisure,4.0,2.0
