Aircraft,CabinFlown,CabinStaffService,DateFlown,FoodAndBeverages,GroundService,InflightEntertainment,Recommended,Route,SeatComfort,Textchunk,TypeOfTraveller,ValueForMoney,WifiAndConnectivitynan,Economy Class,nan,nan,nan,nan,nan,yes,nan,nan,Flew on their new direct flight from Honolulu to New York (JFK) to celebrate the 4th of July. Very impressed with the speed of their boarding flight attendants were friendly and enough storage space. The seats of this Airbus were slightly wider than normal HAL planes so didn't feel like a packed sardine the seat itself slides forward as it reclines and there were folds on the headrest so you wouldn't end up on your neighbor's shoulder; it was quite comfortable to sit for the 10 hour haul. Free soda snack and meals (2) snacks for purchase alcoholic drinks for purchase premium meals for purchase. Surprised that you actually get 2 basic meals for free. Passed out free headsets and there were some video and audio for free but had to pay for others. Everyone has their own video monitor so very cool. USB input available. I kept falling asleep during the meal and drink service and they were very accommodating to bring it for me when I woke up. No regrets and will be returning in 6 months!,nan,4.0,nan
nan,Economy Class,nan,nan,nan,nan,nan,no,nan,nan,Check in at Kansai A/P (Japan) is dysfunctional. I had bought round trip tickets state side for travel from SFO to Kansai due to personal circumstances I ended up buying the trip in 2 segments (for the same day). The first from SFO to Honolulu with a connecting Hawaiian flight to Kansai with similar routing on the return. I was assured I would be able to route my baggage through from SFO to Kansai and visa versa (i.e. without having to pickup and recheck in Honolulu). The agents at SFO were able to do this but the Japanese agent at Kansai insisted that Hawaiian required all baggage picked up at Honolulu with passenger responsibility to recheck bags for continuation flight to SFO. Of course this created undue/unnecessary passenger burden! Bottom line Hawaiian needs to improve training of the Japanese agents they hire for check in at Kansai. I will never take Hawaiian for travel outside the states again!,nan,1.0,nan
nan,Economy Class,nan,nan,nan,nan,nan,yes,nan,nan,ITO-OGG-ITO Weekend inter-island flight. It was an uneventful flight. Service from check-in to inflight was amazing. Its the only way to fly.,nan,4.0,nan
nan,Economy Class,nan,nan,nan,nan,nan,no,nan,nan,"Flew from Honolulu to Maui on Hawaiian Airlines because of my executive platinum status on AA. With my status we thought that it would give us preferred boarding and no checked bag fees - wrong! I stepped into the ""Premier"" line to see if we could get on an earlier flight as we were at the airport ahead of schedule. The woman behind the counter rudely told me to get into the other line (no one behind me BTW) because my status on AA ""didn't matter"" to Hawaiian Airlines even though they were a codeshare partner. I stepped in the other line only to get right back to the same person five minutes later. I asked if we could standby for the earlier flight and she proceeded to charge us $50 per person. For a thirty minute flight with open seats? Decided against that and was rudely reminded that we would still have to pay baggage check fees because they didn't care about our status with AA. Her tone was so rude that I asked to speak to a supervisor who came out and proceeded to complain about AA. I will avoid Hawaiian Airlines at all costs and fly one of the other commuter airlines with better service and lower costs.",nan,1.0,nan
nan,Economy Class,nan,nan,nan,nan,nan,yes,nan,nan,JFK-HNL roundtrip. The food on both flights were very good. There were drinks given throughout the flight and you were able to get a drink anytime throughout the flight. The FA's were nice and interacting with the passengers and were polite and were always cleaning the plane. The bathrooms were clean and FA's cleaned them frequently throughout the flight which is something you do not normally see. On the A330 there was plenty of legroom in the economy class. However the one drawback was when I was trying to confirm a seat on the plane the person on the phone was unhelpful and was unable to help my problem. On the flight you also had to pay for the in flight entertainment and they had a big selection of movies to choose from.,nan,4.0,nan
nan,Economy Class,nan,nan,nan,nan,nan,no,nan,nan,We were married in Maui. Our outbound was very good. On our return flight to Vegas we had a medical stop in Oakland. When we landed some passengers got new flights and hotels to stay in two groups were connecting on Southwest however the customer service desk said they don't work with Southwest so they had to find their own accommodation. In the meantime I got a new flight on my own and I gave a staff member the numbers to our new flights to add our luggage to. He promised it would be there then he left without telling us anything. We slept in the airport until the next morning where we flew out. Our luggage was not on the flight with us.,nan,1.0,nan
nan,Economy Class,nan,nan,nan,nan,nan,yes,nan,nan,LAX-HNL on the new A330-200 economy class. Boarding at LAX was chaotic and crowded although we were spared the worst of it because we got priority boarding with 2 babies. The flight left on time and arrived about 25 minutes early. There was no wait on the tarmac at HNL for a free gate. Inflight service was much better than average for U.S. carriers food was decent IFE was better than the competition and the cabin crew smiled more and was more attentive than average for U.S carriers.,nan,4.0,nan
nan,Economy Class,5.0,nan,5.0,nan,3.0,yes,nan,5.0,Wife and I flew from Las Vegas to Kona Hawaii connecting both ways in Honolulu. The LAS-HON leg is on an Airbus with 2+4+2 seating in economy so my wife and I can sit together. Hawaiian doesn't jam the seats in economy together as much as some airlines. And for an extra $35 per passenger each way you can get a bulkhead or exit row seat with tons of legroom but to get this you have to do online check-in pretty darn close to 24 hours before your flight. You can actually call the airline and talk to a customer representative without waiting more than a few minutes. If you fly in the evening you get a free tasty although small real hot meal with veggies and meat salad and dessert. (The breakfast service is also free but not as nice as the dinner.) Also when I asked about wine the steward mentioned the half bottle (375 ml) of red as having pleased other passengers so my wife and I bought it for $16 and it was a nice pinot noir.,nan,5.0,nan
nan,Business Class,1.0,nan,nan,nan,nan,no,nan,1.0,Arrived at Kona airport with Hawaiian taking us to connect on Oahu with united to California. Had first class tickets upgraded with United points. They tried to charge us for all our bags even though our ticket clearly stated our luggage was free. We asked for a supervisor who still refused to do anything. Finally agree but had delayed us so long we missed our flight. To add insult to injury they stuck us in economy on the next flight. Interesting to see they do not honor United premier or upgrades. Pretty unhappy with desk service!,nan,4.0,nan
nan,Economy Class,2.0,nan,3.0,nan,3.0,no,nan,4.0,LAX-HNL HNL-SFO in A330s. The planes were new and clean. Soft drinks and tea/coffee are free. You also get a free meal (poor to fair quality) with a free wine to accompany it. They nickel and dime you for everything else (baggage IFE (films etc.) preferred seating). Cabin crew was efficient but not overly friendly on the outbound flight and on the return flight one member was downright surly. He didn't even look at us when handing us drinks and ignored us when we asked questions. Also took inter-island flights HNL-ITO return in B717s. Good for short flights and you get a free juice or coffee. In summary Hawaiian are good for inter-island but avoid them for long-haul flights.,nan,3.0,nan
nan,Business Class,5.0,nan,4.0,nan,4.0,yes,nan,3.0,"I hate overnight flights so I booked Business class for the Sydney Hawaii leg in the hope that the extra $1000 would provide a decent night's sleep. Wrong! While the seats do have a footrest and recline more than in economy there was little similarity between Hawaiian and other carriers business class seats Even the pillows were the small and inadequate and the amenities provided were very basic - no cute bag to keep as a souvenir. The cabin crew were excellent and the food served much better than economy but again there is no comparison between it and say the food served in Qantas premium economy. Our flight back to Sydney was back in economy and I was very happy with the experience though the ""Hawaiian high tea"" served towards the end of the flight was just a roll and a biscuit. Flights on all the sectors I flew were on time and had very professional and helpful cabin crew.",nan,2.0,nan
nan,Economy Class,nan,nan,nan,nan,nan,yes,nan,nan,Flew Honolulu to Sydney in Economy. Got exit row seats row 33 with bulkhead in front. Plenty of leg room and no one in front putting their seat back. The only problem was that other people feel it is a through traffic area and use it to cross from one side of the plane to the other. I paid the $75 to have that space for me. I ended up no moving my legs and annoyed some people by doing so. The other thing is the flight attendant was going to move another passenger into the empty seat between myself and a travel friend as the other person was unhappy with her normal economy seat. I complained and reminded her that we had paid $75 for these seats and why should she get a free seat. There were empty rows of seats at the back of the plane that she could have moved her to. I got my way and she was not moved to the exit row seats. Food was good digeplayer was poor. Staff overall were ok. Did not show to much of an effect to make the trip enjoyable. But would fly with them again.,nan,4.0,nan
nan,Economy Class,nan,nan,nan,nan,nan,yes,nan,nan,Seattle to Honolulu return in economy. Enhanced meal service with new breakfast box containing bread with cream cheese guava jelly dried fruit and a macadamia nut cookie. Return dinner teriyaki chicken with salad and cake for dessert. All this food plus a free mai tai on the way out and wine with dinner on the return on a domestic USA flight and free to boot? Unheard of nowadays but thank you Hawaiian for still being the only US carrier to offer free food on flights. Cabin crew generally friendly and sharing the aloha spirit. Be nice to the crew and they will be nice back to you. Cant wait for them to bring the A330 to Seattle!,nan,4.0,nan
nan,Economy Class,nan,nan,nan,nan,nan,yes,nan,nan,Although I am Pualani Platinum and am generally looked after on Hawaiian I have two upgrade certificates which are virtually useless as my preferred flights are booked out and being able to secure any upgrade from within the allowed window of 7 days to 4 hours of the flight is impossible. I have travelled Business on several occasions between Sydney and Honolulu during 2011-12 and although there has been an introduction of new aircraft of late previous flights have been on old planes with tray tables faulty on two occasions. Seats are also not very comfortable in Business although are better than Economy where space between is very tight especially with tray table down and the seat in front reclined. On 6 September 2012 I did Honolulu-JFK on HA50 at least ending up in a pre-booked window seat in row 13. Overall it was very ordinary if adequate without anything terribly exciting. Arrival at JFK was good in what potentially is a nightmare airport.,nan,4.0,nan
nan,First Class,nan,nan,nan,nan,nan,yes,nan,nan,Maui-Oakland/SF-Honolulu First Class. As always an extremely good experience due to the friendly staff good food and comfortable seating. Puts the legacy carriers to shame. Maui-Oakland on an older 767 and SF- Honolulu on the new A330. Both aircraft's have their pluses and minuses. Seats on the 767 are actually more comfortable when upright while the entertainment on the 330 is far superior in choices. Meal service is the same and was excellent on both flighst. Staff friendly and welcoming in short everything a cabin crew should be but rarely is these days especially to and from Hawaii.,nan,4.0,nan
nan,Economy Class,nan,nan,nan,nan,nan,yes,nan,nan,LAX-HNL-SYD-HNL-JFK. A330-200 on every route. Staff and front desk very helpful. FA's very nice. On flights to mainland you have to pay for IFE. On LAX-HNL leg they served a turkey sandwich and a brownie. Chose to upgrade to the cheeseburger for $12.99. Not a lot of leg room onboard but the seat wasn't too bad. Boarding was slick and organized. On flight to Sydney you were served a meal after takeoff and a light snack before landing-not really enough for a 10 hour flight. You also had to pay for IFE on New York flight which is a long route with no IFE. I would definitely fly Hawaiian if I was going from mainland US to Hawaii and definitely a better experience then when I flew United to Hawaii.,nan,4.0,nan
nan,Economy Class,nan,nan,nan,nan,nan,no,nan,nan,It feels like Hawaiian Airlines is becoming more like Delta and United with their very late flights. I've had my fair share of flights amongst the mentioned airlines. I never thought I'd even be comparing the three airlines. Third time in a row my flight is leaving more than an hour late. This last time Hawaiian boarded us then told us to get off because they needed to refuel. We were told we'd leave in two hours. Five hours later they board us again then tell us they still need to refuel. I forgot to mention they were kind enough to reimburse us with poor head sets.,nan,1.0,nan
nan,Economy Class,5.0,nan,4.0,nan,nan,yes,nan,5.0,HNL-KON-OGG-HNL. Inter-island service is fantastic very comfortable. Every time we were asked by check-in staff whether we wanted emergency exit as I am very tall whilst flights are short as soon as we took off a tasty local fruit drink was offered. I was so impressed I will try them long haul next time hopefully they add Melbourne to their Brisbane and Sydney destinations in Australia.,nan,5.0,nan
nan,Economy Class,4.0,nan,3.0,nan,1.0,yes,nan,4.0,BNE-HNL-SEA. Check-in at BNE was easily the slowest I have experienced anywhere - terrible. The check-in staff at BNE are obviously local contractors who couldn't even tell me if I needed to change terminals at Honolulu ! Very poor directions from ground staff at HNL as to how to get to domestic flight. Aircraft was clean comfortable and seat space seemed quite OK. Staff on board are excellent and very friendly. Ground staff need a good shaking up. Meals only so-so. Lousy in-flight entertainment I simply didn't bother. I would fly again if they could trim their prices a bit but if cabin staff should ever fail me I wouldn't be back.,nan,4.0,nan
nan,Economy Class,5.0,nan,4.0,nan,4.0,yes,nan,4.0,"JFK-HNL-JHM-HNL-JFK. Excellent trip in all respects. JFK-HNL leg was on a new A330. Economy seats are 32"" pitch more than most US carriers. That extra inch makes a difference on a 10-11 hour flight. Two free meals were served by hard-working and attentive staff along with several drink services. Yes the first bag cost $35 but Hawaiian checked it through from JFK to West Maui even though that flight was on Island Air and I never touched the luggage until I reached my final destination. I enjoyed these flights so much that I have already reserved another JFK-HNL-KOA-HNL-JFK trip for this coming July. Since I booked so early I was able to snag row 13 which is in the small quiet section behind Business Class.",nan,5.0,nan
nan,Economy Class,4.0,nan,3.0,nan,3.0,yes,nan,3.0,My wife and I flew BNE-HNL-BNE 767 just prior to Christmas and returned early January 2013. Flights were on time and staff efficient and helpful. The service side is a let down they say we are a full service airline but there is no choice with meals and very limited drinks service. The seats are reasonable for someone my size 6ft 2 but I would like better entertainment than a digiplayer. If we were planning on returning to Honolulu I would think about upgrading to business.,nan,3.0,nan
nan,Economy Class,3.0,nan,4.0,nan,1.0,no,nan,2.0,OAK-OGG-KOA KOA-OGG-SJC. This was my first experience on Hawaiian and it may very well be my last. On the Maui-San Jose flight Hawaiian screened a movie featuring graphic violence on the big screen in front of a crowd that included numerous young children. Hawaiian cancelled our flight rebooked us with a ridiculous routing involving two plane changes and neglected to inform us. I only discovered this when I went on-line to check the flight time. In the process of shifting our itinerary Hawaiian messed up the seat assignments and split up our family. Correcting these mistakes cost me considerable time.,nan,3.0,nan
nan,Economy Class,3.0,nan,nan,nan,nan,no,nan,1.0,Easily the most uncomfortable flight I have taken in the last 40 years. Seat pitch is so tight I was just barely able to hold the inflight magazine between my chest and the seatback in front of me and I am not oversized. Fortunately they are usually on time the crews are pleasant enough and bags are delivered quickly. Would never fly this carrier again if there were another way to get from HNL to the other islands. Their seating brings new meaning to the phrase cattle car.,nan,3.0,nan
nan,Economy Class,5.0,nan,5.0,nan,4.0,yes,nan,3.0,SYD-HNL-OGG-HNL-SYD in December 2012. A330-200 between Sydney and Honolulu and B717 between Honolulu and Maui. All flights on time. On A330 I would advise taking the $75 upgrade to a bulkhead seat - particularly row 11 as its right behind Business class and in a mini cabin of only 3 rows. If travelling overnight I'd pay for economy and upgrade on check-in online to Business if available. Best thing about the flights was the excellent service and the prompt appearance of baggage at the carousel. Food was good drinks plentiful. Pay TV option was a bit much but we read. I joined their FF program before I booked - for only $120 it was worth it! Business check-in express pass through customs lounge access it's kind of like the Qantas Club. You also get priority boarding which was very useful. Hawaiian's aircraft on the Sydney to Honolulu route are all brand new A330s.,nan,5.0,nan
nan,Economy Class,3.0,nan,4.0,nan,2.0,yes,nan,1.0,Flight from Seattle to Honolulu in an old Boeing 767 which was 26 years old. Crew was nice but service was normal. Seats were broken and legroom was ok lavatories showed their age and had a bad smell. Free food service that is not normal on us-carriers. Food was enough and the quality was fair. Took some time in Honolulu until we reached the gate almost 20 minutes after landing.,nan,4.0,nan
nan,Economy Class,5.0,nan,4.0,nan,nan,yes,nan,4.0,Flight from Honolulu to Maui and return. Flight was on an B717 which is a nice plane. Crew was very friendly and had a smile. Seating was better than on older 767. Juice was served shortly after take-off. They offered maps with sights of Maui for free. Baggage was soon on belt. Good job for a short flight like this.,nan,3.0,nan
nan,Economy Class,4.0,nan,4.0,nan,3.0,yes,nan,4.0,Airbus 330 flight from Honolulu to Las Vegas. Aircraft had new AVOD but they charge for movies. Free dinner was served with rice beef and veggies. Crew came around with water and juice during flight. Flight on time and seating in the new aircraft is very good. Check in kiosk did not work so we had to do it with staff together.,nan,4.0,nan
nan,Economy Class,1.0,nan,3.0,nan,2.0,no,nan,3.0,"My wife and I got married on Kauai and honeymooned on Maui. Flew Hawaiian Airlines the entire way. On the return we inquired about changing our flight so we would not have a 3-hour layover in Honolulu. The woman at the counter informed us there may be a small fee. 20 minutes later she informed us it would cost $650 per person to change our flight. She was attempting to sell us new tickets at day-of prices and subtracting what we had already paid for our current tickets. She handed us back our ticket vouchers with ""OC"" written on them. It seems she unblocked our hand picked seats we reserved 6 months ago in order to investigate changing our tickets. The ""OC"" stands for overcharge and we no longer had seats on the flight from Honolulu to Portland. This was a 6 hour flight and comfortable seats were important. Got off the plane in Honolulu. Told we needed to speak to the ticket agent at the departing gate. He did find us seats on the flight but they were at the back. Supervisor eventually gave us emergency exit row seats. The real shame is Hawaiian used to be better than the other airlines but now they nickle and dime you with hidden costs just like all the rest.",nan,3.0,nan
nan,Economy Class,1.0,nan,4.0,nan,1.0,no,nan,2.0,HNL to INC. Flight was not full so there were empty seats. Plane was a very old 767 that was showing its age. Run down and torn seats my table tray still had crumbs and gravy stains and my seat volume control was broken as was the overhead monitor screens. Cabin staff treated passengers like cattle. The only smiles I saw from the flight attendants were when they tandem delivered drinks and meals joking loudly with each other as if the passengers didn't matter. During the noodle service the 2 male flight attendants were in such a rush that they shoved the noodle cup in our laps even though some passengers didn't have their tray down. The service did resemble the price I paid. On the upside the meal was tasty and plentiful and the trip back from Fukuoka to HNL was completely opposite.,nan,4.0,nan
nan,Economy Class,4.0,nan,4.0,nan,nan,yes,nan,4.0,"Flew Hawaiian for the first time from San Francisco to Honolulu in coach with some trepidation given previous reviews. On checking in online exit row seats (window/aisle) in a 2-4-2 layout were available at 35 bucks each. Well worth the money especially as priority boarding was thrown in to the price. Bag drop was slow but bags helpfully tagged through to Molokai. Well organised boarding on a completely full flight plus the priority boarding meant that overhead bin space wasn't an issue (though it was for others who boarded later). An on time departure and a very thorough briefing on our role at the emergency exit set a positive tone for the flight. A ""continental breakfast"" (but more like a snack box) with a sweet roll with cream cheese savoury snack bag and a cookie plus T&Cs and juice was served promptly. A second round of T&Cs and a later water run were offered and unexpected. An hour or so out of Honolulu a further drinks run with T&Cs and complimentary mai tai were offered concluding a cabin service which was good and delivered by friendly and professional crew. All in all - cheaper than other N American carriers by a fair amount with a good level of service I wasn't expecting.",nan,4.0,nan
nan,Economy Class,4.0,nan,nan,nan,nan,yes,nan,4.0,Short OGG-KOA island hop flight in a Boeing 717. Chose HA over others since preferred to be in a jet rather than smaller turboprop. Rather chaotic check-in process but that could be the fault of the airport and once past that it was all good. We had aisle and window seats with one person in between us. Didn't feel cramped. We had tried to upgrade to first the day before (you can to it at a reduced charge 24 hours in advance) but fc seats already filled. No matter. Didn't see that much of a difference. And for such a short flight economy was just fine.,nan,4.0,nan
nan,First Class,5.0,nan,4.0,nan,2.0,yes,nan,3.0,SEA-HNL in a B767. Upgraded to first class at check-in. Seats more business class than first. Service from cabin crew excellent. Food was edible plenty of snacks and drinks available. IFE was a joke. Digi player was old and content the same!,nan,4.0,nan
nan,Economy Class,1.0,nan,3.0,nan,1.0,no,nan,1.0,We flew Sydney to HNL - Sydney on their new A330. The seats were very uncomfortable like sitting on bricks for 9.5 hours and 10.5 coming back the service was terrible and the staff don't smile. Food was ok drink service terrible entertainment - they wanted $8.00 for a movie. Next time we will pay extra and go Qantas.,nan,2.0,nan
nan,Business Class,2.0,nan,3.0,nan,3.0,no,nan,1.0,My husband and I flew HA Brisbane to Honolulu Business Class Flight 444 6 Feb 2013. Boeing 767. The cost was Return $7483 Aus. The plane had the oldest most uncomfortable seats I have ever been on. The only good thing about the flight was it was direct Brisbane to Honolulu. I was seated in Seat 2b. The flight on the way home was a newer Boeing 767. I was seated in 1A and it was better. Hawaiian Airlines should not say these are Business Class Seats. Service on the way to Honolulu left much to be desired. It was better on the way Home to Brisbane.,nan,1.0,nan
nan,First Class,5.0,nan,5.0,nan,3.0,yes,nan,5.0,This is my second trip with Hawaiian Airlines. Both times were first class the most recent flight being 01/08/2013 HA 51 JFK to HNL. Flight Crew was very nice. The food was very good even though a touch fancy for my taste. One complaint though why should they charge a first class passenger an overweight fee for a bag.,nan,4.0,nan
nan,Economy Class,3.0,nan,4.0,nan,4.0,yes,nan,3.0,I wasn't expecting much because my ticket from Honolulu to LA was only $172! After flying from Auckland to Honolulu and receiving nothing but water I was bowled over when we were given a complimentary snack box beverages and even a complimentary mai-tai. The entertainment required a 10 dollar fee and since I did not have my own headset an additional 3 dollars bought a headset. The attendants were lukewarm.,nan,5.0,nan
