Aircraft,CabinFlown,CabinStaffService,DateFlown,FoodAndBeverages,GroundService,InflightEntertainment,Recommended,Route,SeatComfort,Textchunk,TypeOfTraveller,ValueForMoney,WifiAndConnectivity
Boeing 757,Economy Class,5.0,July 2018,5.0,5.0,nan,yes,Xiamen to Guangzhou,5.0, |  Xiamen to Guangzhou. Whilst it was an old aircraft it was very comfortable and clean. The crew were lovely and for a short flight the food was very good. The facilities at Xiamen airport are mostly supplied by the airline and are first class.,Business,3.0,nan
nan,Economy Class,nan,July 2018,nan,nan,nan,no,Los Angeles to Bangkok via Xiamen,nan," |  Los Angeles to Bangkok via Xiamen. This airline is the biggest scam! I booked a flight from Los Angeles to Bangkok with three hours layover in Xiamen city. At the airport I was told that I can’t use Xiamen airlines because I don’t have Chinese transit visa. Xiamen airport does not have transit area for transit passengers so everyone has to go through customs, get out of the airport, and then walk back in to check in for the next flight. Be advised, you can’t get out of the airport unless you have Chinese visa. I have never heard that you need to get a transit visa for couple of hours layover. I was told to cancel my round trip with Xiamen airlines and get a refund. After 6-7 hrs of phone calls with the airline, I was issued 15% refund of the total cost. The agent explained that somehow my outbound ticket was activated (I flew with a different airline but they still activated my ticket!) and the “activated” ticket was 85% of the cost and I’m only getting 15% refund for the return flight. Don’t be fulled by this airlines! There is a reason they offer cheaper prices... they will streal your money and you will end up paying double.",Solo Leisure,1.0,nan
nan,Economy Class,2.0,June 2018,2.0,1.0,2.0,no,Hong Kong to Xian via Xiamen,3.0," |  Hong Kong to Xian via Xiamen. I had to book Xiamen Airlines because I would have to have an extra day in Hong Kong, so decided to stay in Xiamen over night. The flight was first delayed 1 hour then 2 and the 3:55 that’s almost 4 hours and another airlines flight to Xiamen went through so it was not the weather that caused the delay, by the time the third delay appeared on the board it was too late to cancel my hotel booking and get a refund, once I got out at Xiamen airport I had only two hours between my flight and next flight check-in, I first asked for a compensation, they said sorry, then later I asked for a hotel refund since clearly this was their mess up that led me to the mess up, also denied, then was told that the airport free hotel had no place and the lounges wouldn’t open for another two hours, will have to take my next flight soon and will have to have a sit down with a manager of some sort, of this is how they run their business I would stay clear of Xiamen Airlines and be careful considering to booking a ticket with them especially involving a non direct location.",Family Leisure,1.0,nan
Boeing 787-9,Economy Class,5.0,May 2018,5.0,5.0,5.0,yes,Los Angeles to Seoul via Xiamen,5.0," |  Los Angeles to Seoul via Xiamen. We booked this airline because 3 of us could go round trip for the price of 1 major carrier! Such a deal - R/T LAX to ICN (Seoul Korea) for $450 per person!  If you are not Asian or don't like Asian food - please pack your own food. Found this airline to be just as professional, efficient, and friendly to fly with. Our flight did have to go thru 2 Chinese ports of entry (Qingdao & Xiamen). The flight was very comfortable due to the new airplane (Boeing 787-9). I noticed the increased air pressure (6000 ft elevation) and increased humidity did not dry me out and felt good at the end of 14 hours in flight. The flight staff was very courteous, attentive, and tried their best with English but Google translate came in handy to communicate. Wifi was available but not very good - too many people using it and not enough bandwidth for streaming. Food was good - 2 hot meals and 2 cold snacks in-between kept you full and satisfied. Very Chinese cuisines on all 4 legs of the flight (2 international, 2 domestic). Just remember, the airline is Chinese and therefore will serve Chinese food - don't expect Panda Express type food like the US. The food is primarily pork based with some fish, chicken or beef offering. If you elect vegetarian or muslim or any other special needs food, make sure you request this 24 hours before your flight. I saw some western folks unhappy with seeing unfamiliar Chinese food being served on a Chinese airline - I had to chuckle watching them eat the bread and desert for their meals. The only issue which is not the airline's fault was going thru Chinese immigration. We did not have a Chinese visa which is normally required for landing in China, but 50+ countries can ""transit"" thru China if you can prove your final destination is outside of China. The government issues a temporary transit visa for those that are going thru the country - it's good for 24 hours. At our 2 hr layover for refueling, Qingdao was the worst - they scrutinized and held up the entire non Chinese group of passengers looking for errors & past problems. They pulled 2 passengers out of the group for failing to register with a local Chinese police agency the last time they were in China. Military uniformed people surrounded them making you feel like you are in a communist country.... The airline staff was very good at preparing you for Chinese immigration - having your itinerary with you, boarding pass with correct name spelled, etc. Landing at Xiamen was much easier and nicer immigration folks. We even had time to visit the First class airport lounge using our Amex Plat card. Return trip was good and we even had an overnight layover and the airline provided a hotel for the night at no cost which was nice. We did have to pay the taxi rides both ways so remember to bring some Chinese Yuan (RMB) currency. We got to also go on a tour of the city on a double decker sightseeing bus that took us all around the perimeter of the island. Overall, a very nice new and fresh airline to fly with for many Asian countries.",Family Leisure,5.0,1.0
nan,Economy Class,5.0,March 2018,5.0,3.0,nan,yes,Kuala Lumpur to ShenYang via Xiamen,3.0," |  Kuala Lumpur to ShenYang via Xiamen. The crew was attentive, especially to the elderly Chinese on board, checking if they are comfortable and needs drink. Their food is very Chinese, and tasty. I like that they served steamed corn at the end. What I didn't like - lack of inseat entertainment. ",Solo Leisure,4.0,nan
Boeing 737 / 787,Economy Class,4.0,April 2018,3.0,1.0,3.0,no,Bangkok to Vancouver via Xiamen,1.0," |  Bangkok to Vancouver via Xiamen. Took a chance on a bargain fare and you get what you pay for. If over 6 Foot and 195 Lbs, you best get an Isle seat safety door or you’ll have no room to move. If you get stuck in a window seat you’ll never get out of your seat. Being a bargain flight they pack you in worse than a sardine tin! If you want to change your flight date be aware the airline charges $159.00 US plus, plus to change. My partner wished to change her flight to an alternate day and it was cheaper to buy a ticket with another carrier. Xiamen Airport is hideous and they charge almost $20 US fee to exchange any money and only 2 food stores take credit cards. A bowl of soup and a bottle of water costs about $25.00 US This airline is good for backpackers only. Spend a little more and fly another airline.",Couple Leisure,1.0,nan
Boeing 787,Premium Economy,nan,January 2018,nan,1.0,nan,no,Manila to Los Angeles via Jingdiang / Quingdao,nan," |  Manila to Los Angeles via Jingdiang / Quingdao. I have never taken the time to write a negative review in my life. Call me old fashioned, but I just do not care enough to complain online for other people to read. I booked a one way return flight on Xiamen a week or so ago from Manila to LAX with two layovers in China. I have flown with China Eastern, China Southern, Air China and China Airlines, so I thought nothing of it. Another pass through China and I would be in Los Angeles for my mothers birthday on the 16th. Upon arriving to the airport 2 hours early and checking in I was notified I could not board my flight because I didn't have proper clearance. I explained to the rep that I had no plans of entering CHINA and would only be passing through. Still not allowed. I explained I had been through China 4 times on layovers and never had an issue. Still not allowed. Long story short it took two hours arguing for the airlines to agree to a 30-60 day refund. It turns out Americans cant connect through their layover city so they are selling tickets that are unusable. No compensation. Just blank faced souless stares. Avoid this airline at all costs.",Solo Leisure,1.0,nan
nan,Economy Class,5.0,December 2017,3.0,1.0,nan,no,Los Angeles to Manila via Xiamen,2.0," |  It was a nightmare! We are suppose to have fun traveling for Christmas vacation but turned out to be a disaster. We are going back to Philippines, our luggage were check in only up to Giandong. We have to go to immigration then get our luggage to check in going to Xiamen. Boarding pass were issued again going only to Xiamen. From Xiamen you have to go out then scan your hand carry for another scanning then get into a long line to get another boarding pass going to Manila. Cheap air fare but think if the hassle and exhaustion you will go through if you take this airline back home. I’m very tired and almost 24 hours in and out of the airport. My husband tried to get the early flight as chance passenger, without checking she said everything is taken. You have to wait for your flight .",Family Leisure,3.0,nan
MF852,Economy Class,nan,December 2017,nan,nan,nan,no,Singapore to Los Angeles via Xiamen,nan, |  I booked my flight using eDreams from Singapore to Los Angeles via Xiamen and the ticket I got was as follows Singapore to Los Angeles via Xiamen (Layover 2h 35mins) Los Angeles to Singapore United (Direct Flight). I hold a valid USA visa and thus was all set to board the flight. When I reached the airport at the counter I was told by the staff that in order to take the Xiamen flight I need to have a China Visa (There is some rule where people from 7 countries in the world need to do when transiting via Xiamen). I asked the airline staff that I was not given any prompt at the time of booking nor is any such requirement mentioned on Xiamen website and on the internet however I was not helped. In order to not spoil my families vacation I bought a one way ticket to USA on another airline. I was not reimbursed for my original ticket let alone any compensation for my new booking. I've been contacting Xiamen Airlines about why is this rule not mentioned on their website as it is such a unique requirement however they're unable to respond to me properly. In their defence they're quoting the requirement of need of a visa for China for people from all over the world except for 51 specific countries if you want to transit for less than 3 days however my case is different. I just had a layover of 2 hour and 35 minutes. I am extremely disappointed and would not recommend anyone to take this airline as their staff is not helpful and neither is their customer service.==,Family Leisure,1.0,nan
nan,Economy Class,nan,November 2017,nan,1.0,nan,no,Los Angeles to Manila via Xiamen,nan," |  Los Angeles to Manila via Xiamen. I missed my flight due to confusing schedule (12:15am), I went to the airport 3 hours within the same day (unfortunately I was told by the lady at the airline counter that I was late to my flight! And it was supposed to be there the earliest day or before midnight of that day!!). Instead of helping me by providing assistance, I was told to buy a new ticket or ""Go home!"" I tried to talk to them but nobody helped me at all and they did not give me a chance to get the ticket rebooked/rescheduled, not even try to refund my ticket nor provided a discount for my new ticket. I will not recommend Xiamen Airline at all.",Solo Leisure,1.0,nan
nan,nan,nan,nan,nan,nan,nan,no,nan,nan,I travelled from Shanghai to Xiamen and back on Xiamen Airlines and was pleasantly surprised by the friendly service both there and back and the high quality food on the return evening flight. Compared to other domestic airlines in China Xiamen Airlines was a good experience.,nan,nan,nan
nan,nan,nan,nan,nan,nan,nan,no,nan,nan,Ground crew at Xiamen Airport pleasant and efficient but FAs inflight were not good. They seem to do the minimum required and act as if they don't really care about the passengers. I was horrified to see people carrying really enormous sacks into the cabin on their backs. Unbelievable. What ever happened to the concept of hand-carry luggage?,nan,nan,nan
nan,nan,nan,nan,nan,nan,nan,no,nan,nan,"Shanghai to Xiamen. The staff were friendly and the flight was fine in general. However if you are over 5' tall DO NOT take a window seat. There is no leg room whatsoever. I'm 5'8"" and wished I'd learned how to say 'aisle-seat' before check-in as it was an incredibly uncomfortable journey made even worse when the person in front tipped there seat back. If I'd had an aisle seat I think it would have been fine though so be warned!",nan,nan,nan
nan,nan,nan,nan,nan,nan,nan,no,nan,nan,Leaving Shenzhen to Fuzhou on 19 Sep (MF 8318) and return on 21 Sep (MF8317) both filghts delayed for at least more than 2 hours. Missed the conference meetings and dinners appointment on both occasions. It is surely a frustrated experience. Why can't they have more competition by opening out more airlines servicing between these two cities? Do we customers need to go through their incompetence operations and their internal problems? By the way the tickets are not cheap Rmb1060 one way.,nan,nan,nan
nan,nan,nan,nan,nan,nan,nan,no,nan,nan,Return Shanghai-Xiamen in economy. Both fairly full flights in Boeing 757. Seat pitch OK for a 1.30 hour or so flight. So is the inflight service. Friendly FA's and a simple lunch box accompanied by non- alcoholic drinks. Uneventful but OK. On the way back we pulled back but stood still for a long time after that. No explanation but when FA's found out that it could take a while they started giving service to passengers. Quite professional.,nan,nan,nan
nan,nan,nan,nan,nan,nan,nan,no,nan,nan,"I would like to say "" Thank You"" to Ms Hou Gui Xia who was on duty on 17.05.05 in GuangZhou XiaMen airline counter. My aged parents were travelling on their own from Melbourne to Guang Zhou to catch the same day flight to Xiamen. As the time was very tight between the two flights I worried that they would be late for the flight to Xiamen. Ms Hou was very patient and helpful every time I called to check if my parents had come to pick up the tickets. She also put my parents on phone so that we could exchange a few words. It is very kind and thoughtful of her to do so. It gave us a lot of comfort . Her attitude towards passengers create a good image for Xiamen airline. At the same time I would like to suggest that you add aged passengers service. As far as I know a lot of aged parents are travelling on their own. It is harder when transit is involved. Wouldn't that be wonderful if you have a service to pick up the aged parents for their worrying children and help them through all the airport procedure till they board on the next flight. I believe people are more than willing to pay for the service.",nan,nan,nan
nan,nan,nan,nan,nan,nan,nan,no,nan,nan,I flew from Shanghai to Wuyi Shan in Fujian province. Service was basic but comfortable nonetheless. Flight attendants made a number of announcements during the hour flight. Chinese newspapers were given out. Drinks were served as well as two bags of pretzels and plums.,nan,nan,nan
nan,nan,nan,nan,nan,nan,nan,no,nan,nan,Excellent full service airline for the price in between no frills and major airlines like SQ. The food and service is similar to SilkAir on comparable flight from Xiamen/Sing.,nan,nan,nan
nan,nan,nan,nan,nan,nan,nan,no,nan,nan,Singapore to Fuzhou from Fuzhou to ShenZhen and back lastly to Singapore. I must say that the treatment on international flight was better than domestic. Quality of food was average and need to be improved to cater to international standards however based on its low cost no frills fare I will chose Xiamen the next time I go to China. Pre-booking your departure 4-5 days earlier is recommended.,nan,nan,nan
nan,nan,nan,nan,nan,nan,nan,no,nan,nan,"I flew Xiamen from Macau to Hangzhou I have never flown on such a dreadful airline. The food was unidentifiable the service of drinks was: coke water or beer and the cabin crew's professionalism basically amounted to ""sit still and shut up"" . However topping it all were the hordes and hordes of passengers that all ran to the exits in preparation to disembark as soon as we began to touch down... they all went flying (excuse the pun).",nan,nan,nan
nan,nan,nan,nan,nan,nan,nan,no,nan,nan,Chinese airlines companies need a huge revamp including Xiamen Airlines. I have flown with Xiamen Airlines on several occasions and only have done so under duress. Their service and food are very ordinary and they do little to make their customers satisfied. Just today my wife is due to return to Guangzhou from Fuzhou. Her flight has once again been delayed - the excuse this time is that they cant find a pilot!,nan,nan,nan
nan,Economy Class,nan,nan,nan,nan,nan,yes,nan,nan,Xiamen-Xian with stop over. On time good and fast check-in 737-800 new aircraft only tiny refreshment for a 4 hours flight. Very efficient service at stop over (Wuhan) good leg room clean aircraft.,nan,4.0,nan
nan,Economy Class,nan,nan,nan,nan,nan,yes,nan,nan,Hangzhou to Xi'an. My First internal flight in China crews smartly dressed with professional service. Tasty dinner with large portions for Economy Class. Cabin crew walked through with sign showing no mobile phones to be used inflight was rather unique. Look forward to flying with them again.,nan,4.0,nan
nan,Economy Class,nan,nan,nan,nan,nan,no,nan,nan,Took MF for multiple flights within and also to/from China: TPE-XMN-KWL-XMN-WUS-XMN-TPE. I think only 2 of them were on-time the rest seemed delayed due to XMN's single-runway capacity limitations. I'd complain more about the food but it seemed comparable to what I got in UA economy on my transpacific flights and MF's trail mix/preserved kumquat dual-pack bettered UA's pretzel stick crumbs. Service was average airport check-in was above average as their hub is fairly well designed although crowded.,nan,1.0,nan
nan,Economy Class,nan,nan,nan,nan,nan,yes,nan,nan,Xiamen-Hong Kong (connecting to an international flight to US). Check-in process fine but had to convince ticket agent to book my bags all the way to Austin TX and not just LA. He finally did. In Hong Kong I only had 1 hour to connect to my other flight. Had no idea this was a 'tight' connection until I de-planed and was met at gate by a Xiamen agent who informed me that I was a 'distressed' passenger. She ran me through the airport to get to the check in counter in time. Then she took me through staff security line (so i could avoid the long line) and got me to my gate with a few mins to spare. Flight was comfortable.,nan,4.0,nan
nan,Economy Class,nan,nan,nan,nan,nan,yes,nan,nan,Qingdao-Xiamen and Xiamen-Chongqing in Economy. My original flight on Shangdong Airlines was cancelled and I was rebooked on Xiamen Airlines. TAO-XMN was delayed by two hours due to air traffic congestion meaning we arrived 0140. Food was acceptable for two hour flight. Service friendly. Tried coconut juice for the first time. Aircraft generic B737 clean IFE consisted of a Chinese flick on flip down screens. Luggage arrived quickly. Second leg similar no delays reasonable food good service. As with other Chinese airlines their English announcements can be a bit 'Chinglish' making them hard to understand.,nan,4.0,nan
nan,Economy Class,nan,nan,nan,nan,nan,yes,nan,nan,Xiamen-Hangzhou: early morning departure clean plane on time departure good service and friendly attendants offering a tasteless snack.,nan,4.0,nan
nan,Business Class,nan,nan,nan,nan,nan,yes,nan,nan,Hong Kong-Xiamen. Boeing 737 in Business Class. Good service and an on-time flight. FAs were attentive but struggled with basic English. Seats comfortable and quite large. Food was OK.,nan,4.0,nan
nan,nan,nan,nan,nan,nan,nan,no,nan,nan,I fly at least once a week Xiamen Airline - it started with good service few years ego and then go down. Now the service is poor and staff are not friendly like before and sometime arrogant. The food is also poor.,nan,nan,nan
nan,nan,nan,nan,nan,nan,nan,no,nan,nan,Guangzhou - Xiamen - Guangzhou. Overall a decent experience. Flights on time staff attitude very good and a well kept 757-200. Lots of drinks on the outward journey albeit with a very basic seaweed snack (!) and the same good service on the return leg (this time with pizza and buns for the meal).,nan,nan,nan
nan,nan,nan,nan,nan,nan,nan,no,nan,nan,Kuala Lumpur to Fuzhou (monopoly operator for the route) was rather chaotic. The flight attendants were fairly rude which may be attributed to the number of passengers who did not follow rules during take-off and landing. However this is no excuse for the appalling level of service (or lack of). FAs impatient and unhelpful by international standards. Generally this is expected from a Chinese domestic operator except the price was even higher than flights going the same distance to other Chinese cities.,nan,nan,nan
nan,Economy Class,3.0,nan,2.0,nan,2.0,no,nan,3.0,Jakarta to Changsha via Xiamen on May 27 2014 on MF 868 and MF 8504. Crew service was very inconsistent especially on Jakarta to Xiamen leg The male crew seemed rude and unhappy however the return flights to Jakarta on June 3 2014 were fine on both legs (Changsha to Jakarta via Fuzhou) on MF 8470 and MF 869. The purser on MF 869 was very helpful. I do not understand why their service is pretty inconsistent. No PTV and feel pretty bored especially for 4-5 hours flights. Meal presentation looked awful but the food was edible. They should improve by staff smiling more better entertainment and better food presentation.,nan,3.0,nan
nan,Economy Class,3.0,nan,4.0,nan,1.0,no,nan,3.0,Dalian to Kuala Lumpur via Xiamen. I might have rated it more positively if this first time of mine to travel with them was a domestic flight. It felt like a domestic flight to me in all dimensions. You are not allowed to check in online or select seat before trip no matter how much you pay for the ticket. What's worse the first segment (domestic) of the flight opens its check-in 1.5 hrs before it opens for int'l passengers (they can check in even earlier online) so the 5 of us we were almost given seats far apart. When passing immigration at Dalian you felt it was quite informal. And then you pass a formal immigration at Xiamen again. Equipment was B738 what you may not expect to sit in for seven plus hours. Seat pitch was no different than any domestic. No PTV poor TV programme. Dinner was OK coming with bread pickled snack and fruit. Cabin crew not as good as they boasted themselves to be and did nothing to stop a Dalian tour group from talking the whole route and running up and down the cabin to annoy other passengers. This particular flight I took MF831 was not punctual as usual. I wouldn't recommend anyone to try Xiamen int'l flight.,nan,3.0,nan
nan,Economy Class,2.0,nan,3.0,nan,2.0,no,nan,3.0,SIN-XMN return. Basically a domestic airlines. Food quality very basic poor inflight entertainment. Worst of all no smiles on the faces of the cabin crew. Not up to standard for international flight.,nan,3.0,nan
nan,Economy Class,5.0,nan,5.0,nan,3.0,yes,nan,3.0,Beijing-Xiamen on Dec 18 first time with Xiamen Airlines. Old B737-700 but clean and well-maintained. On-time departure and arrival. During the 3hrs flight delicious hot lunch and several rounds of beverages served they even served peanuts after lunch and mints before landing! Friendly and efficient cabin crew well-done Xiamen Airlines!,nan,5.0,nan
nan,Economy Class,4.0,nan,4.0,nan,3.0,yes,nan,4.0,Flew PEK-FOC and back. Took the early morning flight which are always on time. Served a biscuit and some snacks for breakfast. Only problem was that the entertainment was in English only. Tickets were cheap and cabin crew were ok. I would choose this airline over China Southern or Eastern.,nan,4.0,nan
nan,Economy Class,4.0,nan,4.0,nan,nan,yes,nan,4.0,From Shanghai to Xiamen. The flight was delayed one hour due to air traffic control. Served pork with rice. 2 hours flying time. Not bad.,nan,4.0,nan
nan,Economy Class,3.0,nan,2.0,nan,2.0,no,nan,2.0,SHA-XMN: typical Chinese airline product. Tight seat pitch. Peanuts and a drink were given on the 2 hour evening flight whereas China Eastern provides a hot meal. Drop down screen showed a Chinese TV show. FAs were efficient but not particularly friendly. There is nothing to distinguish Xiamen Airlines from the other Chinese airlines so book by schedule.,nan,3.0,nan
nan,Economy Class,4.0,nan,5.0,nan,nan,yes,nan,4.0,Hong Kong-Xiamen. Pleasant aircraft interior although looks old on the outside. Great snack box on only a 1 hour flight. Cabin attendants courteous and well presented.,nan,4.0,nan
