Aircraft,CabinFlown,CabinStaffService,DateFlown,FoodAndBeverages,GroundService,InflightEntertainment,Recommended,Route,SeatComfort,Textchunk,TypeOfTraveller,ValueForMoney,WifiAndConnectivity
nan,Economy Class,4.0,June 2018,3.0,1.0,2.0,no,Mauritius to london,1.0," |  The attitude of the cabin crew has improved. The quality of films has improved as well but the screen is abysmal so one cannot really see the film. Or for some passengers around me, their screens were not working at all. But what is disgusting with this airline is if there are delays and communication. The communication of the on ground staff is appalling - first they do not know how to handle angry passengers, they do not know how to keep the passengers updated and the airline does not have a CRM (all complaints fileId directly with the airline will go into a black hole - not even an acknowledgement of receipt). It is an unpredictable airline - if you manage to get onboard, service is ok but if something goes wrong such as cancellations (which happen very often) or long delays, then only God can help you. The only choice we have on this route (direct flight) is British Airways and therefore, if you have the choice, it is preferable to avoid Air Mauritius.",Solo Leisure,1.0,nan
A350,Economy Class,5.0,July 2018,5.0,5.0,5.0,yes,Paris to Mauritius,5.0, |  Paris to Mauritius. Amazing experience compared to my flight from Toronto to Paris. Smooth flight with a very soft landing. Amazing on board staff providing caring service. Food was excellent and breakfast superb. I am very proud to see the effort which is put by the staff to make the trip for passengers remarkable. Thank you for ensuring excellent customer service provided to travellers.,Family Leisure,5.0,nan
nan,Economy Class,1.0,May 2018,1.0,1.0,1.0,no,Mauritius to Singapore,1.0," |  Mauritius to Singapore. Flight was cancelled 3 hours before departure. No update was given to know what was the way forward - especially since a connection was involved. When you call Air Mauritius, the people were rude, and could not help at all. It took 7 hours of timeless wait on the phone, without someone to even lodge a decent complaint to finally get redirect to another flight combination, with inconvenient timing. They do not even get the emails right. No compensation for the delay - no apologies for the inconvenience. No miles, no upgrade, nothing. It's as if we need to be grateful that they actually redirected us, for a ticket which we have paid for! The service on board was below standards compared to the price, but I never knew that the on ground customer service was so lousy as well.",Business,1.0,nan
A340-300,Business Class,5.0,October 2017,4.0,4.0,3.0,yes,Mauritius to Chennai,5.0," |  Mauritius to Chennai. Since the plane was overbooked, I was upgraded to business class. My first notion on the journey was that it would be a hectic journey as I has to travel overnight. But the attendants onboard the aircraft made sure to keep me as comfortable as possible. The seats were excellent, cabin service was outstanding. Staff was well trained, polite and professional. I would recommend flying in the business class on this airline.",Family Leisure,4.0,nan
nan,Economy Class,1.0,July 2017,2.0,1.0,nan,no,London to Mauritius,1.0," |  London to Mauritius. In July 2017 myself, my wife and 2 children aged 1 and 3 travelled to Mauritius. As a regular kestrel Flyer, I expected better treatment and better service. They are very child unfriendly.  When we landed, one of our luggage was missing. This is despite the flight was the flight was delayed by more than one hour. We landed on a Sunday, and had to attend a wedding the same night. My wedding clothes and that of my wife were in that luggage. I complained to the staff, they could not care less and said I was not entitled to anything and was sent away. No manager was available and later in turned out that the duty manager on the day was busy attending to the Prime Minister's wife in the State lounge and could not be bothered about paying passengers. I complained to their customer service, and the service I received was poor. I wrote to the CEO and their Chairman. No response at all from them. When we returned to the UK 2 weeks later, two Air Mauritius Staff were travelling. They were being given business class treatment when they were travelling in economy in front of paying customers. I spoke to the cabin crew about this, and they could not care less. What they offered me is 5000 travel points, 50 Euros, and to use their lounge when I travel next which is pathetic to what my family went through travelling with them. ",Family Leisure,1.0,nan
nan,Economy Class,5.0,September 2017,4.0,4.0,1.0,no,Paris to Mauritius,1.0," |  Paris to Mauritius. The food was good (chicken, fish and special meals). The entertainment on the plane wasn't good (little screen with 18 channels and you couldn't choose a movie). Another issue was the leg space, a problem when you are bigger than 180cms. The cabin crew was friendly and can speak at least 3 languages (French, English and a native language). When you have a question, they will try to help you with a smile.",Solo Leisure,4.0,nan
nan,Economy Class,1.0,September 2017,1.0,1.0,1.0,no,London to Mauritius,1.0," |  I travelled from London Heathrow to Mauritius. I was expecting comfort but things have not changed. Customer service at the check-in desk was nice and welcoming. Customer service within the flight was nice too. Negative - Seat was very uncomfortable (for an average guy of 6 feet). Leg space under the seat in front of you is awful. There was a black box next to my feet. Arm rest was painful, food below average. Cold tea / coffee served and I had to complain. Entertainment was poor. The new movies contained strictly old movies. Overall, people only travel with Air Mauritius because it’s a direct flight however I have to say that this service is not good value for money.",Solo Leisure,1.0,nan
A340-300,Business Class,4.0,August 2017,3.0,4.0,1.0,yes,Mauritius to London,4.0," |  Mauritius to London Heathrow. Really good flight, Check in very quick and easy followed by swift Fast Track immigration. At 6'4"" I always find the seats a bit difficult but was surprised that these Old Type seats were very comfortable in sitting mode and also sleep mode. Not Lie flat but fine as I managed 9 hours sleep. No dinner for me as the flights are evening 2200 departures and I do not wish to eat that late. Woke in time for breakfast which was OK. Looking forward to the A350 on this route soon. Entertainment very old and not worth bothering with, staff were very friendly but still do things the old Mauritian way.",Couple Leisure,4.0,nan
A340,Business Class,4.0,August 2017,4.0,2.0,2.0,yes,London to Mauritius,4.0, |  After a bad flight a few years ago I decided to fly again as they are the only non stop flights from Heathrow to Mauritius. Glad I did despite the old aircraft I managed 9 hours sleep and found the seats more comfortable than expected as they are not flat. Didn't have dinner but woke early for breakfast which was very good. The crew were friendly and smiled except for one. Looking forward to my return and looking forward to the new aircraft A350 at the end of this year. Only problem for me is the chaos at Heathrow boarding gates (gate 8) as Business Class passengers are unable to see the signs or even get through the chaotic crows! Maybe an announcment would be helpful or heaven forbid maybe one of the many managers standing doing nothing at the gate could assist?,Couple Leisure,5.0,nan
A330-200,Economy Class,1.0,June 2017,1.0,3.0,nan,no,Singapore to Mauritius,1.0," |  Singapore to Mauritius. The worst flight experience. We should have flown on a Budget airline to Mauritius for a better experience! There was an hour delayed departure out from Singapore and the aircon in the plane was not working.  After take off, my husband's entertainment system was not working and we press the call bell and no one attend to us. I have to walk to the galley to inform crew about my husband's entertainment system not working.  After informing about the unserviceable system and I doubt he did anything because they were more concerned about meal service.  Finally we get hold of another Stewardess and inform her and she said she will do it later as she was occupied.  When we receive our tray, I informed the 3rd crew again about the entertainment system and she said she will reset again and doubt that it will work. She offered a seat change but we paid for the exit row (USD50 each) to enjoy the extra legroom instead of having to move to another seat behind and be separated. There were many announcement throughout the flight duration.  First meal service was rushed and after that lights switched off within 2 hours.  Our holiday mood to Mauritius was dampened by the experience with Air Mauritius.  ",Couple Leisure,1.0,nan
nan,Economy Class,nan,nan,nan,nan,nan,no,nan,nan,Heathrow - Mauritius return. Outbound flight was appalling. The legroom in economy is the worst we've experienced. As already mentioned in other reviews the IFE box is situated under the seats so severely eats into the already cramped conditions. Cabin staff were generally surly and rude. One stewardess rammed the beverage trolley into my husband twice and poured hot tea in his lap without acknowledgement let alone an apology. Headphones didn't work. Toilets where dirty. Inbound was a slight improvement. The cabin staff where pleasant.,nan,1.0,nan
nan,Business Class,nan,nan,nan,nan,nan,yes,nan,nan,MRU-LHR return A340. The flight could have been brilliant if not for one stewardess on the first leg. Chief Purser and other crew more than helpful and caring. Food excellent on both legs compared to a recent previous trip. Some issues with toilets. Recurrent issues with the seats. IFE the same old story but beyond control of crew brought my Ipad and enjoyed my own movies.,nan,4.0,nan
nan,Business Class,nan,nan,nan,nan,nan,yes,nan,nan,I travelled with my family from London Heathrow. We found the seats reasonably comfortable our 4 year old slept like a baby the whole flight out. The food was just fine with my wife and I enjoying our meals and our son was very happy with his. For the return flight my son fell asleep at takeoff so missed the normal meal time. When he woke up midflight the Flight Attendents had kept his meal and were quickly able to provide it resulting in a happy child who went straight back to sleep. Thank you for a good flight at a good price.,nan,4.0,nan
nan,Business Class,nan,nan,nan,nan,nan,yes,nan,nan,MRU-HKG return - A330 on first leg ok with quite new plane. A340 on return a different story the plane is old. Outbound food was not to standard. Overall the service was quite ok respect the staff and they should provide good service. Return leg service much better as well as the food. The seats in Business are quite of a kind the fabric and the sloppy position pull you downwards.,nan,4.0,nan
nan,Economy Class,nan,nan,nan,nan,nan,no,nan,nan,We flew from LHR in May and were appalled by the rude staff (preferential treatment to Mauritians) cramped seats with the IFE box taking up much of the legroom. The food was mediocre and toilets filthy. I have already complained to my travel agent (Sovereign) who to their credit managed to get a long response from Air Mauritius - sadly they didn't really pay much attention to my points and said how pleased they were that I'd been moved to a seat with more legroom (I wasn't). The staff spent the flight chatting at the back of the plane and passengers were expected to walk up to the galley and help themselves to drinks. I enjoyed the IFE - saw a few films which I enjoyed. We will go back to Mauritius as it is an amazing country but we will be flying a different airline next time no matter what the cost.,nan,1.0,nan
nan,Economy Class,nan,nan,nan,nan,nan,no,nan,nan,Heathrow to Mauritius. Staff friendly however we paid £100 premium for 2 seats with extra legroom. Neither of the entertainment screens worked - in fact one was not even attached properly to the cable which had been previously taped on by an amateur. 11 hours is a long time without music or a film. Also for some unknown reason a passenger was allowed to sit in the jumpseat seat throughout the whole journey. This was unacceptable as she was right in our vision and took up the extra leg space we had paid extra for. The flight steward apologised and gave us name of the vice president of Air Mauritius customer services. When we attempted to contact him  we were told that customer services would contact us via e mail. We are still waiting. This airline is not doing us a favour. We paid a large sum of money for the flights plus the extra leg room premium. Not happy at all.,nan,1.0,nan
nan,Economy Class,nan,nan,nan,nan,nan,no,nan,nan,Mauritius to Delhi. I found the quality of seats very average in the aircraft. In fact even in business class one of the seats couldn't move back. Worst of all the main attendant was rude and unfriendly. She didn't let me see my elderly parents travelling separately in business class the whole flight knowing that they may need my help / assistance in spite of repeated requests. Very disappointed.,nan,1.0,nan
nan,Economy Class,nan,nan,nan,nan,nan,yes,nan,nan,PER-MRU-LHR MRU-PER. Not too bad an airline. A340 aircraft are reliable however Air Mauritius need to review their seats which are quite hard for long haul flights and worn in some cases. Food is average but cabin staff friendly and efficient. In flight entertainment could be upgraded. Checkin and boarding very efficient.,nan,4.0,nan
nan,Economy Class,nan,nan,nan,nan,nan,yes,nan,nan,LHR-MRU-LHR. Air Mauritius use their most modern A340's on the London route which are quiet and smooth. Sat in economy and was surprised at how tight the legroom is and I'm only 5ft 9in. That was the only real negative about the flight. IFE boxes are also under each seat which limits your ability to stretch out your legs. I'm used to BA and Virgin's economy cabins which are more spacious. IFE was ok but not enough choice for a 12hr flight. Food was pretty good and tasty. Staff were pleasant and happy to help with requests.,nan,4.0,nan
nan,Economy Class,nan,nan,nan,nan,nan,no,nan,nan,Seats on the Heathrow to Mauritius flight were hard provided no lumbar support and very uncomfortable. Some members of staff somewhat patronising and not very helpful. Headphone did not work and the food was awful. They do not serve the small bottles of wine and we were served tiny amounts of wine in plastic glasses I felt we were treated like children. When asked for two small glasses we were very patronisingly told that we have to wait for the next trolley - which was going to be a long time after the meal. My partner and I ordered vegetarian food and were served very small portions of very unappetising food and a fruit salad with acidic and unripe fruits. The next morning we were offered two small cold soft and doughy buns with margarine and jam. Not a pleasant trip.,nan,1.0,nan
nan,Economy Class,nan,nan,nan,nan,nan,no,nan,nan,Heathrow to Mauritius seats are very tight spaced. Staff quite unhelpful. In such a long haul flight they did not distribute water or juice after meal times nor did they advise passengers to help themselves with drinks in the catering area. I travelled with 18 month old twins - staff unhelpful and gave our kids meals with adults meals whilst distributing other kids meals earlier. Mauritius to Heathrow staff rude and spoke over our heads literally bitching about kids playing on the floor between passenger seats. They lack manners and customer service. Staff have no compassion and empathy for parents who travel with kids - they behave as if they are doing us favours whilst we pay in full for adult and kid fares.,nan,1.0,nan
nan,Economy Class,nan,nan,nan,nan,nan,no,nan,nan,Frankfurt to Mauritius and back last week. First we booked a non-stop flight the ticket said that too but in fact the plane - after already delayed for over an hour - stopped in Geneva and we had to go out there and wait for another hour. The plane was old  legroom in was poor due to the IFE Box mentioned in other reviews. The staff was friendly but never there. I've hardly seen them during the flight and helped myself for drinks (so far there were drinks). Only the food was ok and the entertainment program was nice.,nan,1.0,nan
nan,Business Class,nan,nan,nan,nan,nan,no,nan,nan,DUR-MRU return Business class on A319. Things work so well from the Durban side but I have flown DUR-MRU-HKG return and JNB-MRU-LHR and by comparison the cabin crew this time barely managed a smile unless you grovelled. I don't expect to be glared at for asking for more bread. The return leg was pretty similar as far as staff went. Clearly nicer staff get to fly the longer routes. The most severe criticism I would make is the boarding leaving Mauritius. It is unjustifiable to leave long lines of passengers waiting for over an hour with no info nor telling us to all go sit down again. They knew perfectly well that they were running a full hour late as they later came up with the excuse that the plane was running late from Rodrigues! They pay lip service to priority boarding of business class passengers. Suddenly they announced a gate change so everyone had to scramble to change gates. Kept us waiting on the tarmac for the bus. What is the most appalling is that they kept 5 medical patients who were flying on the flight in wheelchairs waiting too in the line with no explanation to them.,nan,4.0,nan
nan,Economy Class,nan,nan,nan,nan,nan,no,nan,nan,LHR-MRU-LHR. LHR-MRU poor leg room most uncomfortable seats ever the entertainment system didn't work properly and staff were miserable. The MRU-LHR leg was a different story. We left MRU 3.5hours late due to the bad weather at LHR (snow). 3 hours from LHR captain announces the airport was shut so we were diverting to Milan-Malpensa. We landed and were shipped to a hotel. The following day our plane departed Milan for Paris without telling the passengers any information. Air Mauritius had one rep in Milan airport who ignored us another rep wouldn't speak with us. Very little information given to us we had to chase Air Mauritius at all times. They pretty much just abandoned us in Milan once we got off the plane. After 4 days of little information they left us to find our own way home. I certainly wouldn't recommend using Air Mauritius. The worst customer service I have ever experienced.,nan,1.0,nan
nan,Economy Class,nan,nan,nan,nan,nan,yes,nan,nan,Mauritius-Singapore return Economy new A330 both legs. Seats quite hard but 7 hours flight is sustainable. I no longer rely on the IFE and always bring my IPAD. Flight was quite full but had no one seating to me on both legs and that is a major relief. Crew was performing basic service and not very friendly. The male staffs were more interested in female passengers. Come on MK you can do better!,nan,4.0,nan
nan,Economy Class,nan,nan,nan,nan,nan,no,nan,nan,Cape Town to Mauritius Mauritius to Heathrow. The most uncomfortable seats ever IFE box takes 25% of already limited legroom. Disinterested staff poor food - old planes with bits missing or not working.,nan,1.0,nan
nan,Business Class,nan,nan,nan,nan,nan,yes,nan,nan,"LON-MRU-LON in Business Class travelling with our baby daughter. I have to say the experience was very good indeed particularly on LON-MRU. The cabin crew in biz cabin were excellent attentive and polite. The food was of a good standard the sleeper beds (although not fully flat recline to an angle of 170 degrees) were comfortable - I am 6'3"" tall and could almost fully stretch out. Flights were on time outbound hours delay inbound. AVOD inflight entertainment system in biz class was good decent large screen in your armrest moderate selection of films to choose from. As a leisure airline Air Mauritius offered excellent value for money on this route compared to their only direct competitor (BA). Hold bags were priority tagged and did come off first at both ends. Our babies pushchair was also waiting at the aircraft door in both directions when we landed. Only slight let down is the Air Mauritius Lounge in MRU which is pretty poor and in need of a major makeover but a minor point in the overall travel experience.",nan,4.0,nan
nan,Economy Class,nan,nan,nan,nan,nan,yes,nan,nan,LHR to MRU return in September 2010 (both night time flights). Found the seats cramped and uncomfortable not all of the headset jacks worked. The Flambouant aircraft appears to be less tired than The Chamarel one both Airbus 340's. Staff were helpful and polite we also appreciated the cabin lights being turned off after dinner however due to the severe lack of padding in the seats my legs and posterior spent more time asleep than I did. We do recommend flying with Air Mauritius but not for such a long journey.,nan,4.0,nan
nan,Business Class,nan,nan,nan,nan,nan,yes,nan,nan,Business Class (which was cheaper than I thought) in early September. No problems on the ground (though immigration at Mauritius a bit long winded) or in the air. Food wine and staff very good. Would have no hesitation in using them again.,nan,4.0,nan
nan,Business Class,nan,nan,nan,nan,nan,yes,nan,nan,Johannesburg to Perth return. Service good seats comfortable. AVOD operated without any problems. The crew were friendly tasty food and wine is excellent. On our return schedules changed without notification however Air Mauritius covered all costs.,nan,4.0,nan
nan,Economy Class,nan,nan,nan,nan,nan,no,nan,nan,London-Mauritius-London with A340-300. Check in: friendly and helpful staff trying to accommodate seat requests. Seats uncomfortable and tiny leg space (I am 1.90 m) but managed to sleep somehow. Food ok nothing special staff go round frequently with wine and water during flight. Entertainment limited few selection of films which are shown in unpredictable loops Aircraft needs upgrade to more comfortable seats they must be reading these reviews as most flaws mentioned not noticed (ie. patronising staff no child menu no water etc.),nan,4.0,nan
nan,Business Class,nan,nan,nan,nan,nan,no,nan,nan,Flew back with my husband and 2 children from Mauritius last night in business class and was appalled at level of service onboard. No child meals in fact no child friendly food whatsoever. Considering it's such a long flight they should be more prepared for children travelling. We requested child meals at booking and did not get on way out so on return My agent requested again but yet again this was ignored. We have travelled in business class on both BA and Virgin and Air Mauritius can't even come close in comparison to service provided by these airlines.,nan,1.0,nan
nan,Economy Class,nan,nan,nan,nan,nan,no,nan,nan,LHR - MRU return in economy. Alitalia check in staff at LHR very friendly and helpful. The flight was on a tatty A340-300. The material was coming off the backs of the seats and the inflight entertainment did not work properly. When it did work it had a very limited selection of music and films. The seats were very uncomfortable seat pitch the smallest I have experienced on a long haul flight. The food was fine. The cabin crew were very polite and friendly though forget pressing the call bell as they won't bother coming. If you want something you have to go to the rear galley and get it yourself.,nan,1.0,nan
nan,Economy Class,nan,nan,nan,nan,nan,no,nan,nan,"LHR-MRU in economy on a very tatty A340. The backs of the seats were coming apart to the point where you could see metal seats incredibly hard and uncomfortable and seat pitch so small that I had to sit side saddle for the entire flight. No chance of getting sleep in these seats. IFE didn't work properly and there are very few films or music to listen to - certainly not enough selection for a 12hr flight. Flight attendants friendly and polite and food was fine. Toilets don't appear to be cleaned during the flight so quite disgusting on a 12 hr flight. MRU-LHR in economy was similar. Boarding at MRU a mess. The queue from the gate weaved its way across most of the tiny terminal and was being processed very slowly. A lot of passengers getting angry. Flight attendants operated a ""self-service"" from the rear galley. The flight attendant call bell seems to be purely for decorative purposes so there was an endless line of passengers going to and from the rear galley.",nan,1.0,nan
nan,Economy Class,nan,nan,nan,nan,nan,no,nan,nan,Paris CDG to Mauritius in Economy Class and totally disappointed. Firstly the seats were so uncomfortable it was impossible to sleep. There was no in flight entertainment because it was such an old aircraft - we did have our own tiny screens but they only displayed a map of where we were! The staff were okay and food about edible. Fly with another airline you will not regret it.,nan,1.0,nan
nan,Business Class,nan,nan,nan,nan,nan,yes,nan,nan,CPT-MRU A319 Business Class. Fixed cabin of 16 seats (2-2) but 3-3 with the centre seat as a table. Good leg room for a regional flight although 5 hrs is a long time in a economy seat which it appears to be. It has an IFE box under the centre seat. Cabin service was good and food excellent - a 4 course lunch with a choice of 3 mains. Aircraft - one of only two of this type operate mainly MRU to South Africa. Overall good but a poor seat. Arrived on time but parked remote - seems standard for this type and after some delay disembarked onto a bus.,nan,1.0,nan
