Aircraft,CabinFlown,CabinStaffService,DateFlown,FoodAndBeverages,GroundService,InflightEntertainment,Recommended,Route,SeatComfort,Textchunk,TypeOfTraveller,ValueForMoney,WifiAndConnectivitynan,Economy Class,2.0,nan,nan,nan,nan,no,nan,1.0,A nightmare out of Johannesburg on 16th April. Flight due to take off at 13.20 at 13.45 the Captain announced 9 passengers needed to disembark the aircraft in order to balance the load. A few passengers opted for the US$500 voucher in exchange for disembarking. However an hour later the aircraft hadn't moved. Chief FA then informs passengers that another 10 passengers have to be offloaded. Eventually all passengers had to disembark the aircraft and re-board so calculations could be reconciled with the regulations. At 16.30 after a frustrating 3 hour wait I voluntarily disembarked was taken to the baggage hall to collect my bag only to find all passengersâ€™ baggage had not even been loaded onto the aircraft. Staff lied and tried to pass the buck at every opportunity. I have now been rebooked on 17th April and am not expecting a better show from KQ.,nan,1.0,nan
nan,Economy Class,2.0,nan,3.0,nan,2.0,no,nan,3.0,Heathrow to Harare return. Outbound flight was okay with no delays and the flight was comfortable. Return flight was a nightmare we were delayed twice - once in Harare and Nairobi with no explanation for the delays.,nan,2.0,nan
nan,Economy Class,2.0,nan,4.0,nan,2.0,no,nan,3.0,Nairobi to Lagos. Boarding procedures unpleasant sat in a window seat with a passenger next to me who had little appreciation of personal space and who loved what I was watching on my iPad. Food was great; took 3 requests to get a drink after food service finished. Would see if I could afford business class next time.,nan,3.0,nan
nan,Economy Class,5.0,nan,3.0,nan,3.0,yes,nan,3.0,Have had very poor experiences in the past but Kenya Airways seems to be stepping up their game. Recent flights to Juba Addis Kigali Maputo and Joburg were all on time seats/planes were ok (new Embraer's are great) and service very good. Staff are almost always polite.,nan,3.0,nan
nan,Business Class,1.0,nan,3.0,nan,2.0,no,nan,1.0,To be honest I never got on the airplane got to Nairobi for a flight to Lagos 05/10/2012 to be told the flight was cancelled and they had 'no spare airplanes'. We were told to 'try again the next day.' In the ensuing chaos business class passengers with confirmed ticket for another flight (Nairobi to Addis) were told the flight was overbooked and full already. The airline reflects the airport which is among the worst I've encountered.,nan,1.0,nan
nan,Economy Class,5.0,nan,3.0,nan,nan,yes,nan,4.0,KQ is on time. I have flown them 12 times over the last few weeks ex. NBO to MBA and EBB and they are on time. Boarding commences at least 30 minutes before departure and you may have to sit on the plane for 15 minutes but all flights were in time. Flights have been very full. Service has been good (no food service just drinks) and priority luggage works. In EBB our bags were sitting near the conveyor belt having been off loaded first. Let's hope they can keep it up.,nan,3.0,nan
nan,Economy Class,3.0,nan,2.0,nan,1.0,no,nan,2.0,Flew KQ return flight from CDG to NBI Aug20/Sep4. Flights were about on time. But very old run down 767 (worse than Delta) with pathetic seats/comfort and non-existent inflight entertainment. Staff looked bored and food was poor. With all this you'd expect a discount but no: 900 euros return and the plane was half empty on 20th.,nan,1.0,nan
nan,Economy Class,3.0,nan,4.0,nan,2.0,yes,nan,4.0,We flew from Heathrow to Nairobi on 4th Sep with the flight leaving on time. We managed to get extra legroom seats (row 12) as my husband is 6 ft. 5 and they were fine. Boarding was fairly structured and the food (an evening meal - I chose the veggie option - stuffed peppers) was pretty good - hot and tasty with a snack just before landing for breakfast. I didn't expect much from the IFE from the reviews and wasn't bothered anyway. Some parts of the cabin were a bit frayed around the edges but no real complaints. Crew were fairly attentive. Both internal flights were also fine - a short hop between Nairobi and Mombassa and vice versa - the first left early the second a few minutes late. On both there was time for a snack and a drink with good crew service. Flying back on 13th from Nairobi to Heathrow was fine too - left on time but no extra legroom seats this time so a bit cramped for my husband. IFE was very poor - his seatback TV didn't work and mine was hit and miss. Again no complaints about food. Boarding this time was a bit more chaotic and JKIA is a horrible airport - cramped chaotic and poor flight information. Luggage all arrived with no problems too. Maybe we were just lucky given all the other poor experiences but I can't say there was anything majorly wrong with any of our flights or the service we received.,nan,3.0,nan
nan,Economy Class,4.0,nan,3.0,nan,nan,no,nan,3.0,I was scheduled to fly from Chicago to Brussels and take Brussels Air to Nairobi. July 5th ORD flight was late missed connection re-routed through London London to Nairobi via Kenya Airlines. One checked bag did not arrive. Twice Kenya Air made arrangements to deliver bag while I was in country twice they failed to show. Repeated attempts to contact them after I returned were futile. Six weeks later United calls and says they have my bag.,nan,3.0,nan
nan,Economy Class,4.0,nan,3.0,nan,1.0,no,nan,3.0,"Flew on a 767 from CDG to NBO on July 19th and then a 777 from NBO to AMS on August 17th. Flight from Paris to Nairobi showed as being ""on time"" for 11am departure but bit by bit departure was pushed back until 3pm without any explanation whatsoever. Once on board 767 both AVOD devices did not work making 8-hour journey feel even longer. Food was average (same as most US carriers) and service was kind. On return flight we were once again delayed for one hour without explanation and once again AVOD in both seats did not work. Food on return flight was less than pleasant. I did not have high expectations but Kenya Airways made even mainstream US carriers look luxurious.",nan,4.0,nan
nan,Business Class,2.0,nan,3.0,nan,1.0,no,nan,1.0,"I live in Kenya and I am a Flying Blue Gold member. Unfortunately I have to fly KQ frequently. I say ""unfortunately"" mainly due to the more than frequent delays without explanations without anyone responsible and without real support as to what to do. You feel totally lost in the horrible JKIA. When flights get delayed over night people are ferried to hotels in CBD instead of hotels closer to the airport. Apart from this standing joke on KQ unreliability of flights I have to say that I have always received my luggage (touch wood). In-flight entertainment is a complete joke with old movies on the system that only works half the time. Twice in business NBO-Paris I had no in-flight entertainment at all and no apologies for it. Food is not too bad. Seats are old and uncomfortable. Now if KQ would at least be a cheap airline I could accept all this but given the pricing structure it is just annoying. $1000 in Econ NBO to Maputo? I have seen worse but I have also seen much better.",nan,1.0,nan
nan,Economy Class,4.0,nan,4.0,nan,2.0,yes,nan,4.0,A pleasant surprise with this airline. I made sure I bought travel insurance and examined the policy wording after reading these reviews on this site. However from HKG-BKK-HKG it was clean efficient and with good service. Outbound flight delayed by 45 minutes but inward was on time. Luggage and check-in fast and efficient too (although couldn't check-in online). The price we paid made this a budget airline purchase effectively and we treated as such. Would be happy to fly with them again if we found a good deal.,nan,5.0,nan
nan,Economy Class,2.0,nan,1.0,nan,nan,no,nan,2.0,Flew them last month from Lusaka-Nairobi and return on old Boeing 767's. While going flight was via Lillongwe and on return via Harare. Both ways seats were broken and quite uncomfortable. Staff were not friendly at all. Cabin and toilets were quite dirty. Food both ways was also horrible. On return in Nairobi check-in staff gave me 2 boarding passes one for the Nairobi-Harare flight and the other for the Harare- Lusaka flight meaning I had to change seats in Harare! Never seen that in any other airline. Recommend to avoid this airline if possible and use alternatives when flying to and from Africa such as SAA/ET.,nan,2.0,nan
nan,Economy Class,1.0,nan,3.0,nan,nan,no,nan,3.0,"Flight from Nairobi to Kigali cancelled with no notice and no reason. Rebooked on later flight via Bujumbura. Stayed on the ground at Bujumburra for 2 hours. No luggage on arrival and no one cared. Phone call on a Saturday resulted in ""call back Monday we don't have staff to chase luggage on the weekend. In air service was good on all our Kenya Airways flights but poor schedule management and incredibly bad luggage management means I will not fly again if I can help it. Such a pity it could be a great airline.",nan,nan,nan
nan,Economy Class,5.0,nan,5.0,nan,4.0,yes,nan,4.0,Great overnight flight from LHR to Nairobi. On time. Delightful service. Good food. Generous with drinks. Only issue was shortish time between dinner and breakfast. Connection to Entebbe smooth. On time. New plane. Same quality of service. Baggage arrived. Absolutely no complaints.,nan,4.0,nan
nan,Economy Class,4.0,nan,1.0,nan,1.0,no,nan,2.0,Nairobi to Bangkok. It was an overnight flight that was continuing to Guangzhou. An older aircraft entertainment system didn't work food was inedible. The staff however were delightful. Cheap tickets that got us to our destination - would definitely pay more in the future to avoid such an unpleasant experience.,nan,3.0,nan
nan,Economy Class,4.0,nan,4.0,nan,4.0,yes,nan,3.0,LHR-NBO-NDA Flew 17 Dec. Boarding was quick and efficient. Flight was delayed leaving Heathrow due to baggage needing to be taken off the plane because of no passengers. An understandable security measure and the pilot entertained us with his flight plan. Food was good and staff were friendly and attentive. Landed on time in Nairobi. Second leg to Ndola was uncomfortable. Seated in emergency exit aisle with very straight seat unable to recline. Seat slipped forward so the metal was exposed. Return leg via Nairobi was good. Seat for Nairobi to London was broken so would not stay reclined. IFE was good both ways as was all food and drink served.,nan,3.0,nan
nan,Economy Class,4.0,nan,4.0,nan,3.0,yes,nan,3.0,We travelled for the first time with Kenyan Airways and found staff very friendly and helpful. The food on board was adequate and hot. The seats were not very comfortable seat pitch poor and not much room. The return trip was on a newer aircraft I think and the onboard entertainment system worked fine.,nan,4.0,nan
nan,Business Class,4.0,nan,4.0,nan,nan,yes,nan,5.0,More than happy with the service from Malindi to Nairobi. The travel agent messed up my ticket and did not have the ticket available at the airport. They were kind and patient and even came on board to make sure I was fine I even was upgraded to business. It was such a short flight but the additional leg room was nice and seats were comfortable. Flight is only 40 minutes - time for a snack hot towel and soda.,nan,5.0,nan
nan,Economy Class,5.0,nan,4.0,nan,3.0,yes,nan,5.0,24 Dec 2012. Travelled KQ 484 from NBO-DAR. A midday flight we boarded quite early and waited a long time to depart. Embraer-190 was very clean and new had a delicious meal and arrived on-time and found our luggage. On our return flight boarded on-time and we left 10 minutes earlier than scheduled. The passengers seated in front of me fully lowered his seat which made me quite uncomfortable during both trips however the crew were kind.,nan,5.0,nan
nan,Economy Class,2.0,nan,2.0,nan,1.0,no,nan,1.0,Traveled to NBO on 31 Sep 2012. Flight delayed due to the fact that a jacket was found in a seat with no passenger attached to it. A few mumbled announcements were made to find the passenger. A security delay was announced followed by a need to re-fuel the aircraft before take-off. Many passengers missed their onward flights. Seats were incredibly uncomfortable. Felt like there was no padding and my seat cushion slipped forward revealing the metal base of the seat. Very uncomfortable. Inflight service did not work. No matter how many times they rebooted it certain seats were still no-ops. Headphones were falling apart and the one pair that was not was of no use as the socket on the seat I was sitting in and the one next to me was broken. The meal service was similar to what you would expect on a charter flight. Very basic breads cold to frozen and dry salad was tired and limp. I will not be flying KQ in futre unless I can pay for a C class ticket.,nan,2.0,nan
nan,Economy Class,1.0,nan,1.0,nan,1.0,no,nan,1.0,5 Nov 2012 KQ116 Nairobi to Amsterdam Boeing 767 Morning flight. I booked to fly KLM for both out and inbound journeys but unfortunately found myself obliged to fly KQ for the return seats and fittings equally dilapidated as the KQ flight to Paris that I now systematically avoid. Inflight entertainment was simply missing. I didn't think any airline would put these kind of flights on popular international routes. 2 hrs after take-off the breakfast trolley is rolling past 1 hour later flight attendant offers me a tray with bread croissant butter and juice announcing continental breakfast. Half an hour later I'm still waiting for a hot drink. In the meantime the captain is apologising about late take-off from Nairobi as if it was something to be proud of. Tea eventually comes 1 hour after 'continental breakfast'. Incidentally the temperatures in the cabin is kept glacial. This is nothing compared to lunch. After a terribly long wait to only to end up with a repeat of the earlier back and forth game of trolleys and trays partially empty trays trays with this or that missing. My salad comes with the inside of the already unsealed lid smeared with what looks like chocolate pudding? We are a long cry from the fancy looking menu proudly presented at the onset of flight. Between 2003 and 2007 KQ was my favourite company on this route but it will be a while before I choose KQ over other alternatives.,nan,1.0,nan
nan,Business Class,2.0,nan,4.0,nan,3.0,no,nan,2.0,I found the flight horrible. My partners T.V didn't work there and back). Seats not comfy when we called the flight attendant it was over an hour before anyone came that is after the bell was switched off several times. I was not sat with my partner and when I asked if it was possible if we could sit together they couldn't be bothered to help.,nan,2.0,nan
nan,Business Class,1.0,nan,1.0,nan,3.0,no,nan,3.0,Nairobi to Lagos after a 30 hours delay - yes 30 hours! But what was most annoying is that the Kenya Airways staff refused to explain what the problem was...was it mechanical or what? Turned out the cabin crew were staging industrial action to try to prevent non-Kenyan nationals working for the airline. But the refusal to explain anything only made passengers more and more angry. Never want to fly with them again.,nan,1.0,nan
nan,Economy Class,3.0,nan,2.0,nan,4.0,no,nan,2.0,USA-AMS-NRB. Flight fine until we got to NRB late evening and had to deal with Kenyan customs who extort money. I had no extra or overweight luggage but was told I had to pay duty for my toddler nieces and nephews clothes while I watched multitude of passengers go by with extra tots. NRB-AMS-USA flight had the worst meals: breakfast croissant and bread. FA's appeared tired and bothered when requested for anything especially water. The food products were dirty: yoghurt with old dried yoghurt on the side tray appeared messy/haphazardly setup. Food was better when it was under NAS. Service has really declined what a shame!,nan,2.0,nan
nan,Economy Class,4.0,nan,3.0,nan,3.0,no,nan,1.0,Overnight flight to Nairobi from Schipol. Seating was very uncomfortable where sleep was near impossible. Service onboard was attentive. On the return flight to Schipol I found the food tray to be dirty. Service was reasonable but not as good as the outbound flight. I have flown with Kenya Airways for some 9 years for some reason the overall service has slipped. I've just compared Kenya Airways with BA where the cost is some Â£400 higher the journey time is much reduced and I would be reasonably confident that BA can match or beat Kenya Airways on service.,nan,2.0,nan
nan,Economy Class,5.0,nan,4.0,nan,3.0,yes,nan,4.0,DXB-NBO operated by Kenya Airways codeshare with SU. Boeing 767-200 in a 2-3-2 seat configuration. Aircraft a bit old but well maintained. Flight full. Overbooked on business class 1 person was downgraded. I got one of the very last seats in the middle of an 2-3-2 configuration. But the staff were good hard-working in a sparkling mood and attentive. Ordered 2 drinks and was given 2 of each (as to make up for busy FAs and few rounds of service). This happened to everybody who cared but only at the first service- IFE on large plenum screen worked surprisingly well. Good information from captain and purser. Aircraft parked far from gate. Luggage delivery at the belts in Nairobi messy with tonnes of unpicked suitcases all over the place. Monitors were not properly working thus need to check 6 belts to get luggage as staff were giving incoherent information.,nan,5.0,nan
nan,Economy Class,3.0,nan,4.0,nan,4.0,yes,nan,4.0,Nairobi - Lusaka in July 2013. Was worried as have experienced KQ's long haul service before and Nairobi airport is horrendous. However this was a great flight. New Embraer 190 individual IFE (that worked!) good in-flight service. Departure/arrival on time. Given they have no real competition on this route I was impressed.,nan,3.0,nan
nan,Economy Class,1.0,nan,2.0,nan,2.0,no,nan,2.0,CDG-NBO-EBB and EBB-NBO-AMS. First flight was an hour late in departing IFE had a horrible crackle only 5 movies on the 767-300 one of which they only showed half of. Food was ok school dinner like really only got a lunch meal (pasta followed by chicken curry and apple pie) dinner was a tuna roll which is not a dinner considering the flight was landing at 9pm and 9 hrs long. Seats were uncomfortable material very lose and faded. NBO-EBB was a brand new Embraer 190 excellent comfort leather seats steak and cheese roll much better same on the return leg but got a continental breakfast. NBO-AMS was a 777-200er similarly poor condition but had new IFE 20+ movies but some didn't work. My IFE worked on the my side of the plane (seat fghj) the other side (a-e) were all broken meals again were poor. Won't be flying again KLM BA or Emirates next time.,nan,2.0,nan
nan,Business Class,1.0,nan,nan,nan,nan,no,nan,1.0,Outbound: YYZ-JNB via AMS and NBO. Inbound: JNB-YYZ via NBO and AMS. Flew KLM on YYZ-AMS on an old soon to be retired mighty MD-11 but the cabin looked new. Flight on time. No PTVs in Business Class but I slept almost the entire flight. Service was great. Had an 8 hour layover in Amsterdam. Nightmare began when boarding the AMS-NBO flight. Plane was a moderate Boeing 777-200ER. Garbage all over the floor no PTVs seats that can't recline for standard Business Class and some broken tray tables. Left an hour late. The food for Business Class looked like plastic and it somewhat tasted like plastic. Arrived 15 minutes late the next morning. Nairobi's airport was in very poor shape. NBO-JNB - Luckily it was the gate next to where I arrived. Flight was operated by an old Boeing 737-700. Seats better than AMS-NBO flight cabin clean but some tray tables were missing. Flight delayed because of morning traffic congestion. Flight attendants very polite. Arrived later than scheduled. On the return the JNB-NBO flight wasn't delayed but the Boeing 737-700 was awful. The next day we board at around 8am but the plane wasn't even at the gate. A replacement airplane a very poor looking Boeing 767-300ER was towed to the gate at 9.00. Boarded at 9.45 and left at 10.15. Served the worst breakfast and lunch. Arrived an hour late in Amsterdam. Had a 5 hour layover waiting to travel with KLM. Aircraft was a new Airbus A330-200. On time flight even arrived earlier in Toronto. Business class cabin was great. No PTVs though. This will be the first and last time I will fly Kenya Airways.,nan,nan,nan
nan,Economy Class,3.0,nan,2.0,nan,2.0,no,nan,3.0,"JNB-NBO in a 737. Plane arrived late took off late. Seating on the 737 a bit cramped for a flight of this distance. Served a late lunch fair quality. No IFE. No magazine in my seat pocket. Did not enjoy this trip. Nairobi airport 5 hour layover. Very poor airport to spend time in. Dark and gloomy. No seats to lie down in. Big Big wait to get food at the poor restaurant/snack place. Cold chicken pie could only manage a bit of it. You cannot even watch the planes arriving and leaving. Avoid NBO if longer than 1 hour. NBO-LHR on 777. OK economy fair. IFE very hard to work out and not a good choice. Dinner - fair at best. Breakfast before arrival very poor. Hard to get a second cup of coffee. Compares well to ""Ryanair"".",nan,4.0,nan
nan,Economy Class,5.0,nan,5.0,nan,nan,yes,nan,4.0,ADD-NBO-ADD. Both flights on time. Easy check in. Wonderful new aircraft the Embraer 190 lifts the whole experience above almost all medium haul flights in my entire life. I volunteered to downgrade on the ADD-NBO leg as the flight was sold out and I was only stand-by despite having a booking. However the ticket was issued for the following morning and I had the choice either to downgrade or to wait. But even the economy class was a very good experience despite being full: lots of food (2 food options + vegetarian) constant refill of drinks and the aircraft completely clean and staff observant and kind and quick. Not denied anything. On the way back same excellent service even the tax-free worked well. Very detailed enjoyable and interesting info from captain on both legs the entire cockpit staff was introduced and likewise the chief purser. Nice seats spacious with power-outlets. A great experience. IFE seemed not working but who cares?,nan,4.0,nan
nan,Economy Class,1.0,nan,4.0,nan,1.0,no,nan,1.0,"They have repeatedly failed to deliver service befitting their alleged title as ""The Pride of Africa"". Sydney to Nairobi via Bangkok in April and December 2012 and the experience was appalling. KQ took over from BKK and FAs were very rude dismissive and rolled their eyes at simple and polite requests for essentials such as a blanket and water. When my first blanket request was ignored I pushed the FA button only for a passing FA to turn it off harshly and storm off while I was trying to explain what I needed. Eventually I gave up. There was no entertainment although this was a 15 or so hour flight! The seats were really uncomfortable and bathrooms were disgusting but I have to say the food was the only highlight. Never flying KQ again though.",nan,1.0,nan
nan,Economy Class,2.0,nan,3.0,nan,1.0,no,nan,2.0,Flew from FBM to HKG it was pretty old 767 aircraft. Half of the entertainment system didn't work. Always afraid of whether the baggage will arrive or not. Uncomfortable seats. One of the flight attendant behaviour flying out was very impolite.,nan,2.0,nan
nan,Economy Class,3.0,nan,4.0,nan,nan,yes,nan,4.0,Flight from NBO to MSA. Good experience and seem like high standards. Used the SIMBA lounge as well. There was a huge storm in NBO and the staff checked and rechecked the boarding passes. An elderly lady was in a wheelchair and couldn't don the plastic raincoats they gave us for the trip to the plane (no passenger loader). No one helped her with the raincoat. I helped her and then asked the KQ Staff to help out. They just stood around I guess expecting to be told what to do? Another check by the loading stairs then another check at the entrance of the aircraft with lines forming and people getting wet. Otherwise the flight was ok.,nan,4.0,nan
nan,Economy Class,5.0,nan,5.0,nan,5.0,yes,nan,5.0,NBO-MBA. It was a new Embraer E190. Flight was on time. Flight was full. FA were in a sparkling mood ever smiling and welcoming. Was served with nuts and soft drinks. Good information from the First officer. IFE was working but flight time was short. Overall had a nice flight.,nan,5.0,nan
nan,Economy Class,5.0,nan,4.0,nan,nan,yes,nan,3.0,We flew overnight LHR to Nairobi then back overnight 8 days later after our Kuoni safari. Both were 777-200 quite old but seemed well maintained. Seats 3-3-3 firm but leg room OK. Seat allocation very good: on outward trip it was under 80% full and they gave us 3 seats for the 2 of us. Staff very cheery and efficient drinks plentiful food good except breakfast on return (boring no fruit). Toilets kept clean & dry. Took tablets so can't comment on IFA. No problems at Nairobi airport despite the fire.,nan,4.0,nan
nan,Economy Class,4.0,nan,3.0,nan,1.0,yes,nan,4.0,NBO-JUB (Juba South Sudan)-NBO. Excellent flights in a new Embraer 190 both ways. Aircraft clean and appealing. Onward flight on time full service 3 option hot meals offered. Drinks plenty inc alcoholic beverages. FA service excellent despite flight completely full in both classes. Granted lounge access in NBO and 60 kg luggage due to Skyteam gold status. Flight back to NBO also about full. Departed 30 Minutes prior to scheduled (arrived similarly early). Food was less good only 2 options (goat and chisken) and of much smaller size and meat was grinded. 2 wines are offered (absolutely undrinkable). Inflight entertainment not working despite individual monitors mounted. Power outlets at every seat. Tickets expensive as KQ enjoys very little competition on the route.,nan,2.0,nan
