Aircraft,CabinFlown,CabinStaffService,DateFlown,FoodAndBeverages,GroundService,InflightEntertainment,Recommended,Route,SeatComfort,Textchunk,TypeOfTraveller,ValueForMoney,WifiAndConnectivitynan,Business Class,nan,nan,nan,nan,nan,yes,nan,nan,Bangkok-Almaty (Business) Almaty-Astana-Novosibirsk. The Business Class was very good and liked the beds. There was plenty of space but would prefer truly flat beds. Friendly check-in in Bangkok and food was better than expected. Allowed to stay in the Business lounge while I waited for the connecting flight to Astana. Business lounge in Bangkok was very ordinary and toilets were in a different area. Almaty-Astana-Novosibirsk. Everything was adequate and better food than I expected. These flights were still full.,nan,4.0,nan
nan,Business Class,nan,nan,nan,nan,nan,yes,nan,nan,London-Almaty. The best direct flight between London and Almaty. Service is very good cabin crew are all well presented and professional. My only criticism is that I found the selection of wines quite limited. Everything else was as you would expect from a leading international airline boarding inflight entertainment landing etc. I have been a customer of Air Astana for the last 10yrs and can say that services planes and routes have all improved.,nan,4.0,nan
nan,Economy Class,nan,nan,nan,nan,nan,yes,nan,nan,Friday night back to Almaty they did brilliantly. Excellent selection of drinks served by staff who knew how to mix them well prepared fresh food friendly and professional cabin staff newish plane comfortable seats  good music selection (I even have to admit I found the crass candid-camera-esk overhead TV amusing too then off the aeroplane and out of the airport and into a taxi in 5 mins max.,nan,4.0,nan
nan,Business Class,nan,nan,nan,nan,nan,yes,nan,nan,London-Almaty and this airline seems to get better and better. It was streamlined and helpful from check-in to arrival. The staff were unfailingly polite and helpful and did everything possible to make my journey pleasant. It took me a short while to work the seats but I slept very soundly when I had. There is plenty of space and it was an extremely comfortable way to get to Kazakhstan.,nan,4.0,nan
nan,Economy Class,3.0,nan,3.0,nan,2.0,no,nan,3.0,"Long delay in departing Almaty bound for KL. Perfect weather although no real excuse given. On boarding more than 2 hours late and by bus from the terminal to the aircraft which caused more delay we sat on the ground for a further 30 mins while a drunken passenger was off-loaded. At least half the flights I have taken with Air Astana have been delayed by hours not just minutes. On-board I asked the cabin crew to see if the connecting flight would be held or if other arrangements needed to be made. Their reply was that 'we will call ground staff and let you know'. The second time was 'we will talk to the captain' the third time was the same answer. On my fourth request I was then told that we have other passengers who are all going to be late. I was travelling on an Air Astana ticket and there was no concern or accountability shown toward this situation. T Arriving in KL with just 10 minutes to spare for the connection on Malaysia Airlines of course we could not board. 767 used on this route is very old although has had some face-lifts. Seats are narrow for business class seats and they are not lay flat they are ""lay on an angle and keep sliding down"" seats. The entertainment system is an IPAD style of portable unit. This only had a choice of three last release movies and at the end of the day there is nowhere to put it where you might consider ergonomically sensible to watch it. I would recommend that you definitely leave a minimum of 5 hours for your connections because they will most likely be late!",nan,3.0,nan
nan,Economy Class,4.0,nan,5.0,nan,3.0,yes,nan,4.0,KC907/8 DEL-ALA-DEL on Y class. The Flex fare reasonably priced. Check in both at DEL and ALA was good. Minimal waiting times and the staff were very professional. Board process was ok. Slightly let down by the fact that we were bussed to aircraft and made to board via steps in the rain. Both flights were on well kept clean A320s. Flights were relatively empty so I had 3 seats to myself. Cabin Crew were pleasant and professional. Food and Drink was tasty well presented appropriate for route and time of day. IFE from drop down screens were a bit of a disappointment and hard to follow. Better off bringing a book. Punctual departure and arrival. Would fly again and recommend to others.,nan,4.0,nan
nan,Business Class,nan,nan,nan,nan,nan,yes,nan,nan,ALA-TSB - Emb 190 Business. Early morning business flight. All on time and aircraft full on this relatively new route. Crew were friendly and breakfast was very nice. Departure formalities from Almaty are confusing and bizarre with no priority for business class at any stage apart from check in. No Air Astana staff to guide you through the complexities rather there are hawkers trying to make some cash who are more of a hindrance. Lounge is horrid not even 2* let alone 4*. No priority boarding for business class. Hand held TV offered but I didn't use it. Would happily fly Air Astana again.,nan,4.0,nan
nan,Economy Class,nan,nan,nan,nan,nan,yes,nan,nan,TSE-CIT-ALA. A couple of internal Kazak flights. All on time. Clean and comfortable. Leg room good on both flights. Crews fine but seemed to be little interest in standard health and safety (eg phones ringing in flight people walking around the aircraft during taxi). Did a good job but not a 4* airline!,nan,4.0,nan
nan,Economy Class,nan,nan,nan,nan,nan,yes,nan,nan,Service was good provide travel kits headsets entertainment programs excellent but during boarding I was frustrated by rude attitude of flight attendants one flight attendant gave us instructions about emergency exits we set in front and two other crew came to me and asked me if I was instructed or not about emergency exit because I had small bag in my hands. She raised her voice was very aggressive didn't ask me but said firmly that I must change my seat. Then went away to business class returned with flight attendant-supervisor who said it was ok for me to keep my bag in my hands and was very sorry about this situation. I think the crew need more training (working with passengers and working in a team).,nan,4.0,nan
nan,Business Class,nan,nan,nan,nan,nan,yes,nan,nan,Moscow-Almaty-Bangkok. Both flights departed on time. Flight attendants helpful and friendly with reasonable English. Food was good and sufficient. IFE's a bit restricted and out of date for Business Class. Big problems in Almaty because I could not produce the credit card used for the booking. Took several hours of work and an email from a bank in Australia before I was allowed to board the flight. Flight full from Moscow to Almaty and only a third full from Almaty to Bangkok. Despite the problems with credit cards I will still fly them.,nan,4.0,nan
nan,Economy Class,nan,nan,nan,nan,nan,yes,nan,nan,KUL-ALA-AKX return. First flight from KUL-ALA on their 767-300 flight was on time and service was great. But for a 7 hour flight it was quite hot in the cabin. Had some trouble with my visa-on-arrival in Almaty but the ground crew were very helpful translating throughout the immigration process: they even carried my bags and checked them in for my connecting flight while I was waiting for my visa. Flights from ALA-AKX and return were good got on their new Embraer and the service onboard was excellent though the crew does need improvements their English. Overall it was a great experience and would like to fly them again.,nan,4.0,nan
nan,Business Class,nan,nan,nan,nan,nan,yes,nan,nan,Bangkok to Almaty. Excellent flight friendly and helpful flight attendants. Cabin crews English is getting better and more than adequate for a foreigner travelling with them. Food was good but could have been a little better. Seats good - not quite a bed but allow you to stretch and sleep. Portable hand held entertainment units not so good compared with other airlines. I upgraded at airport and this represents excellent value. Pre-booked business class is not good value.,nan,4.0,nan
nan,Economy Class,nan,nan,nan,nan,nan,yes,nan,nan,ALA-AYT-ALA. Very polite and professional staff onboard. Excellent serving of special meals as ordered at booking and excellent care for children and aged passengers. I would recommend providing more toiletries (hand lotion combs etc). If possible please consider other supplier of noise-reducing earplugs those available in the passenger's pouch now don't reduce the noise and pressure discomfort in the cabin.,nan,4.0,nan
nan,Business Class,nan,nan,nan,nan,nan,yes,nan,nan,Excellent recent flights great selection from inflight service. Very friendly attentive and polite staff. Flights were on time and very comfortable good connections modern aircraft and all in all a great flying experience.,nan,4.0,nan
nan,Business Class,5.0,nan,5.0,nan,nan,yes,nan,4.0,Dushanbe - Almaty in business class. A Western standard experience including attentive and friendly cabin crew and excellent food. On time departure and arrival. This short trip was a relaxing moment in a busy day plus got some work done in the spacious seat. The seat armrest was broken though so hopefully a repair was due just after this flight.,nan,4.0,nan
nan,Economy Class,5.0,nan,5.0,nan,4.0,yes,nan,4.0,I frequently fly with Air Astana mostly within Kazakhstan and sometimes abroad. Air Astana is the best airline in Kazakhstan in terms of comfort and service. Luckily I have not had major delays and those which I had were usually weather related. Flight attendants were friendly and professional good aircraft's better legroom choice of food and entertainment helpful customer service. Overall very good progress in the last 5-7 years and dramatically improved flying experience if compared with its predecessor airlines just around 10 years ago.,nan,5.0,nan
nan,Business Class,5.0,nan,5.0,nan,4.0,yes,nan,4.0,Almaty to Hong Kong and back. It was smooth no delays. 757 of Air Astana’s fleet has good business class with quite comfortable seats - almost flat. Good food and service. Inflight entertainment is ok they provide Ipads which is quite convenient.,nan,5.0,nan
nan,Economy Class,5.0,nan,4.0,nan,4.0,yes,nan,5.0,Flew from Almaty to Istanbul and was greeted by friendly helpful staff on both the outward and inward journeys. I am a tall person and I asked at check in for a seat with lots of leg room and was asked if I wanted to sit by the emergency exit. As a consequence my journeys were wonderful lots of leg room and helpful staff.,nan,4.0,nan
nan,Economy Class,4.0,nan,4.0,nan,4.0,yes,nan,5.0,KC902- flight from London to Astana. No delay at all. The seat was quite comfortable staff service excellent I was served some traditional Kazakhstan food and it was delicious. There wasn't much inflight entertainment. This airline is the best way to access Kazakhstan.,nan,5.0,nan
nan,Economy Class,5.0,nan,4.0,nan,nan,yes,nan,4.0,Almaty to Bangkok return. Everything ran on time (slightly ahead of time actually) and service was up to the usual AA high standards. I was offered a free upgrade to Business Class on the return (overnight) trip which was very much appreciated - I slept solidly throughout the journey and felt surprisingly fresh on arrival.,nan,5.0,nan
nan,Economy Class,5.0,nan,5.0,nan,5.0,yes,nan,5.0,ALA-BKK on 13th February 2013 returning on 17th February 2013. Offered a business class upgrade on boarding. The flat bed seats were brilliant for an overnight flight as was the meal drinks selection and level of customer service. A relaxing journey which went quickly due to the level of comfort and service. On the return journey I was in the economy seat I had originally purchased. I slept almost all the way and with my seat fully reclined I was able to stretch my legs out fully. There was certainly more legroom available than on other airlines I have flown into and out of Almaty and Kazakhstan itself. The meal was a lovely Thai chicken curry. The service was great and the drinks trolley was always in service.,nan,5.0,nan
nan,Economy Class,4.0,nan,4.0,nan,2.0,yes,nan,5.0,PEK-ALA-SVO. Both flights arrived on time. Good food and excellent alcohol selection. Service friendly and efficient. PEK-ALA on 767 and ALA-SVO on 321 old but well maintained. Generous legroom. No individual entertainment. Overall very good value for money.,nan,5.0,nan
nan,Business Class,4.0,nan,4.0,nan,4.0,yes,nan,3.0,Return flight from KL to ALA was in complete contrast to the previous flight down. On time crew very friendly and professional. Food and service was very good. After the debacle of the previous flight the agent in KL met me at the gate to again apologise. He had been very helpful previously. I also received an e-mail from the company's senior operations manager who went to lengths to apologise and explain. I do feel this is more than most airlines would do to follow up. This does give confidence that the airline is focussed on continuous improvement. The entertainment unit also had more movies loaded and this kept me fully occupied and well entertained for the flight. However suffice to say that the experience on the return journey was a good one with very good service and perfectly on time with the plane unloading from an air bridge on arrival making unloading of the 767 much more efficient.,nan,4.0,nan
nan,Economy Class,1.0,nan,1.0,nan,1.0,no,nan,3.0,Flight Almaty - Bishkek December 9th 2012. Horrible experience! All passengers boarded as scheduled by 10pm. Due to weather conditions we were informed we would have to wait. We were kept on the plane from 9.30pm until 4.30am. No reliable info provided by the staff/pilot. No food provided. At 4.30am we were asked to leave the plane and return to the terminal where we were informed that the flight was cancelled and the next one would be in 2 days. Ground staff rude and incompetent. No-one cared to provide us with snacks and hot beverages.,nan,1.0,nan
nan,Business Class,5.0,nan,3.0,nan,5.0,yes,nan,5.0,We travelled from KUL-ALA-LHR-ALA-KUL earlier this month. We were very pleasantly surprised by the high standard of service and attention given by the cabin crew on all sectors. The aircraft was reassuringly up to date and instead of built in entertainment system had iPad movies/TV at least in Business Class which anyway give a much better picture (and the choice of music is excellent too!). Quality of onboard food out of Almaty was a bit iffy however understood when one takes into account one is in Central Asia. This airline is a little gem and excellent value for money.,nan,5.0,nan
nan,Business Class,5.0,nan,5.0,nan,4.0,yes,nan,4.0,Bangkok - Astana Astana - Almaty Almaty - Istanbul. I have been flying Air Astana regularly for nearly 10 years. I think that they are the best airline in the Russian speaking world. My flights left and landed almost on time although we sat in the plane for an extended period of time in Ho Chi Min city and were not allowed off it. The food was good included the shortish flights between Almaty and Astana. The entertainment on the two long haul sectors was a bit limited. Cabin crew spoke quite good English - even on the internal sectors. Seats and legroom quite comfortable though the seats do not go horizontal on the long sectors. They provide good to reasonable value for money.,nan,4.0,nan
nan,Economy Class,5.0,nan,4.0,nan,4.0,yes,nan,4.0,Flight LED-ALA. The new aircraft in rather good condition although seats are very used in economy class. Sensible costs good service on board friendly crew and tasty meal. The traveler mini-bag was given consisted of toothbrush toothpaste a bandage for sleeping and a pair of socks. On-board entertainment was rather good also pillows for more comfort were provided by default. These airlines will be my choice for future trips to KZ.,nan,5.0,nan
nan,Economy Class,5.0,nan,5.0,nan,4.0,yes,nan,4.0,Round trip HKG-ALA-SVO. Meals tasted good. Staff Service excellent both inside and outside the flight. Staff in transfer lounge nice and helpful. Before my return trip from SVO-HKG I had a flight from Riga to SVO with Aeroflot. When I arrived at ALA for transfer the staff of Air Astana suspected and asked if I had any checked luggage. I said I had and Aeroflot had already transferred it to Air Astana as they told me so. He said my luggage was not with the flight according to their record. He also went out to see if my luggage was at claim lounge. He couldn't find mine so took me to report lost baggage. 15 mins after reporting the loss I was waiting for my next flight in departure lounge. My luggage was found at SVO airport. Staff in transfer lounge were professional and helpful.,nan,5.0,nan
nan,Economy Class,1.0,nan,4.0,nan,1.0,no,nan,3.0,Atyrau-Almaty-Bangkok. Atyrau-Almaty flight cancelled without explanation on the day making us stay in Atyrau for additional 2 days without offering accommodation. Replacement flight delayed twice. After we an hour in a check-in queue we were told that they ran out of seats on the plane leaving us and about 20 other passengers stranded. Offered tickets on additional flight on the same day but it was late to get on the connecting flight in Almaty. After 4 hours told that the additional flight was delayed. At 11pm it was announced that the flight was cancelled so we attempted to rebook. Told the next available flight was in 2 days which was unacceptable and we bought tickets with another airline. The next day we flew to Almaty with another airline and got on our connecting flight to Bangkok. As a result of the issues with Air Astana flights we had to spend extra money on the flights in Kazakhstan and Thailand.,nan,1.0,nan
nan,Business Class,5.0,nan,5.0,nan,4.0,yes,nan,4.0,Fly Air Astana once a week on average internal KZ and international. Consistent friendly service and generally very punctual. Last flight Almaty to Atyrau business class. Boarding always a mess but once on board great service. Occasionally poor attention to regulations with people on mobile phones while taking off and landing but generally getting better.,nan,4.0,nan
nan,Economy Class,5.0,nan,5.0,nan,4.0,yes,nan,4.0,ALA-KZO. return. Service was pleasant and efficient. Very polite and professional staff onboard. Food was good but could have been a little better.,nan,5.0,nan
nan,Economy Class,4.0,nan,4.0,nan,2.0,yes,nan,3.0,Frankfurt-Astana June 1 2013. Economy class. Full house. A bit of a mess at the gate at Frankfurt due to the airline's boarding policy last rows board first. Most people did not know or did not understand this so they waited for their turn as close to the gate agent as possible and as a consequence there was some pushing. Left with a delay of 10 minutes. Very hard working and helpful crew they spoke good English and were always around offering something. Economy passengers received a comfort kit somehow basic but still a nice touch. Inflight entertainment is pre-historic small flat screens hanging from the roof every few metres showing just one film and a couple of cartoons. Drink service several choices including alcohol. Meal service with two options fish or chicken. Nice cheesecake for dessert. Finally after the trays had been collected crew served vanilla ice cream. Although the flight took almost 6 hours with an arrival time of 6 am no breakfast was served. Coffee or tea would have been appreciated especially given the 2 hour immigration queue at Astana upon landing. Overall a more than acceptable experience. I would not hesitate to recommend this airline.,nan,4.0,nan
nan,Economy Class,5.0,nan,5.0,nan,4.0,yes,nan,5.0,Astana to Frankfurt and back in May 2013. We flew with a large group of small children. Airport staff were helpful with check-in and we were allowed to board first. Cabin staff were very helpful and friendly and dealt well with our kids (handed out children's packs on the way out for example.) Food was good quality and there were films showing throughout the plane (no individual at-seat screens in economy though). A pleasant experience overall!,nan,4.0,nan
nan,Business Class,5.0,nan,4.0,nan,4.0,yes,nan,4.0,7 hour flight from Almaty to Bangkok this month and it was very comfortable. The cabin crew were friendly and helpful without being overbearing. The spacing between the rows of seats was very large the seats reclined quite far back. Even though there were no indivdual tv screens for each seat we were each given ipads preloaded with movies which was a brilliant idea. You didn't have a huge choice of movies but most of the recent blockbuster releases were there along with some international movies. Overall it was a very pleasant flight and I would definitely choose to fly with Air Astana again.,nan,4.0,nan
nan,Business Class,5.0,nan,5.0,nan,4.0,yes,nan,5.0,"My family of 2 adults and 2 children flew from Astana to Abu Dhabi (non-stop) and back via Almaty. Although it was a New year vacation period with heavy passenger load all services - starting with tickets sales to luggage delivery were efficient and precise. On our way back we flew a brand new Boeing-767 and it was the best plane I have taken so far. We had to stay in Almaty for a night because of the weather conditions and ""Air Astana"" provided us with great rooms in a downtown hotel and round trip transfer. Staff were polite professional and competitive.",nan,5.0,nan
nan,Economy Class,4.0,nan,5.0,nan,4.0,yes,nan,4.0,PEK-ALA-TSE-SVO. Red-eye flight from Beijing to Almaty on B757-200. The aircraft is old but well-attended. Seats are ok. Cabin crew speak good English. Catering was served in the middle of the flight. Passengers who were sleeping were not offered their meals and amenity kits. Arrived early. Almaty-Astana-Moscow on A320. Food is tasty. Good choice of drinks including alcohol. Entertainment is outdated - just magazines music and a movie. Both flights on time. Smooth landings. We checked our baggage straight from Beijing to Moscow. It was a bit risky with 2 stop-overs but the airline staff assisted us in Kazakhstan and checked if the bags followed us. They were very helpful and the ground crew were efficient because our baggage arrived safely at SVO. I would recommend Air Astana if the prices are adequate.,nan,4.0,nan
nan,Economy Class,4.0,nan,4.0,nan,5.0,yes,nan,5.0,I travelled with my family on the ALA-BKK flight on Dec 15 2013 and back on the BKK-ALA flight on Jan 4 2014 and both flights were on their brand new 767. The seat comfort was the best I have ever experienced in Economy and the leg room was significantly more spacious than in other economy cabins. Both flights were on time and despite very full flights the service was very efficient and pleasant.,nan,5.0,nan
nan,Economy Class,nan,nan,nan,nan,nan,yes,nan,nan,EDITORIAL MESSAGE Due to concerns about authenticity of the review submitted and/or the user's name being that of the airline customer as stated on their submit form this comment has been deleted.,nan,nan,nan
nan,Economy Class,1.0,nan,3.0,nan,nan,no,nan,3.0,Tried to fly Dushanbe to Almaty to Bishkek. Almaty to Bishkek flight cancelled at last minute - no idea why (heard several explanations ranging from technical issues to lack of passengers). No notification from Astana staff until three hours later. I didn't have visa for Kazakhstan so forced to stay in airport transit lounge overnight. Next day tried to get visa at airport so I could drive to Bishkek. Air Astana people completely unhelpful - said it was impossible. Said I could either stay in airport another night until the next flight or fly to Bishkek via Moscow. Persisted and argued. Finally managed to talk to consulate at airport and received visa and took car to Bishkek. Air Astana refused to refund ticket or pay for visa.,nan,1.0,nan
nan,Economy Class,nan,nan,nan,nan,nan,yes,nan,nan,EDITORIAL MESSAGE Due to concerns about authenticity of the review submitted and/or the user's name being that of the airline customer as stated on their submit form this comment has been deleted.,nan,nan,nan
nan,Economy Class,3.0,nan,2.0,nan,nan,no,nan,4.0,Something is going wrong with this previously reasonable airline. Almaty - Astana flights. The basic route for this airline are notoriously delayed. So if you plan on a business trip on this route make sure to factor in at least a fee hours. Better a day. Disappointing. Ground staff not trained on how to deal with this. As a result they are nervous not pleasant and generally not helpful at all.,nan,2.0,nan
nan,Business Class,5.0,nan,5.0,nan,nan,yes,nan,5.0,I travelled with Air Astana business class from Kuala Lumpur to Almaty on Sunday October 20th 2013. The whole experience was very enjoyable and comfortable. The cabin crew were very pleasant and helpful and the service was excellent. The food was particularly enjoyable and I was able to relax and enjoy the trip back to Almaty after a hectic week in KL.,nan,5.0,nan
nan,Business Class,5.0,nan,5.0,nan,4.0,yes,nan,4.0,I take Air Astana flights on regular basis local and international economy and business. There are a lot of modern new air planes that are being added continuously to Air Astana. The service is much more pleasant and more active inside the plane because the crew are very young comparing to KLM British Airways Lufthansa. The food is comparatively much better than other international airlines. In some planes they have some seats that are very unusual but comfortable you can sleep on them very easy and comfortable. On the international flight prices they are very reasonable. I'm definitely recommending use Air Astana.,nan,5.0,nan
