Aircraft,CabinFlown,CabinStaffService,DateFlown,FoodAndBeverages,GroundService,InflightEntertainment,Recommended,Route,SeatComfort,Textchunk,TypeOfTraveller,ValueForMoney,WifiAndConnectivity
nan,Business Class,5.0,July 2018,5.0,5.0,5.0,yes,Paris to Bangkok via Vienna,5.0," |  Paris to Bangkok via Vienna. Amazing flight, everything was smooth and perfect. The boarding was efficient and not messy. The cabin is elegant and the seat comfortable. The meals were amazing, very sophisticated, delicious and generous. The staff was very warm and friendly. Many recent movies and a good size screen. Excellent experience.",Couple Leisure,5.0,1.0
nan,Economy Class,5.0,July 2018,5.0,5.0,nan,yes,London to Vienna,5.0," |  London to Vienna. I wasn’t impressed with the 1.5 hours delay. The cabin crew onboard are very friendly however, much more than other European airlines I’ve flown with.  The snacks and drinks are served twice, quite unusual for a 2 hours flight, perhaps an extra service due to the delay. The plane was pleasant, seat is comfortable, enough space for cabin baggage, smooth takeoff and landing. There’s a paid wifi onboard which I didn’t purchase, quite unusual for such a short flight. Overall good value for money, other budget carriers charge around the same and would’ve given less service. If there was no delay, I would have given 10/10.",Solo Leisure,5.0,nan
nan,Premium Economy,4.0,July 2018,nan,1.0,nan,yes,Vienna to Toronto,4.0," |  Vienna to Toronto. When I was boarding the lady at the gate checking the passports asked me a question which I didn’t fully understand. Suddenly she started shouting the question at me. I asked her why she was shouting at me and she said because she has asked me the same question six times. Her underling was equally rude to me and told me to “go” (meaning get on the flight). These two people do not represent the Austrian people nor the Company, and no customer deserves to be shouted at because they do not understand a question. ",Solo Leisure,3.0,nan
A320,Business Class,nan,June 2018,nan,1.0,nan,no,Vienna to Nice,nan," |  I booked Business Class and received a boarding pass for seat in row 8, which made me suspicious. Only after asking for a different seat, the check-in lady told me you have been downgraded. The supervisor tried to cälm me down by promising me that Austrian will ask for volunteers at the gate so I could get the seat I paid for. They did not! Before entering the plane , they tried to have me sign a waiver and give me 120 euros.",Business,1.0,nan
nan,Economy Class,2.0,June 2018,3.0,1.0,1.0,no,Frankfurt to Belgrade via Vienna,2.0," |  Frankfurt to Belgrade via Vienna. Unhelpful, infuriating and late. Showed no concern for missing connecting flight that was also with Austrian. No food or compensation, no help in any way. Complaints department's business card had no name on it. ",Solo Leisure,1.0,1.0
A320 / A319 ,Economy Class,4.0,June 2018,4.0,3.0,nan,yes,London to Sofia via Vienna,3.0," | London to Sofia via Vienna. Checked in online for both flights using the app, which was very easy. I had a ""Economy Light"" fare which meant cabin baggage up to 8kg plus a laptop bag or similar. This was a 06:00 departure from LHR T2. I always like to have paper boarding cards in case of phone failure so on arrival at 04:25 I went straight to a self service kiosk and got boarding cards for both sectors printed very quickly and easily. This is one of the first flights out of LHR so I was amazed I was through security and airside by 04:35. The downside about this time of day in T2 is there is absolutely nothing open until 05:00. My flight was out of the gates in the satellite building so I walked there. Boarding started just after 05:30 and was efficient, used a jet bridge and not a bus, and the staff applied a pragmatic approach to hand baggage. I had no problem stowing my wheelie bag in the overhead locker and my other bag under the seat in front. The seat pitch was acceptable and comfortable enough for a 2h15 flight. We departed approx 5 mins late, but arrived 15 mins late in VIE. Onboard service on this sector was reasonably swift in getting started and was basically beverages including alcohol plus a muffin. There was a second beverage service later into the flight. The flight attendants were all friendly and helpful. Arrival at VIE, which was late, was not helped due to us arriving at a coaching gate and being bussed to the terminal. I then had just under 45 mins until my connection to SOF out of the D-gates. It seemed a long walk and despite a flight attendant telling me I did not need to re-clear security, this was required. This said I did manage to get to my gate before boarding started. Gate D33 was terribly small and over crowded and due to the level of background noise from people passing through security right next to the gate it was impossible to hear what the gate agent was saying over the PA system. Boarding commenced late and was unfortunately another bus to the aircraft. We departed a few minutes late and arrived 10-15 mins late in SOF to yet another bus arrival. So I can only conclude Austrian are trying to save money by turning down jet bridges at SOF when most gates with them were unoccupied at SOF T2. The inflight service was very similar to the flight from LHR, albeit slower to start and slower to get through the cabin. It was a choice of either a sweet pastry or breadstick little snacks. Complimentary beverages were served including alcohol however on this 1h15 flight there was only one drink offered. Overall conclusion on Austrian European short haul economy service is: polite, friendly; appreciate the complimentary beverages albeit the snacks are not a meal, but the amount of bussing to and from aircraft I experienced did not feel full service carrier. I would fly Austrian again at the right price point.",Solo Leisure,4.0,nan
Boeing 777-200,Premium Economy,4.0,March 2018,4.0,1.0,3.0,no,Hong Kong to Zurich via Vienna,4.0," | I felt severely let down by Austrian Airlines. My first set of flights Hong Kong-Vienna-Zurich and return were ok: excellent cabin service but awful boarding procedures. A good initiative is being able to use the business lounge at Vienna for the payment of 30 euros, if one is a premium economy passenger. However, despite the boarding scrum (no area designated area for PE and business class passengers seemed not to fare much better) I still arrived quite happy and enjoyed the actual flight experience (good food, good wine good seats, and excellent service), so much so that I booked Austrian Airlines again out of Hong Kong for a second set of flights a month or so later. Austrian is one of very few airlines offering daylight flights in premium economy into Europe from Hong Kong. However, on the second planned flight disaster struck when I received an SMS in the middle of the night bluntly informing me that my flight from Hong Kong to Vienna was cancelled - that was it. Although I had carefully booked premium economy (partly due to some slight health problems) I found out that I had been shunted onto a midnight flight on Swiss International and downgraded to very basic economy. I was also shoved into a poor seat in the middle down the back on this long overnight flight. I was stunned. Why couldn't Austrian re-book me onto a similar Lufthansa premium economy flight (they are in the same Lufthansa group), albeit also an overnight flight? Why couldn't they otherwise offer a flight next day on Austrian Airlines which I worked out would have been suitable. I could see there were plenty of seats on these other flights in PE. Also beware that as Austrian Airlines is a typical small European airline its call centre and help desk are only open in their local daylight hours, Vienna time - almost useless if one is in Hong Kong or Tokyo trying to make contact. Also Austrian have a fairly small long-haul fleet, making it easily prone to disruption and cancellation for whatever reason. So Austrian (and Star Alliance) have lost a potential lucrative business traveller in me who was in the process of moving over from One World alliance for these flights. I make 15-20 long haul international flights per year, usually in premium economy or business and this experience with Austrian Airlines has sent me rushing back to Cathay Pacific and One World.",Business,2.0,nan
E195/A320,Business Class,5.0,May 2018,4.0,4.0,nan,yes,Vilnius to Copenhagen via Vienna,4.0," |  Vilnius to Copenhagen via Vienna. Efficient boarding in both VNO and VIE. Business Class cabin very comfortable, with very welcoming and jolly flight attendants. Aircraft and cabin well maintained and clean. Food portions were very delicate, well tasting and stylishly served on porcelain. Selection of good quality Austrian wines available. All flights were punctual on landing. Altogether a quality experience, with no flaws. Definitely using Austrian again.",Business,5.0,nan
Boeing 767-300,Premium Economy,2.0,May 2018,2.0,2.0,4.0,yes,Vienna to Beijing,4.0, |  I flew in Premium economy from Vienna to Beijing. The flight was not bad the Premium Cabin was only 3 people from 18 seat so everyone get space enough. The IFE is ok but the service was not good - no welcome drink and after 3hrs they say no more alcohol because they not serve alcohol in the night.,Business,2.0,nan
A320,Business Class,5.0,May 2018,3.0,3.0,nan,yes,Vienna to Paris,1.0," |  Vienna to Paris. Lounge had very few options of food; sad when we know Austrian traditional breakfasts. Boarding was messy in a narrow gate. Business class seats are just Economy seats. Breakfast was a disappointment, compared to previous flight. Usually Star Alliance flight arrive at T1 (CDG). Arrival in CDG was at T2, which is much more user friendly.",Solo Leisure,1.0,nan
nan,Economy Class,1.0,nan,3.0,nan,3.0,no,nan,1.0,Our family flew from Vienna to Bangkok on 21 Sep 2013. The seating we had was appalling the seats did not recline at all and as this is a 9.5 hr flight it was a nightmare. You expect cramped conditions on a long haul economy class flight but this was ridiculous. Staff were rude and unhelpful. I will never fly them again and would not recommend.,nan,1.0,nan
nan,Economy Class,5.0,nan,5.0,nan,3.0,yes,nan,4.0,AMS-VIE. I normally use KLM for this flight but I decided to try Austrian. I have to say I was impressed by the professional staff and the seat comfort on board the Airbus A319. Good food and drinks. Flight left on time and arrived 20 minutes early. I found the experience better than KLM. Would choose Austrian again.,nan,5.0,nan
nan,Business Class,5.0,nan,5.0,nan,4.0,yes,nan,4.0,ZRH-VIE-BKK Business - VIE-BKK on OS25 11/8/2013. New business class excellent service comfortable seat excellent food. Transit in VIE was a little chaotic due to delay.,nan,5.0,nan
nan,Economy Class,5.0,nan,5.0,nan,nan,yes,nan,4.0,VIE-KLX and return charter flight fully booked. Very charming crew on both legs tasty hot meal served with 2 rounds of drinks on this 2 hr flight. Good legroom clean and tidy cabin on A319. Newspapers and magazines were appreciated. Great flight experience by Austrian!,nan,4.0,nan
nan,Economy Class,2.0,nan,2.0,nan,2.0,yes,nan,3.0,We travelled from Athens to Vienna 10/9/2013. While the flight felt safe enough the cabin crew looked tired and disinterested. Packet of dry crackers and drinks (wine or juice and they came around twice which was good). No TV or entertainment of any kind. Perhaps they are better on long haul flights but this short European flight was nothing special. The Lufthansa connecting flight we took two hours later was a huge improvement.,nan,3.0,nan
nan,Economy Class,4.0,nan,3.0,nan,3.0,yes,nan,3.0,Vienna to Stockholm OS317 Saturday August 31 in Economy Class. Flight was fully booked except one seat. I was lucky enough to be placed in this row. I am a SAS Eurobonus Gold member (Star Alliance) but whether my seating had anything to do with this I don't know. The flight was operated by Tyrolean Airways on behalf of Austrian Airlines with an Airbus A319. I was seated on the last row seat 24A. The leg room was decent and the new Recaro seats are ok but not more. The seats has no head-pillow so you must bring your own to sit comfortable and if you would like to take a nap. There was no food served on this 2 hours flight only a chocolate biscuit (the type that you buy on the gas station for 0.85 Euros or so). The variety of drinks was however ok and drinks were served two times during the flight. The cabin was neat and tidy and the cabin crew were observant and friendly. Probably better than the average European full-fare airline but nothing extraordinary.,nan,4.0,nan
nan,Economy Class,5.0,nan,4.0,nan,nan,yes,nan,5.0,IAD-VIE. The flight actually went by very fast with two meal services and comfortable seats enabling me to sleep. I was also surprised by the quality of the food. I will definitely fly with them again.,nan,5.0,nan
nan,Economy Class,1.0,nan,4.0,nan,3.0,no,nan,1.0,"My husband and I flew to Vienna Austria from Dulles International and return. Despite having paid for our tickets and making our seat selections 8 months in advance we discovered upon arriving at the airport that we had been bounced from our seats and put in the worst seats on the plane many rows apart. We had the dreaded middle seat of the middle row of the plane. I have back and neck issues and require wheelchair assistance which was clearly visible to ground staff. They were entirely indifferent and made no effort to assist us. My husband went to the airline office in Vienna prior to our return flight and was told there would be no problem this time. We checked in discovered we had been bounced again to the same miserable seats. After being brushed off yet again we insisted on seeing a supervisor. After 20 minutes she ""suddenly"" came up with seats consistent with what we had reserved. On both flights the sears were horrible: worn out padding and absolutely no leg room in any position. In contrast to the unfailingly polite and helpful Viennese the staff of this airline is the worst we have ever encountered. We are returning to Vienna and will never travel Austrian Airlines again.",nan,2.0,nan
nan,Business Class,5.0,nan,5.0,nan,5.0,yes,nan,5.0,Beijing to Vienna. To summarize the flight I would describe it as First class for the price of business class. There are just 4 seats in a row. The seats are comfortable with a shelf beside for a place to put your bits. When you sit at the window you have no neighbour at all - very nice. The seat can be moved to 180 degree so to a horizontal position. The TV screen is a large TFT screen with a bright picture. Food was good too! Only problem for me is that they fly only 4 times/week. So normally I fly to Vienna on Friday (there is no flight on that day) and return on Tuesday morning (flight is too late for me that day). In all: strongly recommended.,nan,5.0,nan
nan,Economy Class,1.0,nan,3.0,nan,1.0,no,nan,1.0,I was on a return flight from Vienna to Washington DC. On the flight there was a family who were not parenting their two toddlers at all. The 2 year old little girl even wandered into one of the rest rooms and pinched her fingers in the door and the parents had the nerve to yell at passengers nearby. When I had been stepped on enough by the two wandering toddlers I complained to a stewardess and she just shrugged and told me it would be better if I dealt with it myself! I will never fly this airline again!,nan,1.0,nan
nan,Economy Class,2.0,nan,1.0,nan,1.0,no,nan,2.0,Actually the ratio quality/price is very low on Austrian flight you pay big money for nothing for no food (a cold muffin or something like that is no food for me) no service and old aircraft with no entertainment. If you have option to fly with someone other than Austrian take it. Because as I'm flying Geneva-Vienna there is unfortunately no other option if it was the case I wouldn't fly with Austrian.,nan,1.0,nan
nan,Business Class,5.0,nan,5.0,nan,4.0,yes,nan,5.0,NRT to VIE on a very new B777-200ER. Fast and uncomplicated boarding and the flight was totally on time. The food and hospitality was great and also the new cabin impressed me. The IFE offered a lot of different channels. The value for money is perfect.,nan,5.0,nan
nan,Economy Class,3.0,nan,2.0,nan,4.0,no,nan,4.0,Split-Brussels via Vienna. All flights on time or ahead of schedule. Planes were very clean. Cabin crew not all friendly. Web check-in not possible out of Split maybe because the ticket was issued on Lufthansa. Fortunately for us the given seats directly at check-in where ok. Catering with Austrian on European routes has reduced apparently. Only an apple or biscuit available on an evening flight from Vienna to Brussels is a bit poor! They used to serve a decent hot meal some years ago. A sandwich like you have on Swiss would be more appreciated! Austrian also needs to invest in newer planes. Not sure if I am going to fly them again soon.,nan,4.0,nan
nan,Economy Class,1.0,nan,1.0,nan,2.0,no,nan,3.0,Flight OS25. 22nd Sept. Vienna to Bangkok. Flight ran out of food. Was offered the vegetarian option 3 cold potatoes and 3 slices of tomato. Morning meal was a sandwich served still frozen. Staff were less than friendly or helpful. Monitor in back of seat wasn't working. So no entertainment until they exchanged a monitor from a spare seat after 3 hours. My worst flight.,nan,2.0,nan
nan,Business Class,3.0,nan,3.0,nan,4.0,no,nan,4.0,Dubai to Vienna / Boeing 767 in new business class. Seats are comfortable with enough privacy. Maybe for some travellers a bit narrow as the armrests and consoles are quite high. Cabin staff was ok - could have been friendlier. Food was a midnight snack (had chicken tikka) which was ok. Breakfast was eggs with toast yoghurt and fruit. Was very good and freshly cooked by the chef on board. Cabin was clean. Toilets without amenities (no hand lotion or eau de toilette). Lounge service in Dubai ok with good choice of food (hot and cold). Overall good experience but crew could have done more to make it memorable.,nan,3.0,nan
nan,Economy Class,4.0,nan,nan,nan,3.0,no,nan,3.0,Extremely disappointing. Houston to Dubrovnik Croatia. What appeared to be a 3 stop return all on Austrian Airlines was actually across 3 airlines (Croatian Tyrolean and United) so when we tried to check in we were unable to do so online. We had a 1 hour layover in Vienna and the only reason we made our flight is because Austrian was so disorganized they were delayed in boarding the flight from Vienna to Chicago. Our boarding passes we received in Croatia didn't work in Vienna. When I tried to board the attendant dismissed the boarding pass and said it was no good. I had to check in again. My friend had the same issue so we went to the gate and they reprinted the exact same pass. In addition it is very irresponsible for the airline to book a one hour layover when it would easily take 2 hours at least to get from one gate to the other especially with Vienna requiring customs to get in and out of the airport and you have to go through security again. I give credit to the personnel who kept reprinting our tickets at each stop. But we will definitely avoid booking with Austrian again until they get a little more organized for scheduling flights and online check-in.,nan,2.0,nan
nan,Economy Class,5.0,nan,5.0,nan,5.0,yes,nan,4.0,"I have actually been on many flights with ""Austrian"" all over the world: VIE-JFK VIE-PEK VIE-BKK and have never really experienced anything bad. Good onboard programme and food on long range flights. Seats are comfortable (even to sleep). The crew are always nice and friendly and try to help.",nan,5.0,nan
nan,Business Class,5.0,nan,5.0,nan,nan,yes,nan,4.0,OS332/OS6 23-24 Sep OSL-VIE-WAW. Inflight service was impeccable. Food/drink very nicely presented and prepared. I was surprised by the seat comfort and overhead bin capacity on the Fokker 100 and Fokker 70 aircraft. Flights operated on time. Very satisfying experience.,nan,5.0,nan
nan,Business Class,4.0,nan,5.0,nan,nan,yes,nan,4.0,SKG-VIE and VIE-MUC 2 different flights and stories on Miles and More Award. SKG-VIE check in a little bit chaotic and check in staff (not from Austrian) quite rude. Could use the Aegean Lounge which is nice and food/drink choice is ok. However Priority Boarding only for Aegean Passenger direct from the Lounge is possible therefore chaotic boarding procedure (with buses) at the gate and no priority boarding. Flight itself was ok however Service in C-Cl (completely full) rushed. Seating in A320 (new seats according LH-Standard) not so comfortable. Meals on both flights very tasty and still the best in Europe! VIE-MUC: priority boarding and pre- drinks served by the friendly Purser C-Cl was quite empty therefore good service despite the short flight time (35 min). Seating in Fokker 100 much better than in A320! Priority bags arrived in Munich among the last bags although we could see that our bags were loaded in Vienna directly at the door.,nan,4.0,nan
nan,Economy Class,1.0,nan,3.0,nan,3.0,no,nan,1.0,Our family flew from Vienna to Bangkok on 21 Sep 2013. The seating we had was appalling the seats did not recline at all and as this is a 9.5 hr flight it was a nightmare. You expect cramped conditions on a long haul economy class flight but this was ridiculous. Staff were rude and unhelpful. I will never fly them again and would not recommend.,nan,1.0,nan
nan,Business Class,nan,nan,nan,nan,nan,no,nan,nan,Rating : 0/10 Cabin Flown Business Value for Money Seat Comfort Staff Service Catering Entertainment Recommended,nan,nan,nan
nan,Premium Economy,3.0,nan,3.0,nan,2.0,no,nan,1.0,Our experience has been a nightmare with this airline today. After flying from Vienna to Chicago we were re- routed to Detroit due to bad weather. Waited on plane additional 2 hrs finally told flight cancelled and we would be disembarking and new flight arrangements would be made after checking in at Austrian Airlines. Instead no Austrian Airlines personnel could 'ticket' us no option to assist in flights home from Detroit no assistance at all. We were dumped in Detroit and loaded on to buses driving 6 hrs back to Chicago airport. When we arrived there was no Austrian Airlines personnel to assist us. Fortunately the wonderful accommodating United Airlines staff were helpful in obtaining flights home. Their employees stayed into the early morning hrs to help us. We will never recommend this airline.,nan,1.0,nan
nan,Business Class,5.0,nan,5.0,nan,nan,yes,nan,5.0,IST-VIE-MUC 14/11/2013 C-Class IST-VIE on A319: comfortable seat extremely attentive and friendly crew nice and decent catering as usually on OS VIE-MUC on F100 with new leather seats which are among the most comfortable of any airlines in Europe lot of space again decent catering with a hot meal on a 35 min. flight and a very courteous and attentive crew they really work hard to provide a very high level of service. Very much recommended and for sure OS is setting service benchmarks together with LX within the LH-group.,nan,4.0,nan
nan,Economy Class,3.0,nan,2.0,nan,nan,no,nan,2.0,AMS-VIE-AMS. Inbound flight on an A319 was OK mostly due to only being filled 50%. Thin seats provided some space and comfort. Outbound on F100 was terrible. Old seats (new Leather covers do not make seats new) FA's were grumpy and with a full plane the seats were very tight even on the emergency exit. Hardly any information on gate so it was surprise to find that we had to board a bus that brought us to the plane. Drinks were ok snack was small.,nan,2.0,nan
nan,Economy Class,2.0,nan,1.0,nan,5.0,no,nan,1.0,Bangkok to Vienna on Boeing 777-200. The new economy layout is horrible. The seating is 3-4-3 makes the seat very narrow and gives a cramped feeling. Also on a window seat there is no additional space between seat and fuselage. The food was very salty and very spicy. Cutlery was made out of plastic. Drinks are offered twice at lunch and breakfast time. At night time there was only one personal coming through the cabin offering water or orange juice. All at all I had a feeling that a cheap carrier is doing better than Austrian. Next time no Austrian for me anymore.,nan,2.0,nan
nan,Economy Class,4.0,nan,1.0,nan,nan,no,nan,3.0,Sofia to Vienna on an old Fokker 100. The plane itself looks pretty outworn (paint is missing in some areas landing gear was oily). Inside the old seats in new leather design - looks okay. It seems that Austrian is one of the few airlines which is using the airfield for boarding (even Air Berlin uses the fingers). During flight an apple was offered followed by a glass of mineral water. Attendants were friendly. You easily can see that Austrian is saving money where possible. An unpleasant experience.,nan,2.0,nan
