Aircraft,CabinFlown,CabinStaffService,DateFlown,FoodAndBeverages,GroundService,InflightEntertainment,Recommended,Route,SeatComfort,Textchunk,TypeOfTraveller,ValueForMoney,WifiAndConnectivitynan,Economy Class,2.0,October 2015,1.0,1.0,1.0,no,Mauritius to London,1.0,"Totally disappointed with the flight outbound, dated aircraft, in light entertainment was ridiculous all the films started at the same time with no option to rewind or pause. The meals were bland, you'll not starve but that's about it. we couldn't book our return seats online, we tried several times but no results, but thought nothing of it, but this morning once the 24hrs online check in opened we logged in 3 mins after it opened and all the seats were booked. So me and my partner couldn't even be seated together. I'd never fly with Air Mauritius again, I'd rather pay a few pounds more and have a happy 12hrs in the air.",Couple Leisure,1.0,1.0
A340,Business Class,3.0,October 2015,4.0,4.0,3.0,yes,Heathrow to Mauritius,2.0,"Return flight from London to Mauritius in business class. Friendly, welcoming staff on the whole, and good service. Good food and excellent champagne and wine offerings. The main issue is the business class seat, which does not lie flat, and leads to interrupted sleep. Business customers have access to the Skyteam lounge at Heathrow which is excellent. The lounge at Mauritius is reasonable, but the food offerings there are poor.",Couple Leisure,3.0,nan
nan,Economy Class,3.0,August 2015,2.0,2.0,nan,no,London to Mauritius,1.0,"London Heathrow to Mauritius with Air Mauritius. This was the most uncomfortable journey I have ever taken. There was no leg room and the seats were unforgiving. Good value for money, but so are buses.",Couple Leisure,4.0,nan
nan,Economy Class,4.0,September 2015,4.0,4.0,4.0,yes,LHR to MRU,4.0,"London Heathrow to Mauritius return, and we had no problems both ways. Cabin crew helpful and smiling. Food wasn't. We did check in online both ways and this so efficient going through bag drop. We felt the Airport in Mauritius was amazing, the downside to our outward journey was that another passenger became ill 2 hours before we landed. The captain called for medical staff to assist which as both my husband and I are nurses we assisted, but luckily there was a trauma consultant on board. Unfortunately the poor man died despite efforts to resuscitate him. It appears that the Air Mauritius aircraft only had a facemask but no ambu bag and no defibrilator. The cabin crew appeared calm and reassuring to other passengers and treated the deceased man with the utmost dignity when they took him to the back of the aircraft.",Couple Leisure,4.0,nan
nan,Economy Class,2.0,October 2015,2.0,3.0,1.0,no,Perth to Mauritius,1.0,"This Air Mauritius flight was awful. There is very limited leg room due to a metal box taking up most of the available leg room beneath the seat in front.  Impossible to get remotely comfortable on the flight. No sleep was had due to very uncomfortable seats and constant cabin announcements. Badly designed and old plane. Inflight entertainment system poor. Service poor. Food awful. What a shame as we love Mauritius but with no option but to fly from Perth via Air Mauritius, we will not be returning until they have upgraded aircraft. Or perhaps there is another direct carrier.",Family Leisure,2.0,nan
A330,Business Class,1.0,September 2015,2.0,1.0,2.0,no,Mauritius to Perth,1.0,"Air Mauritius is appaling, whilst on holidays (I am Mauritian born) the airline and its associated problems were in the papers on a daily basis. I got home with marks on my knees (even though I have a baby which kept me in and out of my seat - entertainment system did not work on 2 of our 4 seats - delayed for 3hrs in terminal due to technical difficulty. Ground and inflight staff were extremely unhelpful, trying to carry sleeping baby and two toddlers no one offered help - passengers were offering help.  Aircraft is cold, with atrocious service , we had food on the trays for ages whilst trying to move around in a limited legroom. Flight staff barely cared and when asked to assist appeared to be indignant.  I am extremely disappointed of with Air Mauritius , it does leave a good taste for tourists.",Family Leisure,1.0,nan
nan,Economy Class,4.0,July 2015,1.0,4.0,1.0,no,London to Mauritius,3.0,"The seats on this Air Mauritius flight were old and grubby, and the leg room poor. A good point was the seating layout of 2x4x2. The staff were polite and reasonably helpful. The inflight entertainment was poor and the screen was so small I had to wear reading glasses to watch it. The worst thing was the food - on the flight from Heathrow to Mauritius the food was just about acceptable, but coming back was dreadful. The dinner we left most of it and the breakfast was so dreadful that neither of us ate it. We have flown with many different airlines, but none have been as bad as that. On the flight home we were delayed 29hrs and were not informed until we arrived at the airport, then we were taken to the Holiday Inn by the airport. There was no apology or compensation for this inconvenience",Couple Leisure,2.0,1.0
nan,Economy Class,1.0,August 2015,1.0,2.0,2.0,no,Mauritius to London,2.0,A truly awful experience and one as a family we have no wish to repeat by flying again. It was a daytime flight and all the cabin window shutters were kept down and the lights kept down so we flew in darkness - we asked the purser to put up the lights and blinds and we were told he could not do this. There was obviously bright sunshine outside but we were subjected to flying in darkness. The food was truly awful - I am not expecting haute cuisine on an economy flight but we were served pap. We have eaten good food in Mauritius but no attempt was made to serve reasonable food - no fresh fruit - it is a tropical island and I believe an attempt to serve a slice of pineapple is possible even on a tight budget but the salad that was presented was ghastly. The bread rolls were as stale as bricks on all three meals presented - watch your costs but don't bother presenting it to customers as a meal. Just because they have a tray to fill with their little boxes for a 3 course meal doesn't mean the customer should be treated as a fool! The whole experience was a shambles and can reflect on the island of Mauritius as a destination. The airline is getting it wrong by subjecting customers to this kind of service/experience in this day and age.,Family Leisure,1.0,1.0
A340,Economy Class,5.0,July 2016,3.0,4.0,2.0,yes,MRU to LHR,3.0," |  Flew London Heathrow to Mauritius. Great service from Air Mauritius, seats ok, inflight entertainment not so good, food ok at best. Travelled from London Heathrow a week before on a 747 when service was again excellent, food really good, inflight entertainment ok but big downside were seats where legroom was poor. I believe 747s are being replaced in next year or so. Service at airport check-in at both airports was very friendly, helpful and efficient. Luggage all arrived. Pricing was competitive. I would use again.

",Couple Leisure,3.0,nan
A340,Economy Class,4.0,May 2016,3.0,4.0,2.0,yes,SIN to MRU,2.0," |  Singapore to Mauritius. Air Mauritius is frightfully expensive.  I paid twice as much for this 7 hour flight as I paid for a 22 hour flight trans-pacific on another carrier.  I take my hat off to the cabin and ground crew,  they are well trained and in most cases love their jobs. Their smiles are genuine and are attentive to passengers (or to me at least!). The aircraft has seen better days. Entertainment system was old and screen was small. I don't even watch TV. No wi-fi. Seat Livery could do with a makeover - looks a little chintzy, though you can tell it was inspired by the colors of Mauritius, the seats being turquoise to match the natural lagoon. Staff were well-dressed in navy jackets, white shirts and really awesome rainbow scarves.  Food wasn't bad. I think I had some stir fried veggies and rice (Oriental Vegetarian meal). Was hoping they'd surprise us with Haagen Dazs ice-cream but they didn't. Do you want to go to Mauritius? If you do, I recommend Air Mauritius, as it's the only way you can get there.",Family Leisure,2.0,nan
nan,Business Class,3.0,June 2016,1.0,3.0,1.0,no,MRU to LHR,2.0, | Mauritius to London Heathrow with Air Mauritius. Staff are perfectly friendly. Food is poor with the business class meal very average. No snacks available during the flight except the packets of pretzels which the staff went to get me from economy class. Entertainment is poor. This route uses the old style entertainment system which plays a set number of films (about 4 English language options) on loop. The seat is average - old style business class angled flat but with nice cushions. Route and timing is good - on time and direct to London is great.,Business,4.0,nan
A340,Economy Class,4.0,February 2016,2.0,4.0,1.0,yes,MRU to CDG,3.0,Flew Air Mauritius from Mauritius to Paris. Old plane but it was clean. Crew friendly and helpful and service was good. The food could be better. Space was acceptable. Inflight entertainment system was old and not flexible and the screens were unclear. For us not so important due to the fact that it was a night flight.,Couple Leisure,3.0,nan
A330-200,Economy Class,4.0,February 2016,4.0,4.0,4.0,yes,MRU to KUL,4.0,"Mauritius to Kuala Lumpur and return with Air Mauritius. Check in was smooth and efficient.  Flight was half full. Flight attendants pleasant and helpful. Food was ok, but was better on inbound flight. Entertainment was adequate for the flight with AVOD. Seat comfortable for 7 hour flight, regular drinks service by crew. a small snack was served before landing, which could be improved. Overall, it was a good flight.",Solo Leisure,4.0,nan
nan,Business Class,4.0,December 2015,2.0,5.0,1.0,no,MRU to PER,3.0,"Perth to Mauritius was excellent. Day flight, very pleasant FA on my side, (the one on the other side clearly was not happy to there) great food. The trip back was a little disappointing. They ran out of my choice of food (fish) and instead of informing me and suggesting something else on the menu, they decided of give a disgusting, tasteless staff meal! I didn't know that and they only told me about it when I returned it untouched. In fairness, they then asked if I wanted something else. Way too late guys! Of course, by then I was put off by the whole thing and decided to sleep instead. No flat bed is provided and for the price you charge is just not on Air Mauritius. Shame on you! Flight Manager was a welcoming and very pleasant. Honesty and transparency is the best policy. Always inform the passenger first. ",Solo Leisure,3.0,1.0
A340,Economy Class,4.0,January 2016,3.0,4.0,2.0,yes,MRU to PEK,3.0,"Mauritius to Beijing with Air Mauritius. Very smooth check-in, immigration and security procedures at MRU airport. The A340 aircraft was a bit old but comfortable enough. Extremely good service by staff onboard and discrete meals. On-flight entertainment system could be improved but overall a very good experience.",Family Leisure,3.0,nan
A340,Business Class,5.0,January 2016,5.0,5.0,4.0,yes,PER to JNB via MRU,4.0,"Perth to Johannesburg via Mauritius, and on the 4 flights I took in the last month I am most impressed. I flew with a 3 and 4 year old which I thought would be challenging but it wasn't. The crew were attentive and thoughtful, food delicious, drinks never ending, and the amenity kit great. The kids got packs (different) on all 4 flights. Kids meals were age appropriate and delicious. IFE a bit dated but enjoyable nonetheless. The only reason I don't score full marks is because of the seats - what is up with that crazy weird seat?",Family Leisure,5.0,nan
A330,Economy Class,4.0,May 2015,4.0,4.0,2.0,yes,BOM to MRU,4.0,"Mumbai to Mauritius return with Air Mauritius. Somewhat dated aircraft with very sad IFE. The flights were on time, seats were comfortable, food was decent, and they still hand out amenity kits. Not exactly fabulous, but it's fairly comfortable. Wouldn't mind flying with them again if they ramp up their frequencies up a bit.",Solo Leisure,4.0,nan
A340,Business Class,5.0,December 2015,4.0,4.0,3.0,yes,CDG to MRU,3.0,"Paris to Mauritius and return in Business class with the family. A good experience even if a somewhat dated plane with angled seats and a dated entertainment system (although with well curated but limited selection of films). Charming and attentive cabin crew and very kind to our children without any exceptions on both legs. Okay food and drinks selection at an average business class level. AF lounge in Paris in okay. All in all, a good value for money option to Mauritius.",Family Leisure,5.0,nan
A340,Economy Class,5.0,May 2017,5.0,5.0,3.0,yes,Paris to Mauritius,3.0," |  Paris to Mauritius on May 1st. Had a great experience, flight boarded and left on time. The staff were very pleasant, friendly and extremely helpful. The food on board was good and the flight attendant came around several time for beverage. The one negative comment I would have to say is the individual screen have seen better days. I understand it's an older aircraft, but something has to be done about those screen. overall Air Mauritius provided an excellent service and have impressed us. Good job",Family Leisure,5.0,nan
A340,Economy Class,1.0,April 2017,1.0,4.0,1.0,no,Cape Town to Mauritius,3.0," |  We travelled with Air Mauritius two days ago for our honeymoon from Cape Town. We were bitterly disappointed in the lack of service and unfriendly staff. We waited 2 hours before being served a drink and ended up getting our meal at the same time. The entertainment system did not work for half the flight. When we asked for some water, we were forgotten and we had to get up and ask again, even after ringing the bell to alert them. To top it off one of the air hostesses rolled her eyes at us on three separate occasions: when she had to give way to us in the passage, when we asked her to remove the empty cups and when my husband needed the bathroom before landing. Not a great start to our honeymoon! Very disappointing! We are due to fly back on the 20th April, let's hope we are better received this time.",Couple Leisure,2.0,1.0
A319,Economy Class,2.0,February 2017,2.0,2.0,1.0,no,Cape Town to Mauritius,1.0," |  A319 from Cape Town to Mauritius and ATR72 between Mauritius and Réunion. The staff was not friendly. They serve the meal without watching you, don't expect any smile.  The food was poor. The A319 looks old inside, no modern entertainment like personal screen. On the ATR its the same, but flights are short so it's not a problem. The real good thing with Air Mauritius, is the number of lines from Mauritius. And prices are correct. I know the company is going to change some aircraft soon. A good thing for sure. Let's hope that will bring back smile on crew's faces too.",Couple Leisure,3.0,nan
nan,Business Class,5.0,January 2017,5.0,5.0,nan,yes,Perth to Mauritius,5.0," |  We were traveling to Mauritius for my sons wedding. It started off a nightmare leaving Melbourne on a Qantas flight - we had so much terrible boarding the plane, as there was a mistake made with my name on my tickets (different from my passport). After a few hours of stress trying to resolve the situation, and the stress of not knowing whether I could board the plane, it was resolved.. In Melbourne they said I would have problems in Perth when I board Air Mauritius. At Perth we went to the Air Mauritius counter fearing the worst. It was not the case. A beautiful lady there helped us. She made us feel at ease right from the start, even had a little joke with us, and she fixed the problem straight away with no drama. She also gave us an upgrade - we were blown away! Thank you Air Mauritius.",Couple Leisure,5.0,nan
nan,Economy Class,1.0,January 2017,1.0,1.0,1.0,no,MRU to LHR,3.0," |  Mauritius to London. Checkin was chaotic leading to long queues with not enough staff to deal with it and looking visibly unhappy too. It took about 1.5 hours to get to front of queue for checkin. We boarded late only then to sit for about an hour in swelteringly hot and airless cabin before takeoff as the auxiliary power unit was not on, probably to save the airline money as the crew were unwilling to say more than they were suffering too and encouraged me to complain to the airline. Once again, staff unhappy and unmotivated. Requests to talk to senior crew member were ignored and they only came to answer my call button to switch it off, muttering 'later' or words to that effect. No choice of breakfast offered but what came was the most unappetising on any flight I have ever had. The entertainment was very outdated - tiny screen with picture shaking so much that it was unwatchable. And also poor choice of films. On the plus side, the seats were relatively comfortable but only for normal-size passengers. On our outbound flight, the rather large gentleman behind me was in visible pain due to lack of room for his girth/legs. Not that the stewardesses offered any solutions. Luckily, I found another seat so I moved instead to give him more room. As our chosen seats when booking had been unceremoniously reallocated to others by the time we checked in (another first experience for me) this wasn't too much of a hardship.",Family Leisure,1.0,nan
nan,Economy Class,2.0,November 2016,2.0,1.0,2.0,no,MRU to PER,2.0," |  Mauritius to Perth. Flight to Mauritius was delayed for 2 hours. No explanation, then was cancelled with no warning. A guy from Air Mauritius came out and yelled over the top of everyone saying flight has been cancelled come back tomorrow at the same time, then just walked off like that. No one knew what was going on or what to do. Then when we returned the next day the flight was delayed a further 4 hours with the same poor service. Now on my way home flight is delayed a further 2 hours with the same appalling service. What a joke of an airline and the staff need to work on their customer service too!",Couple Leisure,2.0,nan
A319,Economy Class,5.0,November 2016,5.0,5.0,nan,yes,MRU to DUR,4.0,"Mauritius to Durban. Luckily we sat in the front row with the babies and kids. The legroom was excellent. However the legroom for the other seats I noticed was miserable. Tall passengers with their legs in the aisle. Aircraft was clean, crew very friendly and breakfast excellent on this 4 hour flight. However after 1 month I still have not been credited with my miles in my Air France account. Pretty annoying.",Couple Leisure,4.0,nan
A340,Economy Class,5.0,November 2016,4.0,4.0,4.0,yes,JNB to MRU,5.0,"Johannesburg to Mauritius with Air Mauritius. The nicest cabin interiors which make you feel that you are already at the beach. Very friendly staff; excellent legroom. Quite a decent meal for a 4 hour flight. Audio and entertainment worked and cabin was clean. The flight left and arrived on time. However South African Airways staff who weigh the bags for Air Mauritius were a pain, though we were only 2 kilos overweight on one bag. They blamed it on Air Mauritius though SAA flights also watch the exact weight.",Couple Leisure,4.0,nan
A340,Economy Class,3.0,August 2016,4.0,3.0,1.0,yes,MRU to DEL,1.0,"Mauritius to Delhi with Air Mauritius. I booked emergency seat, 27H, but the legroom was not great. I had the emergency slide on front of my legs. Seats are very uncomfortable. Good thing about this airline is that you get free spirits (when you ask). The main reason I have chose this flight was because it was direct.",Couple Leisure,4.0,nan
nan,Economy Class,5.0,July 2016,2.0,2.0,nan,no,LHR to MRU,1.0," |  London Heathrow to Mauritius with Air Mauritius. Staff was helpful and friendly. Food was very average. Entertainment was very tragic. This route uses the old style entertainment system Which plays a set number of films on loop. Inflight entertainment system was old and not flexible and the screens were unclear. Bad quality monitors and headphones, nothing was to actually see and hear. The seat were uncomfortable, very little legroom. They lost my luggage, no one knew why or where it was, we waited 5 days for luggege without any information from the Air Mauritius what happened, when we could expect it . We got 2000MUR (ca. 40 GBP) as atonement, but it was enough only for a swimsuit and shampoo. We do not recommend this airline at all.",Couple Leisure,1.0,nan
