Aircraft,CabinFlown,CabinStaffService,DateFlown,FoodAndBeverages,GroundService,InflightEntertainment,Recommended,Route,SeatComfort,Textchunk,TypeOfTraveller,ValueForMoney,WifiAndConnectivityBoeing 787,Economy Class,3.0,January 2017,3.0,1.0,2.0,no,JNB to BKK via NBO,3.0," |  Johannesburg to Bangkok via Nairobi. Terrible airline - do not book Kenya Airways! We originally booked our Johannesburg to Bangkok tickets via Nairobi because of the short travelling time - there was only a 1-1.5 hour layover in Nairobi each way. Months after booking the ticket, Kenya Airways rescheduled our flights so that there was a 7 hour layover in Nairobi. The 7 hour layover ended up 5 hours longer than expected because the flight to Bangkok was severely delayed (this after our flight to Nairobi had been delayed by 2 hours and used a different aircraft that did not have in flight entertainment). The 5 hour delay severely impacted our plans in Thailand, creating great inconvenience and forcing us to make additional travel arrangement to the island we were staying on, at our own expense. When we raised these concerns with the Kenya Airways service desk at Nairobi airport, we were told that they could not assist us and we had to log a complaint with Kenya Airways customer service. My partner logged a complaint - we have still had no reply to this. We faced the same experience on our return flights - the flight from Bangkok to Nairobi was delayed by 3 hours which meant we missed our connecting flight to Johannesburg and were put on the next flight out - another 7 hour wait at Nairobi airport. Then we were notified that we had been moved to a later flight that evening because a smaller aircraft had to be used. When we eventually arrived back in Johannesburg, my partner's bag had been left in Nairobi. The agent at the Kenya Airways luggage desk told us it would be couriered to us the next morning - it was only delivered at 10pm the next night. Our flights with Kenya Airways ended up being the worst travel experience of any airline - we ended up spending over 20 hours extra at Nairobi airport as well as 5 hours extra at Johannesburg and Bangkok airports due to KQ delays - an entire day of our holiday lost due to their inefficiencies. None of the customer service complaints we have logged have been replied to. We will never fly Kenya Airways again.",Couple Leisure,3.0,nan
Boeing 787,Economy Class,4.0,January 2017,2.0,1.0,3.0,no,JNB to BJM via NBO,3.0," |  A few hours before departing from Johannesburg to Bujumbura via Nairobi, we have been informed that our flight was delayed for 8 hours which caused us to extend our hotel stay and delay our car rental. At airport we are issued with 2 boarding pass (JNB-NBO and NBO-BJM). In Nairobi, we are waiting at our gat to board (flight also delayed for 4 hours). When finally boarding the attendant informed us that this flight doesn't go to Bujumbura anymore but to Kigali. Nobody informed us of the change (despite our visit to the helpdesk to ask information about food and drink voucher which was not given). Calling the operation manager, we have been told that the decision has been made a few hours before our boarding time.  Needless to say, we were not given any compensation whatsoever.  The flight crew were very nice and aircraft and seats comfortable and that is the reason I give it 3 points in my rating. Kenya Airways won't see me again.",Family Leisure,1.0,nan
nan,Economy Class,2.0,December 2016,2.0,1.0,2.0,no,LHR to CPT via NBO,3.0," |  London Heathrow to Cape Town via Nairobi. Flights were as expected (pretty basic economy class) with a 12 hour overnight wait for connection in Nairobi on the return leg which was awful. It was cheap but I would never fly with Kenya Airways again due to their terrible customer service. My fiance left an item (not on display) in the seat pocket in front of her. She realised as soon as she left the plane and staff on board were contacted within 30 minutes of us getting into the terminal. The item had mysteriously disappeared during cleaning. I followed up with their customer service by phone (said they would investigate but never called me back) and then by email. I know it was our fault for leaving the item but I would have expected them to at least be helpful in dealing with our enquiry or show some sympathy or some kind of apology. Instead they said that there was no evidence that I brought the item onboard therefore they could not do anything to help, no form that I could fill in for lost items, no documentation for an insurance claim, just a short, rude reply from their customer services which made me think that this was not the first time that this had happened and that I should make other potential Kenya Airways customers aware of this - if you leave something of value on the plane in Nairobi, don't expect to get it back.",Couple Leisure,4.0,nan
Embraer 190 / Boeing 787,Economy Class,2.0,December 2016,2.0,3.0,2.0,no,LUN to BKK via NBO,3.0," |  Lusaka to Bangkok via Nairobi. The initial Kenya Airways flight from Lusaka to Nairobi was delayed, and I was told that the connecting flight would be delayed by 2 hours which ensured connection time for the connecting flight. Upon arriving in Nairobi I was informed that the connecting flight KQ886 would not depart Nairobi at 02:00am, but  it would depart at 09:00am. Again this KQ886 flight has been delayed, I am now told that this flight will not be available for 4 days and I will have to wait in Nairobi. I am now informed by the airline customer service personnel that the flight will depart on December 30th at 11:59pm. At this point I have no idea if I will be on this flight, if this flight even exists. I am so upset by the poor service and rude customer service personnel. To make matters worse I have other travel arrangements and bookings that have to be rescheduled, some of which are non-refundable, ground transportation changes to be made and no idea at all from Kenya Airways management and customer service personnel when I will arrive at my destination. I have spoked to several customer service personnel and airline supervisors and managers, all of which provide different excuses for the airlines disfunctionality and various excuses as to why the flight is delayed and when it will be rescheduled. What a terrible, terrible experience. I cannot believe that there is such disfunctionality with in this international airline, the lack of customer support and the over all disrespect for its customers.",Solo Leisure,1.0,nan
nan,Economy Class,1.0,December 2016,3.0,1.0,4.0,no,JNB to ZNZ via NBO,3.0," |  Johannesburg to Zanzibar via Nairobi. Worst airline that I have encountered. Flight from Johannesburg to Nairobi delayed by 1.5 hours. We ended up flying at 3am. No drinks were offered prior to the descent which was at about 8 am. About 20 of us missed our connecting flight to Zanzibar, because only 1 hour had been allowed between flights. Others missed flights to Kilimanjaro. Kenya Airways provided a hotel in a terrible area for our 10 hour layover. There was nothing to do near the hotel and most of us missed a full day at expensive resort accommodation in Zanzibar. We would only reach our hotels at around 10 pm.",Solo Leisure,2.0,nan
nan,Economy Class,3.0,December 2016,2.0,1.0,2.0,no,JNB to BKK via NBO,2.0," |  Johannesburg to Bangkok via Nairobi. Terrible Experience with Kenya Airways losing my baggage and not being able to assist in any way to track the baggage. Very poor assistance when calling the helpdesk in Kenya, and staff kept putting me hold with no answers. I would not recommend flying Kenya Airways if you are having to relocate and need your check in luggage urgently.",Solo Leisure,2.0,nan
nan,Economy Class,1.0,April 2017,1.0,1.0,2.0,no,Hanoi to Johannesburg via Nairobi,3.0," |  Hanoi to Johannesburg via Nairobi. We had the misfortune of experiencing 'the pride of Africa' on our honeymoon to Vietnam in April 2017. Our negative and unpleasant experience with Kenya Airways culminated in the loss of my wife's luggage upon arrival in Johannesburg. After numerous phone calls and emails, absolutely nothing was done to locate this luggage and eventually the airline merely admitted that it was untraceable. None of our calls were ever returned, we received differing stories of the bag not being loaded first in Hanoi and then in Nairobi. It became quite obvious from the outset that the airline did not care about this problem and could not be bothered to help us. The flight experience was unprofessional, tardy, and disrespectful towards the passengers. Traveling between Hanoi and Nairobi felt like the passengers were alone on the flight and when the air hostess staff were visible, they were sullen, impatient and obviously cared very little for the wellbeing and comfort of the passengers on board. Upon boarding the flight in Hanoi, we were not greeted by a single staff member. Passengers were sleeping in incorrect seats and no air hostess could be found to assist us. Food was served with an air of contempt and annoyance. The hot breakfast consisted of a stale croissant and fruit. Drinks were served once on the flight. Trays took more than an hour to be cleared. An all round ghastly experience hopefully not to ever be repeated. We arrived home from an amazing honeymoon with a bitter taste in our mouths and one less bag. Stay away - not worth the lower cost at all.",Couple Leisure,3.0,1.0
Embraer 190,Business Class,5.0,April 2017,4.0,5.0,nan,yes,Lubumbashi to Nairobi,4.0," |  Lubumbashi to Nairobi. As bad as Lubumbashi is as Airport, as great was the service by the Kenya Airways ground crew. I could check my baggage all the way through to Zurich and received all boarding Passes even as I switched from Skyteam to Star Alliance. The whole check in procedure took only 5 minutes. The flight was very good, with comfortable seats, good food and great red wine. Staff was super friendly",Business,4.0,nan
Boeing 787,Economy Class,4.0,April 2017,3.0,3.0,2.0,yes,Amsterdam to Johannesburg via Nairobi,4.0," |  Amsterdam to Johannesburg via Nairobi. Clean airplanes, welcoming crew. Departures on time. Service onboard was efficient and friendly. Catering just enough, portions rather small but tasteful. In-flight entertainment poor as well as the quality and availability of working head-sets. Good first experience, though still not to compare with the Middle East carriers.",Solo Leisure,4.0,nan
Boeing 787,Business Class,5.0,April 2017,4.0,4.0,3.0,yes,Johannesburg to Mombasa via Nairobi,4.0," |  Johannesburg to Mombasa via Nairobi. Due to technical issues with the original airline, we were rebooked on Kenya Airways. Boeing 787 was in in mint condition. Warmly welcomed by the purser and shown to our seats. The business class is called Premium World and seats in a 2-2-2 configuration with fully reclining seats. Offered a welcome drink and introduced to staff who would look after us personally. Warm towels followed by a review of the menu and wine list by the stewardess. Flight left on time and was smooth. Seat was comfortable and I managed a good hour nap laying flat. Luncheon included an amuse bouche, followed by a salad and two options for main. I opted for the steak which was slightly over done but still yummy. My fellow traveller tasted the wines and he loved the selection of South African wines. The service was personal, friendly and warm. Not too much or too fawning. The Kenyan coffee was a lovely surprise! My one complaint is that the in flight entertainment isn't up to the level of Emirates but I have encountered few airlines that have matched that. Landing on time and we had priority lane through immigration. Shorter flight was on an Embraer E190. First time flying this aircraft and what a little delight! Similar warm service with good humour. Definitely recommend.",Couple Leisure,4.0,nan
nan,Business Class,5.0,April 2017,4.0,5.0,4.0,yes,Nairobi to Dubai,5.0," |  Despite a 2.5hour delay due to technical issues, the flight went on fine. A wide variety of food options were available, and the food was average. Seats were comfortable with excellent recline, and large (comfy) blankets are provided for sleeping. The bathroom at the front of the aircraft is quite small and cramped, offering no additional features compared to the bathrooms in Economy; in fact, the bathrooms in Economy are more spacious. Cabin lights are practically turned off overnight, allowing for a good night's sleep. There is a TV screen, tray table and power socket in the armrest. TV screen is nice and large. Noise cancelling headphones are provided, I found them rather comfortable and I have a fairly large head and wear glasses. The selection of inflight TV programs is average. Passengers in Business class are treated fairly well. An amenity kit is given (which contains a toothbrush, socks, a pen, a comb, and an eye mask) which is nice. Hot towels are provided at certain points during the flight including upon boarding. The lounge at Nairobi is also quite good. Kenya Airways has a very nice layout of the Airport for Business Class passengers, I had no queues, a very smooth process. Overall, a nice experience. Would've been excellent if technical issues were diagnosed before the flight to avoid delays; and I do hope KQ improves its on-time performance.",Family Leisure,5.0,nan
nan,Economy Class,3.0,April 2017,2.0,1.0,1.0,no,Lusaka to Paris via Nairobi,3.0," |  My Kenya Airways flight from Nairobi to Paris (a codeshare with Air France) was delayed and eventually left 14 h after the scheduled time. We had to queue for almost an hour at 1.30 am to get a voucher for a taxi as they were all written by hand and we were not given a hotel voucher, just told to go to a hotel (which very kindly took us in based on our word that our flight was delayed). We did not collect our luggage. We were told by KQ staff at the airport that we would be collected at 11 am the following day. The next morning I looked at my booking on the internet to see that the plane was scheduled to leave at 11 am. I took a taxi to the airport from the city and when I checked in I was told that the plane was leaving at 11 am. I got the same message at the boarding gate where they were getting ready to accept passengers. The airport staff seemed not to be aware that there were 200+ passengers in hotels in Nairobi. We had to wait for them to arrive. We were then told to go to gate 13 but the plane was at gate 14. We left 14 hours late. Kenya Airways staff made no public announcements during the whole of this shambles, and no apology was given until we heard from the pilot that passengers had to be collected from Nairobi. The staff at the gate seemed leaderless and unable to communicate with the many anxious passengers who had missed their connecting flights and would not arrive in Paris until 9 pm, too late to get anywhere. I had to pay for a hotel in Paris and then continue my journey by train the next day.",Business,3.0,nan
Ambraer 190,Economy Class,4.0,April 2017,3.0,1.0,3.0,no,Djibouti to Antananarivo via Nairobi,2.0," | Djibouti to Antananarivo via Nairobi. My last 6 flights with Kenya Airways, I have had 5 delays in the span of 2 months. That's unacceptable and unprofessional. What is more They don't communicate with their clients out of total disrespect. Has the Pride of Africa become the shame of Africa? Time will tell but at this pace I am going to see somewhere else and get Ã  at least a bit of respect with my money.",Business,1.0,nan
Boeing 787-8,Business Class,1.0,March 2017,2.0,3.0,1.0,no,Nairobi to Amsterdam ,4.0," |  Flew the day flight Kenya Airways from Nairobi to Amsterdam in the new Boeing 787 and I am really not impressed. The 787 is certainly an improvement in comfort and reduce negative effects of flying, but the Business Class of Kenya Airways is just no match for the price, which is 40% more than competition. All in the service is just behind. Lie flat seat is ok but already look old after couple of years, and the conception is already ancient (manual handset with a wire). Service is just too basic for the price you pay, and the staff is pretty cold, un-attentive and seem bored every time you ask something (not all of them, there are couple of pursers really doing it right, but the rest is awful). I am not asking much as flying is a commodity but a minimum of politeness when coughing up 5,000 USD for a 7h flight is a fare expectations, as the level of service is nowhere representative of that. Premium Economy in some European carriers is actually better service for 1/3 of the fare. Meal service is quite basic, you get the plates and in 5 min they are taken out. The cabin is ok but already looks old. Nothing like you should expect in light of the fares charged on this route, and the contrast with KLM is just obvious",Business,1.0,nan
Boeing 787,Economy Class,4.0,February 2017,4.0,5.0,5.0,yes,Bangkok to Nairobi,5.0," |  Bangkok to Nairobi, and I was very impressed with them. I was taking a school group to Africa and originally was trying to fly Ethiopian or Qatar, but both were booked out so we went with Kenya Airways. We were met at Suvarnabhumi Airport by an agent of the airline as we were a group and check-in was very smooth. Their Boeing 787 seems to have more pitch than others I have flown and so was much more comfortable for me with longer legs on an overnight flight. Flight crew to Nairobi were all African (I specify this as the Nairobi to Bangkok return flight they were all Asian as the flight continues to Hong Kong) and were very professional and provided good service. As the flight originated in China, most passengers on board when we boarded were Chinese and so were typically noisy during the flight, but no more than I have gotten used to! Food was good and served punctually. I even slept a bit during the flight - unusual for me! Overall I recommend them as a cheaper flight to Africa.",Business,5.0,nan
Boeing 787,Business Class,5.0,March 2017,5.0,4.0,3.0,yes,LHR to MBA via NBO,5.0," |  London Heathrow to Nairobi. The inbound aircraft from Nairobi was late into Heathrow, we had to briefly go back to the gate with a maintenance issue. One of my reading lights didn't work but these things happen with airlines. The crew was great, the cabin was spotless and meal delicious. They held the connecting flight to Mombasa for me, something that airlines promise but rarely do. That flight had a newish aircraft, charming crew and clear flight deck announcements. They served a warm breakfast, not bad for a 45 minute flight. KQ were equally good on a flight to London a couple of years ago after I slipped a disc and had to be taken home in a wheelchair. I was looked after perfectly until I reached Heathrow. My only criticism is the fault of Kenya Airports Authority. It is unbelievable in the 21st century that to get to JKIA's domestic terminal, you have to push your heavy luggage cart across an enormous car park with kerbs, busy traffic and dubious individuals who want to relieve you of your luggage temporarily - or perhaps permanently. There is no reason not to have a level, paved, lit, signposted pathway - after all if Kenya can get Chinese contractors to finish a brand new railway line between Mombasa and Nairobi with gleaming new stations and viaducts six months early, they can't prevail on the Chinese to build a simple path in a week - if the work is too onerous to do themselves, that is. Or would that deprive freelance porters of income? The car park trek is a huge disincentive to use KQ to domestic destinations in Kenya - it's easier, but not such a pleasant experience, to use Turkish or Ethiopian which fly direct and clear customs at your destination.",Solo Leisure,3.0,nan
nan,Economy Class,1.0,October 2017,1.0,1.0,1.0,no,Zanzibar to Johannesburg via Nairobi,1.0," |  Zanzibar to Johannesburg via Nairobi, we were told that due to overbooking, we must take a later flight about 4 hours. They always overbook a flight so we were the unlucky ones who have to take a flight four hours later, with zero consideration for the inconvenience caused. There will be no compensation as they booked us on SAA (this again was our fault). We insisted on lunch, which was a burger only because Kenyan Airways policy does not buy sides. We were informed our luggage was on the SAA flight, after 30 minutes of waiting we realised that our luggage has not arrived with us. After numerous queries we managed to locate our luggage (Thanks to helpful staff at OR Tambo). As the lady at the counter said that we must actually be thankful that our luggage has arrived. The staff at Kenyan Airways was unhelpful and made as though everything was our fault. I will never fly Kenya Airways again.",Family Leisure,1.0,1.0
Boeing 787 / E190,Economy Class,4.0,September 2017,4.0,4.0,2.0,yes,London to Dar es Salaam via Nairobi,4.0," |  London to Dar es Salaam via Nairobi. Heathrow to Nairobi was full, had an aisle seat, but cushion was well worn. Evening meal served by efficient cabin crew. Meal and breakfast was better than on some better known airlines. Nairobi to Dar es Salaam on Embraer 190 was a pleasant flight, comfortable leather seats and another breakfast. Flight was on time. Return flight from Dar es Salaam scheduled for 3.45 am which was a bit inconvenient, but get to the departure gate in good time - this flight left 15 minutes early as all passengers had boarded. Aircraft was clean, breakfast was served. Cabin crew efficient. At Nairobi there is a scheduled 4 hour wait for the flight to Heathrow. Again aircraft was on time and nearly full. Yet another breakfast, this time a full meal with three choices - omelette, sausage or vegetarian. Cabin crew efficient and worked smoothly and without fuss. Had an aisle seat next to the exit door, plenty of legroom and a comfortable flight. Maybe they could have done a couple of water runs as it is a long flight. Arrived on time but had to stack as airport was busy. I have used Kenya Airways before this year. They are worth considering and are a cut above some of the UK competitors in terms of food and comfort.",Business,4.0,3.0
E190 / Boeing 737,Economy Class,5.0,August 2017,5.0,4.0,4.0,yes,Dar es Salaam to Mahe via Nairobi,4.0," |  Dar es Salaam to Mahe via Nairobi at a very reasonable price. I was surprised (and a little nervous) that my connection in Nairobi was only 50 minutes - what could possibly go wrong? - but on the day, everything went like clockwork. The first flight was in an Embraer, very comfortable and even had USB ports. Nice light breakfast served. Magnificent views of Kilimanjaro on this route (left side, but I imagine this could vary). Departed and arrived on time, found my new gate relatively easily and with plenty of time to explore the severely overpriced airport food outlets. Not that I needed to eat, the next flight provided lunch which was tasty. Full selection of movies on this flight also. All round, an excellent experience.",Solo Leisure,5.0,nan
Boeing 787,Economy Class,4.0,September 2017,4.0,3.0,1.0,no,London to Nairobi,4.0," |  London to Nairobi. The aircraft was a fairly new Boeing 787. I cannot fault the crew, aircraft cleanliness, seat comfort and pitch all were fine on an Economy Cabin flight.  My onboard entertainment system did not function on either the outbound or inbound flights on the London Nairobi flights. the sound accompanying films was inaudible on both the airline provided headsets and my noise cancelling headphones. This is a problem experienced by at least 30 passengers on each flight. And anecdotally according to another passenger a common problem on their flights.",Solo Leisure,3.0,nan
Boeing 787,Business Class,1.0,August 2017,1.0,1.0,2.0,no,Nairobi to Paris,2.0," |  Nairobi to Paris. We were in the lounge when an announcement was made the flight was delayed. The next thing we knew we were called to ""final boarding"". Arrived at the gate to confusion. Once we were boarded the confusion continued. Lots of chatting among staff at the doors for about 20 minutes. During that time there was no attempt to serve the business class passengers. It was a long flight. No water bottles provided which is fine because we like to try and keep things environmentally friendly but also had to ask repeatedly for glasses of water. Had to help ourselves to pillows and blankets from a bin. They ran out of 2 of the 3 choices of breakfast by row 4 in business class. The USB charger in my seat didn't work. My headphones made a loud screeching noise if I turned my head. My seat wouldn't fully recline. During take off and landing our attendant kicked off her shoes and slept. She was probably the only one on the flight that did catch a comfortable sleep. We've flown business class often and if we ever are forced to fly Kenya Air again, we'll choose economy class because it felt like that anyway.",Couple Leisure,1.0,nan
nan,Economy Class,4.0,September 2017,3.0,1.0,2.0,no,Nairobi to Dar es Salaam,3.0," |  Nairobi to Dar es Salaam. This airline is in deep financial crisis and flights are unreliable. Airline management and customer service is very poor quality. The aircraft seem to be in reasonable condition and the crew also seem OK, the problem is the rest of it. Prices are high. Unfortunately the more or less have a regional monopoly so those of us who are forced to use them frequently have expensive frustrations. When there is a problem they are simply not interested. If you have a choice, choose the alternative!",Business,2.0,nan
