Aircraft,CabinFlown,CabinStaffService,DateFlown,FoodAndBeverages,GroundService,InflightEntertainment,Recommended,Route,SeatComfort,Textchunk,TypeOfTraveller,ValueForMoney,WifiAndConnectivity
A320/B769,Business Class,4.0,July 2018,4.0,5.0,4.0,yes,St Petersburg to Bangkok via Almaty,4.0," |  St Petersburg to Bangkok via Almaty. There has been significant improvements to this airline in the fourteen years since I first flew. It was a day service between St Petersburg and Almaty on a clean A320. Seats were comfortable, spacious and with a reasonable recline. Food was good and well presented. In flight entertainment was on tablets and there was a reasonable selection. Cabin service was a little hit and miss - I asked for wine with my meal and by the time I realised that it had been forgotten I had finished and did not ask for it. The cabin crew spoke reasonable/good English but only spoke to me in Russian because initially I had spoken to them in Russian. The check in in St Petersburg was fast, efficient and in English. They had a bus for business class passengers to go to the plane. The flight departed and arrived on time and my luggage was among the first offloaded in Almaty. The Almaty - Bangkok sector was a night flight on a new Dreamliner 769 with a dinner type meal at about 2.30 am. Check in in Almaty was slow because the operator was dealing with problems for a couple of economy class passengers. (It would have been faster to use the economy check in counter)! Food was good and the seat/bed was comfortable and there was quite a selection of in flight entertainment. I was identified as a foreigner and so spoken to in good English. The plane left and arrived on time and again my luggage was amongst the first off the plane.",Solo Leisure,5.0,nan
nan,Economy Class,5.0,April 2018,5.0,5.0,5.0,yes,Astana to Dubai,5.0," |  Astana to Dubai. It was very nice family trip from start to finish. Everything about the flight was perfect, quick check-in, boarding, quality of special meal, reservation of seats and comfort, kids amenities, entertainment system, cleanness of cabin. I would only recommend to provide wifi access but cabin crew informed me that internet is available on some flights. Since I flew with my daughter of 4 years old I had things to do and hadn’t had a chance to enjoy internet anyway. Crew is very positive and i have been individually welcomed as a Silver member. Overall it was very memorable flight and I would recommend Air Astana!",Family Leisure,5.0,nan
A320,Business Class,5.0,June 2018,5.0,5.0,4.0,yes,Kiev to Almaty,3.0," |  Kiev to Almaty. During my stay in Kiev transit, I was upgraded to business class, which made my day. On-board  service was professional, good english-speaking, good service. Food quality and presentation incl. menu fulfilled expectation without any complaints. Choice of beverages was interesting. Entertainment via wifi is working well, the provided screens on high quality. Air Astana are highly recommended from me.",Business,4.0,5.0
A320,Economy Class,3.0,June 2018,3.0,2.0,2.0,no,Dushanbe to Astana via Almaty,3.0," | Air Astana has practically a monopoly in the Central Asian region where I live and work and they don’t hesitate to remind the customer of that. I have travelled approximately 75-100 legs on this airline for business and have purchased several tickets to and from Moscow for both myself and my fiance. You’d think this sort of ‘loyalty’ (is it really loyalty when you consider the lack of available options?) would earn me a little more respect than what I received today, but judging from my experience with the gate agents contracted by the airline at various airports, all I seem to get is ignorance and hostility. Customer service is arguably not very highly esteemed in Central Asia in my experience so I’m long past expecting “service with a smile.” I was caught unawares today by a excess baggage fee when flying out of Dushabe. Apparently Air Astana has recently started offering bare bones fares whose limitations are in no way reflected in the pricing. These fares offer a downright insulting 1 kg baggage limit (10kg for Nomad Club Silver members) when the standard tickets allow for 20kg (30kg) respectively. I unknowingly booked this fare through a third-party website where there was no indication that this wasn’t a standard fare ticket. As I said, the ticket price wasn’t particularly cheap. I expect this sort of thing from FlyDubai or Wizz Air but from a national flagship airline? Seriously? Of course what incentive do you have to treat repeat customers well when you practically have a government-backed monopoly? And about the Nomad Club, it’s quite possibly the stingiest airline rewards program there is. Almaty Airport, the airline’s hub, is a glorified bus station which is insanely overcrowded, overpriced, and boring. On a positive note, the air crew staff are polite, if not exceedingly. Not the worst but not the best.",Business,2.0,nan
A320,Economy Class,5.0,June 2018,5.0,3.0,5.0,yes,Atyrau to Istanbul ,5.0, | I have had to recently use some other airlines and this has reinforced my appreciation of Air Astana’s cabin services. Air Astana has set and manages to maintain exceptional high standards of service. Al the cabin crew appear to have fundamental English skills. The new uniform is fresh and professional. The safety video has been improved and is actually pleasant to watch even after many flights in a short time frame. The new aircraft have screens on the backs of the seats and passengers can select their entertainment. The new earphones are great and I always keep the set. The passenger pack is in a useful bag and the products inside are good but I miss the mini-biro pen. The food and beverages are of good quality with a proper cutlery. I have found the cabin crew to be attentive and responsive to my needs. Depending on the airport I have boarded check-in staff may not have the same consistency but my recent check in at Atyrau was good (this is not usually a friendly airport though there are some exceptional individuals working there). I would say without fear of reproach that Air Astana is my preferred airline of choice.,Solo Leisure,3.0,nan
nan,Economy Class,5.0,May 2018,3.0,5.0,2.0,yes,Delhi to Astana,4.0," | Flew Delhi to Astana with Air Astana. Fantastic service from cabin crew, and airport personnel. Improved meals. Still need to get personal TV screens on all seats, on all flights. The ""watching shows/films on my own personal device"" is a cheap way out, I definitely do not like this option. In the year 2018, all planes should have screens on all seats especially on long flights! Always feel safe on Air Astana flights! Air Astana is a top-notch airline!",Business,4.0,nan
Airbus 320,Business Class,5.0,March 2018,5.0,5.0,5.0,yes,Almaty to İstanbul,5.0, |  Almaty to İstanbul in March 2018. There was no delay on flight. I remember smiling crew faces for that trip. There was delicious food and good entertainment for 6 hours flight. Note: wishing to see bigger planes for such a long vayage. ,Business,5.0,nan
nan,Economy Class,5.0,May 2018,5.0,5.0,nan,yes,Antalya to Almaty,5.0, |  Antalya to Almaty. I write to commend staff on an exceptional level of service when I traveled with Air Astana on the 23 May. The service I had was a superb experience throughout the flight. I trust that you will pass on this recognition to the specific staff members from this flight.,Business,5.0,nan
A320,Business Class,5.0,May 2018,5.0,4.0,5.0,yes,Istanbul to Atyrau,5.0," |  Istanbul to Atyrau. I'm traveling for more than 15 years with this company (I am also a ""Nomad Club"" member as Gold). I can  recommend Air Astana since their prices even better than competitors in the region. The airline is improving. The last flight  was a safe, comfortable and pleasant flight. The staff is very nice and friendly the food is good. Topping all that were the good selection of movies on board.",Business,5.0,nan
A321,Business Class,5.0,April 2018,5.0,5.0,5.0,yes,Tashkent to Almaty,4.0," |  Tashkent to Almaty. Excellent food, high tech inflight entertainment via their application and on time. Although flight was only for one hour thirty minute crew was attentive. The only thing I would feel to improve to make announcements shorter since all are in three languages.",Business,5.0,nan
nan,Economy Class,nan,nan,nan,nan,nan,yes,nan,nan,Moscow-Astana-Almaty return. First sectors a 3.5h night flight and wasn't really crowded. I had a row for myself so laid down and had a sleep. Unfortunately after 1h they switched on the lights and served some food. I tried to continue my sleep. As we were delayed and as I didn't have an absolute proper Visa it took me a while for immigration. Searching my bag was easy even I was late and the belts already stopped. Air Astana had some helpful staff there and got my Bag from the luggage room in a minute. Finally I didn't catch my connecting flight. But the rebooking to the next Astana-Almaty flight worked without problems on this Airport. On this flight they served breakfast that was OK. ALA Airport is hell. Staff (even Air Astana check- in) is nearly not speaking English and to get to the domestic check-in you have to have a print out of your ticket as they don't know what an e-ticket is. Staff in-flight was always kind and helpful and had a good English.,nan,4.0,nan
nan,Economy Class,nan,nan,nan,nan,nan,yes,nan,nan,I flew to Bangkok from Almaty December 2009. We had trouble at the beginning. Although we checked in on the website they couldn't provide the same seats so we had to sit separately from my wife. They also sold 1 ticket for 2 people but they just couldn't do anything with the situation. The only way would've been to seat one of these guys to the business class. We waited 2 hours on the plane (of course some people missed their connection in Bangkok in the result of this unprofessionalism) until they saw no other solution but that. Very unprofessional attitude. Later on cabin crew were helpful and friendly food was OK good classical music channel to listen airplane relatively new clean very small legroom though for a tall guy.,nan,4.0,nan
nan,Business Class,nan,nan,nan,nan,nan,no,nan,nan,A terrible business class lounge. I had to pay for everything except water and cola. They have launched a web check-in service but do not have a terminal to print the boarding pass at the airport. I find it rather uncomfortable due to the fact that you can't often find a printer when traveling on business trips. On my last trip I've checked-in online printed my boarding pass but I have learned that my seat doesn't exist because they've changed the plane. I've found it out only when I was onboard. Maybe not so terrible but not too good.,nan,1.0,nan
nan,Economy Class,nan,nan,nan,nan,nan,yes,nan,nan,I recently flew Air Astana from Almaty to Dubai and return and I must say I was impressed with the level of service. We were late out of Almaty but that was not a real problem as the service on the plane was professional. The seat pitch is okay for the 4 hour or so flight to Dubai as is the food. Entertainment was via overhead video units but it was fine to view. No problems with disembarking in Dubai. Equally the return flight was good leaving Dubai at 2300 - good food and service on board.,nan,4.0,nan
nan,Business Class,nan,nan,nan,nan,nan,yes,nan,nan,"GUW-AMS B767-300 Business class. I have to say the service has greatly improved. The seating is classic but very spacious. The plane is aging but clean. The onboard service is fair to good and IFE surprisingly diverse. I checked no for ""value"" for money because this ticket costs double the price of a twice as long flight on CX or AF.",nan,1.0,nan
nan,Business Class,nan,nan,nan,nan,nan,yes,nan,nan,Have flown several times on Almaty - Bangkok route. Whilst not at the level of top airlines I had no problems at all. Flights on time. Food OK. Planes relatively new and clean. Happy to continue as is quickest route for me and no complaints.,nan,4.0,nan
nan,Economy Class,nan,nan,nan,nan,nan,yes,nan,nan,GUW-IST-GUW A320. Check in smooth and the flight was on time. The plane was a new A320. IFE was limited but this was a 3.5 hour flight. The onboard service was adequate for a medium haul economy class flight. No complaints except for the incredible rise of prices on Air Astana International flights. From Kazakhstan we do not have much choice of airlines and Air Astana is still the only one with a descent safety record so I prefer to use it despite the ever increasing prices.,nan,1.0,nan
nan,Economy Class,nan,nan,nan,nan,nan,no,nan,nan,"The comments about this airline mostly relate to their international flights and I understand that they offer a good service there. It's a different story on their internal and regional flights. I booked on-line for the short hop return from Bishkek to Almaty. It seemed like a good idea at the time but proved to be a disaster. The airline changed their schedule without informing me their records apparently said that they had ""tried to contact me"" - I'm not even sure how. I turned up at the airport and waited for 5 hours assuming that it had simply been delayed for that time only to find out that they had moved me not to that flight but to one 20 hours earlier. The Air Astana agent acted as though he hadn't seen an e-ticket before claimed I hadn't paid for the outward journey or maybe hadn't paid at all - really any excuse to not allow me onto the plane. I had no alternative but to go back to Bishkek and travel overland the next day - all at my own expense of course. The return flight had been similarly moved but a local agent helped me out to properly arrange that one and got a refund for the outward journey. I complained to Air Astana as my non-arrival had seriously thrown out the plans of my hosts in Almaty not just mine. No answer. I complained again only to receive a fob off reply that they regretted this but they weren't going to do anything further about it and hoped that I would fly with them again: I doubt that very much. I've given 1 rather than 0 as the Almaty to Bishkek ""return"" flight itself wasn't bad. Their ground service and support in these regional centres very much needs to upgraded to the same standard as their flight experience.",nan,1.0,nan
nan,Economy Class,nan,nan,nan,nan,nan,yes,nan,nan,Air Astana is right up there with other non-mainstream airlines who do more to please than most. Great service great food an interior decor and outside livery that have a quality design. Air Astana customers include many oil industry personnel who have flown often worldwide and positive comments are often noticeable among passengers. Agree with a previous comment about FAs who are very pleasant. Service to Atyrau has improved leaps and bounds from the days when a worker cigarette in mouth and large hosepipe in hand used to bang the hull of the plane to talk to the pilot about refuelling. The airport is still a bus station though.,nan,4.0,nan
nan,Business Class,nan,nan,nan,nan,nan,yes,nan,nan,Almaty - Atyrau - Amsterdam in Business. Seats are comfortable although not lay flat and space is more than enough. Their duvets are perfect. Cabin crew very friendly and helpful. Food is good service is second to none. Aircraft was clean and flights operated on time. On the ground staff are very helpful. However the Business class lounge is severely lacking in facilities in Almaty. Not even free drinks. In Atyrau there are no Business class facilities at all! Terminal facilities generally in Atyrau are severely lacking. Its not possible to get any refreshments in any way shape or form once you are in the departure lounge. Thankfully if you are just transiting through Atyrau to Almaty or vice versa you're not in there long. All in all very pleased with service its just a shame that terminal facilities let down the rest of the service. Sort that out and its 10/10! Keep up the good work.,nan,4.0,nan
nan,Economy Class,nan,nan,nan,nan,nan,yes,nan,nan,The have good cabin crew quality of food is good. Their fleet is new enough and I know from some sources that they do their best to provide safety and best service. Sometimes it seems that the prices are too high but if you order tickets via internet you will get a discount especially on trips with some promotions. But this service is worth to be paid.,nan,4.0,nan
nan,Economy Class,nan,nan,nan,nan,nan,no,nan,nan,"3 flights over 2 weeks (Almaty-Astana Astana-Almaty Almaty-Delhi). Computers at check in down no assigned seating every man for himself. Quite tall had reserved exit row was told to ""stand at the gate"" to be the first one on to grab the seat. However they boarded 20 people into coach ahead of us and the exit rows ended up being filled by families with kids. Changed ticket received confirmation via email arrive at airport to be informed ""Yes we sent a confirmation but you needed to come to our office to get the ticket."" Upon informing them that they sent the e-mail at 10 pm and the office would be closed they informed me I should have driven from central Astana to the airport to do it. Entire day wasted in Astana airport eventually placed on a late afternoon totally packed flight. Guaranteed exit row instead given tiny seat with zero leg room. Food absolutely dreadful. Staff spent most of their time sitting in the entirely empty Business Class section watching movies and telling passengers on the full flight not to use the Business Class bathroom.",nan,1.0,nan
nan,Business Class,nan,nan,nan,nan,nan,yes,nan,nan,Atyrau to Almaty - friendly service with right amount of attention 3 meal choices excellent legroom great selection of music. Most comfortable.,nan,4.0,nan
nan,Business Class,nan,nan,nan,nan,nan,yes,nan,nan,Business class from Almaty to Bangkok. The comfort and service was of highest standard and compared favourably with airlines with better reputations.,nan,4.0,nan
nan,Economy Class,nan,nan,nan,nan,nan,no,nan,nan,Amsterdam to Atyrau return – one of the most expensive flights per mile of any routes worldwide by any operator so you might think the flight would be special. Old aircraft substandard in-flight entertainment (the overhead TV monitor in my section not working and others with poor picture from what I could see) cramped full flight 2 of the 3 meal choices not available by the time the meal cart got to me all the wine with the meals gone by half way down the cabin bar service once per flight and grudgingly given using cheap local (to Kazakhstan) versions of spirits mixers and wines by unsmiling cabin crew.,nan,1.0,nan
nan,Economy Class,nan,nan,nan,nan,nan,yes,nan,nan,Moscow to Almaty. This was a good flight it departed and arrived as schedules and the luggage was offloaded efficiently at Almaty. There was a slight hiccup with the check-in and I did not get the seat that I had pre-requested however I finished with a better seat. Flight service perfectly adequate and I was spoken to in English when they realised I was not a native Russian speaker. I had no problems on what was a comfortable flight.,nan,4.0,nan
nan,Business Class,nan,nan,nan,nan,nan,yes,nan,nan,Bangkok to Almaty. Very full flight and a booking error in my row which resulted an upgrade to Business Class. Food and service quite friendly with some preferences being given to those who had paid full business class fares. Seats were comfortable recliners and I was a little surprised with the legroom. Service was good and the English better than I expected. Economy class gives value for money but I think that Business Class does not.,nan,1.0,nan
nan,Business Class,nan,nan,nan,nan,nan,yes,nan,nan,GUW-ALA in Y and ALA-URA in C; both flights on older and somewhat stuffy 757s which however have generous legroom in economy and plenty of space in business. Seats in business are rather tired but still comfortable and service is very good; Air Astana FA's are always professional and friendly. Good food both in economy and business. Flights operated on time. Overall this again was a good experience and I would recommend using KC rather than other domestic carriers (which are to be honest very few in Kazakhstan).,nan,1.0,nan
nan,Economy Class,nan,nan,nan,nan,nan,yes,nan,nan,URA-PEK via ALA return in Y. Checked-in online but offered a better seat at the airport which is nice of check-in agents. Domestic legs on newish A319 with plenty of legroom in economy. ALA-PEK on rather tired B767 with ancient bulky ceiling TV-sets and stale interiors but the flight and service very good. Had seats 29A+B for myself (exit row seats) on both flights with huge legroom. Special meal delivered as requested. ALA-PEK-ALA are the night flights so service was unobtrusive if you like which is good for couple of hours sleep. Excellent experience with Air Astana (although no competition whatsoever in the local market therefore fares are quite expensive.,nan,4.0,nan
nan,Economy Class,nan,nan,nan,nan,nan,no,nan,nan,Dubai-Almaty-Ust-Kamenogorsk-Astana-Dubai. Later part of May - beginning June 2010. Flight to Ust-Kamenogorsk via Almaty not too bad or unpleasant considering I was en route already for 25 days (spending 18 hours in horrible Dubai Airport). My suitcase was damaged by rough handling. The flight Ust-Kamenogorsk to Astana was not bad either. Astana-Dubai flight started with a hiccup - since the customs people did not know where Namibia is and I was looked at very suspiciously despite having a private Visa and being with my Kazakhstan wife. The flight was very unpleasant - seats the most uncomfortable for such a flight! Attendants not interested in making the flight a wee-bit more comfortable. Prices not too bad - however flying to the destinations I need to go to there is no alternative to compare. Being the national airline there is much room for improvement.,nan,1.0,nan
nan,Economy Class,nan,nan,nan,nan,nan,yes,nan,nan,I never had much of an issue with this airline. Ppolite staff food very reasonable a good selection of drinks and in-flight entertainment. On occasion the flights can be late but this is more due to the weather and the odd mechanical hiccup however this has improved. You may find this airline very expensive (Amsterdam to Atyrau) with 50% saving to be had via other routings. These comments relate to trips Amsterdam to Atyrau Atyrau to Aktau and Istanbul to Atyrau over the last 3 years.,nan,1.0,nan
nan,Business Class,nan,nan,nan,nan,nan,yes,nan,nan,Four flights IST-ALA-TSE-ALA-KUL. All 4 were on time excellent service by cabin crew very good food and drink selection - both on domestic and international legs. Good seat comfort (cradle seats on shorter sectors angled lie flat on B767 to KUL). The only disappointment was the lounge in ALA which is basically a bar and you get a voucher for a soft drink plus a snack.,nan,4.0,nan
nan,Business Class,nan,nan,nan,nan,nan,yes,nan,nan,Business class to Beijing return from Almaty. Service was good and staff friendly. Better food better wines even cold champagne now. Staff are the airlines asset. They are informative polite and helpful.,nan,4.0,nan
nan,Economy Class,nan,nan,nan,nan,nan,yes,nan,nan,Amsterdam to Atyrau return. Using Air Astana many times (not just this route) I have found the flights to be very expensive and often delayed due to technical issues or weather plus chaotic check-in staff! However the flight itself is well above average in food flight entertainment and service. Taking into account the experience from arriving at the airports plus the cost of the flight one would expect a smooth journey per se. Unfortunately this is not the case! Being a state airline and promoted as such there is a lot of room for improvement in this area.,nan,1.0,nan
nan,Economy Class,nan,nan,nan,nan,nan,yes,nan,nan,Almaty-Astana return and Almaty-Abu Dhabi and all flights were fine. Check-in cabin service average food basic no delays. The Abu Dhabi flight was in an A320 though so entertainment and facilities were limited. It's like a lesser western airline but they do seem well-organised and have a good website. The only problem I had was caused by Etihad. I booked a codeshare through the Etihad website as it was the same price but included a bus to Dubai. However the bus departure time on my ticket did not exist and had never existed. I had to wait 3 hrs for a bus. If they had provided accurate information I would have made alternate arrangements.,nan,4.0,nan
nan,Business Class,nan,nan,nan,nan,nan,yes,nan,nan,Almaty to London. The service was pleasant and efficient KCTV was handed out as soon as seat belt signs went out so the time waiting for drinks to be served passed quickly by. As for the new wine selection this is good now that imported wines are included. The change from my first flight (Nov 2007) to now is positive.,nan,4.0,nan
nan,Economy Class,nan,nan,nan,nan,nan,yes,nan,nan,GUW-TSE-SVO. I flew for business in Economy class and was impressed how professional the service was. The food is ok there was IFE via a small flip-down video screen and headsets were handed out to all passengers in time. During the flight from TSE to SVO they issued a travel pack (flight socks blindfold comb). I did have a complaint with the customer service from one member of the cabin crew and requested a comment form which was handled professionally by other members of the crew.,nan,1.0,nan
