Aircraft,CabinFlown,CabinStaffService,DateFlown,FoodAndBeverages,GroundService,InflightEntertainment,Recommended,Route,SeatComfort,Textchunk,TypeOfTraveller,ValueForMoney,WifiAndConnectivitynan,Economy Class,2.0,nan,3.0,nan,2.0,no,nan,3.0,"Let me start by saying that I have flown WestJet for many years and it has always been my first choice in airline when planning our next vacation. This past experience was by far the worst I have ever had. We left Edmonton late due to ""mechanical"" delays but they ensured us we would catch our connection in Vancouver. We landed in Vancouver to find out our connecting flight just pushed away from the gate (but still on the ground). They rerouted us to Toronto. We couldn't land in Toronto due to weather so we flew to Ottawa. They wouldn't let us pull up to the gate so the entire plane sat for 2 hours. We were not offered water or any form of refreshment. We then flew back to Toronto and again just missed our connection... but the connecting plane was still on the ground. We were offered a hotel and told to pick up our luggage. We waited 2 hours for the customer service people to find our luggage... which was in Vancouver. The flight the next morning was 30 minutes late and I have never had such rude crew staff. They were more interested in complaining to each other loudly than serve beverages. We waited 90 minutes for a glass of water. There was also no inflight entertainment on this flight. When we landed in Cancun they said they would bring our bags to us... we had to continue to call them over the next 36 hours until our luggage finally arrived to us. The flight home was better in general... expect it was 3 hours delayed because of required crew rest. One of them yelled at me which I found very rude and uncalled for. I have been a loyal customer of westjet for years... this was a terrible experience.",nan,2.0,nan
nan,Economy Class,5.0,nan,3.0,nan,2.0,no,nan,3.0,PHX-YWG. Everyone boarded nice and early we pushed back on-time but still managed to depart 40 minutes late. Not Westjet's fault as there was lots of traffic on the ground at PHX but still frustrating nonetheless. Once in the air the flight attendants immediately came around with a water run which was nice. Also the live TV no longer works in the states which is disappointing and would rather watch that then movies. Ended up landing in YWG about an hour late. Will avoid using Westjet outside of Canada as they are more expensive than everyone else and now their inflight service is on par or below everyone else's. The flight attendants were the only good part as they were pleasant and efficient.,nan,1.0,nan
nan,Economy Class,1.0,nan,2.0,nan,1.0,no,nan,1.0,Despite having seats in the Emergency access the person sitting in the aisle seat had to awkwardly get out of his seat to let us out. The centre aisle was impossible to negotiate with other passengers and beverage carts. There was no entertainment and seat backs did not recline. There needs to be control of carry on baggage that people bring on board as we had trouble finding a little space for our small bag. The public announcement system was very difficult to understand. the person speaking spoke quickly and did not enunciate. The only benefit of the flight was that we got back to Vancouver!,nan,1.0,nan
nan,Economy Class,3.0,nan,3.0,nan,4.0,no,nan,4.0,Sitting in airport at this moment flight from Honolulu was late. Fine but flight plan allowed for time to be made up and arrived with time to connect onto original flight. Nope not an option. Even though they knew that anyone connecting to spots like Saskatoon would have to sit all day and not arrive home until 9pm - no attempt to hold the plane for the 5 mins it would of taken to get on that flight. These are being offered as flights for holidays and its not reasonable for you to start a flight at 7.30 pm (3 hours prior) and not get home for 26.5 hours later. I would of assumed that arrangements would of been made to make sure passengers could get connections.,nan,3.0,nan
nan,Economy Class,1.0,nan,2.0,nan,4.0,no,nan,3.0,Family of four - we got 'bumped' off of a flight from Toronto to Winnipeg. Staff made us walk back and forth through terminal for 4 hours directing us to the wrong counters and hotel shuttle pick-up points. We have 2 small children and 4 large pieces of luggage - no offer to help. The lack of customer service was disgusting. Staff have poor attitudes and no compassion for customers at all. Never again!,nan,1.0,nan
nan,Economy Class,5.0,nan,3.0,nan,3.0,yes,nan,4.0,February 18th en-route to Cuba from Halifax via Toronto. Our flight was cancelled due to weather. However staff were very helpful at the customer service desk who arranged a later flight to Toronto along with food vouchers and hotel voucher. We ran into the same problem on our return flight on Feb 28th. Again the staff in Toronto were very helpful arranging for hotel and food vouchers again.,nan,4.0,nan
nan,Economy Class,3.0,nan,1.0,nan,1.0,no,nan,3.0,Travelled half way around the world only to find WestJet cancelled a critical flight leg. This is the fourth mess up by WJ in the last 4 months. Sure wish we had a choice of airlines in Canada.,nan,3.0,nan
nan,Economy Class,5.0,nan,4.0,nan,4.0,yes,nan,5.0,WS399 from Winnipeg to Calgary on February 25th. Ground staff at Winnipeg friendly and very efficient. Flight departed on-time. Cabin crew and flight deck made this trip a good one. Arrived on time. Will certainly fly with them again.,nan,4.0,nan
nan,Economy Class,4.0,nan,3.0,nan,3.0,no,nan,3.0,Well we had a pretty unpleasant week trying to get home from Halifax. We were scheduled to get home dinner time in St Johns NL on Friday Feb 22. Our flight in the morning got canceled and we were rebooked on the 21.40 flight. After spending 9 hours in Halifax airport our second flight for the day got canceled and we were put up in a hotel in Dartmouth. Booked on a flight at 21.40 on Saturday night and my girlfriend was booked on a flight at 10.50 Sunday . We spent most of Friday night on the phone trying to get us on the same flight for Saturday night. Managed to get both of us on the same flight for Saturday night finally got on our flight at 22.30. Mid flight the pilot said we were going to have to redirect to Deer Lake NL due to the runway not being ready for us in St Johns. Landed in Deer Lake and after spending an hour on the plane we were put up in the holiday inn. Got up at 6.30 Sunday morning and went back to the airport to get a rental car to drive to St Johns. We couldn't take the chance that we wouldn't make it home that day via plane.,nan,3.0,nan
nan,Economy Class,5.0,nan,nan,nan,3.0,yes,nan,4.0,Traveled May 4th from Ottawa-Calgary-Comox. On the flight from Calgary we were offered a sky check type of service for our extra carry on. I was on WS-517 seated in 9C and part way through the trip I became very warm and felt a bit faint. A male flight attendant was very quick to respond and ask me if I would like to move up front in row 1as he said it was cooler. I sat there for about a half hour and when I felt better I went back to my original seat. I was offered water and this male attendant keep a close watch on me.,nan,5.0,nan
nan,Economy Class,3.0,nan,3.0,nan,2.0,no,nan,3.0,Not the same at is was years ago every single flight I've been on has been late and either there was no Satellite service or no TV's. My mother flew with them yesterday from Calgary to Kelowna and the flight was also late! The staff used to be the friendliest I've encountered but that also has changed.,nan,2.0,nan
nan,Economy Class,5.0,nan,4.0,nan,1.0,no,nan,1.0,I am not sure I will fly with them again unless I have no other choice. The seats on the plane are extremely cramped and my back was killing me by the end of the short 2.5 hour flight. I much prefer having the option to watch a movie that I don't have to pay 6 dollars for. I would much rather have a TV selection that I get more choices from not just whatever happens to be on TV at the time. I would forgo the snacks to get that option. The staff were good no complaints there and the plane was on time.,nan,4.0,nan
nan,Economy Class,2.0,nan,1.0,nan,1.0,no,nan,2.0,Vancouver to Maui and was very disappointed with the service provided on the flight. No food no movies and the staff was not really friendly. Nothing compared to my excellent experience with the same company 5 years.,nan,1.0,nan
nan,Economy Class,4.0,nan,2.0,nan,2.0,no,nan,4.0,My wife and I booked a round trip to Cancun. Turns out Westjet is a rather ordinary airline with the usual amenities. We travel at least twice a year and have flown with several airlines and Westjet is just another hohum get to the destination boring company. I think they have lost their uniqueness in a big way.,nan,2.0,nan
nan,Economy Class,2.0,nan,1.0,nan,1.0,no,nan,1.0,"My wife and I had flown to Las Vegas for a wedding getaway and honeymoon. WestJet boasts the largest seats and greatest legroom. I'm 5'7"" and was extremely cramped. The fellow beside me was 6'4"" and almost had his knees in his ears. The seats were very narrow very uncomfortable. There was almost no padding in the seats. They didn't recline more than a couple of inches and there wasn't even room for a laptop to be put on the fold down table. It was a 707-700 so seats were 3 across. Between my wife and the fellow on the other side we had no choice but to put the arm rests up so the 3 of us could sit quasi-comfortably. The flight attendants were obvious unhappy with their jobs. Out of the 4 3 of them were just blank faced and walked around like robots. The air circulation system wasn't working properly the forward toilet kept clogging up. So all in all this was an extremely unpleasant flight.",nan,1.0,nan
nan,Economy Class,3.0,nan,3.0,nan,1.0,no,nan,2.0,Vancouver to Los Cabos. Horrible flight passengers very loud and noisy flight staff not happy no movies as advertised. New rate change in fares went to book return ticket and advised no economy fares left but I could have a very expensive plus fare. When I went in to review seats the flight was only a third full and most of the plus fares were at the back of the plane. I flew down for $216 but they wanted over $600 for a fare home on a flight that at this time is only half full. Not sure what's happening with Westjet between their fares and customer service delays etc. I will be giving my business back to Air Canada as it doesn't appear that Westjet is interested in keeping their loyal customers.,nan,2.0,nan
nan,Economy Class,5.0,nan,4.0,nan,5.0,yes,nan,5.0,Prince George via Vancouver to Calgary over-nighted with family then back to airport in morning (10 people). On to Varadero Cuba I was not too happy when I discovered that we were split up on the plane. It was better coming home as we were all together after speaking with the Westjet agent at our resort. Flight back to Prince George was great. In Calgary the agent told everyone that the televisions may not work and suggested that we buy magazines to read. The movies were great both going and coming from Cuba.,nan,4.0,nan
nan,Economy Class,5.0,nan,nan,nan,1.0,no,nan,2.0,Flew from Vancouver to Maui and found out that it was a 6 hour trip with no entertainment unless you rented a tablet from them to watch a movie. Total money grab and really put the flavour that you're riding a cheap airline. It was the same on the way back. We didn't notice anything different than any of our other flights that would have indicated there was not going to be any entertainment offered. I could tell from the reaction staff were friendly and they couldn't do anything about it.,nan,2.0,nan
nan,Economy Class,5.0,nan,4.0,nan,4.0,yes,nan,4.0,"I am very limited as to who I can fly back to Canada with from Punta Cana. I have flown 4 times now on WestJet. Each flight was on time and the service and comfort on-board met the expectations. One must remember you are not paying for 1st class seats. That being said I found for my 5'9"" 190lb body that the seating was more than adequate. Traveling with an infant can be a challenge and the staff at the check in as well as on the plane did what they could to be of assistance. Food quality was better than I expected and for once I have found an airline that serves cold beer. The onboard TV only works half of the way. I am planning another trip home and even if there were more options for me I would choose WestJet.",nan,4.0,nan
nan,Economy Class,4.0,nan,4.0,nan,4.0,yes,nan,3.0,18 Oct 2012 Vancouver to Ottawa. Most liberal in terms of use of earphones. Also inflight entertainment gets switched on for you to watch from the time you board the plane all the way to landing and arriving at the gate.,nan,3.0,nan
nan,Economy Class,4.0,nan,4.0,nan,4.0,no,nan,3.0,Shocking flight to Bermuda. Since the flight was full and they had some sort of weight problem they took 20 people's luggage off the plane. This is very bad since Westjet only flies there every couple of days and we're not going to get our baggage for minimum 48 hours. They could have asked us to prioritize our luggage or leave a piece but instead they just took off about 10% of people's luggage. Certainly they have all our contact info so they could have talked to us and they definitely could have had someone meet us at the other end and explain the problem. Instead we all wandered around the baggage carousel for about 30 minutes then made our way to the baggage desk even though Westjet knew our stuff wasn't there. Making matters worse I found out that Westjet does this all the time and they are chronically behind in getting people's luggage to the island.,nan,2.0,nan
nan,Economy Class,5.0,nan,4.0,nan,4.0,yes,nan,4.0,Vancouver to Calgary on May 26th with my 2 children. My son has Down syndrome and autism so he travels with a Service dog. Our flight attendant was friendly and personable and she asked if there was anything extra that we needed and anything she and the other flight attendants should know in case of emergency. She pointed out to me that there is an extra oxygen mask which in emergency I could put on the service dog no other flight attendant had ever pointed that out to me before after 5 years of travelling by plane at least once a year. It was not a busy flight so the check in desk even gave our family an extra seat so there would be more room for the dog to stretch out. A pleasant travel experience.,nan,4.0,nan
nan,Economy Class,2.0,nan,1.0,nan,1.0,no,nan,2.0,Several years a go I flew WestJet and was pleased at the whole experience so when my son decided he was getting married in Mexico we immediately choose WestJet but the West Jet of yesterday no longer exists. The seats are extremely cramped there was no movie on a 6 hour flight and if you wanted something to eat or drink you paid for it. I recently flew to Cuba on Sunwing and not only was it more comfortable but they offered us 2 meals 2 movies and two pieces of luggage for free all of this cost the same as WestJet. I only hope West Jet listens to their customers and returns some of the perks that came with flying on their airline.,nan,3.0,nan
nan,Economy Class,1.0,nan,1.0,nan,1.0,no,nan,nan,I will never fly Westjet again. I'm a seasoned traveler and have never experienced this kind of incompetence. My 6am flight was cancelled we were unable to get another flight until 4.30pm. The food is awful and their TV's didn't work. What a horrible experience and a waste of a day.,nan,nan,nan
nan,Economy Class,1.0,nan,1.0,nan,1.0,no,nan,1.0,I am an experienced flyer but had never flown with WestJet until a few days ago and I will never fly with them again. The service on the Cancun to Toronto flight was appalling. I was flying with my sister who has 2 young children. We were boarded first but only after approaching the attendants as there was no pre-boarding call. Once on the plane my sister asked if she could go to the back to stand with her 5 month old child to put him to sleep while the plane was loading. The flight attendant said no there was no room so have a seat. After take off passengers were bombarded with merchandise play books (as there was no in-flight entertainment provided) headsets food drinks duty free. You had brief mins. of opportunity to go to the washroom as the aisles were always blocked by carts and you were told to sit down and wait while they finished their task. The staff were very unprofessional and rude. At the end of the flight passengers were not even acknowledged as all the attendants were at the back of the plane talking amongst each other.,nan,1.0,nan
nan,Economy Class,5.0,nan,5.0,nan,3.0,yes,nan,3.0,"YYZ-MIA on a 737-700. Flight left and arrived on-time. I enjoyed the ""First Bag Free"" policy which brought much pleasure to me. The PTVs are a nice addition but it's not supported in southern U.S airspace although free movies were played. The staff were great and the snacks were another perk. Overall great flight!",nan,5.0,nan
nan,Economy Class,1.0,nan,1.0,nan,3.0,no,nan,2.0,"March 1 YVR-YCC then on to ZLO. while booking I was never aware there was a plane change in Calgary until I was shown 2 separate flight numbers. Flight was delayed and took off 30 min late - my 45 min window to change planes and find the right gate was narrowed to 15 min which is cut off for boarding planes. Asking the flight attendant about my connecting flight she was unaware Westjet flew to ZLO and angrily put the blame on me for ""booking flights with too narrow of a window"". I made my plane by seconds. Return flight on April 4th. Stewardess just before landing manhandled my carryon to fit in the containers from the kitchen and I was shouted at when after landing I checked to see if my personal items were damaged. As for Baggage landing at 11.40pm I waited until 12.25 to see any baggage descend to the carousel and because of the delay had to pay $70 for a taxi as the rapid transit could no longer get me home.",nan,2.0,nan
nan,Economy Class,5.0,nan,4.0,nan,4.0,yes,nan,4.0,First flight. Halifax to Cancun and return flight. Great service. Seats larger than stories would have me believe. I am a larger man and had no issues. I have fairly long legs and had no issues with leg room either. Only wish armrests were not hard plastic. Free movies for international flight. Just wish each channel had it's own movie instead of 2 movies with 2-3 staggered copies of the same ones. Flights were always on time or early.,nan,5.0,nan
nan,Economy Class,5.0,nan,nan,nan,3.0,yes,nan,4.0,Traveled May 4th from Ottawa-Calgary-Comox. On the flight from Calgary we were offered a sky check type of service for our extra carry on. I was on WS-517 seated in 9C and part way through the trip I became very warm and felt a bit faint. A male flight attendant was very quick to respond and ask me if I would like to move up front in row 1as he said it was cooler. I sat there for about a half hour and when I felt better I went back to my original seat. I was offered water and this male attendant keep a close watch on me.,nan,5.0,nan
nan,Economy Class,4.0,nan,3.0,nan,nan,yes,nan,5.0,I flew LAX-YYC in economy class. The check-in service was very good and the in-flight service was okay. The seat was very comfortable but the in-flight entertainment wasn't very good since you couldn't pick your own shows. Some of them didn't even work! But still overall it was pretty good and I will definitely fly WestJet again.,nan,5.0,nan
nan,Economy Class,4.0,nan,3.0,nan,nan,yes,nan,3.0,"June 172013 flying from London Ont. to Vancouver connecting in Calgary with about 1.5 hour window of time. Flight to leave at 7am arrived early (5.30) to learn that the flight would be ""about"" an hour later departing as a crew member had phoned in sick! When arriving in Calgary we were allowed off the plane first as our connecting flight to Vancouver was waiting for us we were told to hurry no one directed us I asked where the gate was and was told. I'm 76 and walk slowly but I hurried as fast as I could. This meant no food as I'd planned to have lunch in Calgary. I think we should have been transported to the other gate. It was not a pleasant way to spend the day. I will still travel Westjet but found this experience disappointing.",nan,4.0,nan
nan,Economy Class,3.0,nan,3.0,nan,1.0,no,nan,2.0,YYC to PSP on May 28. I used to admire WestJet for their excellent service and reasonable fares. Not anymore. No IFE system on flight. Several excuses. New aircraft/problems with old system etc. Staff attitude mediocre at best. Website for making itinerary changes is confusing and as for phoning West Jet's call centre - forget it. WestJet persist in referring to their travelers as 'guests'. Until they do treat people as guests I wish they would simply refer to us as 'customers'. It's a pity to see such a decline.,nan,3.0,nan
nan,Economy Class,5.0,nan,4.0,nan,4.0,yes,nan,4.0,Flew 16 June 2013 for the first time in a long time. Hamilton to Halifax. Check-in friendly boarding no problem in-flight service friendly and quick. Overall a good impression.,nan,5.0,nan
nan,Economy Class,3.0,nan,2.0,nan,1.0,no,nan,3.0,Recently YWG-MCO flight left on time crew unprofessional and constantly making jokes. Seating is cramped poor recline and IFE poor at best. Connecting through T3 in YYZ is a joke must collect bags and drag them through customs then to the transfer belt. Waited over an hour in MCO for luggage to arrive. Return flight was on time but no IFE claimed it was a new plane and wasn't installed yet. Buy on Board food horrible selection no sandwiches only junk food. Barely made connection in YYZ and arrived home to no bag. Bag was delivered next morning. Overall this airline has gone downhill will not fly again if I don't have too.,nan,3.0,nan
nan,Economy Class,5.0,nan,4.0,nan,4.0,yes,nan,4.0,May 26th Vancouver to Calgary. Good assistance at check in friendly staff. On time departure comfortable plane. Only gripe is we were not seated together. It would have cost $45 to change seats being a short flight we did not. On May 29th we flew Calgary to Los Angeles. Not seated together at check in our seats were changed free of charge by the friendly check in staff member. Flight departed on time good friendly cabin crew. Good clean plane. Lost TV about 2 hours on American side of border but you can not blame Westjet for that. We would fly Westjet again.,nan,4.0,nan
nan,Economy Class,4.0,nan,3.0,nan,2.0,no,nan,3.0,"Why doesn't Westjet just admit they are removing the inflight TV service that we all loved? Vancouver to Hawaii is a long trip with nothing to watch. We hear all these different excuses like ""it's a new plane"" ""allows for more leg room"" ""it hasn't been installed yet"". Just tell staff to be honest and tell everyone to bring their own movies or music.",nan,3.0,nan
nan,Economy Class,4.0,nan,3.0,nan,3.0,yes,nan,3.0,Vacation from Toronto to Dominican Republic. May 25-13. Flight left ahead of schedule and arrived in DR 30 mins early. Staff friendly service good. On return flight on time staff friendly landed 15 min earlier than schedule. Seats are comfortable but a little tight could be an issue if on a long flight. The only complaint is movies/TV are on air for only 2 hours and flight is 4 hours with no music channels to keep you occupied.,nan,4.0,nan
nan,Economy Class,4.0,nan,2.0,nan,1.0,no,nan,3.0,May 25th we flew to Las Vegas. Received an e-mail prior to our flight advising us that there may be satellite issues about 30 minutes outside Canada but there were pay-per-view movies etc. available. Flight to Las Vegas is perfect for a movie. By the time the movie is done so is the flight. You can imagine our surprise when we found no televisions on the seatbacks. On the flight back we received an e-mail advising that there were televisions on the seatbacks. Both times the flight crews announced that this was because of the plane being new. Oddly my sister had the same thing happen on a flight to Palm Springs last year only this time they claimed it was because of the extra leg room. Instead of televisions they claim they provided us with additional reading materials - about more Westjet vacations! If all we get is additional leg room say so. That way we can decide whether it is worth staying with Westjet or going across the border for cheaper rates. On a short flight leg room isn't going to be all that and I'm tall!,nan,2.0,nan
nan,Economy Class,3.0,nan,2.0,nan,1.0,no,nan,1.0,"WJ used to be a very good low-cost airline. I have seen a gradual disappearance to what made WJ unique and my choice. Have only flown with them regionally during the last 2 years. My biggest complaint is how often they are late or delayed. Passengers are not given the truth as to why planes are delayed. I would rather know that my plane is going to be 2 hours late rather than told several times that it will be 1/2 hour late. My second complaint is how uncomfortable the seats are now! I'm a 5'4"" woman who is not overweight and the seats are so narrow that I find it difficult to get comfortable at all. Sitting beside someone with any normal width to their shoulders has us touching each other and I feel I need to keep my arms as close in as possible - making for a very uncomfortable situation. The seat in front has been moved so that it's difficult to read a magazine at times because it presses up against the seat in front. Flying WJ is now like flying Air Transat or other charter company flights. I also find now with the odd exception the inflight crew to be disinterested and not very friendly. Last the inflight entertainment system - small screens don't work half the time but the biggest annoyance is the advertising that we are subjected to! I do not want to be bombarded with WJ advertising! I hope WJ reads some of these reviews and reformulates their model!",nan,2.0,nan
