Aircraft,CabinFlown,CabinStaffService,DateFlown,FoodAndBeverages,GroundService,InflightEntertainment,Recommended,Route,SeatComfort,Textchunk,TypeOfTraveller,ValueForMoney,WifiAndConnectivity
nan,Economy Class,5.0,July 2018,5.0,5.0,nan,yes,Halifax to Paris,5.0," |  I had an excellent experience flying with Westjet from Halifax to Paris. The plane was roomy, the in-flight service friendly and helpful, and the booking and check-in processes were simple and efficient. I would highly recommend them for your overseas flight.",Couple Leisure,5.0,nan
nan,Economy Class,3.0,July 2018,3.0,1.0,nan,no,Toronto to Orlando,2.0," | July 28th, 2018 booked to fly from Orlando to Toronto for 6pm. 5.36pm - new time 7.10pm, 6.15pm - new time 7.50pm, 6.41pm - new time 8.48pm, 8.25pm - new time 9pm, 8.50pm - cancelled. Told to go to pick up luggage and get further instructions. 9.15pm - in line at ticketing and told we will get hotel vouchers and meal vouchers 9.40pm - still waiting in line and told there will be no paid hotels 10pm - given boarding pass for 9am flight on July 29th so arrive at 6am. Arrived at hotel at our expense $175 US and cab $20 US at 10.30pm, July 29th - 5.30am - shuttle to airport 5.30am - new time via email 10.30am. Summary: We were given the run around on July 28th when it was, in all likihood, known the flight would be cancelled. Then told at 5.30am that we didn’t need to be at the airport until 7.45am. Very poor planning. Absolutely no consideration for passengers. Will not fly WestJet Airlines again!",Couple Leisure,2.0,nan
nan,Economy Class,2.0,July 2018,1.0,1.0,1.0,no,Vancouver to San Francisco,2.0," |  Vancouver to San Francisco. Several online reviews advised to avoid WestJet If you ever want to see my bags again. I should have heeded the warning, as I arrived in San Francisco while my bags stayed in Vancouver. The baggage attendant waited at the counter as passengers watched the empty belt go around, even though he was fully aware they wouldn't appear. Why not tell us? Then, a lengthy process to complete paperwork yielded vague promises that we'd get our bags 'on the next flight out'. That turned out to be the next evening, and when I called I was told I would get the bag between 5 pm and 11 pm, or the next day'. Oh, and the ""100 dollar Incidental Expense' they wrote on the paper they issue? Forget about ever seeing it, as it only covers expenses documented by an itemized receipt (Of course they don't tell you this when they promise it). The entire WestJet experience was horrible and I'll never fly this airline again.",Business,3.0,1.0
nan,Economy Class,5.0,July 2018,5.0,5.0,5.0,yes,Mexico City to Vancouver,5.0," |  Mexico City to Vancouver. I had an amazing trip with westjet. From the 1st minute of check in Lucero the agent was so helpful, friendly and kind. I was so impressed with the efficiency and care she and her colleagues gave me. On the plane then I was served by the lead flight attendant who was very professional and helpful too.",Solo Leisure,5.0,5.0
Boeing 737-700,Economy Class,4.0,July 2018,3.0,5.0,4.0,yes,Toronto to Edmonton,3.0," |  I had an amazing service by WestJet when I flew from Toronto to Edmonton. I arrived at my gate only to see that the previous flight hadn’t left yet. Our flight was delayed 1h15 mine but that was because of the weather. I also have food allergies and I went to the gate agent to tell them and they where super accommodating. They told me u could pre board and made in an announcement at the gate and in the plane. The plane was clean, I had a moderate amount of leg room and we where offered free drinks twice during the flight. None of which contained nut products. What also good is that each seat had universal power plug. And if you download the WestJet app you can connect to the wifi and watch movies in their map.",Family Leisure,5.0,3.0
nan,Economy Class,3.0,July 2018,2.0,1.0,1.0,no,Toronto to New York,2.0," |  Toronto to New York. This was our first trip using WestJet and were looking forward to our vacation to Canada. On the way there, our flight was delayed, without warning until the morning of our flight, which was a severe inconvenience, due to the fact that we were already en route to the airport when we were notified early in the morning, the same day. Additionally, an extra layover trip was added to our itinerary, ruining our entire first day of vacation. This was such a serious lack of consideration, especially due to the fact that I am pregnant and with lower back pain. On top of all of that, our flight returning back home was cancelled. We must now wait over 24 hours for the next flight and no one is willing to help with a hotel. I have never had a more awful experience. If they cared at all about their customers or their reputation, they would do something to rectify this and right their wrongs. I will never fly this airline again.",Family Leisure,1.0,2.0
nan,Economy Class,5.0,July 2018,3.0,1.0,3.0,no,Terrace to Vancouver,3.0," |  Terrace to Vancouver. Most of the staff were quite pleasant and helpful. However, one attendant was extremely rude to me, and the 3 customers before me, upon check in. I feel like the one important thing missing in her customer service training skills is the concept of “its not what you say, it’s how you say it.”  Tone and non verbal communication is everything!",Family Leisure,3.0,4.0
nan,Economy Class,5.0,December 2017,4.0,5.0,nan,yes,Calgary to Kelowna,4.0," |  Overall a great experience with Westjet. I flew from Calgary to Kelowna in December 2017 and had no issues whatsoever. The plane was small and older but did the job just like any other would. The staff were very professional and they treat you like family. The pilots also display a professional attitude by greeting you on and off the plane with greeting words and even shaking your hand. I've flown many times with Westjet and they are my no 1 pick for an airline. My only hiccup I had with Westjet was on a flight from Winnipeg to London UK when we were diverted to Montreal, sat on the tarmac for 3 hours in the middle of the night and given nothing as a compensation which I didn't like. Normally, if there is a delay, a discount on a future flight and/or or free meal would have been nice but we received nothing except a small apology. Other than that, I have had no problems flying with Westjet. Prices are fairly competitive and they have lots of seat sales during the year. A word of advice to anyone who flies on a standby buddy pass, try to use it to go to a destination that has daily multiple flights out if it and back such as Calgary to Toronto or Calgary to Vancouver as you are a low priority over guests flying that paid the regular fare. I would advise on not using a standby buddy pass on a flight with lots of layovers or a one flight a day in and out destination as there's a high chance the plane will be full and you'll likely be out of luck or stuck at a stopover location a lot longer than you originally planned. I would pay the regular fare to have high priority in that situation. That's my advice.",Solo Leisure,4.0,nan
nan,Economy Class,1.0,July 2018,1.0,1.0,nan,no,Toronto to Montreal,1.0," |  Toronto to Montreal. I almost always use Air Canada to fly Montreal Toronto round trip, but occasionally I am forced to book on Westjet if it's a last minute booking. Almost every time, they cancel the flight at the last minute. This happened again today; at 2pm they emailed me that my 5pm flight was cancelled and I would be changed to the 8pm. They say it is out of their control, that air traffic control decided that there were too many flights for the number of runways (suddenly!) and that they had to cancel the flight. The Westjet gate for flights to Montreal is literally as far as possible from the main terminal (it is the last gate, about 1 km from the terminal) and once they cancel your flight you have to walk all the way back to the terminal to get customer ""service"", even if you use the internet to agree to the flight change. They can't email you the boarding pass? Nope. Then another kilometre back to the gate. To pass the 3 hours in this hinterland at the end of the airport they have a few vending machines and a tiny Tim Hortons. Forget getting a proper meal or a glass of wine. Westjet is the worst. Because being changed to the 8pm flight made it so that it would have been faster for me to drive from destination than to fly, there was nothing good about it. Re: the food, small Made Good balls of granola, better than AC's pretzels.",Solo Leisure,1.0,nan
nan,Economy Class,4.0,May 2018,1.0,3.0,1.0,no,Toronto to Montego Bay,3.0," |  Toronto to Montego Bay. I have faithfully flown with WestJet for over 20 years. I take at least 10 flights a year on this airline. It has gotten consistently worse for the past 5 years. The onboard services are non-existent even in premium economy. There are no tablets or other in-flight entertainment services. You have to bring your own device and pray that it might work on their low-tech system, otherwise you will sit for the entire duration of the flight with no entertainment options. The food is simply atrocious in spite of the fact that you have to pay top dollar for it. The only good thing is that the cabin crew are reasonably friendly. It is a shame that was once a good airline is now a pitiful joke.",Couple Leisure,1.0,1.0
nan,Economy Class,4.0,January 2016,2.0,4.0,4.0,yes,YVR to SNA,2.0,"I very much appreciate the convenience of the WestJet direct Vancouver flight to Santa Ana Airport (John Wayne). However Westjet needs to be aware of passengers who are bringing their larger pieces of luggage to the gate. On both legs of my trip recently, the flights were completely sold out - this is during a typical slow travel period so this direct flight is very popular. Some passengers are aware of this and do not check in their luggage to avoid the extra fees. I saw massive backpacks and certainly more than one piece of carry-on for several travellers. The airline rep then makes a preboarding announcement claiming that the overheard bin allowance is very limited and they would appreciate passengers checking in their luggage at the gate for free. This is annoying as I followed the rules (as did many others) and paid the check in fees per piece. Westjet needs to be more vigilant and monitor this. Some of the flights on this route have the tv screens, others do not. Seats are crammed in Economy and the back recliner buttons do not necessarily work - this is probably an advantage. Beverages are served in plastic glasses smaller than hotel bathroom cups, but it is nice that prior to descending, additional water is offered. For an Economy flight, 2.5 hours is tolerable and the staff is typically cheerful. The counter service at Santa Ana is very helpful.",Family Leisure,4.0,4.0
nan,Economy Class,5.0,February 2016,3.0,5.0,3.0,yes,YYZ to CZM,5.0,We flew on WestJet on January 13th from Toronto to Cozumel. Due to weather there were problems landing. The pilot tried 3 times to land but was not successful. We then flew to Cancun and they got more fuel and then they tried again for 40 minutes but again unsuccessful because the airport was shut down. We then returned to Cancun. The pilot kept us informed the whole time which was very reassuring. They rented buses to take us to the Marriott for the night and gave us all a $60.00 food voucher. We were picked up at 11:00 a.m. the next morning and then flew us to Cozumel. We must commend WestJet for their handling of this situation they were absolutely amazing!  Thank you WestJet for turning a potential bad situation into something we will treasure for a very long time.,Couple Leisure,5.0,nan
nan,Premium Economy,5.0,January 2016,5.0,2.0,nan,yes,YOW to YVR via YYZ,5.0,"I was on a WestJet connection from Toronto to Vancouver (origin Ottawa) on January 14th on the 10:30 am flight when I experienced exceptional service. I was in seat 1F in the Plus seating. The one member of the cabin crew for our section (Patrick) was extremely attentive and kind. I had a very bad cough that I couldn't shake and staff ensured that I had bottled water or hot tea (he even refilled my tea when I was sleeping so I had it anytime I coughed and woke!) as well as offering me cough drops (Buckley's - they taste so awful but they really work!). This cabin staff member managed to start and hold a conversation with everyone who came up, myself included. The only reason I bumped it down to a 9 is because on my origin flight we had to wait approx. 30 minutes after landing and arriving at the gate because it was broken and they couldn't fix it so we had to switch gates.",Solo Leisure,4.0,nan
nan,Premium Economy,1.0,January 2016,1.0,4.0,nan,no,YXJ to LIH via YVR,1.0,"I normally do not complain about airlines and their service, however, after flying Westjet service Vancouver to Lihue return, I feel compelled to express my opinion on the cabin crew of both legs. Front end crew had poor attitudes on both flights. On the 1st leg the Cabin steward was extremely grumpy with any guests that stood on his carpeted area at the front of the cabin while being next in line for the bathroom, which would force these people into the other people's sitting area. This happened numerous times throughout the flight. When the front end cabin crew exchanged areas with the rear crew briefly, this was not an issue. Although having paid extra money for 4 to be seated in the ""Plus"" section both directions, there was apparently only one blanket on the plane, and it had just been handed out to row 8. I'm sure it wouldn't break the bank for WestJet to ensure that there is always enough blankets on the plane for people seated in Plus. When my husband asked for a glass of wine (the 1st) only 3 hours into the flight, he was told that the alcohol cutoff time was 2:30 am. How convenient it was 2:30 am! Perhaps it was an inconvenience for us to interrupt her knitting. Having flown many airlines internationally, we have never heard of such an alcohol policy. Please inform me if this does exist. Will I fly WestJet again - yes, but only on regional flights. However, never again on a flight over 2 hours, and never will I pay for a ""PLUS"" seating again. It's not worth $$$ for bad attitudes, poor service and amenities.",Family Leisure,1.0,2.0
nan,Premium Economy,2.0,January 2016,1.0,3.0,1.0,no,YYC to YXX,1.0,"WestJet Plus seating is not worth the price. We flew from Calgary to Abbotsford last week. My wife's first experience in Plus seating. Her points are very valid. Seats too small, not like Air Canada who have spacious seats. Take out the ridiculous middle seat, and put in wider seats where you can comfortably sit together. I have to agree the seat upgrade is not worth the price. The menu is. I had much higher expectations of this upgrade concept to compete with Air Canada. WestJet doesn't get it yet, as a business traveller flying once a week across Canada and the USA, I will choose Air Canada. ",Business,1.0,nan
Boeing 737-600/-700,Economy Class,5.0,December 2015,4.0,5.0,nan,yes,LGA to YXE via YYZ,5.0,"Easy online check-in and baggage drop at the airport. Both flights departed and arrived on-time. Comfortable seats, clean cabin and most important caring and attentive cabin crew. Baggage was delivered in Saskatoon about 20 min after we arrived at the stand. Would highly recommend WestJet and certainly would fly with them again.",Solo Leisure,5.0,nan
nan,Premium Economy,1.0,December 2015,1.0,1.0,nan,no,Vancouver to Calgary,2.0,Very disappointing flight. The crew was unprofessional failing to provide even one uninterrupted announcement due to constant giggling and side discussions during the announcements. Flight arrived early in Calgary but remained on the Tarmac awaiting a clear airbridge. The plane is still waiting some 20 minutes later as I write this.  Will be avoiding this airline in the future unless I see some kind of action to improve their service. The plane had no entertainment system.,Solo Leisure,1.0,1.0
Boeing 3700,Economy Class,1.0,December 2015,nan,2.0,nan,no,Phoneix to Calgary,1.0,"After a three day business trip to Phoenix, I flew roundtrip with WestJest. I sat in the row 4, just behind premium economy class. I was not aware that little dogs with there owners could fly in the cabin. There were two dogs on the flight and one dog would not stop barking. Not one of the staff would say anything to this lady, whose dog would randomly bark every 45 - 90 seconds. I got up after 30 minutes to complain, as if this was a human causing a disturbance on a plane the staff would have no problem telling them to be quiet. However I was told to make a complaint with WestJet. Nice work, I will not fly with WestJet again - they are always late or oversold. We were 1 hour late on the way there and 45 minutes late back. Not one apology.",Business,2.0,nan
nan,Economy Class,4.0,December 2015,3.0,5.0,5.0,yes,Calgary to Cancun,4.0,"No issues at all with WestJet Airlines from Calgary to Cancun. The plane was packed, but staff did everything in their power to make our flights pleasant. We bought an onboard sandwich and a cheese tray. Both were fresh and tasty. One of our flights was on the newer planes, requiring the Westjet ap on our iPads if we wished to watch movies. Luckily we had read about this on their website, unlike other passengers. People, you can't be angry for being ignorant. There was a large selection of movies and tv shows.",Couple Leisure,4.0,5.0
Boeing 737-700,Premium Economy,3.0,November 2015,1.0,1.0,1.0,no,YYZ to LAS,3.0,"Very messy boarding at Toronto's Terminal 1. The gate is behind doors that are supposed to be opened 45 minutes before flight times. These doors did not open until 30 minutes before. Boarding was a haphazard affair with Plus Seat passengers called after emergency row and children and persons requiring assistance, and Zone 1 passengers. The new WestJet Airlines Plus seating isn't worth the extra money. Same seats with the middle seat blocked off. Don't be fooled by the Plus Seating boast of Premium food and drink. The food choices are negligible and are all basically sandwiches. I got a cold ham and cheese croissant with two cookies. Alcohol is also included but limited to cheap wine and beer and a few basic liquor brands. Cabin crew were pleasant enough but became tiresome with the lame jokes. For this they gouged me for over $900.00 one way. For less than that I returned via Chicago in First Class on United with more comfortable seats and better food and drink.",Solo Leisure,1.0,1.0
Boeing 737-800,Premium Economy,4.0,February 2016,3.0,5.0,3.0,yes,TPA to YYZ,3.0,"Tampa to Toronto in Plus fare class. Flight staff pleasant, food selection the usual feed box (fruit salad, Nanaimo bar) plus sandwich, Kit Kat, and beverage. Would like to see a little more variety with the sandwich types. Row 1 (or 2, depending on aircraft type) bulkhead window seat always my first choice. Lots of leg room, window seat and no crawling over aisle passenger. While no under-seat storage, always over-head room available due to priority boarding, and a bulkhead wall pouch to store headphones, smart device, etc. As discussed in a previous review, priority security screening is a mystery to most WestJet staff. Fortunately, at TPA, I had to reprint my boarding pass, no line-up at counter and the extremely friendly and helpful staff made sure I had the priority screening designation on the pass. As an aside, Tampa is a model airport and a pleasure for which to travel to and from.",Solo Leisure,3.0,nan
Boeing 737-800,Premium Economy,5.0,March 2016,3.0,3.0,4.0,yes,YYZ to MBJ,3.0,"Toronto to Montego Bay, family of five, Plus fare class. Flight was the typical WestJet standard - for us, anyhow. Flight staff very efficient and pleasant, went out of their way in assisting our three young kids. Extra treats all around on this flight. Flight was uneventful and on time. The inflight entertainment performed flawlessly and kept the kids engaged. Decent selection of films and TV shows. As covered as part of an earlier review, ground staff hassle at YYZ regarding priority security screening was the only blemish on an otherwise problem-free WestJet experience.",Family Leisure,3.0,nan
Boeing 737-600,Premium Economy,4.0,February 2016,3.0,3.0,4.0,yes,YYZ to TPA via YOW,3.0,"Toronto to Tampa via Ottawa. 'Plus' fare class both segments, operated without issue, on time. Staff efficient, affable and accommodating. Have never experienced a negative in-flight encounter flying WestJet. The Plus fare class continues, in my mind, to be WestJet's attempt at 'premium economy.' I normally book it from the get-go as opposed to waiting to 24 hours prior to flight and checking for availability at time of online check-in , although there is a substantial saving if one is able to snag a Plus seat at that point; well worth it. Is Plus' class worth it at full fare? Obviously I do since I'm willing to pay for it at time of booking. However, would like to see an improvement to the on-board food offered for flights to Florida or the Caribbean. Despite fairly strong satisfaction with WestJet, an area of frustration for me continues to be their ground staff's confusion regarding priority security screening for Plus fare passengers. In my past several flights, there has consistently been a lack of understanding and confusion as to whether priority security screening is, in fact, a Plus fare benefit; on a most recent trip out of Toronto, a WestJet staff member argued with me at the airport that it was not available to my family and me even though I presented him a print-out of the WestJet web page that clearly said it was (learning from past experience). Despite the hardcopy evidence, this staff member unceremoniously dismissed me, stating the site is wrong and I was out of luck (although when I explained it at priority security, surprisingly my family was allowed through, saving us considerable time in the process). I had even contacted the WestJet call centre prior to the day of flight to confirm for my own sanity; the call agent had to visit their own web-site to confirm the benefit applied (which they did confirm, however, I sensed that was news to them). As I mentioned above, this issue has persisted on multiple occasions. On the return flights, gate staff in Tampa admitted to the confusion, at both the check-in and gate check counters, even going so far as to telling me for future trips departing Tampa to visit the main check-in counter to get a priority stamp even if already checked in online. Strange. I intend to contact WestJet's corporate office to seek clarification once and for all and to understand if WestJet management are aware there is a general lack of understanding for a benefit that is clearly stated in their Plus fare information. Despite the above, WestJet continues to be my airline of choice.",Solo Leisure,3.0,nan
nan,Economy Class,5.0,January 2016,5.0,5.0,nan,yes,LAS to YYC,5.0,We flew from Las Vegas to Calgary return. We both required Wheelchairs on the 2 flights and we both received great assistance from the Westjet staff in both Las Vegas and Calgary airports. We would highly recommend Westjet to any of our friends and family!,Couple Leisure,5.0,nan
Boeing 737,Economy Class,3.0,February 2016,2.0,5.0,1.0,no,YYZ to YVR,1.0,"Toronto to Vancouver with Westjet - legroom has gotten noticeably smaller in the past few years. I'm 6'6"" and had the most uncomfortable flight. Not since the days of Canjet have I been that cramped. I hadn't flow Westjet in a couple years, mainly because I prefer the movie selection on Air Canada, but I do remember being able to fit into the seats, now I can't anymore. If you're tall, fly Air Canada (not Rouge), you will be uncomfortable on Westjet.",Solo Leisure,3.0,nan
Boeing 737,Economy Class,5.0,February 2016,1.0,5.0,1.0,no,PHX to YYC via YYF,1.0,"Have flown WestJet three times and have had issues all three times. This last trip on WestJet from Phoenix to Calgary via Penticton is the last time I will fly with this airline. I must say the flight crew were very good and accommodating and the same for all the ground people in Calgary and Phoenix. Booked and paid for tickets last August and then they cancel our return flights about two weeks before departure without any word from them. Read about the cancellations in our local paper and then call our travel agent and find out we have been rebooked on a flight leaving Phoenix at 11pm arriving in Calgary at 2.30 am laying over in Calgary until 2 pm. This was unacceptable to us and had our travel agent arrange for different return flights and all that was available closest to our original schedule was return flights on Feb 18 instead of Feb 20. Lost 2 days prepaid car rental and 2 nights prepaid hotel. Thanks WestJet, never again.",Couple Leisure,2.0,nan
Boeing 737-800,Economy Class,5.0,December 2015,4.0,4.0,5.0,yes,YYC-LAS,4.0,"I flew on a WestJet Boeing 737-800 from Calgary to Las Vegas. The service was great, and you don't have to pay for movies and TV anymore (on a 737-800, that is). Just download the WestJet app and you connect to WestJetConnect (their new wifi) and watch free movies and TV shows. Unfortunately, you have to pay to access the internet. WestJet has always been my favourite airline.",Family Leisure,5.0,4.0
