Aircraft,CabinFlown,CabinStaffService,DateFlown,FoodAndBeverages,GroundService,InflightEntertainment,Recommended,Route,SeatComfort,Textchunk,TypeOfTraveller,ValueForMoney,WifiAndConnectivityBoeing 787 / Embraer,Economy Class,3.0,July 2018,3.0,3.0,3.0,yes,Entebbe to London via Nairobi,3.0," |  Entebbe to London via Nairobi. Overall a very average experience, with staff generally going through the motions, medicore food, limited drinks and three-star entertainment. Excellent baggage allowance and quick connecting times make this an acceptable option on the Uganda - UK routing if the price is right. My headphone socket was broke on the day time NBO - LHR flight which was really disappointing. No sparkling water available nor Amarula. Duty free items requested not available (and I tried to order in advance which also did not work properly). Totally full flight London - Nairobi departed with a 90 minute delay on the tarmac whilst awaiting ATC issues. Captain welcomed us with a 'Good Morning' (at 7 p.m. this was slightly disconcerting) and gave us very limited information about the delay. Cabin crew went round with water on one side of the cabin - but not on ours. On time arrival into Entebbe and luggage out quickly (reassuring considering the delay in London making the connection tighter than it should have been). A cooked breakfast on either the early morning arrival into Nairobi or the 8 a.m. arrival into Uganda would have been really welcomed. Nairobi still a much better transit airport than Addis, but both carriers way short of the standards set by Qatar Airways, Emirates and KLM which also compete on this route at good prices.",Solo Leisure,3.0,nan
B787-8,Economy Class,4.0,July 2018,4.0,1.0,4.0,no,Johannesburg to Accra via Nairobi,4.0," |  Johannesburg to Accra via Nairobi. My luggage went missing in Nairobi. Took three days to have my bags arrive in Johannesburg. When I got my luggage zips were broken, locks removed and my some of my stuff were not inside. ",Family Leisure,4.0,nan
nan,Economy Class,nan,August 2017,nan,nan,nan,no,Amsterdam to Cape Town via Nairobi,nan," |  Amsterdam to Cape Town via Nairobi. It took Kenya Airways more than 4 days to cancel the flight I had booked for November 2018, because they found that the price was too cheap. In their app it is still confirmed. I will never fly this airline because they are just not reliable.",Couple Leisure,1.0,nan
Boeing 787-8,Economy Class,1.0,June 2018,1.0,1.0,1.0,no,Bangkok to Guangzhou,1.0," |  Bangkok to Guangzhou. I am writing to complain the poor services provided Kenya Airways. It is the most disappointed and frustrating journey.  According to the flight information, the aircraft should have taken off at 3:00pm in Bankkok and arrived in Guangzhou at 7:00 pm on that day. However, once we checked in, we were told that the flight was delayed without detailed reason provided. Neither ground staff nor cabin crew could confirm the exact boarding time. We had been waiting restlessly for more than 5 hours without any notice or compensation. That is unacceptable. It was until 8:25 pm that the flight took off, which was 5 hours and 25 minutes later than it was supposed to be. That ruined our trip on that day. In addition, during the flight, one of passengers sitting behind me kept asking cabin crew for alcohol, it astonished me that the cabin crew continued to offer her more alcohol. Consequently, that overly-drunk lady was  out of control, singing and laughing loudly. It annoyed all the other surrounding passengers and adversely affected the safety of the flight. I tried to summon assistance from the crew. It surprised me that the crew ignored my call for four times. I cannot tolerate such bad behaviour. This is the worst flight and airline that I have ever taken. I will never choose Kenya Airways for any single trip in future.",Family Leisure,1.0,1.0
nan,Economy Class,3.0,July 2018,2.0,2.0,2.0,no,Heathrow to Lilongwe via Nairobi,3.0," |  Heathrow to Lilongwe via Nairobi and  30hours later ther luggage doesnâ€™t arrive at the other end. The next day I  ring the airport and told  luggage will be on the next flight, from Heathrow and will arrive in Lilongwe and I can collect from there. I pay 70 dollars for a cab back to the airport as a single young female, to be told, your luggage didnâ€™t reach Lilongwe as it had to stay in Nairobi airport as there wasnâ€™t any room on the flight! Not just your bag but 17 others! But why this wasnâ€™t priority as they didnâ€™t get it right the first time , I donâ€™t know! To be told the next day that you would get a telephone call to arrange pick up of your bag, simple right? No. You arrive at the collection area to pick up your luggage and itâ€™s looked and because itâ€™s sun youâ€™ll have to sit and wait. 6.45-9 am still no one? And when you go and look for that person who knows you are waiting, she is sat having breakfast! It is now 5 days later and still no bag. The staff have been next to useless except for one kind soul who may or may not deliver, watch this space.  The latest is they will deliver her bag tonight or tomorrow 6-7 days after. This is not acceptable what is so difficult. ",Business,1.0,2.0
E190,Economy Class,4.0,June 2018,5.0,5.0,nan,yes,Nairobi to Cape Town via Livingstone,3.0," | Nairobi to Cape Town via Livingstone. We took a few days' break in Livingstone between Nairobi and Cape Town, and so experienced two separate KQ flights. Both check-ins and boarding processes were smooth and easy - except that on the first flight some passengers were allowed to carry huge quantities of hand luggage on board, causing some chaos and frayed tempers. The seats were a little narrow. On the first flight the breakfast served was expansive, with three choices offered in economy class; the lunch on the second flight was also good. The first crew were rather brusque and unsmiling -- but this was made up for by the friendly crew on the second flight (which was much less full). On both flights the crews served all the food and drinks in a few pass-throughs in the first hour, and then disappeared until landing. The flights operated on time and luggage was quick to appear. Overall a pleasant experience.",Couple Leisure,4.0,nan
nan,Economy Class,2.0,May 2018,3.0,1.0,nan,no,Johannesburg to Kilimanjaro via Nairobi,2.0," |  Johannesburg to Kilimanjaro via Nairobi. Let's start with the flight out of Johannesburg being delayed such that I missed my connection from Nairobi to Arusha at 6:30 that evening. Upon arrival I went to the Kenya airways desk to arrange the next flight to Arusha. They proposed an 11:50pm flight. This flight actually would stop in Zanzibar first, thus arriving in Arusha at 3:10 am. I was aware of that flight. I had to ask if there was an earlier flight - hen and only then did the staff say, ""There is a Precision Air flight at 10:50pm."" I replied ""and is that a direct flight"". She answered ""yes"". I then had to connect the dots for the Kenya Air staff (as obviously they are not trained to use common sense or think of their customers at all). I politely said "" and doesn't Kenya Airways run Precision Air?"" At that point the stars aligned and she asked if I would prefer that flight, well yes, I would prefer getting to my lodge 3 hours earlier as it would be the middle of night! It gets better. I needed to return a day earlier so my agent called Kenya Airways on the cost to change - the cost they quoted was more expensive than just going on Expedia and buying new tickets from Arusha to Johannesburg on Kenya Airways. I just went ahead and bought all new tickets home to Johannesburg on a different airline. Never fly them again. They failed miserably.",Business,1.0,nan
nan,Business Class,4.0,April 2018,nan,4.0,nan,no,Bangkok to Nairobi,4.0," |  I was scheduled to fly business class on Kenya Airways from Bangkok to Nairobi, but unfortunately, I had to cancel the flight for business reasons. I duly filled the forms for refund, got a confirmation from Kenya Airways on April 11, but no refund was made until now, ie almost 2 months later; I got in contact with customer service, where I was told that they have a backlog and are working on it; no date for the refund could be obtained. This is very annoying, as we are speaking about a substantial amount of money and this means that Kenya Airways is now on my private black list.",Business,1.0,nan
nan,Economy Class,1.0,May 2018,1.0,2.0,2.0,no,Entebbe to London via Nairobi,2.0," |  Entebbe to London via Nairobi. I recently spent some time volunteering in Uganda and whilst I was there broke and dislocated my ankle quite badly. I needed to return home a few days earlier than planned, to undergo surgery, so rebooked a flight at additional cost and requested wheelchair assistance. Upon arrival at entebbe airport, they seemed unaware of my situation despite having been informed, but did sort out some help. I also asked if it would be possible to be upgraded if there were spare seats in business class as it was important to keep my leg, which was in a cast, elevated as much as possible and particularly during a flight when it may swell more. The check in desk confirmed there were seats but that they couldnâ€™t upgrade me there but that it should be possible in Nairobi where I would change to take an 8.5hr flight to London. At the gate in Nairobi I once again asked if it would be possible to sit in business class so I could elevate my leg. The man on the desk said that he couldnâ€™t do anything without invoicing me but it was his attitude rather than refusal that really annoyed me. He was completely unsympathetic, laughing at me and treating me as if I was just trying to get some free perks. I was clearly in pain and the most annoying thing was that the flight was actually half full. As a goodwill gesture heâ€™d â€˜upgradedâ€™ me to the seats with more legroom but as I explained to him when he did so, that would not help as there was nothing to rest my leg on, so it was still dangling down, putting pressure on the ankle and causing swelling. This seat was also very awkward to get in and out of due to the way the screens came out of the seat from the side and had no additional room to the side as the armrests were fixed. However, it did provide me with a great view of the business class section which was virtually empty, and I was galled to see there were several passengers in economy with at least 4 seats to themselves, enabling them to lie down for the entire flight and had they so wished to elevate their leg! At no point had the man on the desk mentioned that there were many spare seats which would have enabled me to elevate my leg quite comfortably, despite me explaining the issue. None of the air hostesses expressed any concern for my situation throughout the flight despite my obvious discomfort and attempts to create a platform from bags and cushions to rest my leg on. Whilst I understand that other people have paid for the benefit of a business class seat, I felt that in extenuating circumstances such as this, the airline could have made a goodwill gesture to ensure their passengerâ€™s wellbeing and comfort. I will not be recommending them to others and certainly wonâ€™t be rushing back to travel with â€˜the pride of Africaâ€™ any time soon. It topped off a disappointing end to what would have been a fascinating trip, but has left a sour taste in my mouth for this particular airline.",Solo Leisure,2.0,nan
Boeing 787-8,Economy Class,5.0,May 2018,4.0,4.0,3.0,yes,Nairobi to Dubai,4.0, |  Nairobi to Dubai. I would like to commend the crew on a pleasant flight. The service was exemplary. The cabin staff in our section was courteous and her service good. The flight was very smooth & managed to sleep which I find difficult to do in most planes.,Family Leisure,3.0,nan
nan,Economy Class,nan,nan,nan,nan,nan,yes,nan,nan,LUN-LLW in Economy. Adequate for a 1 hr trip. FA were friendly; there was a quick distribution of nuts and drinks; and PTVs. I've always found that you when you ask for a canned drink you get given two of them - a small touch that I've always liked.,nan,4.0,nan
nan,Business Class,nan,nan,nan,nan,nan,yes,nan,nan,I fly Kenya very often (almost once every 2 weeks) and usually Business on the route Nairobi-Mombasa. I find the staff (both ground and flight attendants) quite friendly. The aircraft are usually in good condition usually ex KLM 737s. The domestic flight food quality is quite poor. The real problem with KQs domestic flight is the lack of a lounge in the domestic side. JKIA is KQs hub but it looks more like an outdated bus terminal. Nairobi needs urgently a new airport.,nan,4.0,nan
nan,Business Class,nan,nan,nan,nan,nan,no,nan,nan,Flew KQ in Business NBO-JNB using points. We were on the 8pm flight. Check in was very easy with no queue. The lounge in NBO is small and crowded. We boarded by bus (cram as many people in as you can). On board (737-800) only 5/16 seats occupied. Food was good. There was one starter (no choice) choice of 2 main courses and then desert or cheese (pre-plated). Wine was excellent. Service was good. Glasses were always topped up. We never use KQ IFE. Always carry our own iPad and BOSE noise cancelling headphones. KQ gave a basic amenity kit. Arrival into JNB was 30 mins early. Luggage took 15 mins to come out. Overall pleasant experience.,nan,nan,nan
nan,Economy Class,nan,nan,nan,nan,nan,no,nan,nan,It was a Mombasa-Nairobi flight schedule to leave at 1440h so we arrived at the airport by 1315h and checked in they did not say one word to us about the delay. They didn't tell us anything but simply put it up on the board after we had waited for 2 hrs already without any announcement or explanation. Of course it did not leave until 1840h. KQ will allow you to book and check in then they will not service the flight leaving you effectively grounded and waiting for up to 5 hrs for a local flight. Pure inefficiency.,nan,nan,nan
nan,Economy Class,nan,nan,nan,nan,nan,no,nan,nan,LHR-NBO. Had read on here from many posters that the IFE is grossly unreliable and not surprisingly I struck the same with the entire side of the plane without IFE. No compensation but not=too bothered as was an overnight flight and I slept. Arrival procedure in Nairobi bordering on chaotic with visa process etc and baggage hall a shambles but not fault of airline. Having made the choice over BA/VS to see something different I was satisfied staff were surprisingly good.,nan,nan,nan
nan,Economy Class,nan,nan,nan,nan,nan,no,nan,nan,The seats were neat and clean and food was excellent. Our flight from Johannesburg to Nairobi couldn't land at Nairobi. The plane landed at Mombasa where passengers were kept in the airport for 4 hrs without food/water. Kenyan Airways and Airport staff were not able to manage angry passengers. We were taken to Nairobi the next morning. I missed all my schedules. Staffs are not prepared they lack co-ordination with each other.,nan,nan,nan
nan,Business Class,nan,nan,nan,nan,nan,no,nan,nan,Staff completely uninterested and uninformed especially ground staff who upon being confronted with the slightest challenge turn their back and leave. Always delays very filthy toilets overpriced tickets especially within Africa. Business class lounge is average.,nan,nan,nan
nan,Economy Class,nan,nan,nan,nan,nan,no,nan,nan,NBO-FIH. Check-in at the Jomo Kenyatta airport was slow as usual with long lines starting outside the terminal. Flight on time on a 767-300 for some reason IFE was not available but I did not mind as the flight was 3 hrs. A nice hot breakfast was served after take off by a very friendly almost all male cabin crew. Great flight overall  with good standards and professional crew for an African airline.,nan,nan,nan
nan,Economy Class,nan,nan,nan,nan,nan,no,nan,nan,"London to Nairobi - excellent flight good service comfortable seat decent leg room (I am 5'10"") food could be better good entertainment system. I would happily use them again. Onward to Mombassa also fine delayed coming back at Mombassa - not airlines fault - but connection held and most of time made up and free refreshments when delayed so overall did well despite difficulties.",nan,nan,nan
nan,Economy Class,nan,nan,nan,nan,nan,no,nan,nan,JNB-NBO-JNB. This trip showed both the good and average sides of this airline. JNB-NBO was on time in-flight service was good and the 737-800 used was clean and comfortable. NBO-JNB was a different story. Upon arrival at Nairobi Airport I was informed that I had been re-booked on a later flight instead. As a result the boarding process took a long time and the flight was delayed about 30mins. The 767 used on this leg was in good shape with a smart blue leather interior and a good seat pitch. The IFE was a bit dated with the old-style projector. Meal choices were a bit odd for breakfast but the service was prompt.,nan,1.0,nan
nan,Business Class,nan,nan,nan,nan,nan,no,nan,nan,"Nairobi-London. Lounge in Nairobi was small and food poor but for Nairobi Airport standards it was ok. Very surprised they only started boarding 25mins before departure (usually it's much earlier) but we managed to leave bang on time. Welcome by Cabin Crew was warm. Seat was comfortable in sitting position. Seat nice and wide. When converted into a bed it's angle is 170 degrees but you can't stretch your legs fully (and I'm only 5'8) which means any position for a long period of time is uncomfortable. In flight entertainment was poor - AVOD but very limited selection of films. Lots of features seemed to be broken - whether it was the control or the individual system it was unclear. Food was a mixture - lunch was excellent beautifully presented but the Afternoon tea (which they copied it seems from BA) was appalling - sandwiches were dry rolls with slabs of butter and unidentifiable filling. Scone was cold and dry. Cabin Crew were good but not excellent - they were courteous and warm but very slow which was disappointing as the cabin was almost empty so they had only a few passengers to serve and it still took an age for them to respond to any request or to complete each round of the meal service. I would be very frustrated if the cabin had been full. Disappointingly there was absolutely no interaction with pax from crew. Overall the flight was reasonably comfortable and smooth but not good value for money. As it was an award ticket I can't complain too much but I would certainly not pay a Business Class fare for the ""Premium"" product Kenya Airways offers.",nan,1.0,nan
nan,Economy Class,nan,nan,nan,nan,nan,no,nan,nan,Nairobi-London. As me and my wife are both wheelchair passengers (for which we charged $10 each by the Nairobi office it was a very disappointing experience at London Heathrow. There were no wheelchairs on arrival at Heathrow. I had to wait 40 mins before the ground staff could arrange for a wheelchair or a buggy. In the end we had to walk half the distance with one wheel chair for me (no wheel chair for my wife! although $10 was paid). There was no inflight entertainment I tried to talk to the purser but he/she did not bother. We have flown Kenya Airways many times and competition airlines as well. Seems that the airline in looking for profits is ignoring the comfort of passengers (although a shareholder of the company I do not expect the service to be comprised) to support our national airline. Another area I would like to point out is no refresher kit is given to Economy Class passengers. If I had known we would have brought ours and create profit for the airline.,nan,1.0,nan
nan,Business Class,nan,nan,nan,nan,nan,no,nan,nan,Check in was chaotic and the ground manager seemed more concerned about whether the flight was full than the brusque attitude of the check-in staff even at Business check-in. Onboard the seats were comfortable and the service of the business crew was attentive without being over powering. The drinks were flowing the food high quality with an excellent breakfast. The journey was smooth. The blanket could have been better and the utility set was not to the standard I would expect from Business. The entertainment was ok but there was insufficient choice. Enjoyed the flight but still improvements that could be made.,nan,nan,nan
nan,Economy Class,nan,nan,nan,nan,nan,no,nan,nan,FIH-NBO-CDG. All flights on time I was surprised that they did not make any welcome announcements before takeoff very unusual. Food was great on the first leg (737-800) service was quick and efficient. The Nairobi Jomo Kenyatta airport is getting better every day with new seating areas. Boarding was slow on the Paris flight food good with a new KQ menu a nice touch for Economy Class passengers. The cabin was however too cold so passengers did not have a good night sleep. Good flights overall and friendly staff.,nan,nan,nan
nan,Economy Class,nan,nan,nan,nan,nan,no,nan,nan,NBO-AMS. Plane scheduled to leave at 8.10am. At 12pm no boarding no announcement. Passengers started asking questions and an announcement came that the crew had not arrived. We ended up leaving more than 7hrs later. The TV on the plane did not work making an already 8 hr long journey almost unbearable.,nan,nan,nan
nan,Economy Class,nan,nan,nan,nan,nan,no,nan,nan,LHR - NBO return on a B777. Departed and arrived on time. No problems with bags. The food was average with a full meal followed later by a snack going to NBO. On the trip north a small snack at the start of the trip and a small breakfast at the end. The cabin crew was fine. The plane was in good condition. The entertainment system had limited range of programs. The only major issue was the boarding procedure at Nairobi airport. The passengers were squeezed into a tiny departure lounge for a long time. The boarding process was a mess with announcements and ground staff contradicting each other. I would happily use them again.,nan,nan,nan
nan,Economy Class,nan,nan,nan,nan,nan,no,nan,nan,NBO-AMS on B777. Mixed experience. We were almost 1 hr late departing Nairobi with no explanations or apologies. Arrived in AMS almost on time. Breakfast was average with a hot lunch which was quite good. IFE was a bit unstable but kept me entertained. Had an onwards connection in AMS with KLM-CPH that I made but my luggage didn't. Delivered next day at my home in Copenhagen.,nan,nan,nan
nan,Business Class,nan,nan,nan,nan,nan,no,nan,nan,JNB-NBO. Cabin crew were warm and friendly. Food was very good IFE was average but they can do much better. The duty free was surprisingly good.,nan,nan,nan
nan,Economy Class,nan,nan,nan,nan,nan,no,nan,nan,Antanatarivo to Niarobi. 4 hr flight left on time. Service was good and cabin staff attentive. Food was average with ok leg room. Cabin and toilets clean. First time on KQ and was pleasantly surprised. However this was shorthaul - longhaul experience was awful.,nan,nan,nan
nan,Economy Class,nan,nan,nan,nan,nan,no,nan,nan,Nairobi to LDN. Economy Seat 33C and 24B. Boarding a little chaotic and some sat in the boarding lounge for 90 mins. Staff were sufficiently attentive. Food adequate. AV worked and toilets very clean. Arrived on time. Seating 24B was very poor no leg room and uncomfortable. Moved to 33C aisle seat limited recline and impossible to sleep. Avoid KQ Economy long haul short haul however is good.,nan,nan,nan
nan,Economy Class,nan,nan,nan,nan,nan,no,nan,nan,We were quite disappointed by our first experience of Kenya Airways on our recent trip from London to Nairobi - my husband's TV wasn't working and although we asked for help that was simply ignored. The staff looked bored and were not very attentive. You had to be quick to say that you wanted coffee/tea as you only had one chance much too early during dinner. The food wasn't great but edible. I was also annoyed by the fact that they didn't encourage other passengers to put their seats forward when food was served - that meant we had even less space whilst having our breakfast. The flight back was not quite as bad but still I felt the staff could have made more of an effort (occasional smile would be nice). The thing I would really like to criticise was the boarding procedure at Nairobi airport - we were asked to board 1.5 hours before departure which meant that we were squeezed into a tiny departure lounge for that length of time - the boarding was a mess with the announcements and ground staff contradicting each other - despite the early 'boarding time' we still managed to leave late.,nan,nan,nan
nan,Economy Class,nan,nan,nan,nan,nan,no,nan,nan,Cabin crew in Economy not very communicative. They seem to forget it is their job to be polite and helpful. Flying in Economy is stressful especially when most of the time the entertainment system doesn't work toilets are left dirty towards the end of the flight and if you want duty free items you have to watch for when they come by or you will miss them. Food was awful with very limited choice. Tea and coffee service is poor.,nan,nan,nan
nan,Economy Class,3.0,nan,5.0,nan,2.0,yes,nan,3.0,LHR-NB0-HRE return - B777 and B737-800. The aircraft was modern but seemed a bit tired inside the cabin. Boarding was efficient from LHR but chaotic at NBO the IFE had very limited choices. The cabin crew were semi efficient but at times seemed rude however I found the meals to be good and their complimentary gifts for my kids made for a pleasant flights indeed. Seating and legroom is fair. Overall a decent airline I would use again.,nan,3.0,nan
