Aircraft,CabinFlown,CabinStaffService,DateFlown,FoodAndBeverages,GroundService,InflightEntertainment,Recommended,Route,SeatComfort,Textchunk,TypeOfTraveller,ValueForMoney,WifiAndConnectivitynan,Economy Class,1.0,May 2017,nan,1.0,nan,no,Guadalajara to Vancouver via Mexico City,3.0," |  Guadalajara to Vancouver via Mexico City. I've been flying with WestJet for years and been satisfied with their service. Recently, however, they have chosen to partner with AeroMexico and promote their flights on their site. However, AeroMexico’s standards and policies are nothing like WestJet’s. My husband is Mexican, and they refused to accept the documentation we received from the Embassy of Canada and didn’t allow my husband on the flight. They stranded us in Mexico City – at 2 am with a baby. As a result, what was supposed to be an overnight trip ended up being a three-day nightmare. We were forced to purchase last minute flights with a domestic airline to Cancun to catch a flight from WestJet that flew to Canada. WestJet's policies are up-to-date with Canada's policies and we had no issues flying into Vancouver, or with Immigration when we landed. After discussing this with WestJet’s Help Desk and contacting them through email, explaining the nightmare and asking for a refund for the AeroMexico tickets, they came back saying they do not have access to the funds so they cannot reimburse me and that my issue is with AeroMexico alone. They said it does not involve them in the least. AeroMexico refuses to resolve the issue. I passed that information along to WestJet, but they again said it’s no their issue. Now this is a company WestJet have chosen to partner with and promote these flights on WestJet website. WestJet customers trust you are going to partner with a company that will provide a service that is paid for, and in the least, have accurate understand of the policies of the country they fly into.  We have lost all respect for both companies and will avoid flying with either in the future.",Family Leisure,1.0,nan
nan,Economy Class,2.0,July 2017,nan,1.0,nan,no,Phoenix to Calgary,2.0," |  Booked a flight from Tucson to Calgary through American Airlines, turns out the connecting flight from Phoenix to Calgary is operated by WestJet. Not allowed to check in online. Couldn't even check in at the airport ticket desk for the connecting flight! Arrive in Phoenix and there's no gate posted on the departure board! Wandered through the terminal and no gate attendants could tell us the gate because WestJet has their departure board located at the gate! They have to be the least customer oriented airline I've ever flown!",Couple Leisure,1.0,nan
Boeing 737,Economy Class,5.0,July 2017,4.0,5.0,nan,yes,Calgary to Kelowna,5.0," |  Calgary to Kelowna. We came in international via Calgary, actualy had a later connecting flight booked but could easily change the booking catching an earlier flight to Kelowna. Though they charged us 100 CAD each for the change, we were glad we had this service provided and organized quickly. WestJet staff at the airport was friendly and helped us on instant. Onboard services were minimized due the short flying time but we experienced it as comfortable and good. The friendly staff was in for a chat and made us feel quiet comfortable for this flight. Overall a very good first experience with WestJet!",Couple Leisure,4.0,nan
nan,Economy Class,1.0,July 2017,nan,1.0,nan,no,Toronto to Fredericton,1.0, | WestJet treated my daughter and I very poorly. We were making a connecting flight and when we arrived we were assured by the staff that we would make our connection both when we got off the plane and when we rechecked our bags after customs. We still ran to make our flight just to be safe. We arrived and they told us we had missed it by seconds. They thought this was funny. They put us on another flight that arrives at 1:10 am so we wouldn't be able to get our rental car for a 3 hour drive. We asked them to look for another flight and they said there were no seats available on other flights. We called our travel agent and he got us on another flight so we could get our rental car in time. When I told them there were seats on an earlier flight and asked for them to rebook us they refused and said it was our problem. We were we were told that we were not their responsibility any more because they booked us on the flight that got in a 1 am the next day. We were also told it costs them too much money to hold the flight for another minute eventhough we were present and the plane just stood on the runway with the stairway attached while we sorted out what to do next. They treated us very rudely and with no respect. Our trip started out very poorly because they treat people like numbers and not human beings.,Family Leisure,1.0,nan
nan,Economy Class,2.0,July 2017,nan,1.0,nan,no,Toronto to Montreal,2.0," |  
This is the third time I have had my flight cancelled, and bumped to a later flight. I fly to meetings in Quebec, and I kept telling myself, that its just a glitch, stuff happens. But when I ran into my meeting 1.5 hours late because of a Westjet cancellation for the third time, I felt really foolish for using this Airline, when they are consistently unreliable. It has to be any other airline going forward. There is no choice.",Business,1.0,nan
nan,Economy Class,5.0,September 2017,5.0,5.0,5.0,yes,Kelowna to Ottawa via Edmonton,5.0," |  Kelowna to Ottawa via Edmonton. Excellent service from Westjet. On time, great entertaining staff, outstanding. I was upgraded on second flight to Westjet plus. This was a first for me. It Lots of room, great free food. West jet has become the standard for Canada travel in my opinion.",Business,5.0,5.0
nan,Economy Class,5.0,August 2017,5.0,2.0,5.0,no,Ontario to Vancouver,1.0," |  Flew Ontario to Vancouver with WestJet. Great service but the seating is too tight, wish there was a more comfortable way to fly without paying a crazy amount of money. Felt like we were crammed into a sardine can. The flight attendants were excellent but what a narrow aisle they have to work with for serving snacks and drinks.
",Couple Leisure,2.0,5.0
Boeing 737-800,Premium Economy,4.0,August 2017,4.0,4.0,5.0,yes,Montego Bay to Toronto,5.0," |  Great flight from Montego Bay to Toronto, friendly crew, meal and snack was boxed but good. Tablets provided for entertainment if you did not have your own screen (Plus only). Kids were occupied with the entertainment system. Legroom was great, bottled water upon boarding, zone 1 boarding, worth the upgrade. Comfortable and seamless flight for the family of 4 (2 adults and 2 kids, 12 and 7 yrs). I would repeat for sun destinations as most of the competition is also discount (e.g. Rouge, Sunwing). Good job Westjet!",Family Leisure,4.0,nan
Bombardier Q-400,Economy Class,1.0,August 2017,3.0,5.0,nan,yes,Québec to Toronto,2.0," |  Québec to Toronto. This flight was my first with Westjet. Technicaly, it was a good flight, with the exception of the lack of seating comfort (like be seating on a school bus bench) and the unpleasant mood of the two flight attendants. They get very impatient with our two years girls, since she didn't want to seat during the landing and she was crying. Few minutes before the landing, one of them told me that if my daughter don't sit, the pilots will have to divert the flight to an other airport (!). Very, Very unpleasant service.",Family Leisure,3.0,nan
Boieng 737-700,Economy Class,5.0,August 2017,3.0,5.0,nan,yes,Toronto to Orlando,3.0," |  Toronto to Orlando. Excellent flight. We left Toronto on time and we arrived in Orlando before the scheduled time. Very friendly and professional staff. They offer bilingual services. The plane was clean, but no individual entertainment flight system on each seat. That's the only negative point.",Family Leisure,4.0,nan
Bombardier Q-400,Economy Class,5.0,August 2017,3.0,5.0,nan,yes,Toronto to Québec,3.0," |  Toronto to Québec. Despite the lack of comfort of seats, the flight was pleasant. The flight attendants were very friendly. No delay, left and arried as schedule. I enjoy the flight. I would recommand to improve the comfort of the seating, since it was the only negative point of this flight.",Family Leisure,4.0,nan
Boeing 737-700,Economy Class,5.0,August 2017,3.0,5.0,nan,yes,Orlando to Toronto,3.0," |  Orlando to Toronto. I enjoy my flight. Good service and professional flight attendant. I was served in French at the Westjet counter in Orlando, a service impossible to have in Toronto. I definitely recommend Westjet.",Family Leisure,4.0,nan
nan,Economy Class,1.0,July 2017,1.0,1.0,1.0,no,Vancouver to Gatwick,1.0," |  Vancouver to Gatwick. The flight itself was nice; I got a seat on Economy Plus, and the 9 hours from Vancouver to Gatwick went by quickly. But once I got out of the plane, it was completely chaos. I had a layover in London, before going to my final destination in Copenhagen, and I was told in Vancouver that my baggage would be sent all the way to Copenhagen, however I had to verify with a Westjet Agent in London. Arriving in London I looked and asked for my baggage, but it didn't arrive and I was told that it should have arrived, because it only said ""Gatwick"" and not ""Copenhagen"" on the baggage strip, thus I hadn't been told the truth in Vancouver. I went to Denmark without my luggage, which didn't arrive in Copenhagen either. Then, a long struggle to get in contact with Westjet started - I wasn't provided with the right number to track my bag from the beginning, so I had to contact Westjet by facebook, because I didn't get a reply via email. When I finally got the right tracking number, they hadn't written my email and phone number properly, and didn't seem to care to check (the first days I wasn't contacted at all and didn't know what to do). The correspondance on Westjet's website was quite random and insuficient. I asked several questions I never received any answers to, furthermore I wrote emails directly to Westjet that were never replied. I was suddenly told that my baggage had arrived in an airport in Denmark, even though I wasn't provided with any information of the flight number, date or the new tracking number to my luggage. I rushed to the airport, where I was told that my bag hadn't arrived, and furthermore that I didn't have the right numbers to collect it. Several days went by where I still didn't get any proper answers to my questions on my lost bag, when it finally came and I was contacted directly from an agent from the Danish airport, who had been obliged to look up my phone number because Westjet had given the wrong number. The whole situation was very frustrating and confusing, and it seemed like nobody within westjet wanted to take any responsability - I was in contact with 8-9 different agents during the whole period. I got tons of insufficient information; single phrases and random info that didn't match. Furthermore, from the beginning I got 5-6 different numbers and had no idea which ones to use. Again, the trip from Vancouver to Gatwick was nice - but make sure you never lose your luggage with Westjet, because I've never experienced such an unorganized mess with any airline before in my life! And it's not the first time my baggage is delayed...",Solo Leisure,1.0,1.0
nan,Economy Class,1.0,August 2017,1.0,2.0,1.0,no,Montreal to Toronto,2.0," |  Montreal to Toronto. Westjet cancelled my flight to Toronto because of lack of staff. The problem is I was supposed to go to Korea from Toronto but since WestJet cancelled theirs, my flight to Korea was also interrupted and I ended up going to China through Air China. WestJet only offered me 100$ for cancellation. This is absurd and I would never take WestJet again. ",Solo Leisure,2.0,1.0
nan,Economy Class,2.0,July 2017,nan,1.0,1.0,no,Orlando to Gatwick via Toronto,1.0," |  Orlando to Gatwick via Toronto. You pick the cheapest flight and you get the cheapest customer service. You get what you pay for. I was told on the plane before landing in Toronto to collect my bag and go back through Customs to get to my connecting flight to Gatwick. After waiting an hour in Toronto for my bag to show up, I finally asked a WestJet employee about my bag. He stated all flights from Florida will have their bags forwarded to their next flight. It wasn't. I arrived in London without my bag. The following day, with up to 8 agents standing around in Gatwick's WestJet check in area, I had to wait for the 1 person that was at lunch to get my bag. This caused me to miss my flight to Ireland. WestJet is taking no responsibility for having ill informed employees. They want to give me a voucher for a future flight, as if I would ever fly with them again. I understand mistakes happen, but you own them and you fix them. They ruined my first trip to Europe because I had to spend double what I expected to. Customer service is not their priority. They only get a 1 because the flight crew was decent.",Solo Leisure,1.0,1.0
Boeing 737,Economy Class,2.0,October 2017,5.0,3.0,1.0,no,Ottawa to Calgary,1.0," | First off, they rescheduled my flight, twice. There was no room for a seat upgrade and the seats themselves were small. Our tv screens were smaller than my cell phone (iPhone 6s) and you had to swipe a credit card to even use them. It was very warm despite having both overhead fans on full blast, you couldn’t even feel the air unless you put your hand up to it. They ran out of storage space and we had people from the 7th row looking for space in the 20th. Will not fly with WestJet ever again.",Couple Leisure,1.0,1.0
nan,Economy Class,1.0,October 2017,1.0,2.0,2.0,no,Vancouver to Toronto,2.0, |  Toronto to Vancouver return. Both flights with WestJet were delayed numerous times and on my return flight from Vancouver had delays and numerous gate changes. I had booked an aisle seat and with a change in aircraft no effort was made to accommodate an aisle again. It was a difficult trip on both ends and I found the airline to be extremely disorganized. I used to enjoy flying WestJet but will avoid this airline when possible in future.,Solo Leisure,3.0,nan
Q-400,Economy Class,4.0,October 2017,3.0,3.0,nan,yes,Fredericton to Toronto,3.0," |  Fredericton to Toronto. Flew three legs over a few days in early October. All flights boarded early and left on time. The Q-400 is a turbo prop and was a bit noisy but not too bad. 30"" pitch was tolerable but less so when people in front of me reclined their seats. Don't understand why airlines allow seat recline in such tight space. Crews were generally okay - most of the flight attendants (two per flight) were pleasant, though one was super nice and one was rather cranky - both on the same flight oddly enough. Plane was a little worn and not as clean as it should be but better than some of my recent flights on US legacy carriers. Water was not available in the restroom the two times I used it. Unfortunately I discovered this after I put soap on my hands on the first flight.",Couple Leisure,3.0,nan
nan,Premium Economy,3.0,October 2017,1.0,4.0,nan,no,Edmonton to Kelowna,1.0," |  We flew WestJet Encore from Edmonton to Kelowna and back three days later. We were disappointed to find such a small turbo prop plane. Paying the full premium fare for WestJet Plus our seats weren't any different, still two side by side, possibly a little more leg room that's all. Service was poor could only get one drink the entire flight. Realizing it is only an hour flight but plenty of time for two drinks.",Couple Leisure,1.0,nan
Boeing 737-700,Economy Class,5.0,September 2017,4.0,5.0,nan,yes,Vancouver to San Francisco,5.0," |  
Boarding at YVR started early, we left a couple of minutes before our scheduled departure time. Pilots were informative, cabin crew were friendly and attentive. What really surprised me was the great legroom on this aircraft, even though it was only a short flight. Got free soft drinks, snacks had to be paid for. Windy conditions during the approach into SFO were handled very well by the pilots. All in all a very good experience and definitely one of the nicer airlines I've flown with. Would recommend!",Solo Leisure,4.0,nan
nan,Economy Class,1.0,October 2017,1.0,1.0,1.0,no,Vancouver to Gatwick via Toronto,3.0," |  Vancouver to Gatwick via Toronto. We were surprised to find out that there was no in flight access to any entertainment like movies, tv or music - nothing! The only thing available was a tablet that you of course have to pay for. Even if you bring your own tablet you cannot access any programs. Another dissapointment was the non alcoholic beverage service on board. We asked for a glass of milk and were offered 2 coffee creamers. When I asked for ginger ale I was offered 3/4 of a small plastic cup, not even a can. I am assuming that they serve one can to 3 customers! When you pay for a domestic flight almost as much as one would pay to fly to Europe (where they offer 3 meals and free entertainment ) you'd expect better service. When we landed in Toronto and checked the board for our connecting flight to Gatwick we found out that our flight was being delayed by 43 minutes and ended up to be 2 hours! (after midnight).",Couple Leisure,1.0,1.0
nan,Economy Class,3.0,October 2017,4.0,4.0,nan,yes,Grande Prairie to Regina via Edmonton,1.0," | The best strong coffee of all airlines. Seems trivial but for morning flights it matters to many. I travel for work, don't change your coffee. Quick organized boarding of flights however I'm not a big person and seats were not very big and with a person beside me felt confined and squished. Helpful ticket agents when checking in. It's not assumed that we all know how or that we want to use the e-check in or print at home",Business,3.0,nan
Q400,Economy Class,5.0,October 2017,nan,3.0,nan,yes,Vancouver to Victoria,4.0," | WestJet is a very reliable airline, with flights mostly on time. This particular flight was a short hop, but it was as pleasant as always. The only critique I have is that connections at YVR are a hassle. I had to pick up the bag coming from an international flight and walk all the way to the check in counter in the second floor to leave the bag. In most large airports, this happens right after customs.",Business,4.0,nan
nan,Economy Class,4.0,September 2017,1.0,4.0,3.0,no,Kelowna to Toronto,3.0," |  Kelowna to Toronto. Only snacks were available for purchase, no meals, (I had not prebooked a meal, but didn't know this would prevent me from buying one on the aircraft.). I was told that all meals were already sold, however, I was seated in the 7th row and no one within eye sight was offered food for purchase. This was my return flight, I was very annoyed because they used a different excuse for not serving food on my original flight on Sept 19th from Toronto to Vancouver by only offering beverage service and then when we asked about food service they said it had been combined with the original coffee service and we had missed out. I was in the 5th row and the only people who I saw receiving food were the ""plus"" group, no food cart was ever visible. I am very disappointed that they don't let clients know so that we could make other food arrangements prior to boarding the plane. I am also disappointed that this is clearly an airline decision and they pass it off as though the passengers are somehow to blame for missing out. It's fine not to serve food - but make it clear that you can not buy it on the plane. Also, for the record, these flights were each approximately 4 hrs long. The seats were fine, the staff were good, the flight was pleasant, but this issue needs to be addressed. If only limited food items or no food items will be available for sale during a flight, make this information clear to the passengers. Give us the option of having a meal on the flight by purchasing it before boarding the aircraft.",Couple Leisure,4.0,3.0
nan,Economy Class,1.0,August 2017,nan,4.0,nan,no,Las Vegas to Edmonton,1.0," |  Full plane on a Friday night returning to Edmonton to Las Vegas. Wife and I seated near the back. Wife takes window seat leaving me in middle with a very large woman who arrived ahead of us. To not be rude I tried to squeeze in and had 1/2 a seat. She struggled to do up seatbelt with extender attached. I was pushed to front of seat for the 3 hour flight. I tried to make the best of it and be polite but when I tried to ask Westjet for some kind of help or partial refund since I was only able to use part of the seat, they wrote back and said that they would never try and intervene to help a passenger since we may have been ""together"" and it would be rude. She was on the plane when my wife and I arrived! We never shared a single word! I couldnt even see her since I was forced to sit forward and sideways to accommodate her. But we were forced to sweat on each other from shoulder to ankle for the entire flight. I know it was full flight but all I wanted was some kind of acknowledgement from westjet and they basically said it's not their problem. So next time I am forced to fly with them and have such a large seat mate I will take their advice and deal with it on my own.  So disappointed.",Couple Leisure,2.0,nan
nan,Economy Class,4.0,November 2017,3.0,1.0,1.0,no,Curacao to Calgary via Toronto,2.0," |  I wanted to share extremely unpleasant experience me and my husband recently had with connection flight Curacao to Calgary via Toronto, flight WS675. Upon arrival to Toronto after checking in 24 hours before our flights from Curacao to Toronto WS2689 and Toronto to Calgary WS675 we found out that our flight to Calgary was rescheduled from 10:35 pm on November 19 to 7:00 am on November 20, 2017. Apparently WestJet assumed we wouldn't have enough time to connect due to flight from Curacao being delayed by 1 hour as WestJet representative made an error when checking in luggage for one or more guest in Curacao. Furthermore they assumed we may have luggage to check-in and would't make it through the check-in counter and security check as lines were long due to other WestJet flights being delay. Not only they assigned our sits to other passengers from another delayed Westjet flight connecting Toronto-Calgary but they refused us on standby after we explained we have no bags to check-in and travel only with carry-on. The response from the representative was that we are last to check-in despite we did 24 hours in advance and had our boarding passes printed. After long negotiation process and explanation of the circumstances surrounding my surgery on November 20, 2017 they agreed to send me alone on my initially scheduled flight. Needless to say how poorly and unprofessionally some WestJet staff is trained offering $25 food voucher as a compensation to my husband. After long stressful conversation with 3 westjet representatives and a supervisor we were able to claim our right to be on that flight. Inconsistent and irrational response from representatives, inability to efficiently resolve situation without management interference, poor soft skills training. Westjet used to be better. Overall customer service is poor.",Couple Leisure,3.0,nan
nan,Economy Class,5.0,November 2017,5.0,5.0,5.0,yes,Toronto to Edmonton,5.0," |  Toronto to Edmonton. Big shout out to the crew and passengers on this Westjet flight. The almost 4 hr flight was lovely for my 9 month old and I due to the kindness of everyone on board. A special thank you to the 2 male flight attendants who treated us like gold, made my daughter laugh, and did not get upset over the many Cheerios squished on the floor.",Family Leisure,5.0,nan
nan,Economy Class,4.0,November 2017,nan,1.0,nan,no,Los Angeles to Edmonton via Calgary,3.0, |  Los Angeles to Edmonton via Calgary. Travelled with Westjet for the first time and was highly disappointed to find out that my baggage went missing and they had no clue whether it got misplaced in LAX or YYC. After a total of 18 hours of travelling the last thing I needed was to run around trying to figure things out at YEG.,Family Leisure,3.0,1.0
nan,Economy Class,nan,November 2017,nan,1.0,nan,no,Calgary to Halifax,nan," |  Calgary to Halifax. My gate was changed last minute from a19 to c70, which was on the opposite end of the airport. No announcement was made. I was in the airport at my gate, a19, and I never heard an announcement. I checked with another gate, whose attendant told me the gate was changed. I ran to the other end of the airport, my flight was leaving at 11:05pm, only to get there and was told the doors were already closed. The woman who helped me was very rude. Customer service should at least be nice to the customer. I will never fly westjet again.",Business,1.0,nan
nan,Economy Class,3.0,November 2017,nan,3.0,nan,no,Montréal to Fort Lauderdale,3.0," |  Montréal to Fort Lauderdale. Westjet was some time ago a good company. Since last year Westjet is the worst, I got 2 flights canceled at the very last minute with no evident reason. I had to call to find out the reason no time for that. Now a broken part, waiting 5 hours - new part no good, waiting for another plane to come,  4 more hours and not sure yet if its gonna be on time. They give 15$ vouchers and believe we are happy with this. Very bad Westjet.",Solo Leisure,1.0,nan
nan,Economy Class,2.0,November 2017,1.0,2.0,1.0,no,Ft Lauderdale to Toronto,2.0, |  Ft Lauderdale to Toronto. First time flying Westjet and likely the last. Flight has been delayed twice now at 8 hours due to mechanical issues with the flight coming out of Toronto. Now seeing a flight after us boarding on a Westjet flight scheduled later than us. Not impressed.,Couple Leisure,2.0,nan
