Aircraft,CabinFlown,CabinStaffService,DateFlown,FoodAndBeverages,GroundService,InflightEntertainment,Recommended,Route,SeatComfort,Textchunk,TypeOfTraveller,ValueForMoney,WifiAndConnectivitynan,Premium Economy,5.0,nan,4.0,nan,nan,yes,nan,4.0,Sydney - Honolulu - Hilo. Today I was impressed with Hawaiian econ plus seat 11G I normally travel business class but was fully booked. Staff at Sydney check in were very good typical friendly while being professional. Boarding was good business and families first then econ plus. The seat is in a row 11 just behind business and has excellent leg room it's also in a quiet 3 row section away from the main cabin. Cabin crew excellent as usual high degree of customer service. During a medical problem on board they were very professional and showed honest care for the customer. The food for econ was very hot when served constant drinks available throughout the flight. Overall very impressed. 2 negatives having to pay for lounge entry in Sydney for platinum Hawaiian when platinum velocity can get in free. Next the ground crew at the inter island terminal were nowhere even close to the flight crew in customer service skills. The short island hop was in first as a free upgrade again friendly professional crew.,nan,5.0,nan
nan,Economy Class,5.0,nan,4.0,nan,4.0,yes,nan,4.0,Our family of four recently flew from Brisbane to Honolulu return with Hawaiian Airlines. We found ourselves to be pleasantly surprised by the airline. All of our flights were on schedule the service from crew was very friendly and helpful. For example on one flight our daughter wasn't hungry at the time our first meal was served. Later in the flight we asked what food options were available to purchase and the flight attendant then returned with a spare full meal. I also liked the fact that the staff offered water numerous times throughout the flight and also collected rubbish at very regular intervals. More so than anything other flight I have been on and I really appreciated these small measures which add to the enjoyment of the flight. The seats were comfortable enough with sufficient leg room. Would like to see a little more variety in the entertainment offered (movie and television show wise). We found the check in process not to be completely straight forward. Both occasions on checking in the machines were not working correctly. We then had to be checked in by a staff member at the desk. Overall though I would definitely fly with Hawaiian Airlines again.,nan,5.0,nan
nan,First Class,5.0,nan,1.0,nan,2.0,no,nan,1.0,We flew non-stop from New York to HNL. On the way there we tried extra comfort. Staff were great plane was late getting into JFK but made up time and we arrived only about 20 min late. Seats were ok. Boarding was good also. On the way back to JFK non stop from HNL we bought first class seats - what a disappointment. Seats are about as good as extra comfort nothing better. Food was not good at all. They need to look into United first class seats which recline almost to flat status or look into SAS. Staff at Hawaiian on both flights were great but the rest was terrible.,nan,1.0,nan
nan,Economy Class,4.0,nan,4.0,nan,2.0,yes,nan,4.0,We recently flew Hawaiian Air from Seattle to Maui and return. Return flight was delayed and we had nothing but good come from it. They were very apologetic and one of the girls at the gate did a Hula dance for us and gave volunteers lessons. I enjoyed every minute of the flight there and back and liked the A30 airbus. It was our first experience flying Hawaiian Air and we will be flying it again next year to Maui. We were alerted via email that there was a delay so got to stay by the pool for a bit longer!,nan,4.0,nan
nan,Economy Class,3.0,nan,1.0,nan,nan,no,nan,4.0,We were instructed to confirm our onward flight to San Francisco when we reached Honolulu. Flight to SFO was next day (4th Feb). Rang to confirm this flight and were informed because of a time change in the flight we had to have a new ticket issued and that we would have to ring our agent in Australia to enable this to happen. We rang our agent who checked with Hawaiian Airlines Sydney office to be told no that our ticket that we held was fine and it was when we checked in. I had to make a call to Australia which was not easy and it took nearly 2 hours of our precious time in Honolulu. Not good. Also the food on the plane although I had requested a meal without tomato and mushrooms there was no option. One meal was all that was available and we had it twice with tomato which disagrees with me.,nan,3.0,nan
nan,First Class,5.0,nan,4.0,nan,4.0,yes,nan,4.0,LAX-HNL-AKL. New A330 aircraft on both legs. Seat is very comfortable and sufficient for the length of flights. (Not a sleeper seat). Crew were excellent. Food and wine choices also very good. Would definitely fly them again.,nan,5.0,nan
nan,First Class,4.0,nan,1.0,nan,3.0,no,nan,1.0,Dec 17 HA 452 Sydney-Honolulu. Dec 17 HA 364 Honolulu-Maui. Dec 24 HA 529 Honolulu-Maui. Dec 30 Honolulu- Sydney HA 451. Terrible business class. No lie flat seats. The seats have only minimal recline. Seats are manually operated with no power assistance. Disgraceful lounges in Hawaii. Poor beverages inflight: prosecco (no champagne) red label scotch one cheap red and one cheap white for wine. Food is poor. Inflight staff are very nice. The on the ground staff are rude. Overall a terrible business class which they ironically call first-class!,nan,1.0,nan
nan,Business Class,4.0,nan,5.0,nan,3.0,yes,nan,4.0,We traveled business class return Brisbane - Honolulu on new Airbus A300 aircraft. Only two negatives were limited pitch of business class seats as did not fully lie flat and limited movie selection on in flight entertainment. Food and inflight service was excellent.,nan,4.0,nan
nan,Economy Class,1.0,May 2015,1.0,1.0,2.0,no,HNL to KTM via ICN,2.0,"I am never flying on Hawaiian Airlines again. Once was once too many! Horrible customer service. 1) Luggage issues. They refused to send my bags all the way to the final destination. Their response was ""because you have a layover of more than 4 hours, we cannot send the bags all the way."" This was blatantly false because I later confirmed with people who had flown the exact same route and they had no issues checking their bags all the way to the final destination. Some incompetent staff, for sure! 2) In-flight service for an international flight was atrocious. When I reminded the attendant that I had requested a special meal, she replied rather rudely, ""Oh, we don't do special meals."" 3) Good luck trying to change your flights without paying a hefty amount. And even then, you were restricted to a few dates only.",Solo Leisure,1.0,1.0
A330,Economy Class,4.0,September 2014,4.0,3.0,3.0,yes,PHX to HNL,3.0,"We have flown Hawaiian airlines about 8 times, and it has been satisfying every time. The service is very good, the seat is comfortable (especially the pillows), the food is pretty good and the legroom is comfortable. We fly this airline about once every two years, and it's been very satisfying. They are kid friendly too.",Family Leisure,3.0,3.0
A330,Economy Class,5.0,July 2015,4.0,4.0,4.0,yes,Auckland to Honolulu,5.0,"AKL-HNL on a modern A330 in Extra Comfort seat in 11A. An excellent option at a small cost for the 9 hr long overnight flight. Whilst the seat was the same as Economy Class and the armrest was fixed, this row is situated directly behind Business Class in a small intimate cabin at the front of the plane. The leg room was huge, improving comfort and thus the ability to get some sleep. Return HNL-AKL afternoon flight was in standard Economy seat 18A and whilst a little tight when the person in front reclined, it was perfectly adequate and comfortable. On-demand movies / TV series / games were free and it was fun to watch some Hawaii-centric shows. The touch screen was not very responsive and there was no alternative controls resulting in a lot of unnecessary ""poking"". Upon embarkation, FA's handed out amenity kits comprising eye masks, headphones, earplugs and in Extra Comfort seats additional items were included in a cute little pouch. Food and drink service was prompt after takeoff and I think relevant to the time of travel. A snack pack was offered at midnight with a breakfast before arrival then on the return a hot chicken/rice dish at late PM takeoff with a sandwich as a late supper. Much better than a curry at 3am as I have experienced on some airlines. Service friendliness and professionalism was mixed depending on which crew member attended you (as always) and the return was much better but overall more than adequate. Water was offered frequently throughout the flight. My only negative would be the temperature of the cabin - it was freezing cold! The FA's were even wearing cardigans. And the complimentary blanket smelled like it had been in a smokers zone - it was disgusting. Fortunately I had packed my own. Overall I was very impressed with the flights. It represented good value and the inclusion 2 checked bags in the fare was a bonus. I would recommend this airline for this route and will fly with them again. It's a shame Honolulu Airport is their hub - it is woeful and not a pleasant experience.",Family Leisure,4.0,nan
nan,Economy Class,5.0,July 2015,3.0,2.0,5.0,yes,Honolulu to Brisbane,4.0,"Chaos at the airport which is more the fault of the airport administration than the airline. Though it would be nice about the need to take a shuttle to the gate and there is nothing available at gate 34 except sandwich, sweets and drinks at highly inflated prices. Impressed with the cabin crew and range of inflight entertainment - although any announcement that was made whilst I using it nearly blasted my eardrums. Not quite as cold as my earlier flight but still needed the blanket. Flight was smooth and the landing feather like.",Solo Leisure,4.0,nan
A330,Economy Class,1.0,July 2015,1.0,3.0,1.0,no,Honolulu to Sydney,2.0,"My husband and I were disappointed with the inflight experience from Honolulu to Sydney (arriving SYD 7.30pm). The staff were cold, sullen and non-communicative. The food was minimal and of poor quality. We were given a terrible chicken meal at lunch and then nothing until the equivalent of 11pm (for the passengers' day), when we received sub standard sandwiches. We have never experienced an international flight like it. Additionally, the entertainment systems were problematic in that the touch screen was not sensitive enough and had to be pressed repeatedly. As a result, I had the woman behind me repeatedly pressing the back of my headrest all the way through the 10 hour flight. We will never choose this airline again for an international flight.",Couple Leisure,2.0,1.0
nan,Business Class,5.0,June 2015,5.0,5.0,5.0,yes,Honolulu to Las Vegas,4.0,"I don't usually fly business class, so this was a treat. The first class check-in was fantastic. The seats were only recliner, but very comfortable. I didn't need full flat anyway, as it was not overnight. Attendants were attentive and professional. Food was very good. In-flight entertainment was varied, and had some documentaries available that were very interesting. ",Family Leisure,5.0,nan
nan,Economy Class,5.0,June 2015,5.0,1.0,5.0,yes,Brisbane to Honolulu,3.0,"Check in at Brisbane was poor, the machines didn't work and there seemed to be a shortage of staff. When I finally reached the counter, the young lady was polite and helpful. The actual flight was good, except the cabin was freezing and really needed that blanket. I was involved as a helper in a medical emergency and was impressed with the care and attention given by the crew. Found the shell like seats a little hard.",Solo Leisure,3.0,nan
nan,Economy Class,3.0,nan,3.0,nan,4.0,no,nan,1.0,"I was so looking forward to my trip to Honolulu, but it was not a pleasant experience, was seated next to window with 1 passenger next to me, as soon as we had levelled off the woman in front of me thrust her seat back to the maximum degree and that's where it stayed the entire 8.5 hour trip, until she was asked by staff to return her
seat to upright position 5 mins from landing.  I have scoliosis and prefer to sit upright, but I was left with no room whatsoever, could not even open a magazine, I was severely restricted of any movement and trying to get out the seat to visit the toilet was near impossible, if people want to sleep the whole trip like that they should
travel 1st class and why do the seats have to go so far back. By the time we arrived in Hawaii I was in pain. I was dreading the return trip home, but just dismissed it as bad luck, the return trip I was seated in an aisle seat with empty seat next to me, well the same thing happened we hadn't even taken off and a woman put her seat
right back, I thought surely staff would correct her but obviously they didn't spot her, as soon as we had levelled out again I moved into the seat next to me, her 4 year old son was now in front of me, she then proceeded to push her sons seat back to the extended position, was this really necessary for a 4 year old, the only respite I had was move back to the aisle seat at least I was able to exit the seat so spent much of my time standing at back of airline, how could people be so oblivious to other travellers discomfort by having their seats fully extended the entire trip is beyond me, I certainly wont be travelling with this airline again it was a nightmare trip for me.",Solo Leisure,2.0,nan
nan,Economy Class,4.0,nan,1.0,nan,1.0,no,Brisbane to Honolulu,3.0,"Our flight from Brisbane to Honolulu (overnight) was good even though an awful time to fly. My only complaint was the cabin was freezing. On the return flight this is where the problems started. The airport is mayhem and needs more signage. People wondering aimlessly. Once on board and seated. I had packed for warmth on this flight. It was a day flight leaving at 1.40pm local time. Once on board we were informed that there was no headsets, they had not been loaded onto the plane. so for the next 9 hours plus no movies, how many games can you play of Solitaire. Also on the first meal service we where informed there was no scotch as they had run out. First meal service. That is not good enough. The staff were polite, the meals OK but for an international carrier to have no headsets for a 9 hour flight is ridiculous, and concerning. Hawaiian Airlines need to pick up their game, as in pre-checks and cross checks and strict compliance procedures that must be adhered too for safety and well being of your passengers.",Couple Leisure,2.0,nan
nan,Economy Class,4.0,nan,4.0,nan,nan,yes,Hilo to Honolulu,5.0,"Flight from Hilo to Honolulu, new cabin, seat 5B. The new seats are perfect for the 50 min fight - lots of legroom and comfortable. Staff as normal are perfect and professional. Only negative is I could not check in online and when I called tech support line it is horrible, always has been. Very rarely can they fix problems and can often give incorrect information.",Solo Leisure,4.0,nan
A330,Business Class,5.0,September 2015,4.0,5.0,4.0,yes,Sydney to Hilo via HNL,3.0,"Sydney to Hilo via Honolulu on Hawaiian Airlines in Business class. I was met with friendly faces and enjoyed the flight cocktails which flowed freely. The meals were also great. I have been using Hawaiian for 12 years and it's the crews that keep me loyal, they are caring and professional. The ground staff bend over backwards to make sure I receive the status benefits.",Solo Leisure,5.0,nan
A330-200,First Class,5.0,September 2015,4.0,4.0,5.0,yes,LAX to HNL,3.0,"First trip with Hawaiian Airlines. Online check-in was user friendly and bag drop at LAX was quick. The Hawaiian lounge in LAX is pretty awful, like a dated living room from the 80s (the lounge attendant told us it was due to close the following day). In the end we used Priority Pass to use the Air Canada Maple Leaf lounge which was great. Boarding was orderly and quick. The first class cabin is quite small and seems to take up about half of the space between the first and second set of cabin doors. The first class seat was comfortable but basic, reasonable width and legroom but not lie flat and for a tall guy it was not easy to get into a comfortable lying position. So although on a modern aircraft the seat felt straight out of the 80s again. The IFE was excellent, good choice and on demand with a decent size screen. What stood out about this flight was the cabin crew. We had a Los Angeles based crew with two crew working in the first class cabin. They were professional, friendly, warm and offered a great service. There were regular services and offers of drink top ups. Hawaiian could be a really great airline if they upgraded the first class seating and offered better lounges.",Solo Leisure,4.0,2.0
nan,Economy Class,1.0,September 2015,2.0,1.0,2.0,no,HNL to LAS,2.0,"After 2 hours, 3 agents, 2 supervisors, 1 manager and a gate agent my experience with Hawaiian Airlines was horrible. Had paid for and confirmed Comfort Class seats. When boarding passes were received they were regular coach seats. In a condescending and rude way I was told the Comfort Class seats were canceled by an outside source. Comparable seats were now not available. Only option was coach seats and a Credit for what was paid for upgrade.",Business,3.0,2.0
nan,Economy Class,5.0,August 2015,5.0,5.0,3.0,yes,Las Vegas to Lihue via Honolulu,5.0,"Once again Hawaiian proves that economy class passengers can be treated well and comfortably. We paid for ""extra comfort"" seats on the Honolulu-Las Vegas leg both ways. For $70 each, each way, we got tremendous leg room and the 2+4+2 seating allowed my wife and I to have our own aisle and window row. Nice complimentary meals were served each way, along with a small glass or wine or mai tai. As to value, our two roundtrip tickets costs about $2000 and that was with a 50% discount on one fare due to their credit card. (You don't get a 50% discount on the $140 extra comfort seat upcharge for the roundtrip). We were willing to pay this for very comfortable flights at the more popular times. We did not look to see if we could have saved money by being cramped on an ultra low cost carrier, not did we check out the prices on the legacy airline competitors. Hawaiian has convinced us that they deliver a pleasant economy class experience which is becoming very unusual these days.",Couple Leisure,5.0,nan
ATR42 500,Economy Class,5.0,August 2015,5.0,4.0,nan,yes,Kona to Kahului,3.0,"Flight operated by Ohana for Hawaiian. Thirty five minute flight from KIA to OGG. Aircraft clean and tidy drinks offered en route. Being a small commuter plane very cramped but not a problem on such a short flight. Departed and arrived on time, no complaints.",Couple Leisure,4.0,nan
ATR42 500,Economy Class,5.0,August 2015,4.0,5.0,nan,yes,Kahului to Kona,3.0,"Much the same as the outward flight, same operator Ohana and aircraft a turbo prop ATR. Had problems at the gate with our booking for this one but sorted by friendly gate staff. Thirty five minute flight back to Kona all normal arrived early. No complaints.",Couple Leisure,5.0,nan
A330,First Class,5.0,August 2015,4.0,5.0,2.0,yes,LAS to ITO via HNL,4.0,"Flight was excellent, online check-in easy but bag drop off took a while as the first class line was slower then economy lines. No express line at security but didn't take long. Food was nice as was the bloody Mary's for the morning flight, crew always helpful and attentive. On landing in Honolulu we were advised there was no gate for us and we would need to wait 10-15 minutes, no problem as I had over an hour to make my connection. An hour later we were still on the plane sitting on Tarmac, everybody advised the crew of connecting flights, the crew announced that we would be rescedualed as they would not hold our connections. After an hour they found a gate for us. I ran and they had held the Hilo flight, the crew at that gate said they did not know that the Vegas flight was delayed so they waiting for the rest of the Vegas passengers, well done to the ground crew at inter island terminal. Honolulu is expanding to fast to keep up with infrastructure.",Solo Leisure,4.0,nan
nan,Economy Class,1.0,August 2015,nan,1.0,nan,no,LAS to HNL,1.0,I am sad to say that we were not allowed on our flight today because we were not at the boarding gate fifteen minutes before departure. Even though we were allowed to check in with our two children 6 months and 2. Once we got to the gate exactly 15 minutes before takeoff our agent kept his head down staring at his computer for about 5 minutes. After that he informed us that the gates were closed and no one else could board. Strange because atleast two other people were allowed on the plane while we were standing at the checkin counter. I felt embarrassed as other people were allowed onto the flight while we were held off to the side. I am not sure if they didn't want to let us on because we had the two small children or they didn't like the way we looked. I would not recommend anyone to this airline ever. In fact I would urge you to stay away from them as you can see their other reviews on here are pretty bad as well. If anyone knows a way I can get my family out to Hawaii asap please share. Hawaiian air customer service has given us the run around and made light of our situation.,Family Leisure,1.0,nan
Boeing 767-300,First Class,5.0,July 2015,4.0,4.0,4.0,yes,Kona to Oakland,5.0,"Flying Hawaiians seasonal non stop was a pleasure. Comfortable seating, warm service and good food were the highlights of a pleasant comfortable experience. Nothing to add but a hearty recommendation. I actually prefer the older 767s over the newer A330's. Even the luggage was delivered in a timely manner.",Solo Leisure,5.0,nan
A330,Economy Class,3.0,July 2015,2.0,5.0,1.0,no,SEA to HNL,3.0,"The good: Efficient boarding, departed and arrived on time. The so so: Cabin attendants did their jobs, legroom OK, but less than jetBlue. The bad: ""Entertainment"" - Why have in-seat TV screen when nothing worthwhile to watch, unless you pay extra for it? ""Meal"" - water, few pieces of fruit, mystery cheese thing, one piece of candy. Overall opinion: Very average experience. Hawaiian should be so much better when their slogan is ""Hawaii Flies With Us"". Should not boast about serving a meal, attendants OK, but lack aloha spirit, delete ads when giving info about Hawaii before landing. Would fly again, but only because of mediocre competitors.",Solo Leisure,3.0,nan
A330,Economy Class,4.0,November 2015,3.0,1.0,3.0,yes,Brisbane to Honolulu,4.0,"We found Hawaiian Airlines decent in the air but terrible ground service before and during our trip. The website is archaic in that you cannot book a child online, we had to ring and book our 3 year old who was then on a separate booking code etc which made checking in, changing seats etc a pain (Hawaiian sat him in different areas of the plane to us despite being a minor). Website advises you can book a bassinet for babies, however upon calling up you discover its an extra $140 each way for the privilege. Website does not state this! Ground staff in Honolulu were atrocious and getting any assistance with our complicated check in (kids, kid stuff, separate booking numbers, through ticket to Lihue etc etc) was like pulling teeth and we only got assistance when i turned on the tears (and we are experienced travellers, never have I encountered such useless customer service staff). Our bags then miss the flight but they did turn up on the next one. In the air we were quite happy. Brisbane to Honolulu return in the A330. Flight crew were helpful, accommodating with the baby and 3 year old, nice comfort kit provided as well as pillows and blankets, regular drink runs, food not terrible, plane clean, eat back entertainment free and with a decent veriety, good luggage allowance, flights on time. Honolulu to Lihue and return is a quick flight, they give you a beverage. All in all I would fly them again for the right price, as in the air they were fine. Just dont try to get any assistance out of them before or during your trip!",Family Leisure,4.0,nan
nan,Economy Class,3.0,November 2015,3.0,2.0,3.0,no,Seattle to Honolulu,2.0,"Hawaiian Airlines used to be ""the"" airline to fly, but seem to have lost their ""Hawaiian roots."" They have become far too big. It started when they moved their phone support overseas. They crammed more seats into economy class, and reduced level of service in first class. They started charging excessive baggage fees, change fees, and cancellation fees. Their frequent flyer program has become just another cash cow, charging 100.00 per ticket plus mileage if flying inter island. Our Party of 5, all under a single reservation number, were given 2 seats and 3 members given Standby Seats at the ticket counter, even though the reservations were made and seats selected 6 months in advance. We were told that we would have to talk to the gate agent, who only showed up 10 minutes before the plane was scheduled for departure. Luckily all 5 of us were able to get on the same flight, split all about the cabin. Customer support after the fact was incredibly arrogant and unwilling to explain company policy of splitting reservations between assigned seats and Standby status. Complete lack of Customer Support seems to be their new business model.",Family Leisure,2.0,2.0
