Aircraft,CabinFlown,CabinStaffService,DateFlown,FoodAndBeverages,GroundService,InflightEntertainment,Recommended,Route,SeatComfort,Textchunk,TypeOfTraveller,ValueForMoney,WifiAndConnectivitynan,Business Class,5.0,nan,5.0,nan,5.0,yes,nan,5.0,13 Oct 2013 KC887 Business Class. Almaty - Beijing. Thoroughly professional service good food! Great entertainment on iPad excellent on board staff simple check in procedure. Lacks lounge in Almaty.,nan,4.0,nan
nan,Economy Class,5.0,nan,4.0,nan,4.0,yes,nan,5.0,I travel very frequently on Air Astana from Delhi-Almaty. Check-in staff at Delhi and Almaty are very efficient. I had a wonderful experience on 18 April flying from Delhi to Almaty. The flight crew went out of their way to take care of passengers needs.,nan,5.0,nan
nan,Economy Class,5.0,nan,5.0,nan,5.0,yes,nan,5.0,April 4 KC951 from Almaty to Astana. Return April 4 from Astana to Almaty KC854. Had the pleasure of flying Air Astanas new 767 service between Astana and Almaty. It was the best domestic economy class service I have flown. Each seat has in seat videos with the latest films tv music etc. I had a choice of international newspapers as well as a warm sandwich and drink. As usual the crew were smiling multi lingual and well dressed. The seats had a good tilt.,nan,5.0,nan
nan,Business Class,5.0,nan,4.0,nan,3.0,yes,nan,5.0,I use Air Astana regularly since I have moved to work in Kazakhstan and currently prefer it to the other airlines I have used. I try to arrange my trips back to the UK around the direct flights to LHR. I have never experienced a delayed or cancelled flight the staff are well-trained and generally open and friendly and the food is not exceptional but is of a consistently good quality. I usually travel economy class though on the occasions when I have used business class it has been a good experience.,nan,4.0,nan
nan,Business Class,5.0,nan,5.0,nan,5.0,yes,nan,5.0,Flight KC912 April 2nd from Istanbul to Almaty. It was a fantastic flight crew helpful and smiling. All announcements very clear understandable and most important things for me multi-language Turkish English Russian and Kazakh. The way aircraft was new.,nan,5.0,nan
nan,Economy Class,5.0,nan,5.0,nan,5.0,yes,nan,5.0,I have been using the services of Air Astana for years. Always a pleasure to travel starting from the convenient way of purchasing the ticket and excellent relation of crew members. I quite often take the domestic flights around two times a month and therefore comfort is crucial for me. In January I travelled to Frankfurt from Astana. As usual right from boarding until landing it was an enjoyable journey.,nan,4.0,nan
nan,Economy Class,5.0,nan,5.0,nan,4.0,yes,nan,4.0,Flying from Almaty to KL KC935 was very good we had an excellent inflight meal and the staff on the plane were helpful and friendly. The seats were comfortable and the leg room was good. I was able to check in online and then at the airport changed my seat to the emergency exit seats due to the extra leg room with no problems at all. Kuala Lumpur is fantastic and as we head towards George Town we are looking forward to exploring more of Malaysia and of course the return flight with Air Astana.,nan,4.0,nan
nan,Business Class,5.0,nan,4.0,nan,5.0,yes,nan,5.0,Flight KC907 March 21st and back on KC908 March 26th. I flew with my family from Almaty to Delhi and back and we were all very happy with the flights. The crew was nice and attentive departures were on time and we really enjoyed the time onboard.,nan,5.0,nan
nan,Economy Class,4.0,nan,4.0,nan,3.0,yes,nan,5.0,KC 110 and KC 949 31st January. KC 950 18th February. Air Astana is a very good airline. Staff are friendly and helpful. Because of the demonstrations in Bangkok we had to rebook our flights. Air Astana offered us a free upgrade to Ho Chi Minh City though the ticket was more expensive.,nan,5.0,nan
nan,Business Class,4.0,nan,3.0,nan,4.0,yes,nan,5.0,I was lucky enough to be on one of Air Astana's new Boeing 767s returning from Bangkok to Almaty on the 12th January 2014. My business class seat was worth paying the extra over economy with the full lay flat seat and lots of room to spread out with a wide side table. Over the time I've been flying Air Astana I have seen them polishing their cabin service and the professionalism and presentation of the staff is of a high standard. Beverage service was very good although the food let the otherwise excellent travel experience down a little the meal was below par for business class. This was in contrast to the trip down to Bangkok and all previous international flights with Air Astana where the food has been very good.,nan,5.0,nan
nan,Business Class,3.0,nan,3.0,nan,2.0,yes,nan,3.0,"Not a bad flight but the use of an ageing 757 with seats that looked like they belonged in the 1970s were a disappointment given the trumpeting of their ""new"" business class on their website - I think this is more than disingenuous but Air Astana are hardly alone in this. Staff were friendly and helpful. Lack of business lounge in ALA a major minus. Food average. All in all fair service as it should be noted that this is half the price of BA.",nan,3.0,nan
nan,Business Class,4.0,nan,5.0,nan,3.0,yes,nan,4.0,Bangkok - Almaty - Astana - Novosibirsk. Good quick check and priority lane in busy Bangkok airport luggage slow off in Almaty (did not get priority despite the label). Good crew and food and wine. The 757 from Bangkok to Almaty was a little tired and angled seats should exclude an airline from four star status. The service from Almaty to Astana was good - a full meal served. From Astana to Novosibirsk there were problems in security checks and no fast lane for business class passengers. Staff helped people with tight connections. The domestic Business lounge in Almaty is very poor but the new lounge in Astana was good. I don't think that they deserve their four star rating but they are improving and the English of the Cabin attendants is a lot better than when I first flew with them 10 years ago. I will continue to choose to fly with them in Central Asia.,nan,3.0,nan
nan,Economy Class,5.0,nan,4.0,nan,4.0,yes,nan,3.0,7 Feb from ALA To IST. I travel internationally and domestically frequently. Based on my experience Air Astana is a cut above the rest. As a person who is afraid of flying it is a pleasure to see the rapid modernization of the fleet. I am 193cm tall and leg room is important for me Air Astana usually offers the most. The inflight entertainment is current and changes frequently. Lastly I have found the cabin crew to be very supportive. there was one occasion where I complained about the temperature of the cabin being too hot and the senior flight attendant had a customer complaint book where she recorded my complaint. A great initiative which I have never experienced on other airlines.,nan,4.0,nan
nan,Economy Class,4.0,nan,4.0,nan,3.0,yes,nan,4.0,All in all its OK for a relatively short journey and the food's nice. But you should know this: I travel a number of times a year TSE-FRA and am finding more frequent delays with no information given. The last 3 times there were 40 minute-2 hour delays so beware! Quite a lot of confusion at FRA last time when the plane was 90% filled with a single group of Chinese travelling to Urumqi. Don't take a window seat in winter - the a/c isn't up to it and there's an arctic draft every time. Inflight entertainment not much only overhead screens and reruns of candid camera type stuff and one movie repeated on 6 hour flight. Internally in KZ the prices are ridiculously high because they are the only airline which is up to international standards.,nan,4.0,nan
nan,Economy Class,5.0,nan,4.0,nan,4.0,yes,nan,4.0,Ala-Astana KC 683 back Astana Almaty KC 954 Almaty-Atyrau (Guriev) - KC 889B Atyrau (Guriev) - Almaty KC 890-B. Good service. Perfect take off and landings. Air Astana continues to work on their services and airfleet and I continue to see an ongoing positive development of the company. Some destinations are more expensive than others but generally good value for money.,nan,4.0,nan
nan,Business Class,5.0,nan,5.0,nan,4.0,yes,nan,5.0,I fly Air Astana very often almost every week nowadays. I find the experience with new 767 ER relaxing though the flights between Astana and Almaty are always full. The ground staff keep improving. Seems new planes brought a fresh spirit on board. 767 Business Class is great and gives privacy to the customers. Looking forward to flying the Dreamliner. Food is much better than before.,nan,4.0,nan
nan,Economy Class,4.0,nan,4.0,nan,3.0,yes,nan,4.0,KC 951 21 May. KC 856 21 May. I fly Air Astana very often. I find the experience relaxing though the flights between Istanbul and Almaty are usually full. The leg room is good. I think the mileage program could be improved where you could upgrade using your miles during check-in. The food is usually fresh though could be improved. Inflight entertainment is weak and needs improvement. Overall good value for money.,nan,4.0,nan
nan,Economy Class,5.0,nan,5.0,nan,4.0,yes,nan,5.0,My first flight with Air Astana - London-Astana return. It was a great experience. Friendly staff and excellent service comfortable seat nice and generous food. AirAstana will be my first choice from now on.,nan,5.0,nan
nan,Economy Class,4.0,nan,4.0,nan,nan,yes,nan,4.0,As a family we have flown with Air Astana numerous times (both in economy and business class) since moving to Kazakhstan and have always been happy with the level of service. We travel with a young child and the staff have always been very friendly and helpful.,nan,4.0,nan
nan,Business Class,5.0,nan,5.0,nan,nan,yes,nan,3.0,KC621 Almaty-Astana 22/4/2014. Flown old Boeing 757 in business. Old chairs/layout. Plenty of legroom good for sitting and on a short flight less than 2 hours no need to lie down. A full meal was served on this short flight. A very nice vegetarian meal. No entertainment available or offered. No business lounge available on domestic fights.,nan,3.0,nan
nan,Business Class,5.0,nan,5.0,nan,4.0,yes,nan,4.0,KC856 Astana-Almaty 24/4/2014. Flown new Boeing 767 in business. Good new chairs (fully flat nice big touch LCD- screens) and modern interior. Nice choice of entertainment. And much to my surprise a full meal on a flight less than two hours. Good vegetarian meal. Pity they do not have business lounges on domestic flights.,nan,4.0,nan
nan,Economy Class,5.0,nan,4.0,nan,4.0,yes,nan,5.0,I found this routing from HK-Almaty very convenient and have done it a couple of times now. Direct flight airport close to city and city close to ski fields. Great value for money. Well maintained aircraft good attention to service - what more do you need.,nan,5.0,nan
nan,Economy Class,2.0,nan,4.0,nan,5.0,yes,nan,5.0,ALA-TSE. B757-200 not new AC but fully refurbished to perfection. Clean and inviting. Crew very well groomed wonderful IFE tasty hot snack on this 80 min flight. Temp however was very high in the cabin and my req to lower it a bit were not fulfilled. I started to feel ill and asked for ice to cool my head crew showed no empathy or care. I was glad it was a short flight.,nan,5.0,nan
nan,Economy Class,5.0,nan,5.0,nan,4.0,yes,nan,5.0,IST-TSE-BKK (and back) on A321 and B767 first airplane saws its years the other one is great new and comfortable. The service from the staff was great. Very personalized friendly and they spoke fluent English. There was not IFE on A321 but 2 movies were on drop down screens. Excellent IFE on B767 with HD screens and good variety of movies TV series games. Food was very tasty and plenty of alcoholic drinks beverages coffee/tea. They offer newspapers and amenities kits. Great airline to fly with TSE airport small but new and clean.,nan,4.0,nan
nan,Business Class,4.0,nan,3.0,nan,4.0,no,nan,1.0,I fly regularly on the flight Almaty to Beijing and back. I have to say this is a terrible flight. 4-5 hours at night on an A320. There is little difference between business and economy. The support service for booking and upgrades is simply the worst I have experienced.,nan,1.0,nan
nan,Economy Class,4.0,nan,5.0,nan,4.0,yes,nan,4.0,In the last year I have flown Air Astana on 14 different legs now (ALA-SGN ALA-BKK-SGN ALA-ICH and ALA-DEL). During the past the service has been getting better and better. Some irritants during flights such as flight attendants bumping in to your elbows (aisle seats) or waking you up for meals have disappeared. Meals have got better. The old 757 interiors are being renovated. Long flights know offer personal entertainment systems for each person in Economy. All the ticket prices have been reasonable though it is hard to build up miles with Air Astana's Nomad Club. That is one complaint I have with Air Astana. With most airlines I would have gotten free upgrades by now. Many of Air Astana's low fares exclude you from accumulating frequent flier miles. I hope this changes in the future. Overall I say Air Astana is a good carrier to choose nowadays.,nan,4.0,nan
nan,Economy Class,4.0,nan,4.0,nan,5.0,yes,nan,4.0,I took six flights over two weeks London-Astana Astana-Almaty and Almaty to Tashkent and all of them were very good and I was impressed with the staff quality of food and video/TV system. The flight between Astana and London both ways wasn't very busy and the planes were very modern and well maintained. It was a pleasure and relaxing to fly with them.,nan,5.0,nan
nan,Economy Class,5.0,nan,4.0,nan,5.0,yes,nan,5.0,Bangkok-Almaty on 5 Oct 2014 KC932 and return Almaty-Bangkok on 12 Oct 2014 KC931. Check-in staff were friendly and speak good English. The B757 used was clean and have a new look about it. The IFE was reasonably good with offerings of some of the latest films. The cabin crew was friendly helpful and attentive. The overnight flight from Almaty to Bangkok took off at around 1 am. About two hours into the flight a full meal was served. Before landing in Bangkok at around 8.45 a.m. no breakfast was served. For a flight like this suggest that two light meals be served – one shortly after take-off and breakfast before landing. Overall it was a pleasant experience flying with Air Astana.,nan,4.0,nan
nan,Business Class,5.0,nan,3.0,nan,3.0,yes,nan,4.0,Heathrow to Almaty return via Astana in Business Class. This was the first time that we had flown Air Astana and we were generally pretty impressed. Not quite up to the standard of the top Airlines but worth their 4 star Skytrax status. Outbound the meal was one of the best I've experienced in the air; with multiple courses presented separately and the food options varied and delicious. Inbound was another matter however with tasteless cold fish chicken that was a bit dry and less attractive options. Maybe the Caterer in Astana isn't as good as in London. Service both ways however was excellent with pre take-off drinks offered boiled sweets hot face towels drinks and nuts or canapés and very attentive staff. The seats were pretty comfy and whilst not fully flat (hopefully their Dreamliners on order will have fully flat seats in Business) they still had very decent recline and allowed for some sleep. (we were on a 757 for all sectors so if you get this aircraft type or a 767 on Domestic sectors then you're doing pretty well in Business Class for such a short flight - nothing like the terrible Business Class European Airlines offer on short haul flights). The Etihad Lounge at Heathrow was excellent; and it's very quiet at the time that Air Astana fly as there are no Etihad flights at this time however the Lounge in the Domestic Terminal at Almaty is really an embarrassment (small pokey room no natural light small snack counter charging for everything right down to a cup of tea!). Air Astana hand out tablets in Business Class as there are no seat back TV's. We found that we could hardly hear through the headphones on the way out but this was much better on the way back. The Moving Map however wasn't working on the way back and since the tablets aren't connected to the flight systems at all we had no idea where we were or how long until arrival for the whole flight. (even Economy Class presumably can access this info). Other minor irritations were the same 2 songs played continuously on loop when the aircraft is on the ground and the lovely new anti jet lag ceiling lighting system being inexplicably put through it's paces for the first few hours of the flight jumping between colours every few seconds. Terminal 4 at Heathrow was relatively quiet at the times Air Astana flew which made for a pleasant experience; and I can recommend Terminal 4 Long Stay Parking which is actually just across the main road from the Terminal - no more than 5 minutes in the shuttle bus! Overall we enjoyed our experience with Air Astana perhaps more so than we were expecting and given that they are often keenly priced I would recommend them.,nan,5.0,nan
nan,Business Class,5.0,nan,4.0,nan,2.0,yes,nan,4.0,Moscow - Astana - Almaty - Bangkok. Two of the three sectors were very late at night or early morning and I chose sleep rather than food. It seemed a little strange serving dinner at about 2.00am! It would be better to offer breakfast when flights depart after 11.30 at night. Cabin crew were good and friendly (all seemed to speak good English) and I was allowed to take some items from the dinner menu prior to landing in Bangkok. The Astana - Almaty meal was good and the quantities perfectly adequate. Check in for all flights was quick and easy. I was disappointed that there is no business lounge in Astana for domestic passengers and the lounge in Almaty is one of the worst I have been in for International Business Class. Luggage was relatively quick off the plane especially in Bangkok. The seating was reasonably comfortable and there was adequate leg room on the flights from Moscow to Almaty. From Almaty to Bangkok it is an angled bed which is reasonably comfortable. IFE is very limited but not so important when you only want to sleep on the flight. I had my own entertainment for the Astana Almaty sector. I continue to fly Air Astana because I think that they are probably the best airline in Eurasia and not bad at keeping to their schedules. The flight from Moscow was delayed for about an hour because of a technical problem. We were promptly advised by the crew of nature of the problem and the likely time needed to fix it.,nan,4.0,nan
nan,Economy Class,5.0,nan,4.0,nan,2.0,yes,nan,4.0,Three flights around Central Asia this last week. FRU-ALA ALA-TSE and TSE-AUH. The FRU-ALA flight was so short they offer a cabin drinks service on the ground. ALA-TSE we were offered a drink and small snack on the B757 overhead screens played a silent sketch show. TSE-AUH was on an A320. A full cabin service was offered. Entertainment was on overhead screen and amenity packs were provided. One movies and a couple TV shows. Leg room was good on all sectors. Staff all spoke English. But check-in always seemed to be chaotic.,nan,5.0,nan
nan,Economy Class,4.0,August 2015,3.0,4.0,nan,yes,ALA to UKK,4.0,"Almaty to Ust Kamenogorsk return with Air Astana, and flights to and from were on time. The seat was reasonably comfortable. We were given a basic meal in each direction. Cabin crew were friendly and had good English skills. As a domestic flight there was no entertainment service provided.",Solo Leisure,5.0,nan
nan,Economy Class,5.0,August 2015,5.0,4.0,5.0,yes,Almaty to Antalya,5.0,"We have been surprised by new jets for summer destinations, equipped with modern entertainment, personal ipad with a variety of programs. Quality of meal and drinks onboard is good. Service on board is excellent. Crew were very professional. I can frankly say that these flights were very pleasant for our family and we would fly with Air Astana again.",Family Leisure,4.0,nan
nan,Economy Class,5.0,April 2015,5.0,5.0,5.0,yes,Shymkent to Kuala Lumpur via Almaty,5.0,"Flight from Shymkent to Kuala Lumpur via Almaty and back in April. On vacation we were hospitalized with fever and skipped our flight home. Air Astana appreciated our position and changed dates for our unreturnable tickets without charge, so we could come home later. Great thanks for help, now we are your loyal clients.",Couple Leisure,5.0,nan
nan,Economy Class,5.0,nan,5.0,nan,5.0,yes,nan,5.0,26 April Tashkent-Almaty flight KS128 and 5th May Almaty-Tashkent flight KS127. Embraer 160 from Tashkent-Almaty-Tashkent. Excellent service on Board. It was at a high level starting from check-in to landing. Flight attendants were very neat and friendly also pleased with the print media. Even given candy during takeoff and landing as well as a pillow which were very nice.,nan,5.0,nan
nan,Business Class,5.0,nan,4.0,nan,4.0,yes,nan,5.0,Flight from London on time 767 aircraft with new interior. clean and well presented crew efficient and helpful Food and alcohol selection great seat very comfortable and inflight entertainment console worked well. Arrived on time and fresh. This is a great connection for Kazakhstan.,nan,5.0,nan
nan,Business Class,5.0,nan,5.0,nan,4.0,yes,nan,4.0,Astana-Istanbul-Astana on March 16-18 2015. It was one of my best flight experiences starting from check-in inflight meal offering and friendly approach of flight attendants. It was worth every cent I paid.,nan,5.0,nan
nan,Economy Class,5.0,nan,3.0,nan,5.0,yes,nan,5.0,Flight KC930 24 February. Return trip from Hong Kong in mid February. Plane was very delayed but informed. Could in my view been done earlier but was nice to be told a couple of hours in advance. Trip itself was pleasant. Good inflight entertainment and again the inflight crew did an excellent job and were responsive to needs. Food could be improved as compared to other airlines traveled but do note it is economy class.,nan,4.0,nan
nan,Business Class,5.0,nan,5.0,nan,4.0,yes,nan,5.0,I recently flew return from BKK to ALA. It was the first time I've flown Air Astana and I have to say that I was delighted with the attentive anticipatory levels of service I received. The plane itself looked brand new the business class cabin was spotless and a true delight to sit in. While the inflight entertainment was not as extensive as higher profile airlines this wasn't an issue for me. The dining experience was excellent quality varied food presented fantastically. The service and the environment along with the punctuality made this an excellent first experience of an airline that is clearly having an effect in the region.,nan,5.0,nan
nan,Economy Class,4.0,nan,3.0,nan,3.0,yes,nan,4.0,12/2/15 KS942/952 London - Almaty. 21/2/15 KS601/941 Almaty - London. You really get the feeling with Air Astana that the company is genuinely striving for improvement all the time. Staff are extremely courteous and helpful planes are really clean flights generally arrive on time. The new economy sleeper is a winning option for people who dread the loss of a nights sleep but cannot bring themselves to fork out the full business class fare. I travelled with my four children and we all thought economy sleeper was brilliant. At least a chance of sleep much more space quieter cabin and better food that in economy.,nan,4.0,nan
nan,Economy Class,5.0,nan,nan,nan,nan,yes,nan,4.0,Flight KC929 20 February. Was an overnight flight. Flight left on time and cabin crew were extremely thoughtful. Placed blanket over me while sleeping and when woke even though food service had finished and on way to landing - they found an apple to give me. Was a great experience and very impressed by cabin crew attitude.,nan,4.0,nan
nan,Business Class,5.0,February 2016,4.0,2.0,2.0,yes,SVO to ALA,4.0,"I am French and thought before that there is no better way to fly than Air France or Lufthansa. Since i am in Kazakhstan (2 years) Air Astana is for me now the number one before European airlines. The service and welcome is perfect, food is really good and most of the time, flights are on time! The fidelity programm is very flexible and very attractive.",Business,4.0,nan
nan,Economy Class,1.0,December 2015,1.0,1.0,nan,no,GUW to IST,1.0,"Atyrau to Istanbul return. Most of the times I check into Atyrau Airport, the customer service at check in is not customer friendly. The communication of any flight delays is sub standard, with passengers not being correctly informed of the real reason why the flights are delayed, just technical fault is communicated. Would recommend the staff go on a customer care course to appreciate that the passengers are actually paying an expensive price for their flights. Been flying with this airline for over 10 years and witnessing a deterioration in the check in process.",Business,1.0,nan
Boeing 767,Economy Class,5.0,February 2016,5.0,5.0,5.0,yes,ALA to TSE,4.0,"Almaty to Astana with Air Astana, the flight was a bit late, but the staff announced the reason for the delay and we managed to arrive in Astana nearly on scheduled time. The crew was super friendly and attentive. The pilot had a good sense of humour and made everyone smile while making announcements to the passengers. Thanks Air Astana.",Business,5.0,nan
nan,Economy Class,1.0,February 2016,1.0,1.0,nan,no,BKK to ALA,1.0,"My expensive return ticket to Bangkok included 5 hours in a seat some charter airlines would be ashamed of, the trip in the opposite direction with unadvertised stop in Ho Chi Minh. The flight was moved forward 15 mins in Bangkok but failed to inform me, but they were late anyway for the original take off time. I won't discuss the food on board. ",Business,1.0,nan
