Aircraft,CabinFlown,CabinStaffService,DateFlown,FoodAndBeverages,GroundService,InflightEntertainment,Recommended,Route,SeatComfort,Textchunk,TypeOfTraveller,ValueForMoney,WifiAndConnectivity
nan,Economy Class,2.0,January 2017,1.0,1.0,1.0,no,Los Angeles to Auckland,2.0," |  On January 17th, 2017 me and my husband travelled from Los Angeles to Auckland, New Zealand. Our flight with Air Tahiti Nui delayed almost 7 hrs because of mechanical issues with the plain in Los Angeles. When we informed the representative about our travel destination is Melbourne, she promised no problem, we will taken care of you and rebook you to other flight to make sure you reach your destination. Of course that was not the case. Because of the flight delay we missed our connecting flight in Auckland to Melbourne. Not Air Tahiti and not Air New Zealand helped us in any way when we ask help in the airport too. Both airlines pointed their finger to each other. The bottom line is we had to purchase 2 one way tickets for next day to Melbourne; cost us $800 dollars and we had to sleep in the airport in Auckland. I filed a complaint with both Airlines and I never heard back from Air Tahiti ever. I sent the e-mail to them 4 times without any acknowledgment or anything. Also, I tried to call them for a follow up, but the person on the phone told me I can reach their customer service only by e-mail. Their customer service is terrible. If you have any other airlines you can use, use other carrier.",Couple Leisure,1.0,nan
A340,Economy Class,5.0,April 2016,3.0,2.0,3.0,no,Los Angeles to Paris,2.0," | When booking my flight from Los Angeles to Paris, I was thinking about Air France. I came across Air Tahiti Nui as a quick and cheap departure option on Expedia. I wasn't too sure about this airline. When we got to Los Angeles International Airport (LAX), we stood in the check-in line. The lady checking in our luggage was very nice and professional. As she was checking our passports and wrapping the badges on our luggage, she warned us about frequent delays on this particular flight. As she anticipated, we were delayed for about an hour or more. This was imperative because we had a shuttle service in Paris who had our initial arrival time and had to wait for us. Anyway, we boarded the aircraft and noticed that our economy seats were very small and tight. For an 11 hour flight, these seats were terribly tiny and uncomfortable. The inflight entertainment was very limited. The movie selection was limited and there wasn't a variety of genres. The positive aspect of this airline was the service. The attendants aboard the flight were efficient, responsive, cooperative, and professional. I can't think of anything else to say about the staff. The food onboard the flight was just like your generic airline food. It was cold, slimy, and disgusting. I recommend purchasing food and snacks prior your flight in the terminal. Overall, staff was great but accommodations and passenger convenience weren't well.",Family Leisure,3.0,nan
A340-300,Business Class,2.0,February 2017,1.0,3.0,3.0,no,Papeete to Auckland,3.0," |  Flew Papeete to Auckland with Air Tahiti Nui. The original plane we were to take had mechanical problems so we waited for 3 hours for another plane. It appeared that there was quite a bit of confusion with this and whilst waiting we noticed the very slow boarding and taking off process of other planes. When it came our turn, whilst all were on board it still took over a half an hour to count and recount passengers. The food on both flights to and from Papeete was substandard and in two cases inedible. The cabin staff appeared only moderately trained and made me wonder how they would perform if there was a problem. Tahiti and the surrounding islands and its people are wonderful. On a return trip I would select another airline. On arrival at Auckland airport, it took three hours to organise our accomodation due to missed connections.",Couple Leisure,3.0,nan
nan,Business Class,2.0,February 2017,2.0,1.0,2.0,no,Papeete to Los Angeles,2.0," |  We booked Air New Zealand London to Papeete via Los Angeles. Flights from Los Angeles to Papeete are operated by Air Tahiti Nui. What surprised us that we were asked to check in at Papeete the proof of our flights Los Angeles to London while the flight was made in code-share with Air New Zealand. No online check in was possible, no seats were available by calling 72 hours before, but by miracle they were available at check in after getting the check in manager to assist. We kept our original seats. There is a limit to stupid systems. In short, an experience not to be renewed on Air Tahiti Nui. If this airline did not have the exclusivity on Papeete they would have disappeared a long time ago. 

Nous avons fait une réservation Air New Zealand Londres Papeete via Los Angeles. Les vols Los Angeles Papeete étant effectué par votre compagnie. Quelle ne fut pas notre surprise qu’on nous demande à l’enregistrement à Papeete la preuve de nos vols Los Angeles Londres alors que le vol était effectué en code-share avec Air New Zealand… Pas d’enregistrement en ligne possible, pas de places disponibles hublot en appelant 72 heures avant mais par miracle il y en avait de disponible au check in après avoir fait venir la responsable du check in. Nous avons gardé nos places d’origine. Il y a une limite à la bétise. Bref une expérience à ne pas renouveller sur Air Tahiti Nui. Si vous n’aviez pas l’exclusivité sur Papeete vous auriez disparu depuis bien longtemps. ",Business,2.0,nan
nan,Economy Class,1.0,January 2017,1.0,1.0,1.0,no,Papeete to Los Angeles,1.0," |  Los Angeles to Papeete (Tahiti) return. Both flights left over one hour late. While we were waiting for the plane to leave the terminal at LAX, the captain announced that we would be delayed for an hour to wait on 25 late passengers. After waiting for more than an hour and seeing a few passengers board, we finally left. This must have been the plane that was not updated as is mentioned in so many negative reviews. The tv screen in front of my seat had so many lines in it was not worth watching. What was so disappointing was the service on this flight which was practically non existent. Cups of water were served in the same size cups used in a water cooler and two would not equal one measuring cup. I received two before the crew retired for most of the flight. Drinks were served to the middle rows and when I asked for one, I was told she would come back but never did. When I pressed the call button, it was answered 5 minutes later by a male steward who said ""what do you want""? He returned with my drink order which was wrong. During most of the flight, the stewardess would walk by so fast that if you said something to get their attention, they were already 4 rows behind you. Never once did I see one walking down the aisles looking at the passengers faces to see if they needed anything. The return flight also left over one hour late. The breakfast served included a sausage that I believe was bad. No cruise is worth the 8 hours I had to spend on each flight. I ended up bringing my own snacks and water to make sure I would have some on the return flight.",Couple Leisure,1.0,1.0
A340,Economy Class,5.0,June 2016,5.0,5.0,5.0,yes,PPT to LAX,5.0,"Papeete to Los Angeles. We really enjoyed flying with Air Tahiti Nui. The staff is very nice and helpful. The seats are colorfull, the screens are good quality with recent movies. Everything is free onboard. We really recommend this airline.",Family Leisure,5.0,5.0
nan,Economy Class,1.0,July 2016,2.0,3.0,1.0,no,PPT to LAX,2.0," |  I would recommend avoiding Air Tahiti Nui. Our outbound flight from the US was uneventful. The plane, however, was in poor shape, with threadbare carpet, outdated seatback entertainment (some flights don't even have screens), sagging seatback pockets and below average food and service. The flight was on-time, though, and we were headed to paradise, so we could overlook these minor issues, even though the flight cost, even for an economy ticket, was at a premium price point. On our return trip is where we ran into serious issues. There was a mechanical delay on our flight, which postponed our departure for 24 hours. We waited in line for 3 hours before we had the delay and rebooking information, however, and were told that there was no possibility of being moved to one of the three other PPT-LAX flights that Air Tahiti Nui had before our rescheduled flight left. They put us up in a nice hotel overnight, so we weren't too upset at spending another day in Papeete. We had booked all of our ongoing flights out of LAX on our own due to my wife and I parting ways after the trip and her complicated international travel. Upon getting to the hotel, I began the process of rebooking all of those flights, as we were given the new departure information the following night. After breakfast the following morning, we were feeling pretty good about everything, when I just happened to check the Air Tahiti Nui website to see if our flight was still on time. Nope, we were delayed another 9 hours, which then caused us to miss all of our rebooked connections from LAX. We did not receive any notification from the airline about this additional delay. At this point, Air Tahiti Nui really let us down. They did not rebook us on any of the other departing flights for LAX. They had no consideration for connecting flights. In order for my wife to make her destination in time, we had to reroute her on another Air Tahiti Nui flight to Tokyo-Narita. They would not apply any of the funds we used for the PPT-LAX flight, nor would they simply book her on that flight at no cost due to the mechanical issue. When we spoke to customer service, we had to find all of our own solutions due to their incompetence and lack of understanding. To top it all off, they were completely indifferent and unapologetic. To this day, almost one month later, we have not been engaged by their customer service department for reparations after repeated emails and phone calls. Based on our experience, I would recommend a few things: There are other carriers that fly to/from Tahiti (Air France, Hawaiian Air, etc). Look into them and see if they are an option for you. Take a vacation somewhere else. There are a lot of nice spots in the world, and while Tahiti is exotic and amazing, our poor air travel and all that followed totally clouded our experience. If you still decide to go, and to go with Air Tahiti Nui, try to book all of your air travel through them on one ticket. Or, if you are booking your own connections, be sure to have some flexibility on your US arrival (a day or two in LA on the back end).",Couple Leisure,1.0,nan
A340,Economy Class,1.0,April 2016,1.0,1.0,1.0,no,AKL to LAX,1.0,"Flew Air Tahiti Nui from Auckland to Los Angeles. Firstly the customer service is terrible and they can't change seats on a near empty flight because they are ""not allowed to"". Once on the plane I realised how uncomfortable the seats were, hard and no leg room. The service is terrible as they barely speak english and don't seem to care about customers. They served drinks once on the flight and would not get a coke for me so they just gave the terrible orange juice that was served with breakfast. The food was horrible. Entertainment barely works and is outdated. The headphones they give you are terrible and you can't hear anything with them. No space for items so I say you put your items in the overhead because you can barely fit an iPhone into the seat back pocket. I do not recommend this airline because of it's poor service and terrible seats.",Solo Leisure,1.0,1.0
nan,Economy Class,4.0,December 2015,4.0,4.0,4.0,yes,LAX to PPT,3.0,I flew Air Tahiti Nui in December of 2015 from LAX going to eventual spot of Bora Bora. The flight was good and the airline was punctual. Food was decent and we were fed twice on the flight. Had entertainment to keep you busy in watching movies and the cabin crew was helpful.,Couple Leisure,3.0,4.0
A340,Economy Class,1.0,December 2015,1.0,1.0,1.0,no,LAX to PPT,1.0,"Los Angeles to Papeete with Air Tahiti Nui. Travelers beware! Reservation agents rude and unwilling to process cancellation within 24 hours of booking and website does not allow online cancellation. Plane was very old. The seat, arm rest, tray table and TV monitor buttons are worn or torn. Onboard service was cold and lackluster. This airline certainly cannot compete with world-class airlines. Fly Air France to Tahiti if you are looking for superior experience.",Couple Leisure,1.0,nan
nan,Economy Class,nan,nan,nan,nan,nan,yes,nan,nan,LAX-PPT. The captain and crew thought people could govern themselves as there was no proper checking to see if everyone was belted in when the fasten seatbelt sign came on. Drinks were complimentary and meals decent. I was lucky enough to have a row of four seats to myself which I used to make a makeshift bed. My flight was a good one although the fare was steep - airline has actually been scrutinized recently for corrupt operating practices including sky- high fares so don't be surprised if your airfare is more than you expect.,nan,1.0,nan
nan,Economy Class,nan,nan,nan,nan,nan,no,nan,nan,AKL-PPT-LAX. Horrible flight horrible service. Very slow check in and cramped seats. Service and food on flight fine. However arrived in LAX and they had lost my luggage. Waited 3 hours at the baggage carousel because attendents were disorganized kept walking away and not returning and they had no counter (or system it seems) to handle lost baggage. I was told unclaimed bags were just thrown on the carousel for the next flight coming in and that I should wait around to see if my bags arrived on another flight. Took 5 days to receive my bags. Air Tahiti Nui baggage line never answered my calls went to an answering machine and I left several messages. I only received a call 3 days later saying they had found my bags and they would arrive at my door the next day - which they did not. Wasted 2 days waiting at home for bags that didn't arrive. Finally received my luggage and called to claim my $65 compensation. I couldn't get this either and was told conflicting advice about having to fax someone or having to wait until I got back to Auckland. I was also told that my 2 hour layover was not enough time for the airport in Tahiti to transfer bags to a new plane. Since I had the same layover on the way back I called reservations to see what could be done so I didn't have the same problem on the way back to Auckland - flight change pay for an upgrade mark my bags as priority (I would have been happy with any advice they could give). During this conversation I was talked at instead of listened to treated rudely and the end result was that I was told there was nothing they could do and I shouldn't be so negative. I was told I shouldn't call them anymore. Apparently one phone call is considered harassment. All in all very bad flight and awful service. Even if this flight is a bit cheaper I will gladly pay more and fly Qantas or Air NZ in future. Would not recommend this airline at all.,nan,1.0,nan
nan,Economy Class,nan,nan,nan,nan,nan,yes,nan,nan,PPT-AKL. Attentive flight attendants courteous with genuine care. Hot brunch was not the best I've had on Air Tahiti Nui with meal overcooked/overheated. IFE equipment could be updated and it is now redundant compared to other airlines but choice offered makes up for it. The three languages (French/English/Tahitian) used for inflight communication are well enunciated but could be restricted to French and English only as too many announcements are quite distracting.,nan,4.0,nan
nan,Business Class,nan,nan,nan,nan,nan,yes,nan,nan,AKL-PPT. A very enjoyable flight - check in quick and pleasant crew friendly and professional. Food good and nice wine choices. Old style seats really let them down but otherwise nothing to fault,nan,4.0,nan
nan,First Class,nan,nan,nan,nan,nan,yes,nan,nan,I have flown Air Tahiti Nui several times. I always fly First Class. The level of service on the 2 flights I took on this trip has diminished. The amenity kits are not the same. On the flight LAX to PPT I was given an appetizer that was a joke. A small piece of shrimp with some sauce and 2 pieces of cheese. This is not First Class Service I was used to with Air Tahiti Nui previously. The boarding process is nerve racking. I resent having to go boxed in the buses that transport you to the aircraft. They box you in like sardines. I pay nearly $5000.00 for a one way flight to PPT and get the same boarding treatment was a coach paying passenger.,nan,1.0,nan
nan,Economy Class,nan,nan,nan,nan,nan,yes,nan,nan,AKL-PPT-AKL. Did MEL-AKL earlier in the day with Emirates on a seperate booking. Bags checked in through to PPT at MEL did make it with us so no complaints there. Looking at the plane's fuselage the cabin decor and the Tahitian music playing made you feel you are going on a vacation. Inflight crew attentive and friendly especially on the way back. Meals were good. Only sore point was the IFE. It was not AVOD and very limited choices. Had the IFE been better would have scored this flight at 9 or 10.,nan,1.0,nan
nan,Economy Class,nan,nan,nan,nan,nan,no,nan,nan,The overnight flight Papeete to LA was cancelled without notice. We were booked on the flight 12 hours later which meant we could not make any connecting flights that day to JFK as we arrived too late. We were given an hotel room for the night before the flight but had to fend for ourselves in LA for the enforced overnight stop. The reason for the cancellation was not made clear but I would suspect it was none other than not enough passengers as cancellations seems to happen frequently. The same flight the previous evening had also been cancelled. At no time did anyone offer an apology. I would not recommend this airline as they are unreliable.,nan,1.0,nan
nan,nan,nan,nan,nan,nan,nan,no,nan,nan,LAX-PPT-AKL-LAX Economy return. The flight from LAX to PPT was cancelled. I was notified about two weeks before the flight was supposed to leave. I was a bit peeved as the flight from LAX was a connecting flight and the cancellation meant that I had to overnight in LA and take the next flight the following morning. I explained my situation to Air Tahiti Nui and they put me up in a hotel (Four Points by Sheraton)and gave me dinner and breakfast vouchers! The flights were all on time plane modern plenty of room for economy. I'm 5'11 and was comfortable for the entire trip. The inflight entertainment is not as modern as it could be its not on demand but the movie selection is good and there is a nice selection of recent releases. One note of caution try to avoid any stopovers in Tahiti that will be longer than two hours - the airport is old and boring and there is nothing to do while you wait not even a TV to watch. The food was superb for economy and inflight service by the attendants was friendly polite and professional. Topping all of this off is the fact they were $700-$1000USD cheaper than ANZ Qantas or United.,nan,nan,nan
nan,nan,nan,nan,nan,nan,nan,no,nan,nan,"AKL-LAX-AKL (via PPT) First Class. The service onboard is outstanding and pretty difficult to fault. The crew could not have been more professional or pleasant. Food AKL-PPT and PPT-LAX would have been at home in 5 star restaurant (less good on the return but still acceptable). Seats although first generation lie flat were comfortable and all features worked. There is no screen between passengers but I did not feel an invasion of personal space. Boarding on all legs was efficient and every leg left early . The negatives? Ground crew at all three airports. At the initial check in Auckland I did not get the aisle seat I had requested and had been confirmed with the airline 7 months earlier - and had to kick up quite a fuss - miraculously one opened up. The same thing happened PPT-LAX. On arrival at LAX no bags. They were off-loaded at PPT and could not be traced. They did turn up on the next flight: that isn't good enough on economy but it is completely unacceptable in First. The response of the LAX agents could not havee dismissive. Arriving back in Auckland bags (which had first and priority labels) were the last to appear (perhaps I should be grateful that they appeared at all!). So inflight this is a rival to any airline and competitively priced on the Transpacific route; it certainly would have been a ""10"". If only they could get their act together with ground crew.",nan,nan,nan
nan,nan,nan,nan,nan,nan,nan,no,nan,nan,The flight attendants told passengers those in-transit to Auckland need not complete the Tahitian immigration forms and we should proceed to the transit lounge. This is what we had expected and made sense. Once off the aircraft though those of us who entered the lane marked transit lounge and walked the short distance to the transit lounge found it locked. No one could tell us why it was locked how to enter the lounge or what to do. We asked the cabin crew as they came off the aircraft and they shrugged their shoulders and walked on. Eventually we realized the only option was to complete Tahitian immigration forms and go into the baggage claim area as it appeared we might be able to enter the transit lounge from there. This however proved not to be true. Again no one seemed to know what we should do even though we kept asking how to enter the transit lounge. I speak passable French so this was not a language problem. Eventually we picked up our luggage and cleared Customs. When we entered the airport terminal I found an Air Tahiti Nui staff and she told us that the transit lounge was not open and we would have to go to a hotel for the night. She seemed unconcerned and disinterested. I then found the security office but they couldn't tell me anything. I returned to the Air Tahiti Nui staff who told me that everyone knows that Tahiti won't let passengers use the transit lounge and we should have known it. We weren't about to spend over $100 to stay in a hotel room for a few hours so along with two dozen other passengers we spent the time in the hot dirty smoky airport terminal. The ATN check-in desks finally opened at about 4-30 a.m. and we were able to get our boarding passes but as Security didn't open for another hour or so we were still forced to wait in the terminal. Once allowed into the departure lounge we found that it was shabby dirty and unpleasant. A small coffee bar sold food but didn't accept credit cards and we weren't about to go back out through Security to find an ATM to get cash in a currency we didn?t need just to buy a cup of coffee. You may wonder why we didn't just go directly to the departure lounge and wait there. Well the ATN staff in LAX refused to give us the boarding passes from Papeete to Auckland. They said that they issue boarding passes no more than three hours in advance. When we arrived in Papeete the check-in counters were closed. Thus we couldn't get boarding passes and couldn't get into the departure area. Three weeks later when departing Auckland I asked an ATN supervisor why they don't let transit passengers use the transit lounge. She said that in their view a layover of that length does not constitute in-transit and that they are unwilling to allow people to use the transit lounge. As ridiculous as this is the worst part is that they don't bother to warn you about it before you travel so you can take this into account when making your travel plans. Upon arrival back in Papeete with only an hour layover we again found the transit lounge locked even though flight attendants assured us we would be allowed to wait in the transit lounge. Instead they simply diverted transit passengers directly into the departure lounge even though most hadn't been issued a boarding pass in Auckland (we had one but only because I went back to the check-in counter and insisted upon it). Obviously they could have done exactly the same thing on the Papeete- Auckland overnight layover had they wanted to do so. I suspect the whole thing is a means of trying to force passengers to spend some money in Tahiti. Whatever the reason it is a shabby way to treat passengers.,nan,nan,nan
nan,Economy Class,nan,nan,nan,nan,nan,no,nan,nan,Onboard the air conditioning was broken and the pilot would not turn the engine on as there was another malfunction with the luggage loading. We left over 1.5 hrs late and missed our connecting flight back to Boston. Another rude service counter agent would not help us they would not provide us hotel voucher as it was not there fault or problem. I noticed a terrible attitude problem when enquiring.,nan,1.0,nan
nan,Economy Class,nan,nan,nan,nan,nan,no,nan,nan,LAX-Tahiti. We were informed by our travel agent about the strike and had to switch out flight from LAX-Tahiti. When we got to LAX we had to wait 3 hrs in line before we could get our boarding passes. We received very little information regarding the delay. The service agents stood there and looked at you but had no answers. This was a horrible experience. The best part of the night was when the Air New Zealand crew showed up. They chartered Air New Zealand to take us to Tahiti. That crew and flight was wonderful. On the way home from Tahiti the strike was over so we had Air Tahiti Nui for the flight home. The service on the fight was horrible. If you put on your call light they would ignore you.,nan,1.0,nan
