Aircraft,CabinFlown,CabinStaffService,DateFlown,FoodAndBeverages,GroundService,InflightEntertainment,Recommended,Route,SeatComfort,Textchunk,TypeOfTraveller,ValueForMoney,WifiAndConnectivitynan,Economy Class,2.0,nan,2.0,nan,3.0,yes,nan,1.0,"AKL-PPT-LAX-PPT in economy May 2014. Air Tahiti Nui only have five A340 aircraft. We flew on three of these - all were different experiences. The first leg AKL-PPT was on ""Moorea"" which had an upgraded interior and felt very new and fresh. Leg room seemed adequate for economy however as others have said previously the seat designer should be sacked! The head rest is not ergonomic at all and causes discomfort. The is also no lumbar support. I packed the seat back out with pillows to help. The crew were young friendly and worked the cabin non stop. Food on all flights was edible if not slightly odd - the seat designer must have had input in the menu as well. Entertainment on demand comprised of about 10 of movies (some recent releases) and TV shows. The second flight an 8.5 hr overnight flight from PPT-LAX was on ""Nuku Hiva"". This aircraft was also retrofitted with the new interior however it felt older. tired and there was a noticeable decrease in leg room despite us being in the same seat number on both flights. The crew were a bit surly and disappeared after trolley service. Again the seats weren't that comfortable due to the awful head rest and lack of leg room. Our third flight overnight from LAX to PPT was on ""Bora Bora"" which has yet to have it's interior retrofitted. The seats were much more comfortable than the newer version in economy as they lacked the offending head rest but the entertainment is on the old loop system rather than 'on demand'. Would I fly them again? Only if the price was right (we scored half price tickets) - you only get what you pay for!",nan,5.0,nan
nan,Economy Class,4.0,nan,4.0,nan,3.0,no,nan,1.0,The seats were so uncomfortable I was dreading the flight home. There was no lumbar support and the add on headrest pushed my head forward putting my neck at a very unnatural position. I could not get comfortable using pillows and blankets or in any position. It made for a very long flight home.,nan,3.0,nan
nan,Business Class,5.0,nan,5.0,nan,3.0,yes,nan,5.0,Loved this airline except for one problem. They changed our return flight from Auckland so we had to layover for the night. We did not appreciate this change. It cost us a lot more money to stay in a hotel for one night in Tahiti. It made the trip much longer. The flight to Tahiti didn't get in until 9.45 pm and customs took forever. Then we had to be back to the airport by 6 am. If they had to make this change they could have at least left earlier so we wouldn't have had such a long night.,nan,5.0,nan
nan,Business Class,1.0,nan,1.0,nan,1.0,no,nan,2.0,March 29 PPT TAHITI FRENCH POLYNESIA - LAX LOS ANGLES CA. The flight was horrible. After spending a great deal of money for a business class seat I literally had to get up and go and find flight attendants to get a drink of water after not seeing them for a 3 hour stretch. The food was terrible as well. Not worth the money! Horrible service.,nan,1.0,nan
nan,Economy Class,3.0,nan,3.0,nan,2.0,no,nan,1.0,"Seats are incredibly uncomfortable and service was ok but nothing spectacular. I reacted to something in the air and my eyes started watering and I couldn't stop coughing. I pushed the service button waited 20 minutes and the attendant finally came turned it off and walked away! I cannot stress enough how uncomfortable the seats are especially for tall people. My husband is 6'1"" and I'm 5'9"". We couldn't move and didn't sleep the entire flight down or back. If there was another way to get to Paradise we would definitely take it!",nan,2.0,nan
nan,Economy Class,3.0,nan,2.0,nan,4.0,no,nan,2.0,Flew LAX to PPT and back for an Oceania Cruise. Going to PPT things were just OK. After all you are heading to paradise so it's easier to overlook less than friendly service uncomfortable seats and marginal food. Our return flight was a charter arranged by the cruise line and things were much worse. They had little or no ice limited beverage options and the food was awful. The flight attendants just don't have any spark to them. Some of that may be a cultural thing because I find customer service in FP to be less warm and inviting than in Europe or the US. This airline needs to really punch up their customer service.,nan,3.0,nan
nan,Economy Class,3.0,nan,3.0,nan,2.0,no,nan,1.0,I flew round trip to Papeete for a Paul Gauguin cruise. I will never fly that airline again. This is unfortunate for French Polynesia because it is a wonderful place and I loved my time there the the flight was unbearable. The seats are so small with no leg room so that one can hardly move. The country should subsidize the airline or another one so that passengers can visit this beautiful place without the pain associated with getting there.,nan,1.0,nan
nan,Economy Class,1.0,nan,2.0,nan,1.0,no,nan,2.0,Flew LAX to Tahiti seats 19K/L with my wife on 23 Jan 14. Both of our entertainment systems did not work. Asked the flight attendant 3 times about it and was ignored. Finally a flight attendant indicated they could sit us in separate seats or two middle seats in the last row.,nan,2.0,nan
nan,Business Class,3.0,nan,2.0,nan,2.0,no,nan,1.0,A 5-hour flight from Auckland to Papeete (Business Class) was more or less ruined by a seat that wouldn't budge from the takeoff/landing bolt upright position and a fold out tray that didn't. The whole aircraft was looking very tired and tatty and badly in need of an upgrade. The Air Tahiti staff at the chaotic boarding gate in Auckland were rude and condescending although the flight attendants did the best they could in such a worn out old bus. Food was OK (I don't expect cordon bleu on a plane) but the wine choice was one cheap red or white. Take it or leave it. Entertainment was very limited too. I was told that of a fleet of 5 aircraft 4 have in fact been upgraded. I guess I found myself on the one that wasn't. Assuming the final aircraft is in fact given the major facelift it so badly needs then I'd consider using Air Tahiti Nui again as a last resort but will take Air New Zealand if it's an available alternative.,nan,2.0,nan
nan,Business Class,4.0,nan,2.0,nan,4.0,no,nan,3.0,AA 7176 (code share) on 1/15/14 Papeete to Los Angeles. Business class on this airline was very disappointing in comparison to other airlines we use. Because our tickets were code share we were not allowed in the business class lounge despite paying for business class fare.,nan,3.0,nan
A340,Business Class,2.0,August 2015,1.0,3.0,1.0,no,LAX to PPT,1.0,"This was an awful business class. Food awful. My seat in business class had metal exposed at the head rest. The entertainment unit was fuzzy. You have to watch the movie when they start, it as it is not on demand. The food was un identifiable as to what it was. They only have four planes, this was the one flagged Bora Bora. It had not been updated.",Family Leisure,2.0,nan
nan,Business Class,4.0,nan,3.0,nan,nan,yes,nan,3.0,LAX-PPT-LAX. Having read some of the reviews on here I was a bit worried about what we'd encounter on these flights. Both were overnight so we tried to sleep and made no use of the entertainment system. The aircraft interior was clean and well maintained and the crew were very good. Breakfast was decent. The seat is angled lie flat but reasonably comfortable. Both flights were on time and bags were off quickly. The only downside I could see was the high fares due to I assume lack of competition.,nan,3.0,nan
nan,Economy Class,4.0,nan,1.0,nan,4.0,no,nan,nan,We flew on April 7 and 14 back and forth to Papeete. While the airline staff were friendly and helpful sadly we had an older plane that was not clean and the seats were extremely uncomfortable for our overnight flights. A standard roller bag carry on will not fit in the overhead compartment wheels first and had to be placed sideways. They don't really weigh your carry on at check in but the weight amount of 22 lbs is generous. They didn't weigh or even notice our backpacks. The tray tables were dirty the bathrooms were not kept up during flight and the seats/floor were stained throughout the cabin. I brought Clorox wipes after reading prior reviews to clean off our seating area and felt better after doing so. The amenities were nice such as the overnight flight kit pillows and blankets which were a pleasant feature. The food was not very good at all cold and soggy. The best bet is to bring something such as a Powerbar if you are a picky eater. The movies on the plane were of a good selection but when flying overnight you don't have much time to watch a movie if you are trying to rest. The flight was bumpy both ways but the pilot was considerate in not keeping the seat belt light on for an over-extended period of time. My suggestion is to ask at check in if there are two seats together to transfer to if you are stuck in the row of four you will be much more comfortable. Row 43 (a row of 4) in the back has in seat tray tables so you can't lift the armrest if traveling with a companion and this is not noted anywhere even on Seat Guru. The airport in Papeete is under construction and it took over 2.5 hours for the two planes that arrived at the same time to clear passport control which made us miss the ferry to Moorea. In conclusion if flying to Tahiti again I would try to find a different airline when booking but would likely fly this one again if I had too as the destination is paradise.,nan,3.0,nan
nan,Economy Class,3.0,nan,1.0,nan,1.0,no,nan,1.0,My wife and I flew Air Tahiti from LAX to Tahiti and back. We will never make that mistake again. First the interior of the plane was in poor condition. The seats were old uncomfortable and stained. The digital display (which was from the stone age) did not function properly and the resolution was so bad that I elected to just keep it off. Second the seating layout is awful. If you are not in a window section you will be crammed in the middle of the plane in a row of four seats. I flew for 8 hours fighting over the armrest with a total stranger. Lastly my wife reserved a gluten free meal (she has celiac) and she was given raw vegetables a rice cake and yoghurt for breakfast.,nan,1.0,nan
nan,Business Class,4.0,nan,4.0,nan,3.0,yes,nan,5.0,Flew Business Class from PPT to LAX only 1 out of 5 planes is older and we had a new cabin. Seats comfortable food excellent service very good. Before Takeoff Captain came through the business class to great every guest personally. If I get the same service every time I would most definitely fly with them again. They are as good as some major Asian Airlines and Miles better than any US Airline I flew recently.,nan,4.0,nan
nan,Business Class,1.0,nan,1.0,nan,1.0,no,nan,1.0,Terrible service. Food was better in economy. Seats were awful - unable to adjust it so you could get comfortable and we are 5ft and 6ft so it should have worked for one of us. Headphone socket broken so unable to watch movies or listen to music. Staff just said 'we can't fix it in flight'. Movies NOT on-demand and you are not informed when they start. Definitely not worth the extra. This was AKL-PPT. Go with Air NZ instead.,nan,1.0,nan
nan,Business Class,4.0,nan,4.0,nan,1.0,no,nan,4.0,Round trip LAX-PPT last 2 weeks of 10/14. Flight out was an old aircraft inflight entertainment was awful. Video worse than your 1957 TV. Service and food ok+. Flight back was newer aircraft and entertainment display was good but content severely limited. Gate agent in PPT refused the check through in domestic USA via the post customs LAX baggage transfer service. She was inflexible and rude about it. They advertise in their magazine they have a deal with Alaska Air my domestic carrier. Alaska in LAX confirmed the deal and that AT was erratic in conforming to the agreement. Moving baggage around LAX isn't fun. Very poor treatment of a business class customer.,nan,3.0,nan
nan,Business Class,5.0,nan,4.0,nan,5.0,yes,nan,4.0,Booked C class round trip LAX-PPT. Did not like the previous reviews so I was a little apprehensive. Also as I understand it only 3 of their 5 aircraft have the new C class. As is turned out the new seats were very adequate. At 20.5 they are a tad tight and they do not fully recline. Nonetheless my wife and I were able to sleep most of the way on a long late night flight. Staff were gracious and professional. Food and drink were very adequate but nothing special. All in all a good experience. Tahiti is a very special place and this is as good as it gets.,nan,4.0,nan
nan,Economy Class,1.0,nan,2.0,nan,2.0,no,nan,2.0,Flew from CDG to LAX (return) in late August 2014 / early Sept 2014. Awful customer service. The check-in-staff have absolutely no warmth or charm and made no attempt to fulfil my seat request; they were quite abrupt in refusing it moreover. In-air-staff are likewise very poor. Aircraft was old and seats are inadequate. I will never use this airline again. I often travel on Asian airlines and Air Tahiti Nui is way way below par.,nan,2.0,nan
nan,Business Class,2.0,nan,2.0,nan,1.0,no,nan,1.0,LAX to Papeete business class: terrible. Where to start: Old seats straight from the 90's bad shape seats an entertainment system with 4 movies and bad screen quality. Bland food and to top it all magazines which were 3 weeks old. Flight attendants are nonchalant to say the least and you don't see them unless you hunt them down. Forget snacks. Just awful and way below par any other airlines.,nan,1.0,nan
nan,Economy Class,3.0,February 2016,1.0,3.0,2.0,no,LAX to PPT,1.0,"Our original flight was scheduled to depart at 4pm but a few days prior was rescheduled to 7pm. Imagine my surprise while eating a leisurely late lunch at a hotel in Los Angeles when I get an email message from Flight Aware that the flight to Papeete now was rescheduled to the original 4pm departure. We rushed to grab our luggage, grabbed a ride to the airport only to find out that this was wrong and the flight was not to leave until 7pm. They did not load the flight until 7pm and we never took off until way after 8pm as we all sat in the most uncomfortable seats waiting for the last passenger to arrive. I do not know who designed the seating but they are the worst I have ever seen in over fourth years of flying. As for the meal service, bring a sandwich and you will be much better off. What the TV screen tells one what will be served was not even close to it and was not edible. Also if you hold an American Airlines loyalty card the only way you will get mileage credit is to book this codeshare flight through American Airlines as Air Tahiti will not post the miles to your American account. Let the flyer be aware.",Couple Leisure,1.0,nan
nan,Business Class,5.0,January 2016,5.0,3.0,nan,yes,LAX to PPT,4.0,Los Angeles to Papeete with Air Tahiti Nui. The plane was clean and very comfortable. I agree with a previous reviewer that when extended the seats were somewhat awkward to sleep. But I managed. The dinner they served at midnight was perfect as it was a cold chicken salad and light. The rolls were warm which was very nice. By this time all seemed ready to quickly eat and then sleep. Cabin attendants could not have been nicer trying to make us more comfortable. We fly home in two weeks and will see if we are still so happy with the plane and service but at this point would very much recommend.,Couple Leisure,5.0,nan
A340-300,Business Class,4.0,December 2015,4.0,4.0,nan,yes,PPT to LAX,4.0,"The A340 was Nuku Hiva, the youngest of the Air Tahiti Nui fleet from 2005. Left at 11:30pm, the last flight out of Tahiti in 2015. The cabin crew had made the effort to dress up and decorate the aircraft to celebrate New Year which was approximately half an hour after take-off. Served champagne before take off and after the pilot announced New Year; nice touch. The seats are comfortable and have a foot rest, but, found that the angle when extended for sleep (ever hopeful) was a wee bit awkward to find a good position - not a huge problem though and I am a bit short. There is a lot of leg room which makes it easy when seats are upright to move about. As we needed to try to sleep, we did not use the inflight entertainment. The cabin was fresh and clean, slightly better than our outward aircraft on 16 December, although that one was fine too (Moorea). These were both night flights and therefore we didn't have much contact with the cabin crew, but they were pleasant, polite and efficient although perhaps not quite so at ease with passengers as we have found on bigger international airlines. The breakfasts on both flights offered hot food and continental. It was very acceptable and included fruit and yoghurt. No complaints, the airline did its job and we were comfortable.",Couple Leisure,4.0,nan
nan,Economy Class,nan,December 2015,nan,1.0,nan,no,LAX to AKL via PPT,nan,"Los Angeles to Auckland via Papeete. On Dec 21 noticed that Air Tahiti Nui published possible strike action by Pilots. On reading this I called Air Tahiti and was assured our flight would not be affected and we should go to checkin at LAX on Dec 22 with a scheduled departure at 11:30pm. The customer service rep then  asked if I wanted to cancel. I should have taken the opportunity. On arriving (Myself, wife plus 2 infants) we were informed the flight was cancelled and we were rescheduled onto Air New Zealand. There were 7 to 8 check in staff all congregating and joking among themselves. We were told there was an issue and we'd be scheduled onto another airline. 1 hour later we were told that we were booked on American Airlines via Sydney but had to run to another Terminal in order to make the flight. We did that, arrived at the American Airlines counter who told us that we needed a transit visa for Sydney and Air Tahiti should have known this. Also told us there were no seats and we had missed the flight. We ran back to the Air Tahiti counter in the previous terminal. Again staff just joking around, had no knowledge of transit visas. Spent next 30 minutes trying to get us on another airline. Qantas this time. We ran to that counter with one helpful staff member, checked in and Qantas sorted our visas. Stroller was lost in transit. Flight they placed us on meant a 9 hour wait in Sydney before our final journey to NZ. On check-in we were charged for our on lap infant but told that Air Tahiti would reimburse. On calling Air Tahiti I was basicially told to go away. Worst customer service in 30 years of flying.",Family Leisure,1.0,nan
nan,Economy Class,5.0,September 2015,4.0,5.0,5.0,yes,Lax to Paris,3.0,"I was concerned about this airline after reading many terrible reviews. My Air Tahiti Nui experience was the opposite and crew was friendly and very helpful. The leg room was better than most for economy. The food was ok. On each seat a blanket and pillow, plus a bag with socks, eye mask, ear plugs, ear phones which was a nice touch. They provided 2 meals and also offered food in the galley (sandwiches, drinks, soup and ice cream) nice selection of movies to watch also. ",Family Leisure,5.0,nan
A340,Economy Class,2.0,October 2015,2.0,2.0,2.0,no,Los Angeles to Auckland via PPT,2.0,"Budget is a word that comes to mind for Air Tahiti Nui. The ""Bora Bora"" A340 plane is in need of an update asap. On board entertainment unit was small and quite a few were very fuzzy. Choice is okay but not like bigger players provide and the interface unit is via Wii style hand held unit. It is not an on demand service so when the movies start you need to be read.y Because of this it takes some of the gloss flying with them. Take a tablet, Mac, Laptop when flying Air Tahiti Nui to avoid disappointment. Also have a device that can last 9 hours as there are no charging ports. The other plane we flew in their fleet had a larger tablet screen and usb port for charging. The crew did what they needed to do but nothing more, unless you buzzed them or fly business class. Seat comfort in economy was more domestic than international quality and at 3 hour mark it becomes noticeable. The armrests don't fold right up out of the way either. Food - fussy eaters and kids take snacks as meals make par but that's it, and bread rolls need a chainsaw to cut them open.",Family Leisure,2.0,nan
A340,Economy Class,1.0,September 2015,1.0,1.0,1.0,no,Los Angeles to Papeete,1.0,"Air Tahiti Nui is the worst airline I have flown, starting from the reservation process. The Air Tahiti Nui website is the most outdated and the customer unfriendly of any airline. My credit card was charged twice for the same transaction. The reservation agents are the most condescending I have ever experienced. They are unwilling to do their jobs and try to get you to acquiesce to their attitude rather than follow industry standard customer service. Onboard experience was just as bad. The hardware showed neglected maintenance plus obvious signs of wear and tear with dirty seat cover and tray table. The flight attendants were subpar in their service. I would never fly this airline again.",Business,1.0,nan
A340,Business Class,4.0,September 2015,3.0,4.0,nan,yes,PPT to LAX,4.0,"We had an acceptable night time flight with Air Tahiti Nui from PPT to LAX. The Papeete lounge was air conditioned and spacious. The staff on the plane were pleasant and the food and drink OK, if not high-end cuisine. No complaints from us.",Couple Leisure,3.0,nan
A340,Business Class,1.0,September 2015,1.0,2.0,1.0,no,Los Angeles to Tahiti,1.0,"That was our first, and hopefully last, experience with Air Tahiti Nui. Inflight customer service in business class was horrible. The cabin staff looking after us was unprofessional and rude. She didn't offer us any drink unless she needed to. Wasn't friendly. Staff generally were rude and not very welcoming. Food was very poor quality and we were wondering how bad it must be in economy. Overall it wasn't a good experience. ",Couple Leisure,1.0,nan
nan,Economy Class,2.0,September 2015,2.0,2.0,1.0,no,Paris to Auckland via Los Angeles,2.0,"Just arrived off an awful Air Tahiti Nui plane from Los Angeles to Auckland via Tahiti. The main issue was that the inflight entertainment is outdated - it is draconian. If you must fly Air Tahiti Nui, try and avoid the ""Borabora"" plane - unless you don't wish to watch a movie or play a game. The other planes are better, but they have poor seats that force your head forward. Very awkward. Every flight also boarded late. Not good enough.  My worst international flight.",Couple Leisure,3.0,nan
